var json_Beniarcheologici_11 = {"type":"FeatureCollection","name":"Beniarcheologici_11","crs":{"type":"name","properties":{"name":"urn:ogc:def:crs:OGC:1.3:CRS84"}},"features":[{"type":"Feature","properties":{"gid":"1","id_archeo":"227","codice":"227_PC","nome":"Due fornaci di età romana imperiale e una calcara tardoantica","titolo":"Complesso produttivo in uso dall'età imperiale romana all'età tardoantica","tipo_propr":"Pubblica","comuni":"PIACENZA","sigla_pro":"PC","localita":"Le Mose","tipologie":null,"provvedime":"Declaratoria (03/10/1997)","data_ultim":"1997-10-03","ultimo_pro":"Declaratoria","rif_legge_":"L. 1089/1939","tutela":"Diretto","vincolo":"Declaratoria"},"geometry":{"type":"MultiPolygon","coordinates":[[[[9.734199443054552,45.045417400296749],[9.734101335563022,45.045180054567055],[9.733881224863403,45.045223155962077],[9.733960450764787,45.04541196934948],[9.734040464398845,45.04539644931058],[9.734050291968057,45.045422193851323],[9.734059726084151,45.045446959741703],[9.734068537982168,45.045469740265432],[9.734182714303937,45.045447699364864],[9.734209769458237,45.045442430484961],[9.734199443054552,45.045417400296749]]]]}},{"type":"Feature","properties":{"gid":"2","id_archeo":"228","codice":"228_PC","nome":"Resti di villa romana","titolo":"In loc. Crocetta sulla sponda destra dell’Arda di fronte all’importante insediamento medievale di Castell’Arquato, durante la costruzione di un edificio negli anni ’70 del secolo scorso, venne alla luce una pavimentazione in cotto, strutture mura","tipo_propr":"Pubblica","comuni":"CASTELL`ARQUATO","sigla_pro":"PC","localita":"Crocetta","tipologie":null,"provvedime":"Decreto Ministeriale (24/09/1979), Decreto Ministeriale (05/12/1978)","data_ultim":"1979-09-24","ultimo_pro":"Decreto Ministeriale","rif_legge_":"L. 1089/1939","tutela":"Diretto","vincolo":"Area demaniale"},"geometry":{"type":"MultiPolygon","coordinates":[[[[9.876056449949468,44.8516806237308],[9.875867863001664,44.851496935503086],[9.875699269416961,44.851323913976145],[9.875610974133449,44.851383185710333],[9.87542422273123,44.851508531434291],[9.875611852649863,44.851647514649251],[9.875743679241015,44.851747586915145],[9.876056449949468,44.8516806237308]]]]}},{"type":"Feature","properties":{"gid":"3","id_archeo":"233","codice":"233_PR","nome":"Villa di epoca romana","titolo":"Strutture murarie di villa di epoca romana databile tra I e IV secolo d. C.","tipo_propr":"Pubblica","comuni":"FELINO","sigla_pro":"PR","localita":"Lottizzazione Feroli","tipologie":"Struttura abitativa o insediamento - Epoca Età Romana","provvedime":"Declaratoria (21/10/1993), Decreto Ministeriale (28/12/1994), Decreto Ministeriale (18/01/1982)","data_ultim":"1994-12-28","ultimo_pro":"Decreto Ministeriale","rif_legge_":"L. 1089/1939","tutela":"Diretto","vincolo":"Area demaniale"},"geometry":{"type":"MultiPolygon","coordinates":[[[[10.23763052312545,44.705103405745078],[10.237581285737091,44.705042661188152],[10.237270846363414,44.705165168232497],[10.237363280814259,44.705301171564344],[10.237161090139118,44.705380204348636],[10.237336792981994,44.705614798205097],[10.237245528793418,44.705647420474698],[10.237320347497139,44.705752295954916],[10.237313100042142,44.705755174145324],[10.237378144213187,44.705846814194132],[10.238018875503744,44.705609658492484],[10.23763052312545,44.705103405745078]]]]}},{"type":"Feature","properties":{"gid":"4","id_archeo":"7","codice":"007_BO","nome":"Abitati e necropoli dell'età del bronzo recente, dell'età del ferro e dell'età romana","titolo":"Nella campagna a Oriente di Bologna, nella frazione di Quarto Inferiore, svariati scavi, recuperi e ricerche di superficie effettuate su una ristretta porzione di terreno agricolo, hanno documentato l'esistenza di consistenti presenze archeologiche che c","tipo_propr":null,"comuni":"BOLOGNA","sigla_pro":"BO","localita":"Quarto Superiore","tipologie":"Struttura abitativa o insediamento","provvedime":"Decreto Ministeriale (04/01/1993), Decreto Ministeriale (01/07/1993)","data_ultim":"1993-07-01","ultimo_pro":"Decreto Ministeriale","rif_legge_":"L. 1089/1939","tutela":"Diretto","vincolo":"Diretto"},"geometry":{"type":"MultiPolygon","coordinates":[[[[11.42061397795057,44.524285565453162],[11.420989241470933,44.524132943286148],[11.421046835446202,44.524110133345069],[11.420918241604298,44.523880017303085],[11.420575339775267,44.52398363703491],[11.42039845844155,44.524035444711764],[11.419765638955063,44.524220787722783],[11.419550896398931,44.523865402659673],[11.419499406556866,44.523902522109736],[11.419213951550077,44.524068835805956],[11.419004702299707,44.524185631402268],[11.418815487537318,44.524247177616623],[11.418288924016567,44.524349085294091],[11.418196762195427,44.524378001036418],[11.418152962084903,44.524418215704976],[11.418158549893432,44.524496030412145],[11.418191739481111,44.524583396612577],[11.418310683162092,44.524837171366961],[11.418418328480216,44.52504751522887],[11.418444169803957,44.52511482691289],[11.418458379786314,44.525155306185965],[11.418482126885594,44.525233122969858],[11.418511660689395,44.525355558623779],[11.418494712462389,44.525411831405904],[11.418299829662931,44.52564991552611],[11.418735040933253,44.525456770755078],[11.418935413570976,44.525345205213334],[11.419331990735365,44.52506768837214],[11.419593719932942,44.524887780015199],[11.419825775503945,44.524735525508248],[11.419942696852647,44.524656678429331],[11.420002762066316,44.524619385858571],[11.420117897267787,44.524546337978343],[11.420363902938531,44.524402824753089],[11.42061397795057,44.524285565453162]]],[[[11.418406213566735,44.525239341601868],[11.418376123427299,44.525141449057074],[11.418340762782259,44.525037528651055],[11.418267401738815,44.524899034677887],[11.418244318243,44.524855466641114],[11.417878779407797,44.524948431266452],[11.417876411179213,44.524944846324352],[11.417372724164473,44.525076071582873],[11.416900464979442,44.524280305361678],[11.416913745870234,44.524276504064105],[11.417408027982088,44.524148919015772],[11.417794338992797,44.524046243224554],[11.417528545053308,44.523585078721958],[11.417134454353759,44.523682147978874],[11.41692734230325,44.523322276934394],[11.41325351934479,44.524255797690415],[11.412390952229945,44.524486225603283],[11.41282848135133,44.524787780915617],[11.413155056596519,44.525012484691885],[11.413341508159062,44.525123824030715],[11.413630609391657,44.525293351769385],[11.413645271442196,44.525281518559254],[11.413776259069754,44.525329033918737],[11.414127086258429,44.525477836221384],[11.414590786322384,44.52568822782689],[11.414681758702224,44.52573149383651],[11.415137194508109,44.525962259366501],[11.415955940887116,44.526389555775665],[11.416286132866418,44.526577372412312],[11.416449515952978,44.526692058012642],[11.417342533072365,44.526212596205198],[11.418154398050868,44.525773359670225],[11.418189053581294,44.525744159662793],[11.418232850421948,44.525639722457804],[11.418285458217387,44.525553877298798],[11.418381872501385,44.525453788956781],[11.418419422915695,44.525382675683318],[11.418421581890717,44.525322377334113],[11.418406213566735,44.525239341601868]]],[[[11.418959096539531,44.527443523278698],[11.41915616324226,44.52735042822323],[11.419237618878963,44.527433574653202],[11.419300015175878,44.527404173085252],[11.419335930934849,44.527457929431691],[11.419267314478327,44.527495754085507],[11.419409676403331,44.527693699922835],[11.420518272284617,44.527129403962185],[11.420517713182168,44.527134161856523],[11.420531626684546,44.527130887751376],[11.420531495458647,44.527130727593772],[11.420615508293539,44.527061193359692],[11.420731507054473,44.526933293395878],[11.420903164568029,44.526822666867425],[11.420851255895446,44.526670017782514],[11.420959028954004,44.526576554997369],[11.420965881186209,44.526545747652115],[11.420941512821059,44.526528926344724],[11.420807499128635,44.52651972532535],[11.420762397655709,44.526425023739471],[11.420800326853641,44.526274159049187],[11.420855169495812,44.526194035781323],[11.420862333003249,44.526145541266132],[11.420788252157735,44.526095809149446],[11.420762958015802,44.525991684884545],[11.420829036893343,44.525966174347147],[11.420861614503734,44.525948198513923],[11.421055720494035,44.525843982107688],[11.421099205807929,44.525782842607683],[11.421150549305453,44.525690883378751],[11.421241603530801,44.525608226871711],[11.421307084121377,44.525516705692922],[11.421468330295538,44.525154810268411],[11.421493006127061,44.525000607726867],[11.421484238569889,44.524816777265116],[11.421483040909001,44.524799122116164],[11.421417045044779,44.524596242213995],[11.42122707444889,44.524370607197596],[11.421192436426628,44.5242338408355],[11.421052146016669,44.524282856346289],[11.420472479540114,44.524508872952246],[11.420306945464556,44.52459555778703],[11.420195122108996,44.524650134833436],[11.420033545750066,44.524747925200003],[11.419730482155726,44.524940936539558],[11.419540860636173,44.52506924484068],[11.4190163630699,44.525428362555957],[11.418317649471359,44.525807951695029],[11.418296731292669,44.525776265854589],[11.416527785903172,44.526732701875318],[11.416792673146093,44.526888996946077],[11.417075272031303,44.527059373844445],[11.418674491554597,44.528054334286509],[11.418686062636992,44.528061645492485],[11.419076784178117,44.527863104254166],[11.418897145007497,44.527689034032051],[11.419001520673582,44.527636776769896],[11.41886363292463,44.527491270404404],[11.418959096539531,44.527443523278698]]]]}},{"type":"Feature","properties":{"gid":"5","id_archeo":"29","codice":"029_BO","nome":"Abitato dell'età del bronzo","titolo":"Le prime indagini archeologiche in località S. Giovanni in Triario risalgono alla metà dell’Ottocento in seguito alla scoperta di una necropoli celtica ad opera di G. Gozzadini.\nLa scoperta dell'abitato dell’età del Bronzo è avvenuta, invece, nel","tipo_propr":"Ecclesiastica, Privata","comuni":"MINERBIO","sigla_pro":"BO","localita":"San Giovanni in Triario","tipologie":"Struttura abitativa o insediamento - Epoca Età del Bronzo","provvedime":"Decreto Ministeriale (26/06/1981)","data_ultim":"1981-06-26","ultimo_pro":"Decreto Ministeriale","rif_legge_":"L. 1089/1939","tutela":"Diretto","vincolo":"Diretto"},"geometry":{"type":"MultiPolygon","coordinates":[[[[11.500412251574515,44.603103927888355],[11.501861501906602,44.602650129734606],[11.502520166444841,44.602448436590691],[11.502967764647497,44.602308264777164],[11.503011504876325,44.602293981799704],[11.503189193094794,44.602229948188125],[11.503990874016653,44.601978656870848],[11.503346965043576,44.600975537747644],[11.502642690020027,44.601194440276132],[11.501889257441398,44.600081367661616],[11.501584635350888,44.600170508292223],[11.501196343096835,44.599555348293116],[11.501390555151222,44.599500677584146],[11.501138511391408,44.599030166228459],[11.500075842121568,44.597169113996557],[11.499993797711065,44.597031800576517],[11.499903175386725,44.596880145472497],[11.499477322351805,44.597003345793112],[11.499437859325441,44.597014761018904],[11.498975278688095,44.597148576569253],[11.498886438019408,44.597004326463839],[11.498415719840349,44.59718286101338],[11.498347879366536,44.5972085987312],[11.498251672171159,44.597245085123973],[11.497566082905019,44.597499556057187],[11.49716929010903,44.597648677107273],[11.496858872708144,44.597767099204582],[11.496679253543007,44.597832965681789],[11.495905319361434,44.598119607532084],[11.495737459071497,44.598158489447059],[11.495875586931144,44.598343153141066],[11.496255770012278,44.599052852245187],[11.496393306313342,44.599251492475943],[11.496517214309163,44.599578982539562],[11.49654684222047,44.599705805653173],[11.496609919125962,44.599836937980882],[11.496880022292851,44.60009461162327],[11.497098923446876,44.600427583703357],[11.497176962431226,44.600590832202585],[11.497185294898374,44.600608258153216],[11.497280627071785,44.60076280997815],[11.49763863872559,44.601236771221124],[11.497972068314025,44.601795530353371],[11.498074749577825,44.601768795880282],[11.498613839476388,44.602492291144905],[11.499023113114594,44.60312876744306],[11.49910437301738,44.603255124914241],[11.499626752724522,44.603079910829329],[11.499631278697436,44.603086834294444],[11.499778981430197,44.603310453737194],[11.500090938345849,44.603203872929996],[11.500412251574515,44.603103927888355]]]]}},{"type":"Feature","properties":{"gid":"6","id_archeo":"196","codice":"196_RE","nome":"Abitato dell'età etrusca dalla fine del VI a tutto il V sec. A.C.","titolo":"Resti di un insediamento di età etrusca sono stati individuati grazie a raccolte di superficie effettuate nel 1970 dalla Società reggiana di Archeologia e in seguito divennero oggetto di esplorazioni sistematiche in tre campagne di scavo dal 1975 al 19","tipo_propr":"Privata","comuni":"REGGIO NELL`EMILIA","sigla_pro":"RE","localita":"Casale di Rivalta","tipologie":"Struttura abitativa o insediamento - Epoca Età del Ferro","provvedime":"Decreto Ministeriale (20/07/1983)","data_ultim":"1983-07-20","ultimo_pro":"Decreto Ministeriale","rif_legge_":"L. 1089/1939","tutela":"Diretto","vincolo":"Diretto"},"geometry":{"type":"MultiPolygon","coordinates":[[[[10.596965827607608,44.66429563607052],[10.596551735316391,44.663607513441363],[10.596508403883901,44.663616599453142],[10.595636765994536,44.663884321025179],[10.594857325266039,44.6641229582942],[10.594749773444569,44.664155887303934],[10.594653250536286,44.664185435785868],[10.595079758353215,44.664871945132674],[10.595087914040899,44.664885072474952],[10.595547173319178,44.665624279297454],[10.59650860381295,44.665324065281794],[10.597417848629636,44.665048835115542],[10.597000875108925,44.664364732585945],[10.596963660709447,44.664306757054632],[10.596965827607608,44.66429563607052]]]]}},{"type":"Feature","properties":{"gid":"7","id_archeo":"179","codice":"179_RA","nome":"Abitato e sepolcreto di età eneolitica","titolo":"Fra il 1949 e il 1950 fu rinvenuta un’area di necropoli sulla sinistra del fiume Senio, lungo via Firenze, a circa 300 m dall’attuale centro abitato di Borgo Rivola. Le tombe erano in fossa terragna con una profondità rientrante fra 1,30 e 1,80 m da","tipo_propr":"Privata","comuni":"RIOLO TERME","sigla_pro":"RA","localita":"Borgo Rivola","tipologie":"Sepoltura-e - Epoca Eneolitico, Struttura abitativa o insediamento - Epoca Eneolitico","provvedime":"Decreto Ministeriale (28/05/1991)","data_ultim":"1991-05-28","ultimo_pro":"Decreto Ministeriale","rif_legge_":"L. 1089/1939","tutela":"Diretto","vincolo":"Diretto"},"geometry":{"type":"MultiPolygon","coordinates":[[[[11.668225815586334,44.260750972177917],[11.668409583063656,44.260729239038213],[11.668409769077803,44.260693494532269],[11.668341021691829,44.260571478262605],[11.668250180645684,44.26040858456966],[11.668183172038775,44.260250238248169],[11.668127388608973,44.260113217677223],[11.66808387119827,44.260019140689373],[11.668031341610162,44.259906675019941],[11.667956832798266,44.259760558262698],[11.667945943240728,44.259733904100514],[11.667943678956206,44.259669750757404],[11.667262929426542,44.25947767143527],[11.667186061099718,44.259658141140349],[11.666674634209473,44.259665047003814],[11.666782668084894,44.259342716503753],[11.666317502446503,44.259212439401686],[11.665908144770903,44.259094325036074],[11.665854490653755,44.259078220997566],[11.665467392188853,44.25900493115531],[11.665204829498421,44.2589838643935],[11.664748032861661,44.25899288018617],[11.66395448560978,44.259001803319819],[11.663918177718221,44.259006125532963],[11.664009163473976,44.259449215082633],[11.664113568802433,44.260072807799304],[11.665225496436291,44.259968082004214],[11.665907298890286,44.260108279752401],[11.66595071553696,44.260117207413231],[11.667123346305118,44.260358321971502],[11.667503495052644,44.260318471328581],[11.667530597090018,44.260459799418769],[11.667441188829802,44.260613968722552],[11.667597243181794,44.260757451180766],[11.667620648696694,44.260754509591067],[11.667702665475019,44.260747614676646],[11.667906396769858,44.260755673438503],[11.668152829589522,44.260757836455724],[11.668225815586334,44.260750972177917]]]]}},{"type":"Feature","properties":{"gid":"8","id_archeo":"210","codice":"210_RN","nome":"Abitato dell'età del Ferro","titolo":"Consistenti resti di insediamento, con strutture attribuibili a una fase villanoviana (fino al VI secolo s. C.) e a una umbro-etrusca (V-IV secolo a. C.)","tipo_propr":"Privata","comuni":"VERUCCHIO","sigla_pro":"RN","localita":"Pian del Monte","tipologie":"Struttura abitativa o insediamento - Epoca Età del Ferro, Struttura abitativa o insediamento - Epoca Età del Ferro","provvedime":"Decreto Ministeriale (17/12/1992), Decreto Ministeriale (16/05/1988)","data_ultim":"1992-12-17","ultimo_pro":"Decreto Ministeriale","rif_legge_":"L. 1089/1939","tutela":"Diretto","vincolo":"Diretto"},"geometry":{"type":"MultiPolygon","coordinates":[[[[12.424063969600637,43.978334336986656],[12.424237180103688,43.97820161697981],[12.424327514500016,43.978130738169384],[12.424415355280908,43.978060942404895],[12.424528660479398,43.977976320278813],[12.424647948637341,43.977884100284527],[12.424689056640686,43.977851897462457],[12.424801177688952,43.977764042619071],[12.424827566248396,43.977715230295715],[12.424876810329202,43.97761405654699],[12.424885795566134,43.977595583429768],[12.424962938346242,43.977438700915258],[12.425014709396928,43.977334219297752],[12.425029600221418,43.977289037953099],[12.425042495959531,43.977241683799349],[12.42504445246327,43.977224339874496],[12.425049370865217,43.977186758992666],[12.425052281298939,43.977153496647759],[12.425056070033481,43.977058809431867],[12.424905592880915,43.977068285546522],[12.424597640133772,43.977086510890885],[12.424373178866281,43.977099997729368],[12.424348216346418,43.97690448750464],[12.42434112485692,43.976855338380972],[12.424331367077826,43.976741863831755],[12.424324208232646,43.976670308968927],[12.424316056425685,43.97660489674368],[12.424238992409858,43.976570963924956],[12.424202360082754,43.976514967744521],[12.42415387851891,43.976524740776185],[12.424123394611948,43.976531624131887],[12.423970450838326,43.976556279567838],[12.423797020382771,43.976585636590663],[12.42373855653288,43.976729792644491],[12.42343683494971,43.976713755344363],[12.423331956685201,43.976755873885786],[12.423285470090962,43.976774544411157],[12.423188059072254,43.976814710331077],[12.423142112230746,43.97683604742199],[12.423101659638235,43.97685884019802],[12.423068699300615,43.976877294015331],[12.422992322451069,43.976925750597033],[12.422907440172748,43.976980007887263],[12.422828561973274,43.977034616211675],[12.422770149309388,43.977075484782048],[12.422706242683965,43.977118156564423],[12.422675306169834,43.977143841779387],[12.42265535143429,43.977167334095022],[12.422651433935235,43.977199150134098],[12.422647506967937,43.977237088302928],[12.422649329721512,43.977375873519968],[12.422649685202835,43.977538136805954],[12.42264939849653,43.977567836362859],[12.422648477956928,43.977663904933713],[12.422649575707187,43.977710524081964],[12.422642023615506,43.9777942507368],[12.422635919248743,43.977861963160883],[12.422636501671454,43.977897020270802],[12.42264127419598,43.978018809927676],[12.422642682817228,43.978031380487515],[12.422648681649916,43.978084616399535],[12.422995951411254,43.978257857239242],[12.422892726460095,43.978351381704059],[12.422982456766343,43.97843069274743],[12.422988695287511,43.978425945768407],[12.423201817318802,43.978260313766299],[12.423206103764928,43.978263093081942],[12.423250376568951,43.978291744231704],[12.423317053311246,43.978335361093137],[12.423369052893339,43.978369380126331],[12.423424140533033,43.978406583494937],[12.423538304296356,43.978480969541188],[12.423720072824542,43.978602302275746],[12.42389377935933,43.978467776372021],[12.424063969600637,43.978334336986656]]]]}},{"type":"Feature","properties":{"gid":"9","id_archeo":"109","codice":"109_PR","nome":"Antica fornace","titolo":"Nell’autunno 1994, lavori di scavo per la posa telefonica hanno messo in luce, in loc. Molino dei Notari presso Madregolo, una fornace di età post-medievale ed una fossa di scarico ad essa relativa. È stato possibile perimetrare l’area occupata dal","tipo_propr":"Privata","comuni":"COLLECCHIO","sigla_pro":"PR","localita":"Madregolo, loc. Molino dei Notari","tipologie":"Struttura produttiva - artigianale - Epoca Età Medievale","provvedime":"Decreto Ministeriale (02/11/1996)","data_ultim":"1996-11-02","ultimo_pro":"Decreto Ministeriale","rif_legge_":"L. 1089/1939","tutela":"Diretto","vincolo":"Diretto"},"geometry":{"type":"MultiPolygon","coordinates":[[[[10.217325890271912,44.772297870636251],[10.217320519568222,44.77237392811319],[10.217312651485161,44.772466148475885],[10.21729847180298,44.772623638322941],[10.217292471712653,44.772701921523002],[10.217287098143336,44.772770331739359],[10.217272299324295,44.772942861679823],[10.217416965481902,44.772962762505315],[10.217571086327029,44.772983336516759],[10.21773243968817,44.773005282535827],[10.217757955615163,44.773008657184214],[10.217847342145134,44.772300799728967],[10.217325890271912,44.772297870636251]]]]}},{"type":"Feature","properties":{"gid":"10","id_archeo":"189","codice":"189_RE","nome":"Area archeologica di Luceria","titolo":"Resti dell’abitato romano di Luceria, citato nella Geographia di Tolomeo, frequentato senza interruzioni a partire dal II sec. a.C. fino al IV sec. d.C. Si tratta di una delle poche città romane emiliane che non sono sopravvissute nel tempo. Il centro","tipo_propr":"Privata","comuni":"CANOSSA","sigla_pro":"RE","localita":"Case dell'Eva","tipologie":"Struttura abitativa o insediamento - Epoca Età Romana","provvedime":"Decreto Direzione Regionale (28/07/2011), Decreto Direzione Regionale (29/07/2011)","data_ultim":"2011-07-29","ultimo_pro":"Decreto Direzione Regionale","rif_legge_":"D. Lgs. 42/2004","tutela":"Diretto","vincolo":"Diretto"},"geometry":{"type":"MultiPolygon","coordinates":[[[[10.412256409225662,44.60880346859463],[10.41221867123414,44.608629206913463],[10.412033548693126,44.608647348375108],[10.411628333499644,44.608687057611554],[10.411115125537652,44.608737347532362],[10.411138355252248,44.608897202386288],[10.411094161562849,44.609458042049461],[10.411298507889249,44.609828878735321],[10.411521366688037,44.610133022361879],[10.411633878476497,44.610291342622965],[10.412013558528026,44.610111338599133],[10.412278560899034,44.610026555914679],[10.412072252589175,44.609707112343401],[10.412154417957835,44.609671167754477],[10.412277480001169,44.609622321349924],[10.412424936622497,44.609581653347398],[10.412296688982316,44.608989462126431],[10.412256409225662,44.60880346859463]]]]}},{"type":"Feature","properties":{"gid":"11","id_archeo":"189","codice":"189_RE","nome":"Area archeologica di Luceria","titolo":"Resti dell’abitato romano di Luceria, citato nella Geographia di Tolomeo, frequentato senza interruzioni a partire dal II sec. a.C. fino al IV sec. d.C. Si tratta di una delle poche città romane emiliane che non sono sopravvissute nel tempo. Il centro","tipo_propr":"Privata","comuni":"CANOSSA","sigla_pro":"RE","localita":"Case dell'Eva","tipologie":"Struttura abitativa o insediamento - Epoca Età Romana","provvedime":"Decreto Direzione Regionale (28/07/2011), Decreto Direzione Regionale (29/07/2011)","data_ultim":"2011-07-29","ultimo_pro":"Decreto Direzione Regionale","rif_legge_":"D. Lgs. 42/2004","tutela":"Indiretto","vincolo":"Indiretto"},"geometry":{"type":"MultiPolygon","coordinates":[[[[10.411892882410084,44.61050144110613],[10.412791276907646,44.60989508416688],[10.412882621378658,44.609776213451546],[10.413363988788966,44.609517897466709],[10.413368087433298,44.609521132589045],[10.41339730207466,44.609507213672586],[10.413423432440322,44.609488237612517],[10.413484359398863,44.609455309547776],[10.413620300624357,44.609293836699102],[10.413653242636343,44.60925020903364],[10.413771211169136,44.608890880953581],[10.413812694389794,44.608754207865125],[10.413874141329149,44.608677846089087],[10.413908798647219,44.608651949643033],[10.413546632967943,44.608616442612799],[10.413017338074658,44.608564548052357],[10.413013569076101,44.60856357291042],[10.412582972172913,44.60845223221628],[10.412577786656918,44.60845089108178],[10.412009444279954,44.608501413062363],[10.411598874426694,44.608537907942434],[10.411092664673143,44.608582901653278],[10.410967849980754,44.608593995709164],[10.41054808394817,44.608625115297123],[10.410458976372045,44.60862925562639],[10.410417225381567,44.608632734676164],[10.410388276264239,44.608635147324229],[10.410385820072619,44.608634261212281],[10.410057247917473,44.608515686372478],[10.409617501035314,44.608356987324179],[10.409456533168211,44.608298895781964],[10.409161050726045,44.608358388685566],[10.408240302380275,44.608543766413163],[10.408246491395289,44.60857275223151],[10.408253447876985,44.608604552603225],[10.408349398917757,44.608934411092676],[10.408375281016028,44.609026545567602],[10.408434722403632,44.609174944723399],[10.408519939618804,44.609361546835935],[10.408531825345111,44.60938246565388],[10.40857788767403,44.609467968616606],[10.408828783656405,44.609745539149003],[10.408971975615747,44.609907200728998],[10.409465984531961,44.610443917744412],[10.409480339161043,44.610459035521664],[10.409683350851436,44.61068075955972],[10.409793795508634,44.610801377629748],[10.410170096080094,44.611189673971083],[10.410233674568905,44.611255172969045],[10.410550898621482,44.611572151982301],[10.410580106965652,44.61160057163341],[10.410600049466144,44.611616385463186],[10.410928313337454,44.611834868062452],[10.410993119302237,44.611875019017461],[10.411066296846816,44.611894496299669],[10.411092561456716,44.611798801611016],[10.411165553687836,44.611536005321874],[10.411264665082628,44.61151950403007],[10.411471008759159,44.611310937217475],[10.411477804047159,44.611285556819361],[10.411514406819695,44.611163024487844],[10.411542997688887,44.611005797293913],[10.411558241641117,44.610920303220318],[10.411573580832734,44.610755542794806],[10.411668921935396,44.610676098716219],[10.411681442537045,44.610663358782887],[10.411820010472365,44.610553258717154],[10.411892882410084,44.61050144110613]],[[10.412033548693126,44.608647348375108],[10.41221867123414,44.608629206913463],[10.412256409225662,44.60880346859463],[10.412296688982316,44.608989462126431],[10.412424936622497,44.609581653347398],[10.412277480001169,44.609622321349924],[10.412154417957835,44.609671167754477],[10.412072252589175,44.609707112343401],[10.412278560899034,44.610026555914679],[10.412013558528026,44.610111338599133],[10.411633877218859,44.610291342635776],[10.411521366688037,44.610133022361879],[10.411298507889249,44.609828878735321],[10.411094161562849,44.609458042049461],[10.411138355252248,44.608897202386288],[10.411115125537652,44.608737347532362],[10.411628333499644,44.608687057611554],[10.412033548693126,44.608647348375108]]]]}},{"type":"Feature","properties":{"gid":"12","id_archeo":"48","codice":"048_FC","nome":"Area di rispetto della villa romana di età imperiale","titolo":"Area di rispetto della villa romana di età imperiale","tipo_propr":"Privata","comuni":"PREDAPPIO","sigla_pro":"FC","localita":"Fiumana","tipologie":"Struttura abitativa o insediamento - Epoca Età Romana","provvedime":"Decreto Ministeriale (09/08/1989)","data_ultim":"1989-08-09","ultimo_pro":"Decreto Ministeriale","rif_legge_":"L. 1089/1939","tutela":"Indiretto","vincolo":"Indiretto"},"geometry":{"type":"MultiPolygon","coordinates":[[[[11.992558539745557,44.154681980926682],[11.992531596395576,44.154633353266668],[11.992450711207045,44.154487363650702],[11.992408678145573,44.154416049012042],[11.992388476526033,44.154381792732096],[11.992390425942066,44.154370641370711],[11.992396810026246,44.154251603329527],[11.99229214793233,44.153992975227432],[11.992280986679333,44.153967115337046],[11.992208825839011,44.153787145898121],[11.99213465179329,44.153603952247138],[11.992067052966288,44.15342936366698],[11.991966987147441,44.153186891430785],[11.991922741310841,44.153069064054961],[11.991942716501024,44.152961859162794],[11.991865153201566,44.152987579019367],[11.991786390776968,44.152790011212389],[11.99159958193647,44.152329311929932],[11.991542556037816,44.152188682741297],[11.991433425283502,44.151922064051824],[11.991037395417703,44.152033730892001],[11.991026113008923,44.152022647349717],[11.991034838560875,44.152034452411186],[11.988334319910836,44.152795858578891],[11.987204541198198,44.153114374253164],[11.988840961044371,44.155906036834253],[11.989744856258792,44.155631634939589],[11.99164515237489,44.155045195613333],[11.992597684912042,44.154751224129939],[11.992558539745557,44.154681980926682]],[[11.989727187564965,44.153392331062228],[11.990468940957937,44.153176380590047],[11.990480382287672,44.153195653310981],[11.990717600907805,44.1535952322117],[11.991097280078982,44.15423476426907],[11.989450623939128,44.154724458737356],[11.989341101627149,44.154393950455152],[11.989280448466126,44.154208195018654],[11.989175364954546,44.154054563621443],[11.988959598570521,44.153731476555855],[11.988924705875878,44.153678888059659],[11.988891764357966,44.15362922920086],[11.989727187564965,44.153392331062228]]]]}},{"type":"Feature","properties":{"gid":"13","id_archeo":"220","codice":"220_FC","nome":"Area di sedime di monumento romano","titolo":"Area di sedime di monumento romano - Monumento funerario di Obulacco","tipo_propr":"Pubblica","comuni":"SARSINA","sigla_pro":"FC","localita":"Parco della Rimembranza","tipologie":"Complesso monumentale - Epoca Età Romana","provvedime":null,"data_ultim":null,"ultimo_pro":null,"rif_legge_":null,"tutela":"Diretto","vincolo":"Area demaniale"},"geometry":{"type":"MultiPolygon","coordinates":[[[[12.144917618808332,43.919466934069035],[12.14490480296638,43.91966063251904],[12.144980121061531,43.919662572352124],[12.144980943936302,43.919641329950977],[12.145042703148015,43.919631075383087],[12.145077928821184,43.919610109340248],[12.145093187999858,43.919585579201105],[12.145092919295791,43.919554265674314],[12.145070638911806,43.919515087036011],[12.145025019443338,43.919488219232619],[12.144993600372203,43.919488310780118],[12.144994395920218,43.919464188212771],[12.144917618808332,43.919466934069035]]]]}},{"type":"Feature","properties":{"gid":"14","id_archeo":"203","codice":"203_RN","nome":"Area Rocca Malatestiana, mura romane tardo-imperiali, fossato e insediamenti antichi","titolo":"Tracciato delle mura tardo-imperiali del settore occidentale della città romana, area dell'antico fossato difensivo della Rocca e altri resti insediativi antichi","tipo_propr":"Pubblica","comuni":"RIMINI","sigla_pro":"RN","localita":null,"tipologie":"Fortificazione - Epoca Età Medievale, Fortificazione - Epoca Età Tardoantica, Struttura abitativa o insediamento - Epoca Età Romana, Struttura abitativa o insediamento - Epoca Età Medievale","provvedime":"Decreto Ministeriale (20/10/1991)","data_ultim":"1991-10-20","ultimo_pro":"Decreto Ministeriale","rif_legge_":"L. 1089/1939","tutela":"Diretto","vincolo":"Diretto"},"geometry":{"type":"MultiPolygon","coordinates":[[[[12.564192330275302,44.059088613641912],[12.563575798915782,44.058857081068602],[12.563576124716768,44.058856664880864],[12.563562050433919,44.058851722736719],[12.563513653724936,44.058834726850634],[12.563404022061036,44.058793714265832],[12.563397617369507,44.058791317959177],[12.563293764747494,44.058752467245633],[12.563193485210453,44.058904129521537],[12.563192975470431,44.058903832154435],[12.563155498367632,44.058961581832072],[12.563130636072806,44.058999183234903],[12.563125799561281,44.05900649761157],[12.563036269202053,44.059141902128012],[12.562887857491917,44.059366355771758],[12.562761535219872,44.059545087762437],[12.562615752249753,44.059746115339159],[12.562592627314652,44.059778002463204],[12.562528527353818,44.059866393391914],[12.562515655430042,44.059884616769274],[12.562527358681564,44.060007329808201],[12.562534784739608,44.060015194834982],[12.562607199605527,44.060069593105325],[12.56262182818484,44.060078356753223],[12.56262278788201,44.060081303033044],[12.562724940011154,44.060158038889071],[12.562858596704102,44.060260010807511],[12.562925731389562,44.060282480548466],[12.562943584642264,44.060288456181134],[12.563077697463781,44.06033334278932],[12.563408672217054,44.060444117693542],[12.563451011604045,44.060458287842941],[12.563642494486764,44.060447611504593],[12.563907664438492,44.060432825434432],[12.564060577049561,44.060424298447131],[12.56411375159211,44.060356795389438],[12.564355038116227,44.060050487267773],[12.56434387215606,44.060044108484497],[12.564398254483512,44.059994620388927],[12.564611928745139,44.059717228108227],[12.564505680037788,44.059205833535962],[12.564192330275302,44.059088613641912]]]]}},{"type":"Feature","properties":{"gid":"15","id_archeo":"169","codice":"169_RA","nome":"Basilica di San Probo","titolo":"La chiesa di San Probo (Beati Probi) è stata oggetto di rinvenimenti casuali più che di scavi regolari. Grazie al Liber Pontificalis di Andrea Agnello si può ritenere che la basilica cimiteriale si possa ubicare a SE della chiesa di S. Apollinare in C","tipo_propr":"Privata","comuni":"RAVENNA","sigla_pro":"RA","localita":"Classe","tipologie":"Luogo di culto - Epoca Età Tardoantica","provvedime":"Decreto Ministeriale (28/09/1977), Decreto Ministeriale (26/06/1981)","data_ultim":"1981-06-26","ultimo_pro":"Decreto Ministeriale","rif_legge_":"L. 1089/1939","tutela":"Diretto","vincolo":"Diretto"},"geometry":{"type":"MultiPolygon","coordinates":[[[[12.235972554271729,44.379781454496175],[12.235927738337301,44.379825839452344],[12.235928718363345,44.379826357202226],[12.235852062254523,44.379901729109662],[12.235814340836917,44.379938808188399],[12.235723360992077,44.380028250854167],[12.235651760547778,44.380099161742791],[12.235652167583414,44.380099372556629],[12.235571380212436,44.380178372340026],[12.235570679903805,44.38017905747283],[12.235875088797151,44.380342552037725],[12.235950294180686,44.380267427407347],[12.236004606520396,44.380215032910407],[12.236056130327766,44.380165337153016],[12.236236564633172,44.379987897049567],[12.236432337878673,44.37979727428489],[12.236461948766905,44.379769049290296],[12.236153110658188,44.379605674688797],[12.236049429578463,44.379707217786532],[12.236014988026739,44.379740945063411],[12.235973259018035,44.379781828813947],[12.235972554271729,44.379781454496175]]]]}},{"type":"Feature","properties":{"gid":"16","id_archeo":"169","codice":"169_RA","nome":"Basilica di San Probo","titolo":"La chiesa di San Probo (Beati Probi) è stata oggetto di rinvenimenti casuali più che di scavi regolari. Grazie al Liber Pontificalis di Andrea Agnello si può ritenere che la basilica cimiteriale si possa ubicare a SE della chiesa di S. Apollinare in C","tipo_propr":"Privata","comuni":"RAVENNA","sigla_pro":"RA","localita":"Classe","tipologie":"Luogo di culto - Epoca Età Tardoantica","provvedime":"Decreto Ministeriale (28/09/1977), Decreto Ministeriale (26/06/1981)","data_ultim":"1981-06-26","ultimo_pro":"Decreto Ministeriale","rif_legge_":"L. 1089/1939","tutela":"Indiretto","vincolo":"Indiretto"},"geometry":{"type":"MultiPolygon","coordinates":[[[[12.236925233494786,44.380178379094289],[12.237025205825962,44.38008561867796],[12.237088174735989,44.380026334368836],[12.237233293204328,44.379889511180906],[12.237026323752383,44.379782195356583],[12.23692029949809,44.379727220724462],[12.236872403914287,44.379702386159053],[12.236661384398904,44.379574075850556],[12.236651820682861,44.37958342779195],[12.23646487519064,44.379482565671879],[12.236377767848243,44.379435568401796],[12.23637701489834,44.379435162146372],[12.236261654597024,44.379503911655284],[12.23625942917362,44.379505028951044],[12.236179582473492,44.379580617596581],[12.236153110658188,44.379605674688797],[12.236461948766905,44.379769049290296],[12.236432337878673,44.37979727428489],[12.236236564633172,44.379987897049567],[12.236108622357309,44.380113716222702],[12.236335504386863,44.380233657391486],[12.236351610694818,44.380242171412334],[12.236414082054958,44.380181702474914],[12.23644914770224,44.380201185539512],[12.236447999134286,44.380202277692582],[12.23672487690996,44.380366233952131],[12.236925233494786,44.380178379094289]]]]}},{"type":"Feature","properties":{"gid":"17","id_archeo":"73","codice":"073_FE","nome":"Casone di età rinascimentale","titolo":"Nel 1979 una campagna di scavo  ha riportato alla luce i resti di una dimora precaria di valle, attribuibile ad epoca rinascimentale. \nPer ciò che concerne l’assetto della costruzione, sono stati individuati due livelli pavimentali costituiti da pezza","tipo_propr":"Privata","comuni":"COMACCHIO, PORTOMAGGIORE","sigla_pro":"FE, FE","localita":"Valle del Mezzano, loc. Dosso Volpi","tipologie":"Struttura abitativa o insediamento - Epoca Età Post-Medievale","provvedime":"Decreto Ministeriale (27/06/1992)","data_ultim":"1992-06-27","ultimo_pro":"Decreto Ministeriale","rif_legge_":"L. 1089/1939","tutela":"Diretto","vincolo":"Diretto"},"geometry":{"type":"MultiPolygon","coordinates":[[[[11.967986186795436,44.664465265017341],[11.967962175205185,44.66446576908838],[11.967977812691375,44.664949793502927],[11.968367348150897,44.664943450087229],[11.968381899106786,44.664961703790304],[11.968406614580962,44.66496129473564],[11.96838789086973,44.664456834261706],[11.968005109052312,44.664464868143249],[11.967986186795436,44.664465265017341]]]]}},{"type":"Feature","properties":{"gid":"18","id_archeo":"180","codice":"180_RA","nome":"Centro sacrale per il culto delle fonti","titolo":"Le indagini nella grotta del Re Tiberio hanno portato a un’approfondita ricostruzione storica della sua frequentazione. \nI reperti più antichi rinvenuti sembrano risalire all’Eneolitico. Si può invece ipotizzare un uso sepolcrale della grotta duran","tipo_propr":"Privata","comuni":"RIOLO TERME","sigla_pro":"RA","localita":"Borgo Rivola","tipologie":"Luogo di culto - Epoca Età Romana, Luogo di culto - Epoca Età del Bronzo","provvedime":"Decreto Ministeriale (09/07/1951)","data_ultim":"1951-07-09","ultimo_pro":"Decreto Ministeriale","rif_legge_":"L. 1089/1939","tutela":"Diretto","vincolo":"Diretto"},"geometry":{"type":"MultiPolygon","coordinates":[[[[11.667367137026821,44.256476402342408],[11.667326391161318,44.256262130045108],[11.667107195521575,44.256269078655777],[11.666474264572127,44.256047384165385],[11.665960064133442,44.256106674449796],[11.665317934615148,44.256062376810036],[11.664860344559381,44.256432486398367],[11.664726927527969,44.256548906877129],[11.664561065163092,44.256728490247411],[11.664211874336551,44.257087073585275],[11.665800496784783,44.257134370212547],[11.666266112326417,44.257151998915184],[11.666887246716337,44.256906872086418],[11.667170355251736,44.256878066936864],[11.667367137026821,44.256476402342408]]]]}},{"type":"Feature","properties":{"gid":"19","id_archeo":"164","codice":"164_RA","nome":"Chiesa di S. Niccolò e domus romana repubblicana","titolo":"Stratificazione archeologica complessa, comprendente resti dall'età romana al periodo medievale.","tipo_propr":"Privata","comuni":"FAENZA","sigla_pro":"RA","localita":null,"tipologie":"Luogo di culto - Epoca Età Medievale, Struttura abitativa o insediamento - Epoca Età Tardoantica, Struttura abitativa o insediamento - Epoca Età Romana, Struttura non identificata - Epoca Età Romana","provvedime":"Decreto Ministeriale (17/03/1997)","data_ultim":"1997-03-17","ultimo_pro":"Decreto Ministeriale","rif_legge_":"L. 1089/1939","tutela":"Diretto","vincolo":"Diretto"},"geometry":{"type":"MultiPolygon","coordinates":[[[[11.880268534447085,44.28512196083814],[11.880157979395921,44.285021459547515],[11.880077409740636,44.285059051327373],[11.880167770098272,44.285164980523355],[11.880268534447085,44.28512196083814]]]]}},{"type":"Feature","properties":{"gid":"20","id_archeo":"25","codice":"025_BO","nome":"Complesso archeologico con edificio basilicale, necropoli e strutture tardo-romane ed altomedievali","titolo":"Straordinario complesso di testimonianze monumentali. \nOltre 300 erano le tombe di età tardo-romana, databili dal III secolo d.C. a tutto il VI, che facevano parte della vasta necropoli suburbana che si estendeva sui due lati della via Aemilia; le sepol","tipo_propr":"Privata","comuni":"IMOLA","sigla_pro":"BO","localita":null,"tipologie":"Fortificazione - Epoca Età Altomedievale, Luogo di culto - Epoca Età Altomedievale, Sepoltura-e - Epoca Età Altomedievale, Sepoltura-e - Epoca Età Tardoantica, Struttura abitativa o insediamento - Epoca Età Medievale","provvedime":"Decreto Ministeriale (02/10/1984)","data_ultim":"1984-10-02","ultimo_pro":"Decreto Ministeriale","rif_legge_":"L. 1089/1939","tutela":"Diretto","vincolo":"Diretto"},"geometry":{"type":"MultiPolygon","coordinates":[[[[11.69550375683778,44.356491103392344],[11.695493734882131,44.356479420861973],[11.695186298792041,44.356643673648684],[11.694982436783349,44.356753095167086],[11.694941695535181,44.356770900597297],[11.694948272703249,44.356778334348064],[11.695299432097899,44.357232389013141],[11.695371047831523,44.357326600650786],[11.695714720684569,44.357775411315139],[11.695770216168388,44.357749893182472],[11.696045520769417,44.357623640768281],[11.69614954927258,44.35757401994087],[11.696287730995211,44.357511781100996],[11.696215840529819,44.357404784098115],[11.696177228791937,44.35734430867695],[11.696117680783292,44.35728806376563],[11.696116292059727,44.357286512140483],[11.696082705946699,44.357249144210527],[11.696036075720826,44.357189200227431],[11.695946461548775,44.357072475952144],[11.695796323061076,44.356875196046204],[11.695675714361695,44.356718755703206],[11.695656766844195,44.356691394708228],[11.69550375683778,44.356491103392344]]]]}},{"type":"Feature","properties":{"gid":"21","id_archeo":"175","codice":"175_RA","nome":"Complesso architettonico della chiesa paleocristiana di Santa Croce","titolo":"Resti del complesso della chiesa paleocristiana di S. Croce e di edifici ancora più antichi","tipo_propr":"Privata, Pubblica","comuni":"RAVENNA","sigla_pro":"RA","localita":null,"tipologie":"Luogo di culto - Epoca Età Tardoantica, Luogo di culto - Epoca Età Altomedievale, Luogo di culto - Epoca Età Medievale, Struttura abitativa o insediamento - Epoca Età Tardoantica, Struttura abitativa o insediamento - Epoca Età Altomedievale, Struttu","provvedime":"Declaratoria (14/12/1957), Decreto Ministeriale (25/01/1958)","data_ultim":"1958-01-25","ultimo_pro":"Decreto Ministeriale","rif_legge_":"L. 1089/1939","tutela":"Diretto","vincolo":"Diretto"},"geometry":{"type":"MultiPolygon","coordinates":[[[[12.197992428411728,44.4213164686958],[12.198121076179497,44.421304146557176],[12.198105500748927,44.421250083204157],[12.19809500874082,44.421213665906627],[12.198092295127976,44.421206756198259],[12.198079145013924,44.421173420228889],[12.198078045314318,44.421170993429705],[12.198062263765305,44.421136164845393],[12.198061626751974,44.421134850362556],[12.198044256406614,44.421099220115387],[12.198042742664514,44.421096111751787],[12.198012877732719,44.421050659259755],[12.197979781560846,44.421000319077073],[12.197950818322001,44.420956425694136],[12.19794384754811,44.420945854377592],[12.197917641813794,44.420909904739659],[12.197904267264652,44.420891554933675],[12.197890017989987,44.420873058614227],[12.197862870830233,44.420837810539261],[12.197829721289454,44.42079477270844],[12.197827419302637,44.420792181574974],[12.197768719294638,44.420726346104281],[12.197760205861877,44.420717888581635],[12.197694211875131,44.420652356636516],[12.19766232426071,44.420620698334993],[12.197660597420255,44.420618748243982],[12.197632303830538,44.420586656064295],[12.197630553373378,44.420584733637774],[12.197571991840675,44.420520046487617],[12.197461266361142,44.420565894320227],[12.197342499001479,44.420610086043176],[12.197336050184703,44.420611608203046],[12.197241548440894,44.420633882928215],[12.197259852306511,44.42073174732095],[12.19725973088123,44.420732975043634],[12.197250555982993,44.420837614429907],[12.197250380191674,44.420838996716583],[12.197245159255111,44.420878672376972],[12.197240584324016,44.420913612700403],[12.197238290350175,44.420926820433955],[12.197235859257486,44.420940968257163],[12.197208801480107,44.421097944499266],[12.197204016019835,44.421097952641034],[12.197201625369305,44.421214122852717],[12.197201577453168,44.421217157985495],[12.197383918684299,44.421265708482373],[12.197456894125903,44.421305865294364],[12.19749788259942,44.421328428167946],[12.197614873998743,44.421323941397304],[12.197677927080912,44.421323379642303],[12.197780133405422,44.42132395249677],[12.197828975031996,44.42132423029144],[12.197852107566844,44.421324355792422],[12.197897190597356,44.421321822200795],[12.197992428411728,44.4213164686958]]]]}},{"type":"Feature","properties":{"gid":"22","id_archeo":"186","codice":"186_RE","nome":"Complesso artigianale di età imperiale romana","titolo":"Durante i lavori di posa di un metanodotto, nel 1992, è stato rinvenuto un complesso artigianale di notevole rilievo, costituito da almeno tre fornaci databili all’epoca romano-imperiale.\nDelle tre fornaci solamente una è stata parzialmente esplorata","tipo_propr":"Privata","comuni":"BORETTO","sigla_pro":"RE","localita":"Santa Croce, loc. Quadra Cucca","tipologie":"Struttura produttiva - artigianale - Epoca Età Romana","provvedime":"Decreto Ministeriale (30/04/1993)","data_ultim":"1993-04-30","ultimo_pro":"Decreto Ministeriale","rif_legge_":"L. 1089/1939","tutela":"Diretto","vincolo":"Diretto"},"geometry":{"type":"MultiPolygon","coordinates":[[[[10.538233260701233,44.895590819301766],[10.538192398180502,44.895100204195856],[10.538079861733284,44.895113774771971],[10.5377394957944,44.895154277212107],[10.537523758731382,44.895201849913256],[10.537609208430553,44.895317389258544],[10.537660943368964,44.895414793963013],[10.537680956072798,44.895545059395388],[10.537627229811944,44.89565752229791],[10.537501313470612,44.895939525017312],[10.537410834068234,44.896217530646709],[10.538291917859592,44.896134997380329],[10.538233260701233,44.895590819301766]]],[[[10.536810380028031,44.894227352585006],[10.536663873276305,44.893930468788199],[10.535375983680527,44.894024426116097],[10.535539447974788,44.894583192304808],[10.535803216141447,44.895204197516819],[10.536285192061547,44.896332947279667],[10.536604541653848,44.896296403896727],[10.537280087108321,44.896222685053168],[10.537410688909468,44.895863159076747],[10.537537081510616,44.895582383288513],[10.537558230655149,44.895512523588081],[10.537543962812304,44.89540819594486],[10.537520510513151,44.895360775301747],[10.537440831348821,44.895235562262023],[10.53717876775338,44.89476804548908],[10.537018169659797,44.894519912991093],[10.536870984662064,44.894331677667708],[10.536810380028031,44.894227352585006]]]]}},{"type":"Feature","properties":{"gid":"23","id_archeo":"24","codice":"024_BO","nome":"Complesso idrico di età romana","titolo":"Acquedotto in laterizio dalla struttura molto particolare, con due tronconi rettilinei che si sviluppavano con andamento lievemente angolare ai lati contrapposti di un pozzetto mediano a pianta quadrata, al quale si innestavano. L’altezza complessiva d","tipo_propr":"Pubblica","comuni":"IMOLA","sigla_pro":"BO","localita":"Posere Morina di Sopra","tipologie":"Infrastruttura territoriale o urbana - Epoca Età Romana","provvedime":"Notifica (02/11/1976)","data_ultim":"1976-11-02","ultimo_pro":"Notifica","rif_legge_":"L. 1089/1939","tutela":"Diretto","vincolo":"Diretto"},"geometry":{"type":"MultiPolygon","coordinates":[[[[11.664560656267939,44.338929766561272],[11.664677681758329,44.338973298420157],[11.663917976971705,44.338374281120103],[11.663490667812626,44.338037450885423],[11.663044736146514,44.3383384092472],[11.663230829083632,44.338600513299312],[11.663347488303932,44.338704668600258],[11.663552547506388,44.338852637603232],[11.663797841684483,44.3389672314755],[11.663937220142733,44.339027932285852],[11.663985750098822,44.339045596844798],[11.664161155626287,44.339113783859474],[11.664304548430964,44.339162849382433],[11.664504460736001,44.338909031294975],[11.664560656267939,44.338929766561272]]]]}},{"type":"Feature","properties":{"gid":"24","id_archeo":"229","codice":"229_PC","nome":"Compendio archeologico della città romana di Veleia","titolo":"La città romana di Veleia, la cui esplorazione è cominciata nella seconda metà del 1700, è posta a 460 m. s.l.m. nella valle del Chero, un affluente del Po, fondata poco prima della metà del II sec. a.C. in un territorio all’epoca dominato dai Lig","tipo_propr":"Pubblica","comuni":"LUGAGNANO VAL D`ARDA","sigla_pro":"PC","localita":"Velleia Romana","tipologie":"Struttura abitativa o insediamento - Epoca Età Romana","provvedime":null,"data_ultim":null,"ultimo_pro":null,"rif_legge_":null,"tutela":"Diretto","vincolo":"Area demaniale"},"geometry":{"type":"MultiPolygon","coordinates":[[[[9.722269718272877,44.784206725796558],[9.722388084408998,44.784186487057987],[9.722665232352993,44.784212315743559],[9.722768984687086,44.784196031070785],[9.722814424411649,44.784151173415225],[9.723008030624237,44.784003499399205],[9.723257661841576,44.783834837050478],[9.723085478517133,44.783768231138239],[9.722773522580644,44.783645138868884],[9.722604791832183,44.783616130617652],[9.722329489530836,44.783510899572448],[9.722223254738386,44.783470854690677],[9.722198700224343,44.783523087837942],[9.722131815701722,44.783619186483961],[9.722188755730418,44.78373963600388],[9.722208917500689,44.783799571229167],[9.72219925031669,44.783849540662011],[9.722128412973257,44.783975407622549],[9.722125556842695,44.783987641690459],[9.722165304167877,44.784110972652364],[9.722106548895525,44.784273249132042],[9.722086596405765,44.78433066541966],[9.722269718272877,44.784206725796558]]],[[[9.721689073611827,44.784575176660169],[9.721762218242134,44.784558420223028],[9.721773877458238,44.784555744868449],[9.721799687826033,44.784532247948903],[9.721844908720991,44.784491055961389],[9.721809278410687,44.784490309012462],[9.721738891213045,44.78449297757976],[9.721559292179149,44.784563925068888],[9.721404785256082,44.784564820524011],[9.721339709338572,44.784565645838008],[9.721342456081285,44.784596443061346],[9.721353433044898,44.784673081555511],[9.721357086888418,44.78469855273859],[9.721362885810018,44.78473896303688],[9.721378105588585,44.784742053643228],[9.721455784932413,44.784687405448771],[9.721538016596742,44.784650183710191],[9.721621138518465,44.784596131153101],[9.721689073611827,44.784575176660169]]],[[[9.72401089912646,44.784458434926044],[9.723729289403162,44.784221022777999],[9.723402388401903,44.78394687982528],[9.723308368640177,44.783866761717412],[9.723287668985662,44.783847925202522],[9.723071937986276,44.783993147190081],[9.722852377450867,44.78415675753363],[9.722788541882187,44.784219556060116],[9.722651617522477,44.784237599123124],[9.722401364275706,44.784208395428628],[9.722286854589136,44.784228726814462],[9.722144265920369,44.784327906045498],[9.721879074211445,44.784505126432556],[9.721860189593981,44.784535628318658],[9.721852023665503,44.784548823184487],[9.722077237568488,44.78457094868233],[9.722647156165383,44.784636434408299],[9.723039228952359,44.784682104687299],[9.723489416746455,44.784733292773041],[9.723957247264082,44.784788184137703],[9.724037133831445,44.784789036832827],[9.724194568525723,44.784782645897344],[9.724294478594667,44.784752178718058],[9.724327866242898,44.784726166540587],[9.724317516276404,44.784714232263248],[9.724307801562544,44.784704580513754],[9.724286534909389,44.784686954075156],[9.72401089912646,44.784458434926044]]],[[[9.721408092817025,44.784931414744456],[9.721391061873149,44.784792852282784],[9.721234865506492,44.784868368525316],[9.721224800422721,44.784881332286091],[9.721229912097201,44.784931541343276],[9.721238163392579,44.785023815904601],[9.721239279360674,44.785037321174762],[9.721263413930288,44.785049807800313],[9.721393117604794,44.785112660901518],[9.721429447558975,44.785107633141017],[9.721411774678996,44.78505874578137],[9.72141215684927,44.784964454188653],[9.721408092817025,44.784931414744456]]],[[[9.724574373326289,44.78492172365403],[9.724376842697614,44.784760118201746],[9.724326595144738,44.784789379140136],[9.724237530418254,44.7848188143032],[9.724169953285564,44.784828902371821],[9.724064529546053,44.784838942383864],[9.723952659702675,44.784832828191625],[9.723631990458273,44.784794135291143],[9.723317736541453,44.784758974722067],[9.722730643252271,44.784688883911876],[9.722428554401876,44.78465402196943],[9.722141673795683,44.78462027831641],[9.721923946389392,44.784595386940794],[9.721768397025336,44.784589717867888],[9.721693874424302,44.784621705755065],[9.721697422724757,44.784647825751087],[9.72187164120044,44.784670670122843],[9.722255862945396,44.784741652945456],[9.722352257178997,44.784784055613436],[9.722492781582124,44.784853995755],[9.722549327744481,44.784883804286885],[9.722601185779036,44.78491677523072],[9.72280205678411,44.785047548038996],[9.722974700054959,44.785167003431852],[9.723154532911339,44.785292246452563],[9.723466442018651,44.78551113945386],[9.723704373730442,44.785676883423001],[9.724037010780219,44.785900261574135],[9.724322406345484,44.786087803619644],[9.724324761611376,44.786093190005452],[9.724385998066479,44.786135012810519],[9.724399588579599,44.786134125374879],[9.724425112160239,44.786124132997934],[9.724595851631507,44.78599958408423],[9.724691440040365,44.785856778406121],[9.724806096538606,44.785680075290045],[9.724896363642131,44.785544468983005],[9.725005475540806,44.78528126260646],[9.724574373326289,44.78492172365403]]],[[[9.725064094215339,44.786119905331198],[9.72459187255294,44.78603927307865],[9.724434640985715,44.786167463183403],[9.724485355806271,44.786208920593957],[9.724497613713581,44.786222787229562],[9.724534984141442,44.786271675108075],[9.724580566266942,44.786355583471078],[9.724661268747129,44.786528822855566],[9.724734380651809,44.786690416496207],[9.724738474409307,44.786709484189167],[9.725166138879029,44.786577523636041],[9.725330671126432,44.786526750156938],[9.725227853291761,44.786370350841409],[9.72510616754829,44.786187001633756],[9.725064094215339,44.786119905331198]]],[[[9.724533966844298,44.786378465778199],[9.724479663883002,44.786280497283038],[9.724458854571141,44.786258042797577],[9.724446584958784,44.786241214510191],[9.724405739128754,44.786203520390025],[9.724320786700993,44.78614031478385],[9.724317512476528,44.786132197562949],[9.724062864869019,44.785964346369795],[9.724001062340536,44.785921698771347],[9.723923731794567,44.785870534500802],[9.723813012190012,44.785803791996955],[9.723735175802709,44.78575461128537],[9.723502224234073,44.785589889078715],[9.723101789793684,44.785304940580936],[9.722793733380959,44.785086643333138],[9.72275875541823,44.785110891692419],[9.722610557561035,44.785080556175153],[9.722551643295859,44.78506564332266],[9.722398386037147,44.784987330754262],[9.722353320038691,44.784967874069714],[9.722343097076013,44.784978291296994],[9.722146202104216,44.78492615386719],[9.721901152312794,44.784789141677521],[9.721875700498563,44.78471956247828],[9.721801135074836,44.784705450373941],[9.721748964651146,44.784696084842288],[9.721732008474049,44.784695669913233],[9.721642013856497,44.784696175825999],[9.721594586303942,44.784702264044654],[9.721541460899237,44.784729939556904],[9.721523331073225,44.784743908548919],[9.721473662457598,44.784790358797785],[9.721446947405463,44.784815328729202],[9.721424393601255,44.78483338566474],[9.721438834378773,44.784916132768323],[9.721448483812059,44.784971390385195],[9.721456854834901,44.785127129767638],[9.72147162732432,44.785183687333188],[9.721489797835032,44.785253267624334],[9.721499878603389,44.785397059256525],[9.721531211651852,44.785501466925034],[9.721540153949313,44.785533395267265],[9.721573000003259,44.785532809562575],[9.721584789537966,44.785557869217939],[9.721571917263848,44.785752659417803],[9.721521641099629,44.785835698507171],[9.721525268460812,44.785924068295017],[9.721531471902773,44.785948200021892],[9.721568668443743,44.786052426573008],[9.72159301595001,44.786167347936079],[9.721589846469112,44.786201153268721],[9.72158464141476,44.786270494188365],[9.721817845140494,44.78631246455793],[9.722542321711716,44.786439277693262],[9.722829757333026,44.786491453317524],[9.723050719617568,44.786398006414132],[9.723218593903256,44.786331289901781],[9.723708972538757,44.786498368966704],[9.724323036082463,44.786706134396802],[9.724326626657637,44.786710225619942],[9.724659241626824,44.786823910132199],[9.724733915477206,44.786847435976064],[9.724696627640455,44.786760684350568],[9.724675742070607,44.786705840441044],[9.724610459387872,44.786547626910654],[9.724548347901816,44.786408477895456],[9.724533966844298,44.786378465778199]]]]}},{"type":"Feature","properties":{"gid":"25","id_archeo":"162","codice":"162_RA","nome":"Domus romana e fornace rinascimentale","titolo":"Resti di una domus romana e di una fornace di ceramica di età rinascimentale","tipo_propr":"Privata","comuni":"FAENZA","sigla_pro":"RA","localita":null,"tipologie":"Sepoltura-e - Epoca Età Altomedievale, Struttura abitativa o insediamento - Epoca Età Romana, Struttura produttiva - artigianale - Epoca Età Medievale, Struttura produttiva - artigianale - Epoca Età Post-Medievale, Struttura produttiva - artigianale","provvedime":"Decreto Ministeriale (08/01/1996)","data_ultim":"1996-01-08","ultimo_pro":"Decreto Ministeriale","rif_legge_":"L. 1089/1939","tutela":"Diretto","vincolo":"Diretto"},"geometry":{"type":"MultiPolygon","coordinates":[[[[11.880191061194747,44.286529426991564],[11.880145304095398,44.28646532829373],[11.880067568687714,44.286490003750004],[11.879943445320801,44.286528669563651],[11.879931906712505,44.286532130572688],[11.880088176821866,44.286735699177314],[11.880074475968684,44.286740331989122],[11.880186863942351,44.286857901723813],[11.880341453025332,44.286784685621768],[11.88025269086042,44.286678310230975],[11.880272003291553,44.286666389560843],[11.880167290559605,44.286538980894846],[11.880191061194747,44.286529426991564]]]]}},{"type":"Feature","properties":{"gid":"26","id_archeo":"129","codice":"129_PR","nome":"Domus rustica romana","titolo":"Il sito è posto in prossimità della sponda destra del torrente Cinghio, nell’alta pianura parmense. È stato riconosciuto per la presenza di materiale in affioramento databile all’età romana. Sul posto è stato effettuato un accurato sopralluogo d","tipo_propr":"Privata","comuni":"PARMA","sigla_pro":"PR","localita":"Fossa di Vigatto","tipologie":"Struttura abitativa o insediamento - Epoca Età Romana","provvedime":"Decreto Ministeriale (16/11/1990)","data_ultim":"1990-11-16","ultimo_pro":"Decreto Ministeriale","rif_legge_":"L. 1089/1939","tutela":"Diretto","vincolo":"Diretto"},"geometry":{"type":"MultiPolygon","coordinates":[[[[10.288247914238601,44.71607787485523],[10.287601274737407,44.714403427201738],[10.285366913798207,44.714864763580422],[10.286007053503232,44.716497717017717],[10.287855525379392,44.716155747429809],[10.288243092926571,44.71607919763948],[10.288247914238601,44.71607787485523]]]]}},{"type":"Feature","properties":{"gid":"27","id_archeo":"140","codice":"140_PR","nome":"Domus rustica romana","titolo":"In loc. Casa del Bosco nei primi anni ’90 del secolo scorso vennero recuperati materiali archeologici in aratura pertinenti ad una villa rustica di età romana.","tipo_propr":"Privata","comuni":"PARMA","sigla_pro":"PR","localita":"Roncopascolo, loc. Casa del Bosco","tipologie":"Struttura abitativa o insediamento - Epoca Età Romana","provvedime":"Decreto Ministeriale (07/02/1991)","data_ultim":"1991-02-07","ultimo_pro":"Decreto Ministeriale","rif_legge_":"L. 1089/1939","tutela":"Diretto","vincolo":"Diretto"},"geometry":{"type":"MultiPolygon","coordinates":[[[[10.285125697001321,44.84020345453952],[10.285020592334412,44.839843963213355],[10.283398344373046,44.840182728881985],[10.283481905804505,44.840391315711514],[10.283487724947186,44.840410931772261],[10.283532217784556,44.840542786736847],[10.283574231451405,44.840673526309516],[10.283645201035828,44.840859809392633],[10.28525594967223,44.840545289309823],[10.285124490177617,44.840203692277306],[10.285125697001321,44.84020345453952]]]]}},{"type":"Feature","properties":{"gid":"28","id_archeo":"141","codice":"141_PR","nome":"Domus rustica romana","titolo":"In loc. Casavecchia, nei primi anni ’90 del secolo scorso, vennero recuperati materiali archeologici in aratura pertinenti a una villa rustica di età romana. Sopralluoghi reiterati condotti dalla Soprintendenza hanno permesso di circoscrivere l’area","tipo_propr":"Privata","comuni":"PARMA","sigla_pro":"PR","localita":"Roncopascolo, loc. Casavecchia","tipologie":"Struttura abitativa o insediamento - Epoca Età Romana","provvedime":"Decreto Ministeriale (15/11/1990)","data_ultim":"1990-11-15","ultimo_pro":"Decreto Ministeriale","rif_legge_":"L. 1089/1939","tutela":"Diretto","vincolo":"Diretto"},"geometry":{"type":"MultiPolygon","coordinates":[[[[10.273979170547079,44.847141227766322],[10.273798581515843,44.846634111132452],[10.272563841246905,44.846880999463302],[10.272796731074331,44.847485762001348],[10.273979170547079,44.847141227766322]]]]}},{"type":"Feature","properties":{"gid":"29","id_archeo":"157","codice":"157_RA","nome":"Edificio di culto altomedievale","titolo":"L’edificio di culto altomedievale individuato a Monte del Tesoro era costituito da un unico vano lungo 9 m e largo 5 m,  l’abside semicircolare era orientata a E. I muri perimetrali si sono conservati fino a 2 m di altezza ed erano realizzati in conc","tipo_propr":"Privata","comuni":"BRISIGHELLA","sigla_pro":"RA","localita":"Monte del Tesoro","tipologie":"Luogo di culto - Epoca Età Altomedievale","provvedime":"Decreto Ministeriale (30/06/1997)","data_ultim":"1997-06-30","ultimo_pro":"Decreto Ministeriale","rif_legge_":"L. 1089/1939","tutela":"Diretto","vincolo":"Diretto"},"geometry":{"type":"MultiPolygon","coordinates":[[[[11.723086514799746,44.178690911765919],[11.723040367966309,44.178668954854672],[11.722688955444376,44.178679446935512],[11.722702019904064,44.178909938066965],[11.722706617194227,44.178991063242208],[11.723251934447902,44.178973291629241],[11.723245527366855,44.178883827251809],[11.723236546953871,44.178758408116352],[11.723086514799746,44.178690911765919]]]]}},{"type":"Feature","properties":{"gid":"30","id_archeo":"178","codice":"178_RA","nome":"Edificio di epoca bizantina","titolo":"Resti di strutture e pavimenti a mosaico e di un'area sepolcrale.","tipo_propr":"Privata","comuni":"RAVENNA","sigla_pro":"RA","localita":null,"tipologie":"Sepoltura-e - Epoca Età Tardoantica, Struttura abitativa o insediamento - Epoca Età Tardoantica","provvedime":"Decreto Ministeriale (09/06/1993)","data_ultim":"1993-06-09","ultimo_pro":"Decreto Ministeriale","rif_legge_":"L. 1089/1939","tutela":"Diretto","vincolo":"Diretto"},"geometry":{"type":"MultiPolygon","coordinates":[[[[12.194970468630894,44.418588052363503],[12.19489944248854,44.418519508936569],[12.19488637432779,44.418507901946938],[12.194882065019542,44.418509958180749],[12.194848266751393,44.41852798253538],[12.194815432914533,44.418501265216292],[12.194788457476729,44.418479938209664],[12.194798527159874,44.418473642528468],[12.194733521203162,44.418415985220399],[12.194705790524754,44.41839140249408],[12.194688093192632,44.418375523020607],[12.194739939144846,44.418344326800373],[12.194690993637087,44.418298786801415],[12.19467956169475,44.418288160209904],[12.194616586523464,44.418321423633749],[12.19459080829739,44.418295327803435],[12.194584985714162,44.418289441347518],[12.1945570527621,44.41826114628158],[12.194535570773789,44.418239665320094],[12.194437050784865,44.418141184795566],[12.194433105204475,44.41813701020569],[12.194308273515961,44.418199634405696],[12.194211976866349,44.418250224255026],[12.194300090241017,44.418343063930898],[12.194331286952171,44.418375930847183],[12.194333392028273,44.418378140471326],[12.194365138382615,44.418412333332817],[12.194395163493009,44.418444674909978],[12.194402729885867,44.41845282613162],[12.194448273132281,44.418501855447779],[12.194472681113137,44.418528160738497],[12.194479280559422,44.418535256069241],[12.194515102588175,44.4185184543595],[12.194545156291944,44.418555027099607],[12.194545580763883,44.418554818054005],[12.194548031341029,44.418557144028824],[12.194573901446789,44.418581697889657],[12.194638043466744,44.418641017920073],[12.194666682602421,44.418668437957571],[12.194769491669531,44.418764466499631],[12.194781038847754,44.418774900802156],[12.194813645572545,44.418804361203755],[12.194888877195869,44.418762742201913],[12.194929358669219,44.418740353505818],[12.195004407386568,44.418698838579957],[12.195056094579522,44.418670257345667],[12.195053124946822,44.418667396786553],[12.195001564362428,44.418617906138657],[12.194970468630894,44.418588052363503]]]]}},{"type":"Feature","properties":{"gid":"31","id_archeo":"161","codice":"161_RA","nome":"Edificio di epoca tardoantica","titolo":"La chiesa di San Martino prope litus maris si data probabilmente alla metà del VI secolo e, come suggerisce la sua titolatura, era posta a breve distanza dalla linea di costa antica. L’edificio di culto, orientato EO della lunghezza di circa 38 m, era","tipo_propr":"Privata, Pubblica","comuni":"CERVIA","sigla_pro":"RA","localita":"Podere Mariona","tipologie":"Luogo di culto - Epoca Età Altomedievale, Luogo di culto - Epoca Età Tardoantica","provvedime":"Decreto Ministeriale (17/02/1996), Decreto Soprintendente Regionale (27/04/2004)","data_ultim":"2004-04-27","ultimo_pro":"Decreto Soprintendente Regionale","rif_legge_":"D. Lgs. 490/1999","tutela":"Diretto","vincolo":"Diretto"},"geometry":{"type":"MultiPolygon","coordinates":[[[[12.334794214715984,44.257199052502557],[12.33474157446441,44.257175657224991],[12.334385107769162,44.257516799792135],[12.333944237983912,44.257931575782166],[12.33371461616461,44.258151955501127],[12.333763790455304,44.258177713019585],[12.333825622071231,44.258210100012711],[12.334813446199927,44.258727509590649],[12.334937848924925,44.258608241665002],[12.33531439665885,44.258303955717864],[12.335950331035621,44.257839143583226],[12.335996791596687,44.257806866519488],[12.335357206466602,44.257471335898735],[12.334861168013621,44.257228809088346],[12.334794214715984,44.257199052502557]]]]}},{"type":"Feature","properties":{"gid":"32","id_archeo":"200","codice":"200_RN","nome":"Edificio di età romana imperiale","titolo":"Edificio con resti delle strutture murarie degli ambienti, di vasche e di condotte di acqua, riferibile all'età imperiale","tipo_propr":"Privata, Pubblica","comuni":"CATTOLICA","sigla_pro":"RN","localita":null,"tipologie":"Struttura abitativa o insediamento - Epoca Età Romana","provvedime":"Declaratoria (03/03/1971), Decreto Ministeriale (31/03/1967), Decreto Ministeriale (12/06/1979)","data_ultim":"1979-06-12","ultimo_pro":"Decreto Ministeriale","rif_legge_":"L. 1089/1939","tutela":"Diretto","vincolo":"Diretto"},"geometry":{"type":"MultiPolygon","coordinates":[[[[12.743242410337333,43.963199442720992],[12.743158264192454,43.963127257281883],[12.74314888676005,43.963118859481369],[12.743137941183573,43.963106137888424],[12.743096054080363,43.963067153713816],[12.743033642700736,43.963009397379651],[12.743032942239392,43.963008723561252],[12.742933775526346,43.963063537424873],[12.74295867944012,43.963092494538166],[12.742799065756355,43.963176335112813],[12.742777674704501,43.963150834932058],[12.742739564424173,43.963170743896882],[12.742740163914883,43.963171258987337],[12.74274600844395,43.963176792876119],[12.742767359134497,43.963198994947739],[12.742847702153824,43.963283846010974],[12.742866226834321,43.963301738522986],[12.743187155269631,43.963579225399812],[12.743218904265019,43.963560568397305],[12.743300691371084,43.963510603450288],[12.743426327141604,43.963432110980918],[12.743476853765108,43.96340028909858],[12.743474593361306,43.96339831608644],[12.743437323526797,43.963365968467265],[12.743408970935731,43.963344014271293],[12.743242410337333,43.963199442720992]]]]}},{"type":"Feature","properties":{"gid":"33","id_archeo":"58","codice":"058_FE","nome":"Edificio residenziale di età imperiale romana","titolo":"Resti strutturali di un edificio residenziale di età romano-imperiale sono emersi in seguito a prospezioni subacquee realizzate nel 1996 nell’ambito di un più ampio progetto di censimento delle emergenze archeologiche del complesso delle Valli di Com","tipo_propr":"Privata","comuni":"COMACCHIO","sigla_pro":"FE","localita":"Dosso dei Sassi","tipologie":"Struttura abitativa o insediamento - Epoca Età Romana","provvedime":"Decreto Ministeriale (30/06/1997)","data_ultim":"1997-06-30","ultimo_pro":"Decreto Ministeriale","rif_legge_":"L. 1089/1939","tutela":"Diretto","vincolo":"Diretto"},"geometry":{"type":"MultiPolygon","coordinates":[[[[12.140364903112378,44.611790882168236],[12.139295684917506,44.611789219816174],[12.139178132107064,44.611797947106375],[12.137695272781855,44.611814350514877],[12.137785047096568,44.615334545630013],[12.139408330393248,44.615312101418724],[12.140463671943621,44.615289391210823],[12.140364903112378,44.611790882168236]]]]}},{"type":"Feature","properties":{"gid":"34","id_archeo":"106","codice":"106_PR","nome":"Fornace d'epoca post-classica","titolo":"Nell’autunno 1990, lavori di scavo del Ministero della Difesa e della Soprintendenza hanno messo in luce una fornace di età post-medievale o farnesiana. È stato possibile perimetrare l’area occupata dal manufatto e metterne in luce le caratteristic","tipo_propr":"Privata","comuni":"COLLECCHIO","sigla_pro":"PR","localita":"Collecchiello","tipologie":"Struttura produttiva - artigianale - Epoca Età Medievale","provvedime":"Decreto Ministeriale (06/11/1995)","data_ultim":"1995-11-06","ultimo_pro":"Decreto Ministeriale","rif_legge_":"L. 1089/1939","tutela":"Diretto","vincolo":"Diretto"},"geometry":{"type":"MultiPolygon","coordinates":[[[[10.193410797119503,44.762524629674331],[10.193384281807774,44.762434795351972],[10.193374862010822,44.76243632507984],[10.193178304338449,44.762468192940815],[10.19304466297076,44.76248985226318],[10.193005896659765,44.762496136335344],[10.193136696027389,44.76296156399993],[10.193423151011803,44.762914054987192],[10.193521188812031,44.762897794827616],[10.193466451003255,44.762713858156474],[10.193410797119503,44.762524629674331]]]]}},{"type":"Feature","properties":{"gid":"35","id_archeo":"155","codice":"155_RA","nome":"Fornace di età romana","titolo":"In località Ca’ Nova, lungo la via Faentina, è stata individuata una fornace di epoca romana a pianta rettangolare e corridoio centrale di medie dimensioni, attribuibile al tipo Cuomo di Caprio II/b.\nLa fornace, a cui sono attribuibili due fasi d’u","tipo_propr":"Privata","comuni":"BRISIGHELLA","sigla_pro":"RA","localita":"Cà Nova","tipologie":"Struttura produttiva - artigianale - Epoca Età Romana","provvedime":"Decreto Ministeriale (30/06/1997)","data_ultim":"1997-06-30","ultimo_pro":"Decreto Ministeriale","rif_legge_":"L. 1089/1939","tutela":"Diretto","vincolo":"Diretto"},"geometry":{"type":"MultiPolygon","coordinates":[[[[11.806838856142324,44.244265803200456],[11.806701137609018,44.244212743183844],[11.806473510507788,44.244056491075753],[11.806375517820948,44.243957953222036],[11.805276824913461,44.244436041595584],[11.805586866692794,44.244823824021694],[11.806838856142324,44.244265803200456]]]]}},{"type":"Feature","properties":{"gid":"36","id_archeo":"82","codice":"082_MO","nome":"Fornace romana del periodo tardo-repubblicano","titolo":"Lavori di aratura profonda condotti nel sito hanno riportato in luce, nel settembre 1986, resti laterizi ed innumerevoli frammenti di anfore.\nLe indagini di scavo intraprese nell'ottobre 1997 misero in luce una fornace di epoca tardorepubblicana a pianta","tipo_propr":"Privata","comuni":"MARANELLO","sigla_pro":"MO","localita":"Torre Oche, Cà del Pelato","tipologie":"Struttura produttiva - artigianale - Epoca Età Romana","provvedime":"Decreto Ministeriale (12/07/1989)","data_ultim":"1989-07-12","ultimo_pro":"Decreto Ministeriale","rif_legge_":"L. 1089/1939","tutela":"Diretto","vincolo":"Diretto"},"geometry":{"type":"MultiPolygon","coordinates":[[[[10.828090998012669,44.505007320837777],[10.828239925894765,44.504916328948156],[10.828447653821256,44.504989149271672],[10.82863901987807,44.504817198315223],[10.828706766280307,44.504698721877034],[10.82898233488722,44.504290999550847],[10.829002969225229,44.504261974688653],[10.828779478847911,44.504161678074993],[10.828329918374328,44.504508978178151],[10.828246428143338,44.504572522269974],[10.827882204253065,44.504849796734014],[10.827833707220233,44.504886718107315],[10.82798347821614,44.505011485844392],[10.828011311670801,44.505034671076437],[10.828020706225097,44.505042364305964],[10.828079156016353,44.505011797491271],[10.828090998012669,44.505007320837777]]]]}},{"type":"Feature","properties":{"gid":"37","id_archeo":"158","codice":"158_RA","nome":"Fornaci di età romana","titolo":"In località Rio di Quinto, lungo la via Faentina, è stata individuata un’area con tre fornaci di epoca romana, le strutture sono tutte a pianta rettangolare, attribuibili al tipo Cuomo di Caprio II/b. Nell’area si è rinvenuto anche un pozzo con ca","tipo_propr":"Privata","comuni":"BRISIGHELLA","sigla_pro":"RA","localita":"Rio di Quinto","tipologie":"Struttura produttiva - artigianale - Epoca Età Romana","provvedime":"Decreto Ministeriale (30/06/1997)","data_ultim":"1997-06-30","ultimo_pro":"Decreto Ministeriale","rif_legge_":"L. 1089/1939","tutela":"Diretto","vincolo":"Diretto"},"geometry":{"type":"MultiPolygon","coordinates":[[[[11.80846561681747,44.247235647337099],[11.808399200766271,44.247174567491427],[11.807909828127107,44.247456873211775],[11.807981698703795,44.247521195140941],[11.80826050398559,44.247770715044901],[11.808745448208883,44.24749299738103],[11.80846561681747,44.247235647337099]]]]}},{"type":"Feature","properties":{"gid":"38","id_archeo":"4","codice":"004_BO","nome":"Giacimento del Mesolitico","titolo":"Rarissimo giacimento di pianura del Mesolitico attribuibile ad una fase media o recente del Sauveterriano (6.500-5.800 a. C. circa).","tipo_propr":null,"comuni":"BOLOGNA","sigla_pro":"BO","localita":"Borgo Panigale, loc. Cava Due Portoni","tipologie":"Struttura non identificata - Epoca Mesolitico","provvedime":"Decreto Ministeriale (29/05/1991)","data_ultim":"1991-05-29","ultimo_pro":"Decreto Ministeriale","rif_legge_":"L. 1089/1939","tutela":"Diretto","vincolo":"Diretto"},"geometry":{"type":"MultiPolygon","coordinates":[[[[11.274587632328961,44.530266820201355],[11.274632420990537,44.529801812213321],[11.274676360393828,44.529492564973367],[11.274695289343152,44.529259907682032],[11.274713988790888,44.529057478470648],[11.274171236164465,44.529229505433669],[11.27411904351645,44.529248811631398],[11.273990242037952,44.529296435882713],[11.274076164241976,44.529443270475532],[11.274276322379976,44.52978659896575],[11.273748696251062,44.529956259887172],[11.273688118305977,44.529976138125974],[11.273585987008762,44.530009654828632],[11.273306050316831,44.529567268978973],[11.273152949427866,44.529623064502204],[11.272941633684031,44.529705460325268],[11.272704621326069,44.529785658005771],[11.272056728675054,44.52997473947282],[11.27246953470455,44.530636433913742],[11.272529615764499,44.530732129069996],[11.272627827227041,44.530888532443846],[11.273308422309356,44.531981779429373],[11.273406251368064,44.531956819911208],[11.274207008157058,44.531672536585582],[11.274647706292225,44.531487537646036],[11.274603502002702,44.53092774438111],[11.274571302502201,44.530676081848625],[11.274587632328961,44.530266820201355]]]]}},{"type":"Feature","properties":{"gid":"39","id_archeo":"74","codice":"074_FE","nome":"Impianto rustico agricolo di età romana imperiale","titolo":"In località \"LaMalisarda\" alcuni sopralluoghi effettuati nel corso del 1980 hanno permesso di identificare un insediamento rustico-agricolo di età romana.\nSi tratta di un’ampia superfice disseminata di frammenti ceramici di svariate tipologie ed epo","tipo_propr":"Privata","comuni":"VOGHIERA","sigla_pro":"FE","localita":"Podere \"LaMalisarda\"","tipologie":"Struttura abitativa o insediamento - Epoca Età Romana","provvedime":"Decreto Ministeriale (26/06/1981)","data_ultim":"1981-06-26","ultimo_pro":"Decreto Ministeriale","rif_legge_":"L. 1089/1939","tutela":"Diretto","vincolo":"Diretto"},"geometry":{"type":"MultiPolygon","coordinates":[[[[11.731619915224332,44.749954373782934],[11.731618712604742,44.749953811143634],[11.731190058488023,44.750586497744905],[11.731565138572405,44.750777945476628],[11.732051919500107,44.751024954165523],[11.732137763874098,44.75106966851402],[11.732582846228022,44.750398584769663],[11.732527201920313,44.750372692716894],[11.732258301381991,44.750247595327124],[11.731619915224332,44.749954373782934]]]]}},{"type":"Feature","properties":{"gid":"40","id_archeo":"91","codice":"091_PC","nome":"Impianto rustico romano","titolo":"Nel 1984, durante lo scavo per la realizzazione di un impianto di irrigazione, ad una profondità di circa 60 cm, vennero individuate dal funzionario della Soprintendenza alcune strutture murarie in pietre e laterizi, riferibili ad un insediamento rustic","tipo_propr":"Privata","comuni":"GAZZOLA","sigla_pro":"PC","localita":"Croara Nuova","tipologie":"Struttura abitativa o insediamento - Epoca Età Romana","provvedime":"Decreto Ministeriale (12/07/1989)","data_ultim":"1989-07-12","ultimo_pro":"Decreto Ministeriale","rif_legge_":"L. 1089/1939","tutela":"Diretto","vincolo":"Diretto"},"geometry":{"type":"MultiPolygon","coordinates":[[[[9.584025184001884,44.925563126617611],[9.583166016983437,44.925786666425445],[9.5835529259128,44.92658257950221],[9.583930484413118,44.927312040170598],[9.584054254131267,44.927560075878894],[9.585120145783792,44.927310358864986],[9.584769176472655,44.926738365758503],[9.584685117078084,44.926601372973259],[9.584436246724808,44.926210199459291],[9.584055794436553,44.925612168238814],[9.584025184001884,44.925563126617611]]]]}},{"type":"Feature","properties":{"gid":"41","id_archeo":"86","codice":"086_MO","nome":"Insediamento del Neolitico ed Eneolitico","titolo":"Nel sito pluristratificato del Pescale sono stati rinvenuti, specialmente nella prima metà del XX secolo, grandi quantità di reperti prevalentemente risalenti al Neolitico medio, superiore e all’Eneolitico. Gli episodi di frequentazione del neolitico","tipo_propr":"Privata","comuni":"PRIGNANO SULLA SECCHIA","sigla_pro":"MO","localita":"Cà di Gazzata, Il Pescale","tipologie":"Struttura abitativa o insediamento - Epoca Eneolitico, Struttura abitativa o insediamento - Epoca Neolitico","provvedime":"Decreto Ministeriale (06/07/1984)","data_ultim":"1984-07-06","ultimo_pro":"Decreto Ministeriale","rif_legge_":"L. 1089/1939","tutela":"Diretto","vincolo":"Diretto"},"geometry":{"type":"MultiPolygon","coordinates":[[[[10.718272532972238,44.492973890657865],[10.718248587938163,44.492792401656267],[10.717655209568129,44.493092290778492],[10.71757567004691,44.493159025388195],[10.717465186483681,44.493319850952311],[10.716990765449019,44.493439338275365],[10.716873852436686,44.493621145647801],[10.716937053040189,44.493820409492663],[10.716818522736952,44.493861442868557],[10.716792143394228,44.494248224571869],[10.716893198976852,44.494331687798599],[10.716989414041473,44.494370211517442],[10.717004789695705,44.494396987585262],[10.71707570810311,44.49461918150044],[10.717002954500462,44.494642961987388],[10.716994000201506,44.494697831538851],[10.717071297402015,44.494828824760489],[10.717126462242927,44.494977075444574],[10.717072673854592,44.495012814015929],[10.717201182985365,44.495191650007669],[10.717364483965907,44.495321709330796],[10.717879969624269,44.495332317959011],[10.718178211035214,44.495380403616515],[10.718766671290764,44.495443204300187],[10.719135964428085,44.495409555736778],[10.719194064325542,44.495190143734064],[10.719175669900762,44.495185697179771],[10.718822684518598,44.49512367441725],[10.718371810761965,44.495000467140457],[10.718191860819175,44.494868859360466],[10.718154472362128,44.49476067258994],[10.718079582035728,44.494745955461575],[10.718030875578652,44.494663505930383],[10.717968356023901,44.494521848123057],[10.71801722780692,44.494438650216324],[10.718086537664025,44.494074988584998],[10.717963638763729,44.494035787087711],[10.717877921878648,44.493960736327018],[10.717867598735845,44.493866185947411],[10.7179276372426,44.493700717717203],[10.71813799558895,44.493360500195962],[10.718244792026084,44.493091340030396],[10.718272532972238,44.492973890657865]]]]}},{"type":"Feature","properties":{"gid":"42","id_archeo":"18","codice":"018_BO","nome":"Insediamenti pre-protostorici","titolo":"Sepolcreto villanoviano, resti di un abitato di età pre-protostorica, insediamenti pre e protostorici","tipo_propr":"Privata, Pubblica","comuni":"CASTENASO","sigla_pro":"BO","localita":"Villanova","tipologie":"Sepoltura-e - Epoca Età del Ferro, Sepoltura-e - Epoca Età del Ferro, Struttura abitativa o insediamento, Struttura abitativa o insediamento","provvedime":"Decreto Ministeriale (02/12/1975)","data_ultim":"1975-12-02","ultimo_pro":"Decreto Ministeriale","rif_legge_":"L. 1089/1939","tutela":"Diretto","vincolo":"Diretto"},"geometry":{"type":"MultiPolygon","coordinates":[[[[11.42889358911688,44.497407121040581],[11.429028318856417,44.497363225328478],[11.429043138040266,44.497384941582261],[11.429731478594594,44.497133853383254],[11.428638581213075,44.495575542097512],[11.428169066084793,44.49494546981402],[11.427854247451053,44.495052658761587],[11.427562760948836,44.495148300671616],[11.427512646768827,44.495167254822938],[11.427321604114496,44.495229592410141],[11.427236660660904,44.495258496977975],[11.427201513527443,44.495299566410836],[11.427121337828321,44.495337281780557],[11.426969833092899,44.495376775755972],[11.426906089547636,44.495485539111193],[11.426894139358229,44.495521559740375],[11.426886672004629,44.495544071475344],[11.426878348484703,44.495620192491693],[11.426896564360336,44.495709054377535],[11.42781660595656,44.497596591237553],[11.427851571890846,44.497681369474428],[11.427861744179562,44.497699157689951],[11.427878013172414,44.49771231497072],[11.427892711308276,44.49772550568278],[11.427939947501711,44.497765010932554],[11.427977088041706,44.497750716886159],[11.428616515472541,44.497512046245369],[11.428768217900208,44.497454802236255],[11.42889358911688,44.497407121040581]]],[[[11.467358527246644,44.510701872725164],[11.467171784872495,44.51041333497465],[11.467101842233117,44.510432852063637],[11.467026749992392,44.510458232946618],[11.466859968965387,44.510514601769678],[11.466751316590914,44.510548459089478],[11.466732842341839,44.510557860841701],[11.466627142289527,44.51058715304633],[11.466684382930449,44.510675911917588],[11.466818975856567,44.510884583944154],[11.467358527246644,44.510701872725164]]],[[[11.473802436043641,44.509981687091084],[11.473454221317507,44.509557124355126],[11.473408277862648,44.509549118016793],[11.473387282105451,44.509536069666716],[11.473297679485741,44.50957402141519],[11.472501264613841,44.509895661019321],[11.472343704847129,44.50995929195529],[11.471587676155293,44.509485044573516],[11.471012759511822,44.509128401412127],[11.470548118354809,44.509408533602233],[11.470402663754861,44.509501706489516],[11.470468794132815,44.50955543182755],[11.470481952439505,44.509566120762052],[11.470504321828567,44.509584298242842],[11.470897782988763,44.50990509246045],[11.470615982732793,44.510081078043669],[11.470543365422539,44.510134594571731],[11.470784319659835,44.510511090192324],[11.471124361809959,44.511087068867049],[11.471370744270072,44.511486806482495],[11.472099180354553,44.511130392964418],[11.471895412902525,44.510923252931335],[11.472371384806657,44.510685999962867],[11.472842991230888,44.510450919159858],[11.473424740631092,44.510160920064656],[11.473802436043641,44.509981687091084]]],[[[11.470277355069918,44.51301441620214],[11.469390854652991,44.511694442549832],[11.469325189719136,44.511596666101738],[11.469296426050015,44.511553836148622],[11.469130907003271,44.511307374778902],[11.468838181544614,44.51087310724413],[11.468402269732096,44.511025886360393],[11.468103748603738,44.51112740006154],[11.46800576998452,44.511161090693285],[11.467673477285944,44.511275342898507],[11.467594986862228,44.511302499092551],[11.467115507530984,44.51146679904214],[11.467109604575487,44.511468826175275],[11.466507460328129,44.511674766394258],[11.466566450222469,44.511768725620605],[11.466616786115674,44.511849285914167],[11.466680741708259,44.511951642565229],[11.466743908211715,44.512052736104359],[11.466930235456408,44.512350935761859],[11.467019309435541,44.512493490076359],[11.467383933731885,44.513077025492755],[11.46912494539677,44.513393069431103],[11.470277355069918,44.51301441620214]]]]}},{"type":"Feature","properties":{"gid":"43","id_archeo":"165","codice":"165_RA","nome":"Insediamento del neolitico inferiore - Cultura di Fiorano","titolo":"Resti di un insediamento di vasta estensione attribuibile al neolitico inferiore","tipo_propr":"Privata","comuni":"LUGO","sigla_pro":"RA","localita":"Fornace Gattelli","tipologie":"Struttura abitativa o insediamento - Epoca Neolitico","provvedime":"Decreto Ministeriale (13/01/1986)","data_ultim":"1986-01-13","ultimo_pro":"Decreto Ministeriale","rif_legge_":"L. 1089/1939","tutela":"Diretto","vincolo":"Diretto"},"geometry":{"type":"MultiPolygon","coordinates":[[[[11.921073035326769,44.429181956131487],[11.921378372359463,44.429061142729658],[11.921491328517549,44.429212856982467],[11.921630282108602,44.429154043270742],[11.922090465223301,44.428962880306379],[11.922346138733817,44.42886601285015],[11.922319734256227,44.428833578457677],[11.922064612715538,44.42854529412692],[11.921942911035952,44.428411178855761],[11.922273065250081,44.428270444603932],[11.922287541313425,44.428206544471401],[11.922688000457484,44.428044770656442],[11.922338719314325,44.427595713212185],[11.922150988901159,44.427359060041191],[11.921983774814322,44.427144576109384],[11.921578965856982,44.426633786733014],[11.92145264491444,44.426466381521003],[11.921253192627677,44.426218215870492],[11.91963126743099,44.426869676639114],[11.91844383268746,44.427348876033513],[11.918606841113665,44.42755100538114],[11.918569099753457,44.427566905495709],[11.917851980025087,44.427869012470673],[11.917767074174973,44.427888724430197],[11.917757324462752,44.427876317341642],[11.91768077488514,44.427908760925774],[11.917625472610974,44.427932199049138],[11.917618428300996,44.427923235483128],[11.917350914626722,44.427985341762877],[11.916923860786815,44.42808448752578],[11.916761045947554,44.428122285390593],[11.916711126872645,44.428133875248427],[11.916698652956439,44.428136770531374],[11.916926734623173,44.428430578781722],[11.917424389980782,44.429044221139279],[11.917552616052411,44.42922804730523],[11.918004675342672,44.429867807236398],[11.918173352156284,44.430088579154102],[11.918324437252707,44.430292615252498],[11.918368456246728,44.430355613108709],[11.918790923351679,44.430843348156969],[11.919204464760032,44.431331075882795],[11.919387783582772,44.431557070862986],[11.919421389054495,44.431543418845983],[11.921167959988429,44.430813358497439],[11.920660051619489,44.430181144127836],[11.920568927936406,44.430054328901647],[11.92015915351438,44.429547694785391],[11.920408816199703,44.429449086013868],[11.920805689664403,44.429292226861932],[11.921073035326769,44.429181956131487]]]]}},{"type":"Feature","properties":{"gid":"44","id_archeo":"87","codice":"087_MO","nome":"Insediamento del Neolitico inferiore (Cultura di Fiorano)","titolo":"Resti di un insediamento del Neolitico inferiore (Cultura di Fiorano)","tipo_propr":"Privata","comuni":"SAVIGNANO SUL PANARO","sigla_pro":"MO","localita":null,"tipologie":"Struttura abitativa o insediamento - Epoca Neolitico","provvedime":"Decreto Ministeriale (18/03/1988)","data_ultim":"1988-03-18","ultimo_pro":"Decreto Ministeriale","rif_legge_":"L. 1089/1939","tutela":"Diretto","vincolo":"Diretto"},"geometry":{"type":"MultiPolygon","coordinates":[[[[11.033792307961381,44.480056164866802],[11.03379008196306,44.480053874707252],[11.033786372675518,44.480055758355192],[11.033672922075718,44.480113378613929],[11.033559089853618,44.480176378155448],[11.033595124783094,44.480217657644147],[11.033297853283162,44.480394446855556],[11.033353102179433,44.48045253374201],[11.033019383198729,44.480652837284779],[11.033363519321949,44.480982077682491],[11.033280757283292,44.481031607930731],[11.033173182527829,44.481095986438305],[11.033364984240613,44.481277160625147],[11.033377052818995,44.481288657764722],[11.033457670363472,44.481365452531662],[11.033525881473185,44.481430432047027],[11.033529822058942,44.481434187871045],[11.033582847085899,44.481406290406419],[11.033925454788541,44.481221689964762],[11.033995950251143,44.481182324473089],[11.03404243879473,44.481141480820611],[11.034073033904138,44.481102825183264],[11.03410868360907,44.481056458097143],[11.034139834991237,44.480931877616925],[11.034141113195069,44.480889396120055],[11.03415410007625,44.480428153902047],[11.03414928078543,44.480426610329069],[11.034084788727942,44.480360808729031],[11.034020981995178,44.480293014358615],[11.033924555601891,44.480192231228166],[11.033792307961381,44.480056164866802]]]]}},{"type":"Feature","properties":{"gid":"45","id_archeo":"1","codice":"001_BO","nome":"Insediamento dell'età del bronzo","titolo":"Resti di vasto Insediamento dell'età del bronzo recente.","tipo_propr":null,"comuni":"ANZOLA DELL`EMILIA","sigla_pro":"BO","localita":null,"tipologie":"Struttura abitativa o insediamento - Epoca Età del Bronzo","provvedime":"Autorizzazione (20/02/2002), Autorizzazione (10/05/2002), Decreto Ministeriale (06/10/1992)","data_ultim":"2002-05-10","ultimo_pro":"Autorizzazione","rif_legge_":null,"tutela":"Diretto","vincolo":"Diretto"},"geometry":{"type":"MultiPolygon","coordinates":[[[[11.191121336105466,44.550717486577874],[11.191088027104737,44.550668613582346],[11.190996638760005,44.550539835172373],[11.190991583329046,44.550530929952792],[11.190947994798725,44.550459748566283],[11.190842000161881,44.550277236739973],[11.190615184697492,44.549894492827079],[11.190605242925463,44.549881180247112],[11.19059687369027,44.549867837479852],[11.190398513251838,44.549907654489111],[11.190325998008166,44.54977851324626],[11.190057717999091,44.549842177484969],[11.189970331630985,44.549861859213173],[11.189803590165788,44.549905569502819],[11.189769332076994,44.549915229213106],[11.189747032388214,44.549866144554841],[11.189738494548223,44.549848303813512],[11.189705915779006,44.549776910679569],[11.189627165562509,44.549607378327742],[11.189633455655963,44.549607257628502],[11.189647439577278,44.549602488145645],[11.189620084987544,44.54954449816681],[11.18949010924927,44.549267921177041],[11.189505834393065,44.549267619446404],[11.189497055472204,44.549247979257146],[11.189518989232255,44.549236529684386],[11.189466700751968,44.549121298108354],[11.189493974771802,44.549119309211086],[11.189793364714774,44.549046046989986],[11.189832339812206,44.54903629674137],[11.190152171431507,44.548962641277861],[11.190183203211975,44.548959780685799],[11.190183641392201,44.548959816388944],[11.191189195147457,44.548772589922578],[11.191779959743407,44.548602802865318],[11.191840442233511,44.548579135376968],[11.191836959348372,44.548570199986131],[11.191817803475624,44.548521055334483],[11.191800558023042,44.548480876270645],[11.191360827499201,44.547373037480355],[11.191258256126311,44.547113940719477],[11.19114417190881,44.54684156148938],[11.190654929624177,44.547012996346297],[11.19019960319716,44.547165773526281],[11.189255023732679,44.547489977918765],[11.188787278671782,44.547647488849087],[11.188518614938351,44.547742664884034],[11.188465656880801,44.547757184010734],[11.188256071534751,44.547833221761273],[11.188110113968074,44.547885533307351],[11.188070445434123,44.547898600104688],[11.187979543634913,44.547928547330613],[11.187013261187577,44.548262151522806],[11.186940197037337,44.548286057579908],[11.185497209373136,44.548790825400275],[11.184882075756263,44.549005156806132],[11.184869495668176,44.549005397682166],[11.184231379966301,44.549227470064636],[11.184264328616834,44.54929322675153],[11.184403822472669,44.549578654943794],[11.184587118711761,44.549974584685792],[11.184593097538965,44.549987501040555],[11.184608090196479,44.550007307111841],[11.184620546802147,44.550003089619793],[11.18462259797035,44.550002393180861],[11.184623659608336,44.550004857492404],[11.184452460388288,44.550056054170817],[11.184454982552179,44.550059867869614],[11.18444673835349,44.550061934176526],[11.184242471393251,44.550131083975245],[11.184272952084235,44.550200412293329],[11.184285197765478,44.550221162218847],[11.184282487575215,44.550222078317248],[11.18428819874938,44.550235076322203],[11.184406360940983,44.550503720242233],[11.184448689548185,44.550599972593595],[11.184467748232203,44.550643304848037],[11.184478935320744,44.550668729202847],[11.184585114785955,44.550910154334836],[11.184598930866043,44.55094156887975],[11.18467009118077,44.550921508750868],[11.184992915546422,44.550830499107725],[11.185129874886526,44.551140057805867],[11.185142156401565,44.55116780173438],[11.185234993351555,44.551377595653534],[11.185244662628628,44.551399457082987],[11.185246382444257,44.551403358145855],[11.185256078571973,44.551425264069437],[11.185265568150056,44.551446696831086],[11.185301631358493,44.551528215071173],[11.185400342490945,44.551751282755824],[11.185669071316301,44.552358615312301],[11.185690843604181,44.552407800874676],[11.185763137053804,44.552571193951763],[11.186480217903091,44.552367237690873],[11.186727988538793,44.55229676411583],[11.187578750344521,44.552054779046671],[11.187613010059266,44.55204511996034],[11.187634857688847,44.55204019997273],[11.187655132718703,44.552035310123081],[11.188617713586051,44.551769288918727],[11.188802825904236,44.551717089932794],[11.189353310141662,44.551558045649472],[11.189821839809094,44.55144010953282],[11.189866348681392,44.551427147293779],[11.190268609109291,44.551310003973661],[11.190425918785028,44.55126647407964],[11.190557199694563,44.551226477410665],[11.190662415806461,44.551194416885892],[11.190907877241877,44.551125409896677],[11.191160737920628,44.551054315806397],[11.191327481550765,44.551010603505148],[11.191174529279078,44.550792984604385],[11.191141220188516,44.550744111627445],[11.191121336105466,44.550717486577874]]]]}},{"type":"Feature","properties":{"gid":"46","id_archeo":"17","codice":"017_BO","nome":"Insediamento dell'età del Bronzo","titolo":"Vasto insediamento preistorico terramaricolo. I materiali sono costituiti da numerosi frammenti ceramici riconducibili a vasellame domestico, frammenti ossei animali e resti di oggetti in bronzo; sono riferibili all’età del Bronzo medio/recente. I rep","tipo_propr":null,"comuni":"CASTENASO","sigla_pro":"BO","localita":"Ca' Madonna","tipologie":"Struttura abitativa o insediamento - Epoca Età del Bronzo","provvedime":"Decreto Ministeriale (29/10/1991)","data_ultim":"1991-10-29","ultimo_pro":"Decreto Ministeriale","rif_legge_":"L. 1089/1939","tutela":"Diretto","vincolo":"Diretto"},"geometry":{"type":"MultiPolygon","coordinates":[[[[11.459401726108872,44.497226104993864],[11.459787376911747,44.49718349256441],[11.45993837933621,44.497213107356295],[11.460058182660003,44.497260543218573],[11.46006575602379,44.49726781137273],[11.460085730297694,44.497265373176305],[11.460300875164323,44.49729674359758],[11.460327389766384,44.497291670681534],[11.460533424970432,44.49725087707381],[11.461136112033783,44.497293805544125],[11.461369866471703,44.497328966722648],[11.461371301144094,44.497327670946817],[11.461553360942029,44.49717070329082],[11.461445199245327,44.497028999070423],[11.461712025376031,44.496906211869714],[11.461895653767199,44.496749209823754],[11.461911094576237,44.496667855467649],[11.462056209442334,44.496529688882937],[11.462124678081073,44.496438187862331],[11.462336444195275,44.496240067321615],[11.462412063836902,44.496094397672103],[11.462601356141871,44.49569870983477],[11.462712533788405,44.495538768984503],[11.462626197056791,44.495504623044027],[11.462553073366214,44.495560215415622],[11.462377794087978,44.495654021861782],[11.462312145018368,44.495700450405984],[11.462213565264527,44.495711580142704],[11.462146835341969,44.495695015437143],[11.461921435712297,44.495569345014296],[11.461883603765978,44.495529650716314],[11.461673758142057,44.495250604130788],[11.461397052501557,44.494914484197544],[11.461085261980843,44.494417077907002],[11.46103349654463,44.494350241974104],[11.460569426060369,44.494564468360721],[11.45994908620337,44.493897539018484],[11.459808095188336,44.493965176912823],[11.459668192509218,44.493790546689326],[11.458751196767748,44.494183772162884],[11.458984048129315,44.494489636159898],[11.459241499118317,44.494776799997084],[11.459262763759247,44.495081167800905],[11.459210715039307,44.495251860750109],[11.459156460389408,44.495370115672728],[11.459030703301407,44.495598921147987],[11.45893594366026,44.495827059357104],[11.459064315860832,44.496330989447202],[11.45901199194201,44.496562249760814],[11.458893838338303,44.496770704302364],[11.458871177913053,44.496872944478916],[11.458865651261828,44.496891068288143],[11.45888525752291,44.496908650472015],[11.45922941277126,44.497054273196056],[11.459317641759101,44.497133392693001],[11.459401726108872,44.497226104993864]]]]}},{"type":"Feature","properties":{"gid":"47","id_archeo":"19","codice":"019_BO","nome":"Insediamento dell'età del Bronzo","titolo":"La terramara di Pragatto si colloca in una porzione dell’alta pianura bolognese già nota in passato per le segnalazioni dello Zannoni. Il successivo rinvenimento della necropoli omonima, scavata dallo Gozzadini, di cui rimane ignota l’esatta ubicazi","tipo_propr":"Privata","comuni":"VALSAMOGGIA","sigla_pro":"BO","localita":"Pragatto","tipologie":"Sepoltura-e - Epoca Età del Bronzo, Struttura abitativa o insediamento - Epoca Età del Bronzo","provvedime":"Decreto Direzione Regionale (08/06/2005)","data_ultim":"2005-06-08","ultimo_pro":"Decreto Direzione Regionale","rif_legge_":"D. Lgs. 42/2004","tutela":"Diretto","vincolo":"Diretto"},"geometry":{"type":"MultiPolygon","coordinates":[[[[11.151772703617249,44.515024943375302],[11.151709502816116,44.514931610594296],[11.150490423317702,44.515224662646439],[11.149608409446632,44.515469410315774],[11.149653737501621,44.515524001849442],[11.1499424305128,44.515847147678862],[11.149996185358042,44.515908133856186],[11.150438096883592,44.516409455127985],[11.150735319497207,44.516750442824048],[11.150794383861887,44.516816846964524],[11.150818124654995,44.516820900627927],[11.151123210087547,44.517161739086426],[11.151420440642269,44.517502724814292],[11.151682846486853,44.517794853662558],[11.151722224164279,44.517839122733626],[11.151876426360838,44.518011760119713],[11.152026080036769,44.518188984247054],[11.152145620854872,44.518317263351015],[11.15263755692653,44.518136939622977],[11.152842379261214,44.518064018528435],[11.152971330785315,44.518018113264311],[11.153125301836367,44.517960419820277],[11.153300222327479,44.51789487689706],[11.153263821056049,44.517846051033217],[11.153201689016539,44.517739195591645],[11.153106133845343,44.517578956847743],[11.152978396259604,44.517356308963379],[11.152927432884191,44.517253743799074],[11.152887882838026,44.517119455116337],[11.152844858117325,44.516976229650908],[11.152825991924306,44.5168910634941],[11.152810103394925,44.516801339988533],[11.152767164948425,44.516703124499067],[11.152740606364848,44.516622604620444],[11.152665983314193,44.516475474056747],[11.152627348866901,44.516408685457399],[11.152577215660575,44.516328610279785],[11.152520754056635,44.516230100655761],[11.152508302760008,44.516208378866907],[11.152425079517304,44.516083916194596],[11.152413746470495,44.51607512765203],[11.152035332531483,44.515412546005606],[11.152016987873369,44.515380429592781],[11.151868828302367,44.5151581655659],[11.151772703617249,44.515024943375302]],[[11.152283489406825,44.516768883522893],[11.152269626255015,44.516775095551253],[11.152198836728907,44.516694770669282],[11.152130144975599,44.516616737776275],[11.152143931671793,44.516610500199036],[11.152108712277848,44.516570482955728],[11.152162757216043,44.516546363636515],[11.152176335395295,44.516561789587776],[11.152268268783841,44.516520355284342],[11.152314426864185,44.516572796412802],[11.152271318869659,44.516592217349952],[11.152314627278326,44.516641417379482],[11.152361710335954,44.516694372176367],[11.152404860380621,44.516674725354605],[11.152451326412427,44.516726980574738],[11.152359392188446,44.516768739119669],[11.152373109435887,44.516784180429831],[11.152319125951438,44.516808946857665],[11.152283489406825,44.516768883522893]]]]}},{"type":"Feature","properties":{"gid":"48","id_archeo":"20","codice":"020_BO","nome":"Insediamento dell'età del Bronzo","titolo":"Ricognizioni di superficie condotte nel corso degli anni 60 del secolo scorso accertarono la presenza a Granarolo, in località nota anche con la denominazione di Prati della Pippola, di una vasta area insediativa riferibile all'età del Bronzo. Più rec","tipo_propr":"Privata","comuni":"GRANAROLO DELL`EMILIA","sigla_pro":"BO","localita":"Casa Poggi / Prati della Pippola","tipologie":"Struttura abitativa o insediamento - Epoca Età del Bronzo","provvedime":"Decreto Direzione Regionale (12/05/2005)","data_ultim":"2005-05-12","ultimo_pro":"Decreto Direzione Regionale","rif_legge_":"D. Lgs. 42/2004","tutela":"Diretto","vincolo":"Diretto"},"geometry":{"type":"MultiPolygon","coordinates":[[[[11.441918794709066,44.571294595112072],[11.442017506209828,44.571283479650873],[11.442269469633302,44.571323096609966],[11.442370130693828,44.5713209413641],[11.443793935365143,44.570961864265009],[11.443925109536851,44.57093654828136],[11.444480884222482,44.570825614560093],[11.444960283118576,44.570657800473313],[11.445072518243897,44.57066889816118],[11.445191920047707,44.570850885155956],[11.445270998526574,44.570934711514774],[11.445363478144712,44.571000246001127],[11.445277107905939,44.5707050227889],[11.444959380590191,44.569510030875868],[11.44481835387611,44.568999924324451],[11.444786903067493,44.568888070048892],[11.444630658084016,44.5683152735036],[11.44456367003056,44.568069146723985],[11.444371074000454,44.567380099259815],[11.443947059233016,44.566833541091654],[11.44232962381612,44.567347307596549],[11.441964177210943,44.567454156534033],[11.440224056054985,44.567964014456322],[11.43819771297353,44.568556483357646],[11.438741586697427,44.569328054263877],[11.438980790450611,44.569665026127261],[11.439585619807268,44.570651343915138],[11.440394403573331,44.571921367579797],[11.441161033768921,44.57165740144999],[11.441681541809224,44.571380694207825],[11.441918794709066,44.571294595112072]]]]}},{"type":"Feature","properties":{"gid":"49","id_archeo":"85","codice":"085_MO","nome":"Insediamento dell'età del Bronzo","titolo":"Le prime ricerche archeologiche furono condotte da G. Canestrini tra il 1864 ed il 1866, dopo un lungo periodo di sfruttamento del sito come cava di terriccio fertilizzante iniziato nel XVIII secolo. Dal 1870 al 1895 A.Crespellani realizzò ripetuti scav","tipo_propr":"Privata","comuni":"NONANTOLA","sigla_pro":"MO","localita":"Redù","tipologie":"Struttura abitativa o insediamento - Epoca Età del Bronzo","provvedime":"Decreto Ministeriale (07/02/1996)","data_ultim":"1996-02-07","ultimo_pro":"Decreto Ministeriale","rif_legge_":"L. 1089/1939","tutela":"Diretto","vincolo":"Diretto"},"geometry":{"type":"MultiPolygon","coordinates":[[[[11.06756180967408,44.666111467714842],[11.066748800816825,44.664721346837496],[11.066238868292022,44.663849402920633],[11.065422594013794,44.662453577758171],[11.064938842106413,44.662176507735325],[11.064788049743996,44.66222593494409],[11.06412817423184,44.662442223200486],[11.063728634540423,44.662571876369292],[11.063346574896629,44.66269653107134],[11.063138174392506,44.662765371683456],[11.062638684737966,44.662460317477972],[11.062615733716704,44.662446300705177],[11.062018620133752,44.662081616051125],[11.061939080298123,44.662097343673672],[11.061366776099227,44.661769457720212],[11.06110975656207,44.661674061197807],[11.060753195956941,44.661770693807526],[11.05987091376808,44.662009796402444],[11.059866853338079,44.66201089681833],[11.059067618097547,44.663001868817751],[11.059566437599905,44.663893205944589],[11.061730931142614,44.665261993322765],[11.061761113009027,44.665252274107239],[11.062028091997055,44.665709085167784],[11.062033464030252,44.665719312762498],[11.06216310639474,44.665966166421278],[11.06285140404553,44.666739737885131],[11.063365506819375,44.667306851773006],[11.064501342063492,44.667004579739704],[11.065395372931679,44.666766648485321],[11.065909025910077,44.666610078467812],[11.06653310628904,44.666423060317136],[11.066990309539227,44.666282630954491],[11.067214463573912,44.66621549745399],[11.06756180967408,44.666111467714842]]]]}},{"type":"Feature","properties":{"gid":"50","id_archeo":"154","codice":"154_PR","nome":"Insediamento dell'età del Bronzo","titolo":"L’abitato dell’età del bronzo è posto su un pianoro di circa 600 mq sotto la cima di Monte Predellara. \nIl sito vede più fasi di frequentazione. La più antica, caratterizzata da strutture abitative con piani pavimentali in terra semicotta, si dat","tipo_propr":"Privata","comuni":"VARSI","sigla_pro":"PR","localita":"Rocca Vecchia","tipologie":"Struttura abitativa o insediamento - Epoca Età del Bronzo","provvedime":"Decreto Ministeriale (24/04/1996)","data_ultim":"1996-04-24","ultimo_pro":"Decreto Ministeriale","rif_legge_":"L. 1089/1939","tutela":"Diretto","vincolo":"Diretto"},"geometry":{"type":"MultiPolygon","coordinates":[[[[9.820308549561346,44.642825215249559],[9.82174984313767,44.642576950772408],[9.82170718969966,44.642559598542903],[9.821686884657083,44.642489724171533],[9.821684526723192,44.642440912278033],[9.821646485846706,44.642345910217664],[9.821556682273863,44.642275014265074],[9.821094858835457,44.641910419501542],[9.821120623335272,44.641889778223486],[9.821124458351019,44.641873293419891],[9.821094136832512,44.641868750014481],[9.821099512997959,44.641858358645614],[9.821102653346495,44.64185215144672],[9.820826563995197,44.64176314322431],[9.820777327577021,44.641775949077172],[9.820723897257158,44.641729785299319],[9.820577219313487,44.641603055750686],[9.820495223618618,44.641424574036904],[9.820428070014637,44.641278396907438],[9.820346298988424,44.641100401396805],[9.819021610122627,44.64157271216223],[9.819008417751826,44.641695963692271],[9.818998490343855,44.641788716085216],[9.819045303817067,44.642016669786756],[9.819087867019306,44.642149188292279],[9.819144466927867,44.642246324039306],[9.819203645701979,44.642294499872172],[9.819199815609002,44.642315760331023],[9.819222345580908,44.642309722915854],[9.819306201740629,44.64237798785701],[9.819277399228355,44.642396872545262],[9.819272316470643,44.64244879326229],[9.819320050959565,44.642535615460766],[9.819357996623618,44.642567651002736],[9.819490682309608,44.642679667272084],[9.820270532175803,44.642818449292122],[9.820270924550936,44.642808362917904],[9.82028937653976,44.642821803294972],[9.820302928551083,44.642831674304517],[9.820308549561346,44.642825215249559]]]]}},{"type":"Feature","properties":{"gid":"51","id_archeo":"187","codice":"187_RE","nome":"Insediamento dell'età del Bronzo","titolo":"Complesso archeologico interessato da numerosi resti fittili e pavimenti in battuto d'argilla cotta pertinenti ad un insediamento dell'età del Bronzo. Si tratta di una delle più estese terramare individuate, che, attiva nel corso del Bronzo Medio, perd","tipo_propr":"Privata","comuni":"CAMPEGINE","sigla_pro":"RE","localita":"Case Cocconi","tipologie":"Struttura abitativa o insediamento - Epoca Età del Bronzo","provvedime":"Decreto Ministeriale (03/12/1980)","data_ultim":"1980-12-03","ultimo_pro":"Decreto Ministeriale","rif_legge_":"L. 1089/1939","tutela":"Diretto","vincolo":"Diretto"},"geometry":{"type":"MultiPolygon","coordinates":[[[[10.528772343771994,44.796840521075119],[10.529345942209654,44.796644356374856],[10.52877330596648,44.795483132610443],[10.528990190618286,44.795434309357823],[10.528962177186154,44.795334384883404],[10.528873451636573,44.795187464110256],[10.528856581212654,44.795125045509494],[10.528874686388896,44.794960436606331],[10.528868793485548,44.794889544204764],[10.528882922646476,44.794846271705097],[10.528901728185248,44.794747907704185],[10.528956811513032,44.794636392140625],[10.528944134927915,44.794578625405997],[10.528911304441772,44.794508822898422],[10.528871053718669,44.794446708387234],[10.528725221134595,44.794254201177658],[10.528676588761583,44.794064749308603],[10.528581899206996,44.793981992963161],[10.528508074453205,44.79393915088869],[10.5278151895105,44.793749113033407],[10.527726441008964,44.793679671360721],[10.527706893803128,44.793651324745987],[10.527620671418067,44.793542024590053],[10.52760808492499,44.79354653193446],[10.527501196850718,44.79356241917219],[10.527339963675178,44.793600016866826],[10.527143829881854,44.793310041302561],[10.526814469886236,44.793433479054443],[10.526681006834133,44.793227399873082],[10.526387872345577,44.792766179735459],[10.526225711066617,44.792511044985247],[10.526277163448936,44.792495391427373],[10.526256553607988,44.792452878889527],[10.525299885550661,44.792750914757377],[10.52522059479989,44.792770980746575],[10.525118674984062,44.792605559596453],[10.524924068632149,44.792292582278527],[10.524556488977332,44.792408239511381],[10.524260988308352,44.79250121608375],[10.524358427570093,44.792661496502895],[10.523792922692632,44.792854998669654],[10.523693568779663,44.792886706227357],[10.523418336151652,44.792782409728432],[10.523339911592412,44.792797562192582],[10.523131509381491,44.792878848613157],[10.522919219100322,44.79294788084858],[10.522777572683438,44.793035180639031],[10.522664752970465,44.793097124405747],[10.52246198780473,44.793200065114291],[10.522573330525685,44.793337642372464],[10.521390359843178,44.793801691131691],[10.521143897971992,44.793897890486356],[10.521790984438944,44.794726963915153],[10.522543865389105,44.795725476909617],[10.522751951321183,44.795630791913489],[10.52278515777024,44.795597410906538],[10.523907174383053,44.797027008646538],[10.52425607458663,44.796884681733772],[10.524857229186988,44.798023411335066],[10.526009559044827,44.79768414593854],[10.527733128535063,44.797181463200204],[10.527808816915776,44.79715874669921],[10.527894781376551,44.797140240564673],[10.528065662934347,44.797082240594555],[10.528237539106829,44.797023137820347],[10.528772343771994,44.796840521075119]]]]}},{"type":"Feature","properties":{"gid":"52","id_archeo":"80","codice":"080_MO","nome":"insediamento dell'età del Bronzo (terramara)","titolo":"Resti dell'insediamento dell'età del bronzo (terramara) e del castello medioevale.  Il primo impianto della terramara risale al 1600 a.C. Il villaggio subì nel tempo numerose ricostruzioni nonché opere di manutenzione delle abitazioni e delle fortific","tipo_propr":"Ecclesiastica, Privata","comuni":"CASTELNUOVO RANGONE","sigla_pro":"MO","localita":"Montale","tipologie":"Struttura abitativa o insediamento - Epoca Età del Bronzo","provvedime":"Decreto Ministeriale (24/02/1994)","data_ultim":"1994-02-24","ultimo_pro":"Decreto Ministeriale","rif_legge_":"L. 1089/1939","tutela":"Indiretto","vincolo":"Indiretto"},"geometry":{"type":"MultiPolygon","coordinates":[[[[10.90954271175468,44.576904685036226],[10.910176416890208,44.576649926222707],[10.910277487807077,44.576602981522036],[10.910236957797753,44.576553498806973],[10.910153280744133,44.576449762755949],[10.910525844889948,44.576292718975537],[10.910550706627816,44.576167156297245],[10.910547806048616,44.576078600395739],[10.910552398137535,44.576035649457417],[10.910581562284591,44.575987842625828],[10.910644632497633,44.575878583160709],[10.910658785652563,44.575854064412184],[10.910584979987972,44.575783300567224],[10.91053411186093,44.575736449589201],[10.910482974086589,44.575689053968254],[10.910433855823818,44.575642173645662],[10.910341332736204,44.575555573058956],[10.910261656194956,44.575481270404858],[10.910175308441014,44.575400543766754],[10.909488880283144,44.574970960195081],[10.909431945213152,44.574935328917825],[10.909178388950911,44.574995008938927],[10.909133443632131,44.575020435279029],[10.908870849383886,44.575172924949854],[10.908609713730165,44.575322688950791],[10.908505332216047,44.57538359781234],[10.908304474874349,44.575497235015646],[10.90821458517104,44.575548394854884],[10.908197064663298,44.57555836529567],[10.908150923983321,44.575582812897643],[10.907902792161991,44.575714776415261],[10.907877029773218,44.575742928714931],[10.907801357517261,44.575976424767376],[10.907781149870031,44.575980026896836],[10.907862371423738,44.576105492140513],[10.907886625029111,44.576145416556457],[10.908004516198988,44.576338433377991],[10.908210600882242,44.576664756420072],[10.908221932348015,44.576682729796438],[10.908545871010897,44.576762700946745],[10.908590990423175,44.576777844086791],[10.90873644756536,44.576820043687682],[10.908739990610671,44.576818891540704],[10.908847315868046,44.576843054724122],[10.909378647852934,44.576956538109073],[10.90954271175468,44.576904685036226]],[[10.908751843755082,44.576717217465024],[10.908582992111349,44.576611937378189],[10.908366091954621,44.576469987121136],[10.908228495268801,44.57634960568658],[10.908131431233359,44.576237496774816],[10.908028090471396,44.576092115047935],[10.908002708519144,44.576003532220845],[10.908014988273482,44.575900821577271],[10.908069813200871,44.575834286405488],[10.908084279337832,44.575800667011407],[10.908109238318334,44.575770580881681],[10.908154495864551,44.575726557194479],[10.908442963165035,44.575563362334236],[10.908925351636427,44.575222293498378],[10.909105168224317,44.575141637260614],[10.909214546850764,44.575129550165499],[10.909285895658986,44.575153820932947],[10.909362195927157,44.575159962187413],[10.909442519614734,44.575183343024591],[10.909554685938094,44.575228442981079],[10.909610405120384,44.575239873131615],[10.909739776624846,44.575282212718854],[10.909844948099458,44.575324956970732],[10.909954871545144,44.575407180311963],[10.910043162094537,44.575462568867344],[10.910188709948594,44.575576337414276],[10.910314324509894,44.575715163466221],[10.910346815109467,44.57575665091688],[10.910362505353712,44.57581325397075],[10.910382462173354,44.575894509800179],[10.910373755656702,44.575999656783871],[10.910364985099157,44.576080106088618],[10.910339021056567,44.576152368032695],[10.910289590674155,44.5762273676117],[10.910263713327973,44.576282193752462],[10.910203587325308,44.576347482576395],[10.910119389383571,44.576408113288565],[10.91004056384334,44.576476615225829],[10.909939991904681,44.576537323760192],[10.909760317960272,44.576649115679189],[10.909665294843256,44.576705098274658],[10.90959366332623,44.576735965387059],[10.909465026446039,44.576776967496691],[10.909350220378307,44.576801847304672],[10.909171888319309,44.576796176061336],[10.90904694161949,44.576783430855016],[10.908914937709882,44.576762001986999],[10.908751843755082,44.576717217465024]]]]}},{"type":"Feature","properties":{"gid":"53","id_archeo":"81","codice":"081_MO","nome":"Insediamento dell'età del Bronzo (terramara)","titolo":"La terramara della Cappuccina, che si trova circa 1,2 km a sud-ovest del centro di Formigine, fu segnalata per la prima volta da Celestino Cavedoni nel 1851. Secondo quanto riportato da Cavedoni, “erano stati rinvenuti nel cavare il terriccio fertilizz","tipo_propr":"Privata","comuni":"FORMIGINE","sigla_pro":"MO","localita":"La Cappuccina","tipologie":"Struttura abitativa o insediamento - Epoca Età del Bronzo","provvedime":"Decreto Ministeriale (31/10/1997)","data_ultim":"1997-10-31","ultimo_pro":"Decreto Ministeriale","rif_legge_":"L. 1089/1939","tutela":"Diretto","vincolo":"Diretto"},"geometry":{"type":"MultiPolygon","coordinates":[[[[10.836613705619751,44.562443729743855],[10.835236009558557,44.562358185734354],[10.835191616919271,44.562376763919808],[10.834614500768792,44.563203343355006],[10.834230406449862,44.563753451264319],[10.834665643250307,44.564158714408883],[10.834669603724766,44.564161124545016],[10.834674551070426,44.564167008085697],[10.834700357943776,44.564197701297502],[10.834728548649442,44.564233644102487],[10.834732408898866,44.564236951565626],[10.835294348237197,44.564372296099179],[10.836464210487485,44.564703603289637],[10.837091241095534,44.564883637966794],[10.837594430048348,44.565028111899053],[10.837914450996575,44.564971764713547],[10.838369583665967,44.564890424258508],[10.838858482353988,44.563289517579676],[10.837828739115105,44.562891011159792],[10.837631640522185,44.562814732902403],[10.836613705619751,44.562443729743855]]]]}},{"type":"Feature","properties":{"gid":"54","id_archeo":"119","codice":"119_PR","nome":"Insediamento dell'età del Bronzo","titolo":"La terramara di Basilicanova è nota dalla metà dell’Ottocento per la presenza di materiale archeologico affiorante. Già il Pigorini vi eseguì nel 1865 un intervento di scavo mettendo in luce una stratificazione di circa 7-8 metri, di cui i 4 metri","tipo_propr":"Privata","comuni":"MONTECHIARUGOLO","sigla_pro":"PR","localita":"Basilicanova","tipologie":"Struttura abitativa o insediamento - Epoca Età del Bronzo","provvedime":"Decreto Ministeriale (15/06/1993)","data_ultim":"1993-06-15","ultimo_pro":"Decreto Ministeriale","rif_legge_":"L. 1089/1939","tutela":"Diretto","vincolo":"Diretto"},"geometry":{"type":"MultiPolygon","coordinates":[[[[10.365737586842469,44.694532210513614],[10.365373440000695,44.693841663128488],[10.364237289564697,44.694136115960013],[10.36385126766778,44.694236156565289],[10.363958126582737,44.694416688147598],[10.364008028427964,44.694481523510824],[10.364039918216307,44.694559743239594],[10.364046603927809,44.694631118070475],[10.364027832569933,44.694684933955621],[10.363992145144744,44.694732338868178],[10.364013657657809,44.694796564449753],[10.364022981451805,44.694824377801339],[10.364553379808635,44.694734006641482],[10.365737586842469,44.694532210513614]]]]}},{"type":"Feature","properties":{"gid":"55","id_archeo":"197","codice":"197_RE","nome":"Insediamento dell'età del bronzo","titolo":"Resti di un piccolo villaggio databile all’età del bronzo medio e recente, di forma sub-circolare e delimitato da un fossato, erano già noti nella letteratura paletnologica dell’Ottocento; tuttavia la marniera ottocentesca asportò tutto il deposit","tipo_propr":"Privata","comuni":"REGGIO NELL`EMILIA","sigla_pro":"RE","localita":"Elsa di Valllere","tipologie":"Struttura abitativa o insediamento - Epoca Età del Bronzo","provvedime":"Decreto Ministeriale (12/01/1982)","data_ultim":"1982-01-12","ultimo_pro":"Decreto Ministeriale","rif_legge_":"L. 1089/1939","tutela":"Diretto","vincolo":"Diretto"},"geometry":{"type":"MultiPolygon","coordinates":[[[[10.516188366294038,44.75376898827043],[10.516237211801336,44.753595762184048],[10.516205303867025,44.753582889940674],[10.516161751475924,44.753616523640893],[10.515996082185952,44.753683933955394],[10.515768148633443,44.753735669955432],[10.515613580876463,44.753591358191123],[10.515556492059808,44.753509783627521],[10.515517815921699,44.753454511558324],[10.515508107226553,44.753393876883116],[10.51550089329668,44.753348449317897],[10.51545838745187,44.753300834758249],[10.515409794532863,44.753290029151451],[10.515369750673806,44.753334166337808],[10.515358830339986,44.753432073065504],[10.515323234039897,44.753452557112496],[10.51531734640966,44.753456407091022],[10.515226233982464,44.753515868238267],[10.515252379305082,44.753548981725466],[10.514209684506776,44.754066862902356],[10.515242776566224,44.755086070098351],[10.516985537340796,44.754237460364862],[10.516978030784719,44.754202091298673],[10.516828130916501,44.754160522076681],[10.516356027077133,44.753824545632931],[10.516226995926363,44.753816654033621],[10.516188366294038,44.75376898827043]]]]}},{"type":"Feature","properties":{"gid":"56","id_archeo":"53","codice":"053_FC","nome":"Insediamento dell'età del ferro e romana, resti di epoca bizantina","titolo":"La zona identificata come sito del Compito presenta una lunga continuità insediativa, con rilevanti ed eterogenee tipologie strutturali (edifici rustici, impianti artigianali e produttivi, aree di necropoli e sepolture).\nIl sito è stato oggetto di vari","tipo_propr":null,"comuni":"SAVIGNANO SUL RUBICONE","sigla_pro":"FC","localita":"San Giovanni in Compito","tipologie":"Sepoltura-e - Epoca Età Romana, Struttura abitativa o insediamento - Epoca Età Romana, Struttura abitativa o insediamento - Epoca Eneolitico, Struttura abitativa o insediamento, Struttura produttiva - artigianale - Epoca Età del Ferro","provvedime":"Decreto Ministeriale (16/04/1998)","data_ultim":"1998-04-16","ultimo_pro":"Decreto Ministeriale","rif_legge_":"L. 1089/1939","tutela":"Diretto","vincolo":"Diretto"},"geometry":{"type":"MultiPolygon","coordinates":[[[[12.369415693071083,44.089177621062824],[12.368989049958884,44.08886937345261],[12.368943348626946,44.088874008589414],[12.368651085360487,44.088903684392875],[12.368342461464032,44.08892583544305],[12.368344551870647,44.088978982734595],[12.368347954437414,44.089052937722442],[12.36834886924577,44.089072995529335],[12.368362837365716,44.089376430120147],[12.368383067372017,44.089859092751837],[12.368390075354126,44.09009124308055],[12.368287909139399,44.090349239374518],[12.368222981452893,44.090353181344007],[12.368376605376953,44.090601151970006],[12.368629836341261,44.091003493583919],[12.368846802658911,44.091352961597885],[12.368918740609246,44.091468834997862],[12.369072206618462,44.09170271121949],[12.36928064143823,44.091612779226402],[12.369327487583163,44.091596163695733],[12.369375729233946,44.091579047811109],[12.369856606325806,44.091448291963552],[12.370217742913061,44.091384979903204],[12.370652669372525,44.091304650920016],[12.371089083073789,44.091222160731711],[12.371368888414059,44.091169385916849],[12.371377560076077,44.091140447443294],[12.371421818587903,44.09088925471405],[12.371430539441665,44.090818794782614],[12.371413870644611,44.090710193720433],[12.371390311832211,44.090657243223767],[12.371376639617321,44.090641082359348],[12.371337200629871,44.090599035015607],[12.37124788919906,44.090520803120867],[12.371043094846899,44.09034713402486],[12.370812430451858,44.090182637144757],[12.370469358850221,44.089931712859993],[12.369982828965703,44.089584428974518],[12.369415693071083,44.089177621062824]]]]}},{"type":"Feature","properties":{"gid":"57","id_archeo":"38","codice":"038_FC","nome":"Sepolcreto di età villanoviana","titolo":"Nel 1980 fu segnalato alla Soprintendenza per i Beni Archeologici dell’Emilia Romagna il rinvenimento di tre sepolture in urne cinerarie, una delle quali biconica. I lavori interessavano la risistemazione del terreno posto su via Masrola di Sopra, pres","tipo_propr":"Privata","comuni":"BORGHI","sigla_pro":"FC","localita":"Ripa Calbana, Masrola di Sopra","tipologie":"Sepoltura-e - Epoca Età del Ferro, Struttura abitativa o insediamento","provvedime":"Decreto Ministeriale (26/06/1981)","data_ultim":"1981-06-26","ultimo_pro":"Decreto Ministeriale","rif_legge_":"L. 1089/1939","tutela":"Diretto","vincolo":"Diretto"},"geometry":{"type":"MultiPolygon","coordinates":[[[[12.360338804686132,43.991385851731039],[12.359865029234733,43.991475366665874],[12.358741344450438,43.991675178443003],[12.358230768902571,43.991731329574094],[12.35824487780649,43.991744238487811],[12.358268370026778,43.991911439237946],[12.358042109811064,43.992141526244296],[12.357964915135282,43.992446955440215],[12.358114561247401,43.992472900825689],[12.358354012818817,43.992525282395789],[12.358436038319788,43.992546663041473],[12.358605703334112,43.992521657424369],[12.358808864459256,43.992497565404278],[12.358928475130353,43.992463075996298],[12.35901581528014,43.99239593799426],[12.35920304253793,43.992269881115149],[12.359338175899506,43.99218302465853],[12.359494277332205,43.992150161436385],[12.359643969527896,43.992125256019449],[12.359831796689617,43.992117827460412],[12.359954946776835,43.992144262307363],[12.360083141533188,43.992173906526183],[12.360179145026594,43.992181361304212],[12.360281522183717,43.992009582013438],[12.360356898732249,43.991946810430051],[12.360490399594443,43.991680765275817],[12.360396810826423,43.99150058525516],[12.360338804686132,43.991385851731039]]]]}},{"type":"Feature","properties":{"gid":"58","id_archeo":"64","codice":"064_FE","nome":"Abitato della prima età del Ferro","titolo":"Abitato della prima età del Ferro localizzato tra i meandri di un palealveo ancora leggibile sul terreno. Il sito è disseminato di materiali fittili appartenenti a tipi cermaici ad impasto, di distanziatori per la cottura dei materiali ceramici, di fra","tipo_propr":"Privata","comuni":"ARGENTA, COMACCHIO","sigla_pro":"FE, FE","localita":"Bonifica del Mezzano","tipologie":"Struttura abitativa o insediamento - Epoca Età del Ferro","provvedime":"Decreto Ministeriale (13/06/1983)","data_ultim":"1983-06-13","ultimo_pro":"Decreto Ministeriale","rif_legge_":"L. 1089/1939","tutela":"Diretto","vincolo":"Diretto"},"geometry":{"type":"MultiPolygon","coordinates":[[[[12.070316847345747,44.625511670561394],[12.069676603885309,44.625322076381778],[12.068957053648154,44.626540055677985],[12.068947874545799,44.626555594292526],[12.067712733331803,44.628646187778948],[12.068573897969882,44.628900039191066],[12.070099873688864,44.626288009430667],[12.070112725157998,44.626266011086479],[12.070518571894072,44.625571277997025],[12.070316847345747,44.625511670561394]]]]}},{"type":"Feature","properties":{"gid":"59","id_archeo":"65","codice":"065_FE","nome":"Insediamento della prima età del ferro","titolo":"Strato archeologico, adiacente a quello già tutelato con decreto 13/6/1983, pertinente ad abitato della prima età del ferro, con pavimentazione in concotto e incannicciato, fondazioni a palafitta e rinvenimento di materili fittili, lisciatoi ed element","tipo_propr":"Privata","comuni":"ARGENTA, COMACCHIO","sigla_pro":"FE, FE","localita":"Bonifica del Mezzano","tipologie":"Struttura abitativa o insediamento - Epoca Età del Ferro","provvedime":"Decreto Ministeriale (06/07/1984)","data_ultim":"1984-07-06","ultimo_pro":"Decreto Ministeriale","rif_legge_":"L. 1089/1939","tutela":"Diretto","vincolo":"Diretto"},"geometry":{"type":"MultiPolygon","coordinates":[[[[12.069509218813142,44.625272507938661],[12.06883304295693,44.625074106832372],[12.067815574423859,44.626808772914146],[12.067822394702988,44.626817004570789],[12.068649661000594,44.627052520853347],[12.068941543327476,44.626557064499139],[12.068950672950626,44.626541567722853],[12.069670194603384,44.625320177482187],[12.069509218813142,44.625272507938661]]]]}},{"type":"Feature","properties":{"gid":"60","id_archeo":"55","codice":"055_FE","nome":"Insediamento della seconda età del ferro","titolo":"Il sito, nel quale furono rinvenuti negli anni ’50 del secolo scorso i resti di alcune sepolture di età romana andate distrutte, è stato per la prima volta censito nel 1984 relativamente alla sua facies romana, mentre successive segnalazioni hanno co","tipo_propr":"Privata","comuni":"BONDENO","sigla_pro":"FE","localita":"La Barchessa","tipologie":"Struttura abitativa o insediamento - Epoca Età del Ferro","provvedime":"Decreto Ministeriale (29/10/1991)","data_ultim":"1991-10-29","ultimo_pro":"Decreto Ministeriale","rif_legge_":"L. 1089/1939","tutela":"Diretto","vincolo":"Diretto"},"geometry":{"type":"MultiPolygon","coordinates":[[[[11.244418729120119,44.900203205711868],[11.24416993491703,44.899987598832091],[11.244029716992131,44.900106886781771],[11.243576518206899,44.900494642908768],[11.242982299004776,44.901003364061289],[11.242723835201224,44.901227271170711],[11.243387787277118,44.90162363006722],[11.243663115225367,44.901786940865733],[11.243273065830685,44.902504219306159],[11.243331550629293,44.902538729212949],[11.243671549741132,44.902737312176789],[11.244152754457557,44.903021802760442],[11.244247057296397,44.903078486708722],[11.244480575154006,44.903213574416661],[11.244987856121584,44.903510772153794],[11.245135559357406,44.903598937197813],[11.245322289900743,44.903438333180539],[11.245781322785605,44.903045297398087],[11.246040015102597,44.902823782412057],[11.246122973018901,44.902752753948548],[11.246652374874589,44.902299430090764],[11.246447840045713,44.902172255848342],[11.24556328346628,44.901651044677038],[11.24503128777911,44.901338438516703],[11.24515914195719,44.90124520186788],[11.245285908203602,44.901152985686274],[11.245450903793046,44.901031607112735],[11.245029217890016,44.900701688628267],[11.244891003423795,44.900597763509609],[11.244814841289566,44.900533593666744],[11.244763015360801,44.900490054269547],[11.244418729120119,44.900203205711868]]]]}},{"type":"Feature","properties":{"gid":"61","id_archeo":"218","codice":"218_BO","nome":"Insediamento di epoca preromana","titolo":"Insediamento di epoca preromana (metà del IV - inizi del II secolo a.C.)","tipo_propr":"Privata, Pubblica","comuni":"MONTERENZIO","sigla_pro":"BO","localita":"Pianella di Monte Savino","tipologie":"Struttura abitativa o insediamento - Epoca Età del Ferro","provvedime":"Declaratoria (10/07/1979)","data_ultim":"1979-07-10","ultimo_pro":"Declaratoria","rif_legge_":"L. 1089/1939","tutela":"Diretto","vincolo":"Diretto"},"geometry":{"type":"MultiPolygon","coordinates":[[[[11.378426546643315,44.271054239799476],[11.378376122733178,44.271170884913779],[11.378317903755049,44.271243399378918],[11.378580885410743,44.271177780297421],[11.378766038198034,44.271170679838129],[11.378858817646863,44.271159743088823],[11.379108459931446,44.271136173209619],[11.379373139474893,44.27111264935079],[11.379569307314362,44.271055623236258],[11.379744718671898,44.271005871676635],[11.379590187036177,44.270803113380374],[11.379459809849786,44.270627579390059],[11.379307226336524,44.270473034327068],[11.379131017939772,44.270527843326427],[11.378882583862296,44.270606124236807],[11.378784523262825,44.270709718440109],[11.378738221892208,44.270779463944031],[11.378691223797244,44.270856786186556],[11.378426546643315,44.271054239799476]]]]}},{"type":"Feature","properties":{"gid":"62","id_archeo":"99","codice":"099_PC","nome":"Insediamento di epoca romana","titolo":"Resti di un insediamento romano frequentato tra il I secolo a.C. e il I secolo d.C.","tipo_propr":"Pubblica","comuni":"PIANELLO VAL TIDONE","sigla_pro":"PC","localita":"Cimitero","tipologie":"Struttura abitativa o insediamento - Epoca Età Romana","provvedime":"Decreto Ministeriale (16/10/1989)","data_ultim":"1989-10-16","ultimo_pro":"Decreto Ministeriale","rif_legge_":"L. 1089/1939","tutela":"Diretto","vincolo":"Diretto"},"geometry":{"type":"MultiPolygon","coordinates":[[[[9.413911405848093,44.943251681016029],[9.413884712202814,44.943250999078082],[9.413680042078672,44.943704275964727],[9.413652531846832,44.943892975155308],[9.41369401905601,44.943882532987658],[9.414079290949498,44.943786553587842],[9.414096404502446,44.943631667251054],[9.414117454508904,44.943394038844161],[9.4141295721892,44.943257256393089],[9.413988614088439,44.943253654389331],[9.413911405848093,44.943251681016029]]]]}},{"type":"Feature","properties":{"gid":"63","id_archeo":"88","codice":"088_PC","nome":"Insediamento di età romana","titolo":"Il sito è localizzato a circa 200 metri dal torrente Chiavenna, in una area verde oggi risparmiata dalle lottizzazioni moderne, a Roveleto di Cadeo. Qui, in un’area prospiciente la stazione ferroviaria sita tra la ferrovia e la via Emilia, è stato me","tipo_propr":"Privata","comuni":"CADEO","sigla_pro":"PC","localita":"Roveleto","tipologie":"Struttura abitativa o insediamento - Epoca Età Romana","provvedime":"Decreto Ministeriale (23/07/1997)","data_ultim":"1997-07-23","ultimo_pro":"Decreto Ministeriale","rif_legge_":"L. 1089/1939","tutela":"Diretto","vincolo":"Diretto"},"geometry":{"type":"MultiPolygon","coordinates":[[[[9.853620463194568,44.966652871289753],[9.853505091475668,44.966555110485686],[9.853315032799966,44.966578820358023],[9.853230546669703,44.966588498922441],[9.853069358490776,44.966606888485181],[9.852907535714984,44.966625246562025],[9.852855839233452,44.966631367095481],[9.852635455032759,44.9666572468699],[9.85269279480277,44.96687878494042],[9.852741269296873,44.967072807698372],[9.852772267866625,44.967173405262642],[9.852965156702595,44.967057316623801],[9.853155977248475,44.966939478766037],[9.85337921381579,44.966802332337451],[9.853620463194568,44.966652871289753]]]]}},{"type":"Feature","properties":{"gid":"64","id_archeo":"147","codice":"147_PR","nome":"Insediamento di età romana","titolo":"Resti archeologici relativi a un insediamento di età romana di notevoli proporzioni","tipo_propr":"Privata","comuni":"PARMA","sigla_pro":"PR","localita":null,"tipologie":"Struttura abitativa o insediamento - Epoca Età Romana","provvedime":"Decreto Direzione Regionale (26/03/2012), Decreto Direzione Regionale (24/02/2012), Decreto Ministeriale (07/06/2001)","data_ultim":"2012-03-26","ultimo_pro":"Decreto Direzione Regionale","rif_legge_":"D. Lgs. 42/2004","tutela":"Diretto","vincolo":"Diretto"},"geometry":{"type":"MultiPolygon","coordinates":[[[[10.351834051891215,44.782195640861573],[10.351720039188592,44.7818833779247],[10.351229551731175,44.78200699111521],[10.350912566351989,44.781370629423897],[10.350513099424113,44.781461157042621],[10.350633635216223,44.781721002246798],[10.350547409363664,44.781741890468574],[10.35061068419496,44.781868299428318],[10.350795008304367,44.78224383271953],[10.350784075124638,44.782246515698716],[10.350741804036561,44.782258421997604],[10.351057209279164,44.78281666141082],[10.351566392905463,44.782674441479692],[10.351362680717791,44.782269269465722],[10.351515528236936,44.782244115150803],[10.351834051891215,44.782195640861573]]]]}},{"type":"Feature","properties":{"gid":"65","id_archeo":"147","codice":"147_PR","nome":"Insediamento di età romana","titolo":"Resti archeologici relativi a un insediamento di età romana di notevoli proporzioni","tipo_propr":"Privata","comuni":"PARMA","sigla_pro":"PR","localita":null,"tipologie":"Struttura abitativa o insediamento - Epoca Età Romana","provvedime":"Decreto Direzione Regionale (26/03/2012), Decreto Direzione Regionale (24/02/2012), Decreto Ministeriale (07/06/2001)","data_ultim":"2012-03-26","ultimo_pro":"Decreto Direzione Regionale","rif_legge_":"D. Lgs. 42/2004","tutela":"Indiretto","vincolo":"Indiretto"},"geometry":{"type":"MultiPolygon","coordinates":[[[[10.35170897800792,44.783329916836124],[10.351749017977276,44.783342902620838],[10.351747485352586,44.78331876219189],[10.351742973483223,44.783291550930308],[10.351713312468998,44.783224948299782],[10.351688559247613,44.783181755897949],[10.351807027998287,44.783149982672164],[10.351564376573927,44.782677966574489],[10.35105683342405,44.782815809783244],[10.351393080102264,44.78339474260482],[10.35170897800792,44.783329916836124]]]]}},{"type":"Feature","properties":{"gid":"66","id_archeo":"13","codice":"013_BO","nome":"Insediamento di età romana e altomedievale","titolo":"Materiali in affioramento, sistematiche ricerche di superficie e fotografie aeree hanno permesso di accertare l’esistenza di un estesissimo insediamento abitativo di epoca romana e altomedievale. La documentazione raccolta indica la presenza nel sottos","tipo_propr":null,"comuni":"CALDERARA DI RENO","sigla_pro":"BO","localita":null,"tipologie":"Struttura abitativa o insediamento - Epoca Età Altomedievale, Struttura abitativa o insediamento - Epoca Età Romana","provvedime":"Decreto Ministeriale (04/10/1994)","data_ultim":"1994-10-04","ultimo_pro":"Decreto Ministeriale","rif_legge_":"L. 1089/1939","tutela":"Diretto","vincolo":"Diretto"},"geometry":{"type":"MultiPolygon","coordinates":[[[[11.268227703766991,44.591858843638157],[11.267837802899763,44.590399151883346],[11.267751592722805,44.590085786254335],[11.267435786705819,44.588890260601069],[11.263151974665343,44.589848544786889],[11.263410547272844,44.590262020379761],[11.263820169196869,44.591482702124324],[11.264183491151645,44.591430480382805],[11.264308502745761,44.591446003699694],[11.264378613666537,44.591507627955465],[11.264533696607334,44.591770116479026],[11.264765887141225,44.591950053629162],[11.264848063424417,44.591957424466408],[11.265290416606677,44.591953142621584],[11.265404939103224,44.591982376411707],[11.265457741949861,44.592003833504307],[11.265626991969473,44.592144508584788],[11.265624020683873,44.592230089126332],[11.268227703766991,44.591858843638157]]]]}},{"type":"Feature","properties":{"gid":"67","id_archeo":"146","codice":"146_PR","nome":"Insediamento di età romana","titolo":"Resti di strutture insediative di età romana","tipo_propr":"Privata","comuni":"PARMA","sigla_pro":"PR","localita":"S.Lazzaro Parmense","tipologie":"Struttura abitativa o insediamento - Epoca Età Romana","provvedime":"Decreto Ministeriale (13/06/1998)","data_ultim":"1998-06-13","ultimo_pro":"Decreto Ministeriale","rif_legge_":"L. 1089/1939","tutela":"Diretto","vincolo":"Diretto"},"geometry":{"type":"MultiPolygon","coordinates":[[[[10.345360365559515,44.770726679775834],[10.345339810470881,44.770726875160719],[10.345330385454719,44.770747489247164],[10.345185356081293,44.771064652698726],[10.345619583633498,44.77101666384501],[10.345793227349096,44.770988109887554],[10.345797454811843,44.770987414612122],[10.346309645602457,44.770780059369905],[10.346457912620947,44.770720034540339],[10.345924332997317,44.770724066074919],[10.345360365559515,44.770726679775834]],[[10.345327549185905,44.771009125266978],[10.345293070830206,44.770964276344991],[10.345269602217643,44.770961575526933],[10.345369810688959,44.770795154078002],[10.345372055147662,44.770783813846506],[10.345364747577406,44.770757104134354],[10.345761191315022,44.770766425837564],[10.345761050001048,44.770778336748627],[10.345729048606012,44.770786157180858],[10.345725433156488,44.770792452148733],[10.345747106701552,44.770825840339569],[10.345795152232139,44.770824976354305],[10.345845958061016,44.77072701944337],[10.345915362070546,44.770727987790139],[10.345799519876984,44.770941040041706],[10.34576896552414,44.77095717990457],[10.345750628591535,44.770959480139858],[10.34572438405,44.770981226084949],[10.345670008441948,44.770979485058142],[10.345630852028554,44.771003169542197],[10.345517890866855,44.770980384454731],[10.345504140211075,44.771000196743231],[10.345401262755214,44.770979674568594],[10.34538374451123,44.770999233502941],[10.345372742224107,44.770993408513547],[10.345327549185905,44.771009125266978]]]]}},{"type":"Feature","properties":{"gid":"68","id_archeo":"231","codice":"231_PC","nome":"Insediamento di età romana, villa romana di Arcello di Pianello Val Tidone","titolo":"In area collinare in località Arcello, negli anni ’90 del secolo scorso, è stato individuato un sito frequentato già durante la seconda età del ferro e sul quale, in età repubblicana, venne edificata una villa romana successivamente ampliata in et","tipo_propr":"Privata","comuni":"PIANELLO VAL TIDONE","sigla_pro":"PC","localita":"Arcello","tipologie":"Struttura abitativa o insediamento - Epoca Età Romana","provvedime":"Decreto Ministeriale (12/11/2011)","data_ultim":"2011-11-12","ultimo_pro":"Decreto Ministeriale","rif_legge_":"D. Lgs. 42/2004","tutela":"Diretto","vincolo":"Diretto"},"geometry":{"type":"MultiPolygon","coordinates":[[[[9.44901599231496,44.950497522833686],[9.448428756022967,44.950074752330885],[9.448014588246313,44.950297405326346],[9.44855738530341,44.950695266848172],[9.448728276257587,44.950620012909432],[9.448928687316251,44.950534382297072],[9.44901599231496,44.950497522833686]]]]}},{"type":"Feature","properties":{"gid":"69","id_archeo":"12","codice":"012_BO","nome":"Insediamento dell'Età del Bronzo","titolo":"La presenza di un abitato dell'età del Bronzo nella località denominata Trebbo Sei Vie, fu segnalata da Edoardo Brizio nel 1896. Nel corso delle sue ricerche, Brizio rinvenne tracce di numerose capanne con focolare in posto e ne dedusse perciò che que","tipo_propr":null,"comuni":"BUDRIO","sigla_pro":"BO","localita":"Trebbo Sei Vie","tipologie":"Struttura abitativa o insediamento - Epoca Età del Bronzo","provvedime":"Decreto Ministeriale (07/06/2001)","data_ultim":"2001-06-07","ultimo_pro":"Decreto Ministeriale","rif_legge_":"L. 1089/1939","tutela":"Diretto","vincolo":"Diretto"},"geometry":{"type":"MultiPolygon","coordinates":[[[[11.521278072370565,44.502047192731453],[11.520943583605531,44.501618150728689],[11.519935914317781,44.502030031942304],[11.519976491111368,44.502084230020614],[11.519446644463851,44.502305505700583],[11.518369553083486,44.502741591922167],[11.518546366432703,44.502968148752849],[11.518682496178645,44.503137988486095],[11.518830321621277,44.503322333674163],[11.518955174267482,44.503463974663774],[11.518956505265304,44.503471507237251],[11.519067407200916,44.503616336850072],[11.519222184975025,44.503845179577439],[11.520898106933261,44.503153513058358],[11.521317247100605,44.502978608541255],[11.521844464235556,44.502766384646897],[11.521835800370917,44.502752172413047],[11.521278072370565,44.502047192731453]]],[[[11.518761595489439,44.50442344063574],[11.519310526539739,44.504160264021657],[11.519300562022368,44.50414592727865],[11.519292826395892,44.504129893894003],[11.519276815003934,44.504108641844631],[11.519128937009858,44.503899812086217],[11.518920062716287,44.503606626590738],[11.518678723820388,44.503307315603863],[11.518668111878206,44.50329458650782],[11.518660702124585,44.503286107840076],[11.518543105260758,44.503149347662728],[11.518284583695534,44.502824848477822],[11.518197492962987,44.502718742719047],[11.518176980373649,44.502686426961787],[11.518019490379084,44.502487890459221],[11.517961992272017,44.502414620086483],[11.517798161626821,44.50220902133649],[11.517709974383685,44.502100778822125],[11.51734879850412,44.501658991666055],[11.517070865136123,44.501350762039188],[11.517023161145007,44.501294559588061],[11.516821394178233,44.501049105733806],[11.516809979106256,44.501041075391889],[11.516795145234951,44.501023758030406],[11.51678345133489,44.501009252155981],[11.516332991863305,44.500409909998403],[11.515966578275627,44.499925671311743],[11.515766429560955,44.499661167187419],[11.515636658943997,44.499498385684902],[11.515549860101036,44.499468971339823],[11.515275826166972,44.49948765212914],[11.514527468620541,44.499538680456993],[11.514169173081138,44.499560619944127],[11.513962355687022,44.499571658799994],[11.513136384337848,44.499622623654282],[11.511980372312614,44.499697413630784],[11.511801627944864,44.49970608403904],[11.511096691527701,44.499740272728886],[11.510361890079931,44.499782008154014],[11.509347961501964,44.499838162092999],[11.508472673425226,44.499889097522917],[11.507367432230506,44.499954010246221],[11.507387178431138,44.500038535801288],[11.507292120872716,44.500048934817329],[11.507822930307604,44.500800468504643],[11.508491360413325,44.501661066264184],[11.508836474191035,44.502152206620366],[11.509055268283843,44.502466799125855],[11.50934427948728,44.502913890758684],[11.510460852749643,44.502531305033258],[11.510843766008557,44.502402607832003],[11.511041470236657,44.502316847830258],[11.511774543757012,44.503325340323329],[11.512071139104018,44.503424902938654],[11.512135112528158,44.503438258212732],[11.512593909299829,44.503506295745382],[11.512825380696407,44.503530005509027],[11.513250830836922,44.503594813789832],[11.513429311046078,44.503626530458973],[11.513968744307693,44.503697468163772],[11.514286556065077,44.503739797801984],[11.514346214647349,44.503746405149286],[11.514454193950113,44.503753387942204],[11.514472337430519,44.50375406836627],[11.514735719770766,44.503770949380915],[11.514962274292529,44.503797283815217],[11.515383875035273,44.503819317879],[11.515689655826733,44.50386262902942],[11.516072049527036,44.503932336244162],[11.516086295442001,44.503935984016501],[11.516100541321036,44.50393963087884],[11.5162105023163,44.503969254175061],[11.516327084389284,44.504012414885004],[11.516912276115688,44.504281100013422],[11.516989878186436,44.504307115269334],[11.517076049834651,44.504321778525423],[11.517214192381751,44.504328093248361],[11.517444941460971,44.504331995421275],[11.517473012537994,44.50433246442185],[11.517472795576884,44.50432742789971],[11.517505973746976,44.504326695824616],[11.517510367272285,44.504335241118724],[11.517524444357877,44.504334381363371],[11.517730177656125,44.504321748509739],[11.518170001775433,44.504322844802957],[11.518402961869079,44.504334267194871],[11.518517316039306,44.504349027468095],[11.518534547343425,44.504351887945347],[11.518624725486788,44.504366101493424],[11.518761595489439,44.50442344063574]]]]}},{"type":"Feature","properties":{"gid":"70","id_archeo":"56","codice":"056_FE","nome":"Insediamento età del bronzo","titolo":"Al 1979 si data l'identificazione del sito del fondo Verri di Pilastri, grazie alla segnalazione effettuata da un appassionato locale, cui seguirono ricognizioni di superficie. La terramara di Pilastri è un sito archeologico caratterizzato da una freque","tipo_propr":"Privata","comuni":"BONDENO","sigla_pro":"FE","localita":"Pilastri - I Verri","tipologie":"Struttura abitativa o insediamento - Epoca Età del Bronzo","provvedime":"Decreto Ministeriale (09/08/1989)","data_ultim":"1989-08-09","ultimo_pro":"Decreto Ministeriale","rif_legge_":"L. 1089/1939","tutela":"Diretto","vincolo":"Diretto"},"geometry":{"type":"MultiPolygon","coordinates":[[[[11.283067907079349,44.94841190267438],[11.28297792452617,44.948259949321546],[11.282910426220647,44.948279666293651],[11.282369181021172,44.948408580487751],[11.281884687320963,44.94853256370186],[11.282489567144975,44.94976874312119],[11.282664728115087,44.949716368972069],[11.282970027948547,44.949626210690312],[11.28351502334484,44.949463128889192],[11.283571893403758,44.949445835128884],[11.283067907079349,44.94841190267438]]]]}},{"type":"Feature","properties":{"gid":"71","id_archeo":"133","codice":"133_PR","nome":"Insediamento età del Bronzo","titolo":"La terramara venne segnalata in loc. Cornocchio, a nord ovest della città d Parma, già nel 1864 da Strobel e Pigorini che recuperarono importanti materiali archeologici, anche in bronzo, senza però effettuare un vero e proprio scavo. Negli anni ’80","tipo_propr":"Privata","comuni":"PARMA","sigla_pro":"PR","localita":"Golese, loc. Cornocchio","tipologie":"Struttura abitativa o insediamento - Epoca Età del Bronzo","provvedime":"Decreto Ministeriale (04/01/1993)","data_ultim":"1993-01-04","ultimo_pro":"Decreto Ministeriale","rif_legge_":"L. 1089/1939","tutela":"Diretto","vincolo":"Diretto"},"geometry":{"type":"MultiPolygon","coordinates":[[[[10.291487671494316,44.840046450221173],[10.293168050327052,44.83713323034582],[10.290555847091769,44.837490545520495],[10.290488839562839,44.839985972783538],[10.290488137134187,44.840012133096153],[10.290567130686323,44.840168551300543],[10.290621644203739,44.840194793120283],[10.291292545826337,44.840362623766005],[10.291487671494316,44.840046450221173]]]]}},{"type":"Feature","properties":{"gid":"72","id_archeo":"142","codice":"142_PR","nome":"Insediamento età del Bronzo","titolo":"L’area di Fraore, posta lungo la SS9 poco ad ovest di Parma, è nota dall’Ottocento per ritrovamenti dell’età del Bronzo già citati dal Pigorini nel 1864. Si tratta di due terramare ravvicinate di cui una in prossimità del canale Vallazza e l’","tipo_propr":"Privata","comuni":"PARMA","sigla_pro":"PR","localita":"San Pancrazio","tipologie":"Struttura abitativa o insediamento - Epoca Età del Bronzo","provvedime":"Decreto Ministeriale (15/06/1993)","data_ultim":"1993-06-15","ultimo_pro":"Decreto Ministeriale","rif_legge_":"L. 1089/1939","tutela":"Diretto","vincolo":"Diretto"},"geometry":{"type":"MultiPolygon","coordinates":[[[[10.269775857985499,44.81846851409626],[10.269623451045087,44.818043379189923],[10.269343912720052,44.818047387927315],[10.26923140970813,44.818051312315788],[10.267521619224507,44.818094199207536],[10.266829491310061,44.818154291054682],[10.266445916855169,44.818208723848713],[10.266179420954147,44.818255060430957],[10.265979447860115,44.818305276767511],[10.265466090472358,44.818473976467914],[10.265238232045958,44.818539993048184],[10.264900703004709,44.81862559740911],[10.264138804621993,44.81879518116861],[10.263909931755091,44.81884211308369],[10.263520364737753,44.818932295355985],[10.263925063031632,44.819912589783577],[10.264414903181022,44.821098985625909],[10.264774316233623,44.821023213480153],[10.265095493394471,44.820945163317511],[10.265411973633009,44.820857127081524],[10.26601776544466,44.820736616549574],[10.266259326502913,44.820699909972348],[10.266462651615511,44.820632597163041],[10.266713723766498,44.820569354243297],[10.266865770895704,44.820536610214297],[10.266982087282958,44.820517162380177],[10.267273711478945,44.820508299363908],[10.267473316003196,44.820483668531459],[10.267960014717087,44.820397633198375],[10.268380761476402,44.820331628838147],[10.268732703662995,44.820268025943086],[10.26915685994204,44.820177081297665],[10.269797919450051,44.820034199711472],[10.27033685023901,44.819912846497999],[10.270305193976707,44.819839823447772],[10.270089462195786,44.819327744372465],[10.269789478843707,44.818608415731525],[10.269750216069786,44.818490746163043],[10.269775857985499,44.81846851409626]]]]}},{"type":"Feature","properties":{"gid":"73","id_archeo":"145","codice":"145_PR","nome":"Insediamento età del Bronzo","titolo":"Grande terramara oggetto di vari sopralluoghi del Pigorini nel corso degli anni’70 dell’Ottocento e segnalata anche dal toponimo “Terramarna”. Solo recentemente è stato possibile posizionarla e definirla con maggiore precisione grazie a ricerche","tipo_propr":"Privata, Pubblica","comuni":"PARMA","sigla_pro":"PR","localita":"S.Lazzaro Parmense, S. Prospero, Quingento","tipologie":"Struttura abitativa o insediamento - Epoca Età del Bronzo","provvedime":"Decreto Ministeriale (06/07/1984)","data_ultim":"1984-07-06","ultimo_pro":"Decreto Ministeriale","rif_legge_":"L. 1089/1939","tutela":"Diretto","vincolo":"Diretto"},"geometry":{"type":"MultiPolygon","coordinates":[[[[10.399845679872206,44.77212271492769],[10.399115216370976,44.770461299694595],[10.39889488381443,44.769964126500213],[10.397587761171636,44.770394613597759],[10.397499180744886,44.770424216211943],[10.3974742211176,44.770432551505245],[10.396283088387337,44.770830547004309],[10.395674691856618,44.771034121425998],[10.395356338675629,44.771144587308129],[10.395561341850163,44.771568867309178],[10.395807620456042,44.772078539538114],[10.396155473978586,44.771982754041467],[10.396607602349292,44.77288443836661],[10.399845679872206,44.77212271492769]]],[[[10.395797163895457,44.773485231837654],[10.395674629513538,44.773224708188458],[10.396219312385943,44.773090688309289],[10.395843749205568,44.772296063612785],[10.395584956465909,44.771741741418765],[10.395308995034705,44.771162782833038],[10.394763262391061,44.770139475998093],[10.393715941556502,44.770330018822492],[10.393196042591931,44.770423899431307],[10.392348984378424,44.770578057339669],[10.392295153032652,44.770564425774928],[10.392290854189778,44.77056333673886],[10.392175912440504,44.770534230456228],[10.392120221411412,44.770517725538994],[10.39209802016002,44.770468664271775],[10.391994738031096,44.770488206580993],[10.391223895536321,44.770604140577738],[10.390068834835956,44.770776806406204],[10.389872536938398,44.770805139911857],[10.389414175544214,44.770873381632917],[10.389827032472255,44.771830618474461],[10.390506862216901,44.77356241533105],[10.391008150092027,44.773423913938267],[10.391185592127194,44.773635135756557],[10.392005296173176,44.774643920803449],[10.394787265348503,44.773793631467058],[10.394860784270856,44.773777944825063],[10.394944991788632,44.773759978767913],[10.394946876534947,44.77375957675676],[10.394988615011892,44.773750671532795],[10.395797163895457,44.773485231837654]]]]}},{"type":"Feature","properties":{"gid":"74","id_archeo":"145","codice":"145_PR","nome":"Insediamento età del Bronzo","titolo":"Grande terramara oggetto di vari sopralluoghi del Pigorini nel corso degli anni’70 dell’Ottocento e segnalata anche dal toponimo “Terramarna”. Solo recentemente è stato possibile posizionarla e definirla con maggiore precisione grazie a ricerche","tipo_propr":"Privata, Pubblica","comuni":"PARMA","sigla_pro":"PR","localita":"S.Lazzaro Parmense, S. Prospero, Quingento","tipologie":"Struttura abitativa o insediamento - Epoca Età del Bronzo","provvedime":"Decreto Ministeriale (06/07/1984)","data_ultim":"1984-07-06","ultimo_pro":"Decreto Ministeriale","rif_legge_":"L. 1089/1939","tutela":"Diretto","vincolo":"Area demaniale"},"geometry":{"type":"MultiPolygon","coordinates":[[[[10.396234717226442,44.772971664368832],[10.396607602349292,44.77288443836661],[10.396155473978586,44.771982754041467],[10.395807620456042,44.772078539538114],[10.396234717226442,44.772971664368832]]]]}},{"type":"Feature","properties":{"gid":"75","id_archeo":"103","codice":"103_PR","nome":"Insediamento età del Bronzo","titolo":"La terramara di Casaroldo è posta al limite tra la media e bassa pianura, ad una quota di 36 m slm. L’esistenza del sito è nota dalla metà dell’Ottocento a causa delle estrazioni di marna. Nei primi anni ’70 dell’Ottocento Pigorini avviò le p","tipo_propr":"Privata","comuni":"BUSSETO","sigla_pro":"PR","localita":"Casaroldo di Samboseto","tipologie":"Struttura abitativa o insediamento - Epoca Età del Bronzo","provvedime":"Decreto Ministeriale (12/12/1992)","data_ultim":"1992-12-12","ultimo_pro":"Decreto Ministeriale","rif_legge_":"L. 1089/1939","tutela":"Diretto","vincolo":"Diretto"},"geometry":{"type":"MultiPolygon","coordinates":[[[[10.110468017448094,44.950716533122602],[10.109639173978342,44.95062432077146],[10.109506798777065,44.950643781899537],[10.109478987519772,44.950660957538616],[10.109433659869026,44.950732224153747],[10.109417819615111,44.950794355454292],[10.109308851842139,44.951189837005685],[10.109195037020404,44.951603585153563],[10.10911339722907,44.951980608338616],[10.109146263162735,44.952075735095477],[10.10915699085284,44.952106155966412],[10.109218386399581,44.952164755295698],[10.109318807394326,44.952182845409979],[10.110187584733414,44.952302901321254],[10.110972601906752,44.952387812532116],[10.111095837881892,44.95240040401945],[10.111318219235091,44.952357065380767],[10.111406600514325,44.952000328114032],[10.111490294204742,44.95167268518388],[10.111542777763178,44.951467230353458],[10.111651186316918,44.951052092254706],[10.11168634780546,44.95090483157707],[10.111642226125017,44.950846713501598],[10.111026482516133,44.950779882620303],[10.110848365091604,44.950759678422322],[10.110468017448094,44.950716533122602]]]]}},{"type":"Feature","properties":{"gid":"76","id_archeo":"22","codice":"022_BO","nome":"Insediamento età del ferro","titolo":"Tracce consistenti di un insediamento della piena età del Ferro (VI-V sec. a.C.), con i resti di un impianto artigianale per la produzione ceramica, sono state individuate agli inizi degli Ottanta del secolo scorso.\nA seguito di alcuni rinvenimenti di s","tipo_propr":"Privata","comuni":"IMOLA","sigla_pro":"BO","localita":"Montericco","tipologie":"Struttura abitativa o insediamento - Epoca Età del Ferro","provvedime":"Decreto Ministeriale (02/02/1982)","data_ultim":"1982-02-02","ultimo_pro":"Decreto Ministeriale","rif_legge_":"L. 1089/1939","tutela":"Diretto","vincolo":"Diretto"},"geometry":{"type":"MultiPolygon","coordinates":[[[[11.681399979279945,44.351429336515494],[11.680747355435885,44.350742905261058],[11.68063563942002,44.350788227409851],[11.680252797074116,44.350936755190425],[11.680095506577407,44.350998198996393],[11.679747918839411,44.351221328686655],[11.679153383690819,44.351610605041778],[11.679140626212412,44.351618088413673],[11.679072906256577,44.351694190974655],[11.679057172309291,44.351751149536803],[11.679113815543598,44.351832507400758],[11.679148303313644,44.3518764760219],[11.679230535382212,44.351981080659591],[11.679245291890606,44.351997352783947],[11.679416089015749,44.352177578413162],[11.679425515999222,44.352186755662608],[11.679556399799498,44.35233719269128],[11.679778846478186,44.352599243691472],[11.680153349152453,44.353037601572488],[11.680265869034734,44.352987246671894],[11.682119767525734,44.352157527049421],[11.682102578487347,44.352130860645978],[11.682037987085172,44.352112419957344],[11.681454438018093,44.351432645751323],[11.681399979279945,44.351429336515494]]]]}},{"type":"Feature","properties":{"gid":"77","id_archeo":"28","codice":"028_BO","nome":"Insediamento etrusco","titolo":"Nei terreni situati nella località in oggetto, è stato possibile accertare l'esistenza di un insediamento dell'età del Ferro. Si sono evidenziati resti di cavità e buche strutturali riferibili ad un abitato a capanne assegnabile alla piena età del F","tipo_propr":"Privata","comuni":"MEDICINA","sigla_pro":"BO","localita":"Tiro a segno","tipologie":"Struttura abitativa o insediamento - Epoca Età del Ferro","provvedime":"Decreto Ministeriale (20/03/1995)","data_ultim":"1995-03-20","ultimo_pro":"Decreto Ministeriale","rif_legge_":"L. 1089/1939","tutela":"Diretto","vincolo":"Diretto"},"geometry":{"type":"MultiPolygon","coordinates":[[[[11.64983407372325,44.493731875473948],[11.649166394330624,44.492918272860784],[11.648791329778115,44.493085456386709],[11.648290189693817,44.493305940474087],[11.648083028218002,44.493397169829066],[11.647357148199829,44.493720809605264],[11.646973537461982,44.493892829705452],[11.646795955280647,44.493970767415256],[11.646385691456455,44.494154206467563],[11.646877411330577,44.49499669822729],[11.647355331572761,44.494791762210006],[11.647412635428131,44.494768467233222],[11.648609904532133,44.49425564194987],[11.648932776247984,44.494119955152534],[11.64983407372325,44.493731875473948]]]]}},{"type":"Feature","properties":{"gid":"78","id_archeo":"84","codice":"084_MO","nome":"Insediamento etrusco","titolo":"Nel 1986 l'Archeoclub di Nonantola rinveniva in località Galaverna un esteso affioramento di materiale archeologico risalente alla seconda età del ferro. \nL'abitato etrusco occupa una superficie di circa un ettaro.\nI numerosi materiali rinvenuti si col","tipo_propr":"Privata","comuni":"NONANTOLA","sigla_pro":"MO","localita":"la Galaverna","tipologie":"Struttura abitativa o insediamento - Epoca Età del Ferro","provvedime":"Decreto Ministeriale (28/05/1991)","data_ultim":"1991-05-28","ultimo_pro":"Decreto Ministeriale","rif_legge_":"L. 1089/1939","tutela":"Diretto","vincolo":"Diretto"},"geometry":{"type":"MultiPolygon","coordinates":[[[[11.059358393978478,44.676361132387463],[11.059157548512507,44.676076685502579],[11.058590362078666,44.676277760789475],[11.058059016187855,44.67551838544216],[11.057737596212387,44.675631540339303],[11.057011574431082,44.675887129669164],[11.056565955252925,44.676044002911858],[11.056268305759884,44.676148783723399],[11.057792862077836,44.678288779717057],[11.058076759657448,44.678197754233111],[11.059271038144107,44.677814821735154],[11.060176883439315,44.677524361938353],[11.059907942656467,44.677143049437284],[11.059358393978478,44.676361132387463]]]]}},{"type":"Feature","properties":{"gid":"79","id_archeo":"112","codice":"112_PR","nome":"Insediamento etrusco","titolo":"Il sito è stato scavato negli anni ‘90 dalla Soprintendenza. Situato ai piedi delle colline su un pianoro lambito dal rio Siccomonte e non distante da sorgenti salsobromoiodiche, sfruttate per la produzione del sale, l’abitato etrusco, nel momento d","tipo_propr":"Privata","comuni":"FIDENZA","sigla_pro":"PR","localita":"Cabriolo, loc. Case nuove di Siccomonte","tipologie":"Struttura abitativa o insediamento - Epoca Età del Ferro","provvedime":"Decreto Ministeriale (05/10/1992)","data_ultim":"1992-10-05","ultimo_pro":"Decreto Ministeriale","rif_legge_":"L. 1089/1939","tutela":"Diretto","vincolo":"Diretto"},"geometry":{"type":"MultiPolygon","coordinates":[[[[10.071138008185558,44.843281470587421],[10.071241164020339,44.843172667799934],[10.071423968072486,44.842986609507278],[10.071471533318809,44.842969662460106],[10.071528391466062,44.842978247863385],[10.071719521939697,44.842775259201609],[10.071415167744773,44.842656795861245],[10.071128005301139,44.842540789992505],[10.071144312696973,44.842522236908323],[10.071201463398564,44.842457246394147],[10.071272604165951,44.842376344074111],[10.071256380753617,44.842369402727385],[10.07131056007978,44.842304539055142],[10.071322553972228,44.842290149337074],[10.071525465922679,44.842384026383719],[10.071599671112994,44.842299872384714],[10.071956409800144,44.842524823166741],[10.072295140895044,44.842164713015904],[10.072494994099918,44.84196295540864],[10.072714017577534,44.841737486102694],[10.072928504437201,44.841514462532935],[10.072364973221301,44.841325284092292],[10.072764862546009,44.840942518824882],[10.073246393674276,44.841177114300393],[10.073274112746454,44.841147866384091],[10.07332979410967,44.841089117988815],[10.073647407132766,44.840756424347838],[10.074388207512033,44.839987080542706],[10.074262187532067,44.839927705401472],[10.073260153861186,44.839516069733072],[10.073069123253266,44.839436820316266],[10.072361080156423,44.839144984439613],[10.072146332039722,44.839058403555264],[10.071940549657528,44.83929063407713],[10.071786464170092,44.839252858937783],[10.071785527775223,44.839248078662408],[10.071720082578267,44.839147438471279],[10.071628506449709,44.838994057720576],[10.071540283678205,44.838860458831],[10.071489589626699,44.838823135181478],[10.071430013922996,44.838785138700217],[10.071372682651045,44.838759003762362],[10.071237477020002,44.838702173502341],[10.071146503445403,44.838675345882145],[10.070903988573951,44.838588149958099],[10.070797058341739,44.838522276994738],[10.070606143499708,44.838360843042572],[10.070302784674048,44.838210032056473],[10.069852974711361,44.837996111317324],[10.069782607501235,44.837960780652764],[10.0695027008849,44.837833405050269],[10.069085520311496,44.837644453239591],[10.068661025529288,44.837449122918002],[10.068520086113484,44.837385690598751],[10.068339649023295,44.837303174366966],[10.068323494619539,44.837321761638201],[10.06833076632007,44.837439268816176],[10.068332934853165,44.837559272290974],[10.068251299840867,44.837673983552818],[10.068054201391675,44.837846829667171],[10.068003271262912,44.837867740659192],[10.067926363535982,44.837896024199146],[10.067797489931747,44.837969281635758],[10.067706657150103,44.838096420274326],[10.067651793622103,44.838179724786926],[10.067661348768221,44.838350340483451],[10.067671082697041,44.838482704980606],[10.067754304502442,44.838600213058832],[10.067751775008297,44.838647497248225],[10.067735647760616,44.83867442903577],[10.067717471186276,44.838686319634085],[10.067544738524068,44.838743594286768],[10.067530725111064,44.838765789233129],[10.067547276839669,44.838841242316072],[10.067553420714342,44.838992274525566],[10.067411850079338,44.839079018221078],[10.067401103856986,44.839126712293741],[10.067436815051598,44.839179094156385],[10.067501341191173,44.83928038455111],[10.0675418627743,44.839347268648751],[10.067508126355159,44.839383961192731],[10.067443536174689,44.839412048218165],[10.067371929540998,44.839501387428058],[10.067390434674154,44.839551085533316],[10.067390430425121,44.839689860472276],[10.067325954716971,44.839793329142509],[10.067313417388691,44.839939260812365],[10.067337278061975,44.840065839980035],[10.067332972814112,44.840219733469688],[10.067261686510667,44.840423719122889],[10.06724119805906,44.840562532490452],[10.06725173095848,44.840604626424522],[10.067344521672187,44.840692068638276],[10.067432064544782,44.840757063831667],[10.067531790737572,44.84083362064213],[10.067617505879923,44.840926349950088],[10.067684121051688,44.840993359045989],[10.067698803727547,44.841005293422093],[10.067760412121109,44.841055380523784],[10.067811457818134,44.841094637957966],[10.067910878763389,44.841132038571786],[10.068015709498033,44.841126701000782],[10.068157391766679,44.841086144812138],[10.068200419667413,44.8410996053221],[10.068233991946387,44.841110111615883],[10.068248132282362,44.841122132015236],[10.068267149850488,44.841284305177133],[10.068235920404724,44.841353966800213],[10.068276605472251,44.841443930213707],[10.068376979107814,44.841482851845463],[10.068441415802134,44.841442946103797],[10.068478203879145,44.841439181063642],[10.068679044305565,44.841475532794917],[10.06889605910529,44.841518925338065],[10.068968291101168,44.841549522005195],[10.068987963235712,44.841563714011492],[10.068999766936845,44.841587566817559],[10.068985129401332,44.841625953377452],[10.068867331629292,44.841768891792469],[10.06889673436889,44.841844647413964],[10.06900452983143,44.841887315855836],[10.069045945579628,44.841877890050242],[10.069083190288262,44.841872122093825],[10.069168987042561,44.841877440022138],[10.069340432580658,44.841905369924547],[10.069373595605155,44.841918337252707],[10.069442413697525,44.841984559505448],[10.069476681038964,44.842020264524606],[10.069486083902671,44.842036758123491],[10.069501419644759,44.842185750602006],[10.06964852098239,44.842230030660794],[10.069687772437538,44.842262241143771],[10.069689748910827,44.84228014560896],[10.069664752982618,44.842305774440128],[10.069678406862897,44.842324973805738],[10.069735083263005,44.84236956980574],[10.069804736141799,44.842330514631279],[10.069985508770717,44.842277851273309],[10.070062474007791,44.842285879880791],[10.070109080581027,44.842382475601987],[10.070099495359313,44.842491381615247],[10.070072621341307,44.842516028916947],[10.070008526599684,44.842547758548093],[10.069962974477916,44.842566828596354],[10.069592424705311,44.842569337457263],[10.069570575647408,44.842578373108466],[10.069594645700016,44.842689277291939],[10.069758654022998,44.842771189196178],[10.069898117452892,44.84278830044255],[10.069946090731982,44.842739402114539],[10.0699776267997,44.842715737378768],[10.070123729525143,44.84268007042143],[10.070275361390143,44.84266966506425],[10.070310371952736,44.84267850988963],[10.070383348202826,44.842717740599852],[10.070402043311697,44.842736523533056],[10.070405232178244,44.842759070649969],[10.070386604155557,44.84279921416887],[10.070215996467139,44.842983986224972],[10.070297518552222,44.842978396946322],[10.070337595181828,44.842977931213419],[10.070366011400564,44.842990069560734],[10.07038009135178,44.843005610040819],[10.07038312321078,44.843044947349945],[10.070366738802381,44.843103064828071],[10.070345521610466,44.843136643151631],[10.070280346995055,44.843205723345662],[10.070270279027694,44.843298808369077],[10.070313620188939,44.843298330046466],[10.070418888483974,44.843286360693291],[10.070599075231659,44.84324564751595],[10.070766917636135,44.843254371769298],[10.070799964858809,44.843266493580728],[10.07084211840233,44.843298190340121],[10.070874061218225,44.843340146104211],[10.07087055773472,44.843373666398215],[10.070810467350256,44.843434408367145],[10.070694029007718,44.843529814325812],[10.070687517039378,44.84353824725207],[10.070744735761405,44.843563528367532],[10.070798886808602,44.843551650973069],[10.070878442777975,44.843510953919399],[10.071138008185558,44.843281470587421]],[[10.069955357231429,44.8405162081947],[10.070100374720147,44.840306830792656],[10.070323313010855,44.840374416514628],[10.070300444104593,44.840457422319304],[10.07050392927901,44.840532832745737],[10.070415251986923,44.840668982276334],[10.070234174559632,44.840945970058122],[10.069760095917843,44.840783714023495],[10.069955357231429,44.8405162081947]]]]}},{"type":"Feature","properties":{"gid":"80","id_archeo":"195","codice":"195_RE","nome":"Insediamento neolitico","titolo":"Insediamento neolitico con sequenza dal VI al IV millennio a.C.","tipo_propr":"Privata","comuni":"REGGIO NELL`EMILIA","sigla_pro":"RE","localita":"Bazzarola","tipologie":"Struttura abitativa o insediamento - Epoca Neolitico","provvedime":"Decreto Ministeriale (08/06/2001)","data_ultim":"2001-06-08","ultimo_pro":"Decreto Ministeriale","rif_legge_":"D. Lgs. 490/1999","tutela":"Diretto","vincolo":"Diretto"},"geometry":{"type":"MultiPolygon","coordinates":[[[[10.652152575015648,44.674579688440389],[10.65196805985255,44.674239998740184],[10.651526879771232,44.674336169123087],[10.651452117472731,44.674341985768052],[10.650944309400691,44.674442592525523],[10.650909019426116,44.674449170294473],[10.65051672408153,44.674520909233294],[10.650593052511883,44.674825697905931],[10.650855712175446,44.67587406831408],[10.65113262245217,44.676966720312514],[10.651167318227117,44.677104650435879],[10.651408161774004,44.677071848667424],[10.651569829572441,44.677049830413992],[10.651704209292413,44.677031527620684],[10.652673142838831,44.676892446541302],[10.652673092946401,44.676892244713372],[10.652793193666453,44.676874122145954],[10.652767557257413,44.67677831461684],[10.652704414424564,44.676557929566556],[10.652456234884726,44.675668268455745],[10.652456371886791,44.675668250269389],[10.652202937274406,44.674803460898026],[10.652152575015648,44.674579688440389]]]]}},{"type":"Feature","properties":{"gid":"81","id_archeo":"5","codice":"005_BO","nome":"Insediamento preistorico","titolo":"Insediamento preistorico della tarda età del Bronzo con continuazione forse fino alla prima età del Ferro.","tipo_propr":"Privata","comuni":"BOLOGNA","sigla_pro":"BO","localita":"Borgo Panigale, Fondo Bellavista, loc. Cava Salute","tipologie":"Struttura abitativa o insediamento - Epoca Età del Bronzo","provvedime":"Decreto Ministeriale (10/07/1979), Decreto Ministeriale (02/11/1982), Decreto Ministeriale (09/10/1985)","data_ultim":"1985-10-09","ultimo_pro":"Decreto Ministeriale","rif_legge_":"L. 1089/1939","tutela":"Diretto","vincolo":"Diretto"},"geometry":{"type":"MultiPolygon","coordinates":[[[[11.274330832888037,44.536092503167438],[11.275045338222485,44.535820978660453],[11.275045771587743,44.535821505652045],[11.275360430851368,44.535704756163327],[11.275203969041524,44.53548385232952],[11.275203792738166,44.535483946772324],[11.275203180132063,44.535483471062015],[11.275140639323165,44.535396375935477],[11.274998483804064,44.535469382277697],[11.27470228945602,44.535622737799912],[11.274552405523917,44.535714948392382],[11.27440298231077,44.535821580314511],[11.274236920474983,44.535960222903235],[11.274157584476075,44.536035065388923],[11.274064567234205,44.536123485977726],[11.273978981089927,44.536223677423372],[11.274167542992704,44.536153382381059],[11.274330832888037,44.536092503167438]]]]}},{"type":"Feature","properties":{"gid":"82","id_archeo":"183","codice":"183_RA","nome":"Insediamento preistorico","titolo":"Il sito di Via Ordiere costituisce uno degli abitati dell’età del Bronzo più importanti della Romagna ed è inquadrabile tra la Media età del Bronzo e l’età del Bronzo Recente: è stato possibile delineare un’estensione abitativa di circa 10 et","tipo_propr":"Privata","comuni":"SOLAROLO","sigla_pro":"RA","localita":null,"tipologie":"Struttura abitativa o insediamento - Epoca Età del Bronzo","provvedime":"Decreto Ministeriale (25/08/1980)","data_ultim":"1980-08-25","ultimo_pro":"Decreto Ministeriale","rif_legge_":"L. 1089/1939","tutela":"Diretto","vincolo":"Diretto"},"geometry":{"type":"MultiPolygon","coordinates":[[[[11.82168561270959,44.376018333449046],[11.821986005432928,44.375900906979162],[11.822000976656637,44.375919126738943],[11.822132443140141,44.376070591117092],[11.822718081401108,44.375861433301644],[11.823079874908364,44.375732798912892],[11.823323409709028,44.375644979634416],[11.823502809846934,44.375565093024875],[11.823838178457891,44.375407744157457],[11.823532622999837,44.375037365451973],[11.823082420167946,44.374502597272318],[11.822604404282126,44.37393319874004],[11.822216338646072,44.373470070761329],[11.822159623061452,44.373400408306388],[11.821773756402399,44.373559090717777],[11.821600503256319,44.373628649976538],[11.821271305325759,44.373760482775921],[11.821466307610132,44.373994925141041],[11.82168031563182,44.374245068290165],[11.821419564151615,44.374356670822984],[11.820843547781589,44.374609146705168],[11.820604410036612,44.374339844769231],[11.820350845348175,44.374444335431235],[11.820141550948483,44.374523263256108],[11.820063041273871,44.374421063511839],[11.819571448762892,44.373809559454187],[11.819370378125214,44.373555473798731],[11.818200841568117,44.374011780214381],[11.818545922314771,44.374433726158685],[11.818736654556254,44.374666984981808],[11.819092086607895,44.374528689742462],[11.819435599740475,44.374951769956247],[11.819752151224396,44.375348328009778],[11.819415717373211,44.375492862786686],[11.819523439766787,44.375625219501195],[11.819721649674527,44.375866349038368],[11.819927709474447,44.376120877875714],[11.820236124952773,44.376498100363406],[11.820290332018912,44.376565692160014],[11.82039786798512,44.376693299373009],[11.820741662308352,44.376578827792606],[11.821107160854114,44.376455284484514],[11.821357733604682,44.376369618069603],[11.821517787220388,44.376313835031084],[11.821387044329846,44.376137964630075],[11.821634257507018,44.37603753572855],[11.82168561270959,44.376018333449046]]]]}},{"type":"Feature","properties":{"gid":"83","id_archeo":"184","codice":"184_RE","nome":"Insediamento rurale di età romana","titolo":"Nei terreni ubicati presso il torrente Lodola in località Fogliano, in seguito ai lavori di posa di un metanodotto, nel 1995 sono emerse diverse strutture murarie riferibili ad una villa rustica di età imperiale con più fasi costruttive (fine I sec. a","tipo_propr":"Privata","comuni":"ALBINEA","sigla_pro":"RE","localita":"Bosco, loc. Caselle","tipologie":"Struttura abitativa o insediamento - Epoca Età Romana","provvedime":"Decreto Ministeriale (17/03/1997)","data_ultim":"1997-03-17","ultimo_pro":"Decreto Ministeriale","rif_legge_":"L. 1089/1939","tutela":"Diretto","vincolo":"Diretto"},"geometry":{"type":"MultiPolygon","coordinates":[[[[10.653786861354041,44.628394076491034],[10.65363610987395,44.628254015240458],[10.653422026016486,44.628351753516775],[10.653380766386501,44.628392744895258],[10.653373385307104,44.628417376522542],[10.65346255115694,44.628498315011107],[10.653550530754496,44.628537434617655],[10.653786861354041,44.628394076491034]]]]}},{"type":"Feature","properties":{"gid":"84","id_archeo":"184","codice":"184_RE","nome":"Insediamento rurale di età romana","titolo":"Nei terreni ubicati presso il torrente Lodola in località Fogliano, in seguito ai lavori di posa di un metanodotto, nel 1995 sono emerse diverse strutture murarie riferibili ad una villa rustica di età imperiale con più fasi costruttive (fine I sec. a","tipo_propr":"Privata","comuni":"ALBINEA","sigla_pro":"RE","localita":"Bosco, loc. Caselle","tipologie":"Struttura abitativa o insediamento - Epoca Età Romana","provvedime":"Decreto Ministeriale (17/03/1997)","data_ultim":"1997-03-17","ultimo_pro":"Decreto Ministeriale","rif_legge_":"L. 1089/1939","tutela":"Indiretto","vincolo":"Indiretto"},"geometry":{"type":"MultiPolygon","coordinates":[[[[10.653603840637228,44.628636203570288],[10.653955695768087,44.628434909718898],[10.653913629729457,44.628376370975126],[10.653820054885323,44.62828251281713],[10.653722441745678,44.628188713969905],[10.653631829500435,44.628127993100982],[10.6535099602581,44.628175922507673],[10.653258211711639,44.628312818284193],[10.65332208138935,44.628389267406448],[10.653446560390298,44.628504317026341],[10.65358109494389,44.628617778707699],[10.653603840637228,44.628636203570288]],[[10.653786861354041,44.628394076491034],[10.653550530754496,44.628537434617655],[10.65346255115694,44.628498315011107],[10.653373385307104,44.628417376522542],[10.653380766386501,44.628392744895258],[10.653422026016486,44.628351753516775],[10.65363610987395,44.628254015240458],[10.653786861354041,44.628394076491034]]]]}},{"type":"Feature","properties":{"gid":"85","id_archeo":"105","codice":"105_PR","nome":"Insediamento tardoantico","titolo":"Marzolara, frazione del comune di Calestano a pochi chilometri a N del capoluogo, si colloca lungo il versante orientale della media Val Baganza. Il sito tardo antico è noto dal 1993 in occasione dello sbancamento preliminare di una lottizzazione privat","tipo_propr":"Privata","comuni":"CALESTANO","sigla_pro":"PR","localita":"Marzolara, loc. Ferlaro","tipologie":"Struttura abitativa o insediamento - Epoca Età Tardoantica","provvedime":"Decreto Ministeriale (22/03/1997)","data_ultim":"1997-03-22","ultimo_pro":"Decreto Ministeriale","rif_legge_":"L. 1089/1939","tutela":"Diretto","vincolo":"Diretto"},"geometry":{"type":"MultiPolygon","coordinates":[[[[10.173772564520508,44.633369826627174],[10.17420417377112,44.633167062980185],[10.174049408474612,44.632981576124159],[10.173896917092563,44.632795642584945],[10.173740499893059,44.63260691342451],[10.17330095718898,44.632816886617825],[10.173326431694658,44.632824151004669],[10.173352142735729,44.632814380587305],[10.173376032523411,44.63284309572245],[10.173341334906915,44.632857990702718],[10.173457140009043,44.633002161893621],[10.173574501343587,44.633139700287352],[10.173613423242788,44.633121088918585],[10.173633431464026,44.633156118468435],[10.173608537575452,44.633167654006783],[10.17361245092429,44.633186662698073],[10.17363542401716,44.633195537106651],[10.173666597569744,44.633185935579974],[10.173685172528947,44.633214282126801],[10.173654660289124,44.633229170216495],[10.173772564520508,44.633369826627174]]]]}},{"type":"Feature","properties":{"gid":"86","id_archeo":"143","codice":"143_PR","nome":"Insediamento rustico di epoca romana","titolo":"Insediamento rustico d'epoca romana inserito nelle maglie centuriali lungo la via Emilia","tipo_propr":"Privata","comuni":"PARMA","sigla_pro":"PR","localita":"San Pancrazio","tipologie":"Struttura abitativa o insediamento - Epoca Età Romana","provvedime":"Decreto Ministeriale (15/03/1997)","data_ultim":"1997-03-15","ultimo_pro":"Decreto Ministeriale","rif_legge_":"L. 1089/1939","tutela":"Diretto","vincolo":"Diretto"},"geometry":{"type":"MultiPolygon","coordinates":[[[[10.277961993544565,44.811768965779727],[10.277958488129681,44.811760273072366],[10.277333969678288,44.811882982676728],[10.277289045353138,44.811891929165071],[10.276703176063444,44.812008558670712],[10.276670340672501,44.812022626900628],[10.276684451768309,44.812071791109588],[10.276695130365482,44.812098371649505],[10.27688425358955,44.812569042018204],[10.277070775355432,44.813028857709376],[10.277116450034356,44.813141456987111],[10.27747506947032,44.813069947821347],[10.277662878737601,44.813032540345276],[10.277727612522753,44.813019204086544],[10.277738036321781,44.813017052979546],[10.278046205895281,44.812954064391612],[10.278407756255538,44.812880232983105],[10.278381283452086,44.812813707526082],[10.278170902001067,44.812286997152682],[10.277961993544565,44.811768965779727]]]]}},{"type":"Feature","properties":{"gid":"87","id_archeo":"114","codice":"114_PR","nome":"Insediamento rustico di epoca romana","titolo":"Nell’autunno del 1994, a seguito di un accordo con l’Amministrazione Comunale di Fornovo Taro, è stata avviata l’esplorazione archeologica in una lottizzazione posta ai margini della frazione di Riccò, dove era imminente il recupero ambientale de","tipo_propr":"Privata","comuni":"FORNOVO DI TARO","sigla_pro":"PR","localita":"Riccò","tipologie":"Struttura abitativa o insediamento - Epoca Età Romana","provvedime":"Decreto Ministeriale (22/03/1997)","data_ultim":"1997-03-22","ultimo_pro":"Decreto Ministeriale","rif_legge_":"L. 1089/1939","tutela":"Diretto","vincolo":"Diretto"},"geometry":{"type":"MultiPolygon","coordinates":[[[[10.119486649080756,44.699928542200063],[10.119359479463833,44.699896245540835],[10.119345905327004,44.699899880372215],[10.119281021909476,44.699885113035066],[10.119270071823456,44.699873625393195],[10.119041909416145,44.699816156953823],[10.118974287610239,44.699821707323949],[10.118848208269595,44.699883274834995],[10.118828075676605,44.699946757733549],[10.118825779421043,44.699954009019429],[10.118824541937839,44.699957910104672],[10.119668090056239,44.700237486146776],[10.119707136991947,44.700084749560581],[10.119716314800726,44.700048848700789],[10.119714702082247,44.700031985294636],[10.119710807211755,44.700022445064832],[10.119700113720512,44.70000659786507],[10.119682781239144,44.699987484875585],[10.119654836177792,44.699969151030324],[10.119626648409616,44.699950666519861],[10.11958614706553,44.69993965747652],[10.119513108912534,44.699933351260022],[10.119492281122326,44.699929990408108],[10.119486649080756,44.699928542200063]]]]}},{"type":"Feature","properties":{"gid":"88","id_archeo":"33","codice":"033_BO","nome":"Insediamento rustico di età romana","titolo":"Resti di un insediamento abitativo di età romana sono emersi in seguito a raccolte di superficie dopo le arature e ad una campagna di ricognizioni effettuata nel 1986. Si tratta di una villa urbano-rustica attiva almeno dal I sec. a.C. al VI sec. d.C.,","tipo_propr":"Privata","comuni":"SALA BOLOGNESE","sigla_pro":"BO","localita":"Conocchietta / Sala Nuova","tipologie":"Struttura abitativa o insediamento - Epoca Età Romana","provvedime":"Decreto Ministeriale (04/10/1984)","data_ultim":"1984-10-04","ultimo_pro":"Decreto Ministeriale","rif_legge_":"L. 1089/1939","tutela":"Diretto","vincolo":"Diretto"},"geometry":{"type":"MultiPolygon","coordinates":[[[[11.253201791726967,44.593308466650797],[11.251750195273836,44.59396099671828],[11.251129098990452,44.594209642222928],[11.250654544025965,44.594422816861695],[11.251296250842003,44.595379158692026],[11.251989634448506,44.596420178177517],[11.25467812087498,44.595411754409874],[11.253877936744011,44.594268434974083],[11.253201791726967,44.593308466650797]]]]}},{"type":"Feature","properties":{"gid":"89","id_archeo":"124","codice":"124_PR","nome":"Insediamento rustico di età romana","titolo":"Resti di un insediamento rustico d'epoca romana","tipo_propr":"Privata","comuni":"PARMA","sigla_pro":"PR","localita":"Cortile S. Martino","tipologie":"Struttura abitativa o insediamento - Epoca Età Romana","provvedime":"Decreto Ministeriale (02/06/1995)","data_ultim":"1995-06-02","ultimo_pro":"Decreto Ministeriale","rif_legge_":"L. 1089/1939","tutela":"Diretto","vincolo":"Diretto"},"geometry":{"type":"MultiPolygon","coordinates":[[[[10.327785539389739,44.818337418760699],[10.327775183997419,44.818308912944758],[10.326991505358766,44.818476873835806],[10.325993444038076,44.818690114928145],[10.326216404741752,44.819229641659042],[10.326469943136502,44.819827190268612],[10.327551213335838,44.819599861438967],[10.328216979218089,44.819456808792467],[10.328203979437101,44.819418368601553],[10.327984491548451,44.818848063796807],[10.327885348721606,44.81859928638552],[10.327832421889495,44.818464530392419],[10.327819519081643,44.818430842071379],[10.327800484436541,44.818378527972577],[10.327785539389739,44.818337418760699]]]]}},{"type":"Feature","properties":{"gid":"90","id_archeo":"27","codice":"027_BO","nome":"Insediamento rustico di età romana imperiale","titolo":"Resti riferibili ad un insediamento rustico produttivo di età romana imperiale. \nSono state evidenziate strutture in laterizio pertinenti ad un’area lavorativa costituita da ambienti in muratura, piattaforme in mattoni e focolari destinati alla trasfo","tipo_propr":"Privata","comuni":"MEDICINA","sigla_pro":"BO","localita":"Luogo Pozzo","tipologie":"Struttura abitativa o insediamento - Epoca Età Romana","provvedime":"Decreto Ministeriale (20/03/1995)","data_ultim":"1995-03-20","ultimo_pro":"Decreto Ministeriale","rif_legge_":"L. 1089/1939","tutela":"Diretto","vincolo":"Diretto"},"geometry":{"type":"MultiPolygon","coordinates":[[[[11.613902553038988,44.513603857545313],[11.61297378778626,44.513045145300758],[11.611882142341836,44.513940087934756],[11.612823657015083,44.514507100757129],[11.613902553038988,44.513603857545313]]]]}},{"type":"Feature","properties":{"gid":"91","id_archeo":"120","codice":"120_PR","nome":"Insediamento rustico romano","titolo":"In un terreno, localizzato su un ampio pianoro sulla sponda destra del torrente Parma già sfruttato come cava di argilla e che ancora oggi ha nome Cava Garsi, negli anni ’70 del secolo scorso sono stati identificati resti di muri in ciottoli pertinent","tipo_propr":"Privata","comuni":"MONTECHIARUGOLO","sigla_pro":"PR","localita":"Basilicanova, loc. Cava Carsi","tipologie":"Struttura abitativa o insediamento - Epoca Età Romana","provvedime":"Decreto Ministeriale (22/02/1975)","data_ultim":"1975-02-22","ultimo_pro":"Decreto Ministeriale","rif_legge_":"L. 1089/1939","tutela":"Diretto","vincolo":"Diretto"},"geometry":{"type":"MultiPolygon","coordinates":[[[[10.355125224886971,44.708990922303606],[10.357035819603892,44.708430329960386],[10.356939388736992,44.708243582968386],[10.356791718559174,44.707960689569383],[10.356555961489024,44.707505992094482],[10.356293423690909,44.70699035251311],[10.355889208043862,44.706202413991605],[10.354800685754221,44.7064201492976],[10.354822442851589,44.706512937414658],[10.354020063534513,44.706630272171694],[10.354049277232644,44.706760826072809],[10.35407442021506,44.706839710877034],[10.354193867473628,44.707151029254568],[10.354383070315373,44.707643435681703],[10.354558422725457,44.708115049015611],[10.354613103095952,44.708226783257736],[10.354654404794042,44.708292099052088],[10.354935664776251,44.708693498991963],[10.355125224886971,44.708990922303606]]]]}},{"type":"Feature","properties":{"gid":"92","id_archeo":"191","codice":"191_RE","nome":"Insediamento terramaricolo dell'età del Bronzo","titolo":"Insediamento terramaricolo riferibile all'età del Bronzo recente (XIII secolo a.C.)","tipo_propr":"Ecclesiastica","comuni":"CASTELNOVO NE`MONTI","sigla_pro":"RE","localita":"Felina","tipologie":"Struttura abitativa o insediamento - Epoca Età del Bronzo","provvedime":"Decreto Soprintendente Regionale (26/07/2004)","data_ultim":"2004-07-26","ultimo_pro":"Decreto Soprintendente Regionale","rif_legge_":"D. Lgs. 42/2004","tutela":"Diretto","vincolo":"Diretto"},"geometry":{"type":"MultiPolygon","coordinates":[[[[10.459582178760339,44.452788459518004],[10.459415618278721,44.452551803818039],[10.459376066705421,44.452481747088633],[10.459129430318526,44.452552686959862],[10.458984497199582,44.452595346727804],[10.459039069592583,44.452694235978989],[10.459081585121229,44.452771276957755],[10.45909125880903,44.452788771399064],[10.459023868705586,44.452871114275133],[10.459044399342078,44.452909202928986],[10.459073931645689,44.452901479635237],[10.459123466376406,44.452888945549809],[10.459254409761938,44.452855808967733],[10.459414651610627,44.452816671335285],[10.4595666449038,44.452791520809065],[10.459582178760339,44.452788459518004]]]]}},{"type":"Feature","properties":{"gid":"93","id_archeo":"232","codice":"232_PR","nome":"Sito dell'età del Bronzo","titolo":"Insediamento dell’età del bronzo individuato per la presenza di materiale affiorante su un pianoro pianeggiante a circa 225 m di quota slm, protetto su tre lati da uno strapiombo di 30-35 m formato da due corsi d’acqua confluenti, il rio Castione e","tipo_propr":"Pubblica","comuni":"FORNOVO DI TARO","sigla_pro":"PR","localita":"Vizzola di Riccò","tipologie":"Struttura abitativa o insediamento - Epoca Età del Bronzo","provvedime":"Decreto Ministeriale (10/07/1995), Decreto Ministeriale (25/01/1993)","data_ultim":"1995-07-10","ultimo_pro":"Decreto Ministeriale","rif_legge_":"L. 1089/1939","tutela":"Diretto","vincolo":"Area demaniale"},"geometry":{"type":"MultiPolygon","coordinates":[[[[10.138204209717728,44.695407661940713],[10.137534596422975,44.695113942280315],[10.137156836807835,44.695636870641572],[10.136999633735172,44.695799440059893],[10.136968425022527,44.69583761402113],[10.137098082873967,44.696254667437046],[10.137197411993434,44.69646736539223],[10.137271684790958,44.696534890303901],[10.137469323756454,44.69670583842705],[10.137621406054707,44.696589761957647],[10.137861281532125,44.696405492356156],[10.138049939240226,44.696208345976785],[10.138083762427641,44.695948816407565],[10.138131263588148,44.695785069556223],[10.138334121397138,44.695526998081213],[10.138204209717728,44.695407661940713]]]]}},{"type":"Feature","properties":{"gid":"94","id_archeo":"230","codice":"230_PC","nome":"Insediamento terramaricolo delle Colombaie di Bersano","titolo":"La terramara, localizzata nella media pianura tra il “Canale della Bonifica” ad ovest e l’Ongina a est, è segnalato da Pigorini e Strobel già dal 1862. Ripetutamente visitato da Pigorini, che nel 1891 ne constatò l’estensione di circa 2-3 etta","tipo_propr":"Pubblica","comuni":"BESENZONE","sigla_pro":"PC","localita":"Bersano, loc. Colombare","tipologie":"Struttura abitativa o insediamento - Epoca Età del Bronzo","provvedime":"Decreto Ministeriale (05/07/1997), Decreto Ministeriale (20/07/1988)","data_ultim":"1997-07-05","ultimo_pro":"Decreto Ministeriale","rif_legge_":"L. 1089/1939","tutela":"Diretto","vincolo":"Area demaniale"},"geometry":{"type":"MultiPolygon","coordinates":[[[[10.010445628559545,44.97739527954171],[10.010657303216265,44.97787960061433],[10.010775025565755,44.978147369323572],[10.010893262461254,44.978419094124618],[10.010972676056635,44.97859547375019],[10.011074864028561,44.978726831659955],[10.011187489130517,44.978774407404153],[10.011998544502369,44.978999842064731],[10.012656487361056,44.978583659285661],[10.013347853863468,44.978148803273349],[10.014312380086459,44.977538087114418],[10.013900420063344,44.977171306410348],[10.013526901017366,44.976838047513169],[10.01331662822656,44.976657664615331],[10.013264378427731,44.976605972192395],[10.013245740065434,44.976587539986738],[10.013107412115044,44.976466631820237],[10.012623318695139,44.976037276201964],[10.012187468920278,44.97630669553692],[10.011490504593123,44.976739811896692],[10.010722615049335,44.977218813157279],[10.010610745816811,44.977291314085257],[10.010554463884912,44.977325488171438],[10.010445628559545,44.97739527954171]]]]}},{"type":"Feature","properties":{"gid":"95","id_archeo":"153","codice":"153_PR","nome":"Insediamento terramaricolo","titolo":"I terrazzi a nord del centro di Salsomaggiore sono stati interessati da importanti ritrovamenti archeologici riferibili sia all’età del Bronzo che a epoca romana.\nL’insediamento terramaricolo, noto come Campore di Bargone, è posto a poca distanza d","tipo_propr":"Privata","comuni":"SALSOMAGGIORE TERME","sigla_pro":"PR","localita":"Ponte Ghiara, podere Montata","tipologie":"Struttura abitativa o insediamento - Epoca Età del Bronzo","provvedime":"Decreto Ministeriale (24/09/1988)","data_ultim":"1988-09-24","ultimo_pro":"Decreto Ministeriale","rif_legge_":"L. 1089/1939","tutela":"Diretto","vincolo":"Diretto"},"geometry":{"type":"MultiPolygon","coordinates":[[[[10.011891598307097,44.831847886813335],[10.011871519172852,44.831841462661949],[10.01154655550528,44.831652571295706],[10.011214146043685,44.831374939590319],[10.011072563011929,44.831201553459664],[10.011136961213435,44.831080463528785],[10.011002994449004,44.830980097604218],[10.010930579879528,44.831008861261175],[10.010662843665612,44.831115196414736],[10.00969376947895,44.831502433368691],[10.009109564614766,44.831739482465835],[10.009075586342201,44.831754060046222],[10.009615147353232,44.832060122274783],[10.009715928994616,44.8321183655748],[10.009819058490789,44.832181368119791],[10.009905696598199,44.832234524153421],[10.010063406931538,44.832376693911286],[10.010154729510608,44.832476348968299],[10.010197408406874,44.832533952731275],[10.011891598307097,44.831847886813335]]]]}},{"type":"Feature","properties":{"gid":"96","id_archeo":"213","codice":"213_RN","nome":"Insediamento villanoviano","titolo":"Area di rinvenimento di materiali della prima età del Ferro e resti di fondi di capanna dell'insediamento villanoviano. Resti di strutture in pietra assegnabili alla fase etrusca fino al V secolo a.C.","tipo_propr":"Privata","comuni":"VERUCCHIO","sigla_pro":"RN","localita":"Pian del Monte","tipologie":"Struttura abitativa o insediamento - Epoca Età del Ferro, Struttura abitativa o insediamento - Epoca Età del Ferro","provvedime":"Decreto Ministeriale (09/12/1971)","data_ultim":"1971-12-09","ultimo_pro":"Decreto Ministeriale","rif_legge_":"L. 1089/1939","tutela":"Diretto","vincolo":"Diretto"},"geometry":{"type":"MultiPolygon","coordinates":[[[[12.426020093316692,43.979473581043777],[12.425864310381678,43.979352228253632],[12.425848792245656,43.979339946211603],[12.425802917844296,43.979306032557858],[12.425769648665881,43.979281445452521],[12.425599836543446,43.979147450461085],[12.425742092116909,43.979039676500051],[12.425989153945919,43.978848011051795],[12.425796835674898,43.978707885867074],[12.425578469737124,43.978549699473561],[12.425625434531542,43.9785308786172],[12.425670908670563,43.978521465303722],[12.425709894853208,43.978513480077289],[12.425787379469229,43.978503330983749],[12.42580836893822,43.978502592931022],[12.425911855209291,43.978497127931284],[12.426090838744505,43.978486191575911],[12.426147819736377,43.978484355041026],[12.426307331533216,43.978486444620216],[12.426483834712132,43.978487429679831],[12.426506277242025,43.978461044162437],[12.426589459279009,43.978347831473421],[12.426640637046347,43.978308065838746],[12.426412893801931,43.978202473740474],[12.42632233658748,43.978233775965194],[12.426227391084904,43.978234721267029],[12.426026422971947,43.97809337427389],[12.426006392409608,43.978078932013815],[12.424821890593616,43.977785626275008],[12.424781991695692,43.977817347228289],[12.424729894098419,43.977858756519979],[12.42452875376944,43.978016073465589],[12.424444995562018,43.97808098439215],[12.42441396523682,43.97810503438911],[12.424368052216884,43.978141918644162],[12.42417289367955,43.978295976559536],[12.424222969654211,43.978331007200516],[12.424349877753585,43.978416047403229],[12.42437704287066,43.978434237090639],[12.424385212473249,43.978439717700937],[12.424178035402676,43.97859963687641],[12.42414113900681,43.978628130077496],[12.424107305111477,43.978654163677248],[12.42389956079972,43.978814000340819],[12.423690750133822,43.978677499283407],[12.423526550101377,43.978808039607259],[12.42346815704771,43.97885468768321],[12.42367993504662,43.978982520547554],[12.423737017916428,43.979016467941868],[12.423809652052126,43.979072815692206],[12.423854733681265,43.979110742140165],[12.423871273435328,43.979126270789848],[12.423987539687605,43.979242581959817],[12.424033636071654,43.979288823406797],[12.424142389308971,43.979396105017152],[12.424223054338391,43.979475222485135],[12.424334309635302,43.97958719127837],[12.42434584656375,43.979598755721554],[12.424359695585055,43.97958896837995],[12.424441609623067,43.979669848766314],[12.42442769926479,43.979680520222516],[12.424444564783906,43.9796973714176],[12.424616273878726,43.979567540745734],[12.424766535714104,43.979454342209259],[12.424997889602059,43.979609637631242],[12.424916529141861,43.979675080121218],[12.424729370425524,43.979822624027094],[12.424649498249172,43.979884474605043],[12.424809337311258,43.980024982138474],[12.424897017985417,43.980103357445394],[12.425068173888702,43.980171215238187],[12.425202450500045,43.980076816356849],[12.425330257031485,43.979988931392469],[12.425479534394158,43.979885493397134],[12.425507978855929,43.97986632816739],[12.425517469961147,43.979861622977403],[12.425696213197018,43.979742265789788],[12.425879917864139,43.979619662462618],[12.42605917878114,43.979503908260334],[12.426025183099226,43.979477533492059],[12.426020093316692,43.979473581043777]]]]}},{"type":"Feature","properties":{"gid":"97","id_archeo":"104","codice":"104_PR","nome":"Rinvenimenti dell'età del Bronzo","titolo":"La terramara di Roncole è ubicata sulle alluvioni antiche della media pianura ad una quota di circa 42 m slm e sul lato occidentale di un leggero dosso che divide due piccole depressioni, nella più orientale delle quali scorre il canale Fontana. E’no","tipo_propr":"Privata","comuni":"BUSSETO","sigla_pro":"PR","localita":"Roncole, loc. Monticelle e Fontana","tipologie":"Struttura abitativa o insediamento - Epoca Età del Bronzo","provvedime":"Decreto Ministeriale (10/03/1975)","data_ultim":"1975-03-10","ultimo_pro":"Decreto Ministeriale","rif_legge_":"L. 1089/1939","tutela":"Diretto","vincolo":"Diretto"},"geometry":{"type":"MultiPolygon","coordinates":[[[[10.082157096318813,44.934572899696228],[10.082674997870367,44.934323437178747],[10.082682802487454,44.93431861020899],[10.08499363219182,44.933137310641357],[10.085154808459086,44.933078275234493],[10.085231874460186,44.933080432370694],[10.085312578476492,44.933053037858315],[10.085359997108776,44.933009153265488],[10.085111484491598,44.932873292098172],[10.084667171194372,44.932625939464138],[10.084433729459999,44.932469193407769],[10.084286877746219,44.93235333912687],[10.084195719154607,44.932219780329838],[10.084114164604406,44.931977000997108],[10.084081453459449,44.931875131717653],[10.08369815786857,44.930721601942352],[10.083680619978431,44.93062865336686],[10.083442392424466,44.9307680751307],[10.083066718472836,44.931015300979105],[10.082889805473506,44.931131581367488],[10.082636536124186,44.931295512079394],[10.082182801062695,44.931592427151536],[10.081837171903544,44.931888046135903],[10.081544247495001,44.932133861781551],[10.081222301735597,44.932398666309773],[10.081090219609678,44.932509694382233],[10.08191616977658,44.933207876133665],[10.081700780199883,44.933344116231261],[10.081976490821459,44.933617383177044],[10.081986932838319,44.933627748857525],[10.081976855402718,44.933634771265268],[10.081497319028452,44.933894408401201],[10.080404069219879,44.934486312877475],[10.079708217465187,44.933868491820796],[10.079693562385575,44.933877686249915],[10.079076826264068,44.934266463605418],[10.079281789212043,44.934446471479355],[10.079546160157241,44.934681665656463],[10.079776219123712,44.93488601934655],[10.080181614725854,44.93524382453618],[10.080013792237024,44.935340345427825],[10.080196155782305,44.935517135668832],[10.080566768472915,44.935876888823763],[10.080386486836185,44.935982872072174],[10.080887202574308,44.93648000320497],[10.081088483875902,44.936403004281956],[10.082096171094024,44.936026570976011],[10.082611755647914,44.93583586768559],[10.082944263250459,44.935710208523091],[10.082811462301635,44.93552161037212],[10.082192414859815,44.934624091447297],[10.082157096318813,44.934572899696228]]]]}},{"type":"Feature","properties":{"gid":"98","id_archeo":"52","codice":"052_FC","nome":"Monumento funerario di epoca romana","titolo":"Il monumento funerario, noto anche con il nome di “Petrone”, è situato sul lato meridionale della via Emilia, in un punto in cui sorse una Cappella con la dedica alla Vergine (Cappella della Madonna del Petrone). \nDel monumento si conserva la parte","tipo_propr":"Privata","comuni":"SAVIGNANO SUL RUBICONE","sigla_pro":"FC","localita":"San Giovanni in Compito","tipologie":"Sepoltura-e - Epoca Età Romana","provvedime":"Decreto Ministeriale (30/03/1967)","data_ultim":"1967-03-30","ultimo_pro":"Decreto Ministeriale","rif_legge_":"L. 1089/1939","tutela":"Diretto","vincolo":"Diretto"},"geometry":{"type":"MultiPolygon","coordinates":[[[[12.381906425745941,44.091631999824578],[12.381896135364697,44.091722240720273],[12.381942182736662,44.091726277635352],[12.381954475741155,44.091635671294398],[12.381906425745941,44.091631999824578]]]]}},{"type":"Feature","properties":{"gid":"99","id_archeo":"209","codice":"209_RN","nome":"Mosaico romano","titolo":"Mosaico romano, forse del I secolo d. C., con rappresentazioni di divinità egizie e emblema centrale con testa di Gorgone","tipo_propr":"Privata","comuni":"RIMINI","sigla_pro":"RN","localita":null,"tipologie":"Struttura abitativa o insediamento - Epoca Età Romana","provvedime":"Decreto Ministeriale (28/04/1948)","data_ultim":"1948-04-28","ultimo_pro":"Decreto Ministeriale","rif_legge_":"L. 1089/1939","tutela":"Diretto","vincolo":"Diretto"},"geometry":{"type":"MultiPolygon","coordinates":[[[[12.567679282670015,44.057647583434481],[12.56768031665786,44.057646301547457],[12.567722118546881,44.05759449908728],[12.56772456418329,44.057591468869823],[12.567692941320351,44.057577931180148],[12.567679631431943,44.057587279705594],[12.567653100821904,44.057574532537039],[12.567668734005162,44.057562610458056],[12.567655393933361,44.057552128190771],[12.567651581528212,44.057554995882342],[12.567577295911731,44.057610937928168],[12.567536886770727,44.057642513063968],[12.567600932203824,44.057677240898656],[12.567639503023448,44.05763676838658],[12.567679282670015,44.057647583434481]]]]}},{"type":"Feature","properties":{"gid":"100","id_archeo":"226","codice":"226_MO","nome":"Mura di età tardo medievale-rinascimentale","titolo":null,"tipo_propr":"Privata, Pubblica","comuni":"CASTELFRANCO EMILIA","sigla_pro":"MO","localita":null,"tipologie":"Infrastruttura territoriale o urbana - Epoca Età Medievale, Infrastruttura territoriale o urbana - Epoca Età Post-Medievale","provvedime":"Declaratoria (27/06/1992)","data_ultim":"1992-06-27","ultimo_pro":"Declaratoria","rif_legge_":"L. 1089/1939","tutela":"Diretto","vincolo":"Declaratoria"},"geometry":{"type":"MultiPolygon","coordinates":[[[[11.050559438916611,44.5959189489637],[11.050523572699728,44.595866001473638],[11.050127711312959,44.596006260363758],[11.050100814576558,44.596015789718741],[11.05016394673742,44.596104690890655],[11.050190366513322,44.596095319522384],[11.050382214713919,44.596027265919751],[11.050360888367713,44.595988968693703],[11.050559438916611,44.5959189489637]]]]}},{"type":"Feature","properties":{"gid":"101","id_archeo":"217","codice":"217_RN","nome":"Mura e torri dal Medioevo al Seicento","titolo":"Mura e torri dal Medioevo al Seicento","tipo_propr":"Pubblica","comuni":"RIMINI","sigla_pro":"RN","localita":null,"tipologie":"Fortificazione - Epoca Età Medievale, Fortificazione - Epoca Età Post-Medievale","provvedime":"Declaratoria (30/08/1994)","data_ultim":"1994-08-30","ultimo_pro":"Declaratoria","rif_legge_":"L. 1089/1939","tutela":"Diretto","vincolo":"Declaratoria"},"geometry":{"type":"MultiPolygon","coordinates":[[[[12.563757029200397,44.061409445649268],[12.563911132204982,44.061632000665661],[12.563959509294758,44.06184343416345],[12.563778968152713,44.061873368751975],[12.56372218592208,44.061555010582865],[12.56363159414046,44.061566702271264],[12.563655052566126,44.061620609680979],[12.563679880194966,44.061719879600524],[12.563686319067392,44.061752870909707],[12.563771289686041,44.062419772872666],[12.563838005514031,44.062672011122437],[12.563866456740113,44.062708347982699],[12.563927579055276,44.062723039459506],[12.563944942151231,44.06271570916541],[12.563971448309129,44.06270013501549],[12.563979575834628,44.062682884314874],[12.564090360908398,44.062212317133998],[12.564134499423274,44.062016438140311],[12.564127854028161,44.061977520627423],[12.564035295780483,44.061744004865353],[12.564027202310116,44.061744779832786],[12.564014427943382,44.061714813251754],[12.563967054649071,44.061727384205405],[12.563926087456647,44.061670984513569],[12.563970467806977,44.061648703288526],[12.563776263603868,44.061402139761185],[12.563757029200397,44.061409445649268]]]]}},{"type":"Feature","properties":{"gid":"102","id_archeo":"208","codice":"208_RN","nome":"Murature romane pertinenti al lato nord della cinta muraria urbana, seconda metà del III sec. D.C.","titolo":"Presenza di ruderi riferibili alla cinta difensiva urbana di età tardoimperiale (III secolo d. C.)","tipo_propr":"Privata","comuni":"RIMINI","sigla_pro":"RN","localita":null,"tipologie":"Fortificazione - Epoca Età Romana","provvedime":"Decreto Ministeriale (06/06/1995)","data_ultim":"1995-06-06","ultimo_pro":"Decreto Ministeriale","rif_legge_":"L. 1089/1939","tutela":"Diretto","vincolo":"Diretto"},"geometry":{"type":"MultiPolygon","coordinates":[[[[12.568979760537536,44.061960142929927],[12.568974750489463,44.061953088603929],[12.568959426668021,44.061931007550776],[12.568952415442993,44.061922025359024],[12.568876239995731,44.061952534826247],[12.568800458872948,44.061977190154217],[12.56880144476499,44.061978470088363],[12.568615364556999,44.062050819271157],[12.568612407518682,44.062053776374974],[12.568646905628334,44.062076235416725],[12.568656196022969,44.062085375007413],[12.568785205766886,44.062033381355441],[12.568864989279518,44.062007289172506],[12.568979760537536,44.061960142929927]]]]}},{"type":"Feature","properties":{"gid":"103","id_archeo":"110","codice":"110_PR","nome":"Necropoli altomedievale","titolo":"Nel 1977, nel corso di escavazioni nella cava di argilla della fornace, vennero casualmente in luce alcune sepolture alla cappuccina. Lo scavo sistematico della necropoli, condotto nel 1979 dalla Soprintendenza, ha consentito di individuare una sessantin","tipo_propr":"Privata","comuni":"COLLECCHIO","sigla_pro":"PR","localita":null,"tipologie":"Sepoltura-e - Epoca Età Altomedievale","provvedime":"Decreto Ministeriale (10/07/1980)","data_ultim":"1980-07-10","ultimo_pro":"Decreto Ministeriale","rif_legge_":"L. 1089/1939","tutela":"Diretto","vincolo":"Diretto"},"geometry":{"type":"MultiPolygon","coordinates":[[[[10.200416641158517,44.75202284347268],[10.20029222977376,44.751664495204345],[10.19998128519655,44.751724967166346],[10.200106937918282,44.75207849738937],[10.200416641158517,44.75202284347268]]]]}},{"type":"Feature","properties":{"gid":"104","id_archeo":"211","codice":"211_RN","nome":"Necropoli dell'età del Ferro","titolo":"Necropoli villanoviana che ha consentito il rinvenimento di oltre duemila tombe con ricchi corredi","tipo_propr":"Privata","comuni":"VERUCCHIO","sigla_pro":"RN","localita":"Lavatoio","tipologie":"Sepoltura-e - Epoca Età del Ferro","provvedime":"Decreto Ministeriale (09/08/1988)","data_ultim":"1988-08-09","ultimo_pro":"Decreto Ministeriale","rif_legge_":"L. 1089/1939","tutela":"Diretto","vincolo":"Diretto"},"geometry":{"type":"MultiPolygon","coordinates":[[[[12.419174092525912,43.978157410047714],[12.419219431971536,43.978084012036803],[12.419313492085589,43.978116502789639],[12.419554485408579,43.978112055465033],[12.419849982592098,43.978105407335327],[12.420084455861907,43.978098795540859],[12.42008852558947,43.977906897726328],[12.420091515272569,43.977674511046565],[12.420092026530744,43.977668004767295],[12.420199629520257,43.977494475924651],[12.420271868343328,43.977375915021454],[12.420345593626667,43.977252637107398],[12.420452943830258,43.977181026354558],[12.420244434333542,43.977175346362166],[12.420159919888381,43.977173575685086],[12.420253294821428,43.977119318009315],[12.420283268395474,43.977100504379301],[12.420327687553026,43.977066880494782],[12.420387528044145,43.976998548109471],[12.420443387938541,43.976932756717886],[12.420508284417568,43.976881035811104],[12.420622063153978,43.97678919218361],[12.420634039313683,43.976776535538498],[12.420660447977422,43.976732792095362],[12.420767310180217,43.976674186589996],[12.420867686923952,43.976619223408832],[12.420961773349655,43.976666512483298],[12.421156248601434,43.976645819756335],[12.421229700572349,43.97662843942399],[12.421367125814696,43.976596213443919],[12.421348505319889,43.976544897968537],[12.421269520104117,43.976322665873042],[12.421199091485155,43.976129346034988],[12.421168915951867,43.976049856288846],[12.421084377189315,43.975805589809944],[12.421011419714013,43.975601434344007],[12.420947541214842,43.975428345164907],[12.420820598745925,43.975445753064513],[12.420776651617127,43.975468910836042],[12.420840297793994,43.975537539534784],[12.420843331135215,43.975556696432527],[12.420841410896465,43.975582717822654],[12.420840442593436,43.975597538312819],[12.420835966890245,43.975617055314373],[12.420829014154524,43.975634035765061],[12.420819062060854,43.97565392396433],[12.420803587196678,43.975670556661342],[12.420787119397669,43.975686831997777],[12.420759157627653,43.975703109715219],[12.420730189915199,43.975716851805245],[12.420691236934285,43.975731685397953],[12.420657257934081,43.975738924649676],[12.420614258923166,43.97574149173478],[12.42055874649712,43.975737168636691],[12.420472211255797,43.975717336274052],[12.420410583773036,43.975656281173741],[12.420199312962934,43.975765162406965],[12.419936634515594,43.975898648616017],[12.419773818535475,43.975982562033174],[12.419595028757886,43.976073354745459],[12.419382778936839,43.976180436244341],[12.419264404572152,43.976242644329339],[12.419061161879982,43.97635115690219],[12.418952777347192,43.976406502422741],[12.41882099515078,43.976502691825743],[12.418806026622017,43.976515347882774],[12.418724647485844,43.976578995000203],[12.418675801340742,43.976642990995735],[12.418640945575838,43.976710943233023],[12.418610570266216,43.976769866579431],[12.418590733012342,43.976840357860226],[12.418578816446873,43.976883360668921],[12.418576331086957,43.976889142834104],[12.418567104014569,43.977006967691629],[12.418559379724831,43.977144661552913],[12.41855452294732,43.977204657091029],[12.418558273656174,43.977324650008754],[12.418562109911598,43.977472827868034],[12.418569516826542,43.977665804327657],[12.418577452157486,43.977867110476915],[12.418583295051619,43.978020701869816],[12.418590139279836,43.978182608793645],[12.418589758753484,43.978228507035567],[12.418594911696564,43.978309098058382],[12.41859700406151,43.978353553817612],[12.418610161119537,43.9784178712573],[12.418633284204107,43.978475327198311],[12.418668967739594,43.978560234308269],[12.418672994536669,43.978567829021664],[12.418908986570163,43.978565918576798],[12.419016602711009,43.97839708987523],[12.419089358873856,43.978282484420468],[12.419174092525912,43.978157410047714]]]]}},{"type":"Feature","properties":{"gid":"105","id_archeo":"212","codice":"212_RN","nome":"Necropoli dell'età del ferro","titolo":"Necropoli villanoviana di Verucchio. Rinvenimento di oltre duemila tombe con ricchi corredi","tipo_propr":"Privata","comuni":"VERUCCHIO","sigla_pro":"RN","localita":"Le Pegge","tipologie":"Sepoltura-e - Epoca Età del Ferro","provvedime":"Decreto Ministeriale (19/03/1988)","data_ultim":"1988-03-19","ultimo_pro":"Decreto Ministeriale","rif_legge_":"L. 1089/1939","tutela":"Diretto","vincolo":"Diretto"},"geometry":{"type":"MultiPolygon","coordinates":[[[[12.430460682790082,43.979381348578421],[12.430159155584374,43.979224203131871],[12.430070109282335,43.979253959467307],[12.429893508582312,43.979309510920487],[12.429869983636401,43.979388262378954],[12.429844236572887,43.979490109541452],[12.429805969096368,43.979629541150629],[12.430085247089632,43.979762310654898],[12.430220337260209,43.979826014014108],[12.430386283312137,43.979755387660667],[12.430532779284082,43.979686696098874],[12.430615718748987,43.97964723798809],[12.430689123702082,43.979606752017339],[12.430712441379711,43.979594707695782],[12.430763815617583,43.979546421354009],[12.430676313492569,43.979497213996552],[12.430460682790082,43.979381348578421]]],[[[12.430121098969401,43.981079688837248],[12.429961901681725,43.980966375719767],[12.42981471483346,43.980853340642874],[12.429752199428924,43.980802886552233],[12.429734929667928,43.980778837130927],[12.429699882957133,43.980731455728446],[12.429663365605396,43.980684082497461],[12.429623221512319,43.980626996284897],[12.429602407457352,43.980556806425923],[12.429579292143211,43.980462477439545],[12.429566197392329,43.980412437751646],[12.429556180575043,43.980367779217403],[12.429554689407603,43.980327410867119],[12.429551112073595,43.980278750689003],[12.429566723131352,43.980164343306285],[12.429601081984172,43.979949937638885],[12.429624535927243,43.979782115564355],[12.429644168050823,43.97967128744763],[12.429671428326431,43.979612346786375],[12.429700898286962,43.979529230462809],[12.429756647455019,43.979390056784652],[12.429769271964796,43.979360769707505],[12.429778867166791,43.979244958593881],[12.429784229309536,43.979151529377482],[12.429732752852367,43.979065659970317],[12.429681277311477,43.9790209058838],[12.429648986048067,43.978992977534354],[12.429624750400018,43.97897005569174],[12.429539729385882,43.978919737585493],[12.429462277648199,43.97887442254509],[12.429428113289624,43.978856606444715],[12.42923841458682,43.978779175289411],[12.428959936255858,43.978668391267959],[12.428750190434766,43.978586394029854],[12.42852340889076,43.978498012070361],[12.428374389784745,43.978439793604593],[12.428314187371383,43.978417087597947],[12.428286105101353,43.978406803778569],[12.428268063831259,43.978401151829182],[12.428210033382557,43.978393207996817],[12.428179824135494,43.978413957362605],[12.428186918930797,43.978464402519883],[12.428219757034652,43.978495564842298],[12.428301041021273,43.9785693402265],[12.428332812061321,43.978594745822306],[12.428361180543583,43.978628824197514],[12.428430052031812,43.978708085877692],[12.428544079763251,43.978846210165486],[12.428571036354398,43.978887154956404],[12.428625584968991,43.97897985569535],[12.428678725186913,43.97908013398181],[12.428687863856098,43.979092688305123],[12.428694552981197,43.979109250406403],[12.428708007561248,43.979147377809824],[12.428721500166985,43.979189843375387],[12.42873413301313,43.979244218352541],[12.428736322117643,43.979259709268121],[12.428735058744994,43.979279544183939],[12.428728739393417,43.979334749591594],[12.428712733553041,43.979415282531924],[12.428683743706101,43.979537699020661],[12.428663818749701,43.97962616404191],[12.428643985448415,43.979679650774671],[12.428582661919613,43.979853471744825],[12.428572961938125,43.979877701347242],[12.428511721979595,43.979976158079751],[12.428429365323677,43.980104318864797],[12.428402851700778,43.980142701620608],[12.428385128398364,43.980204470436924],[12.428374364712765,43.980222574114634],[12.428332156102517,43.980285222467792],[12.428266831657099,43.980376851671835],[12.428239848439887,43.980415959707805],[12.428119205182321,43.980475121178848],[12.428108852709526,43.980486730529464],[12.428066793390293,43.980517999856666],[12.427845757650509,43.980661074728332],[12.427682787824912,43.980771345963262],[12.427724850665543,43.980780822933362],[12.427946144572157,43.980827049517401],[12.428273579316425,43.980896069302041],[12.428673270859054,43.980993112561002],[12.428767425736382,43.981015608601211],[12.428829824674347,43.981012338570046],[12.428846309325747,43.981013679877336],[12.42890824688898,43.981014735960315],[12.428948170849898,43.981011970031147],[12.428959217334132,43.981016949746838],[12.429039957624409,43.981085321275437],[12.429163966348327,43.981098619542841],[12.429202510119673,43.981106302126335],[12.429401202844932,43.981142581749658],[12.429487801210874,43.981160073673642],[12.429567424149649,43.981177243983183],[12.429609042836251,43.981190685788725],[12.429685242043949,43.981217024625444],[12.429700315945098,43.981222225353399],[12.429715325715518,43.98122501528001],[12.42977027965895,43.981226469805627],[12.429842786683034,43.981276137471276],[12.430032637290951,43.981406228841287],[12.430200801840272,43.981519137296829],[12.430311547424104,43.981592367833819],[12.430393189910385,43.981611682528012],[12.430422246070965,43.9816187135768],[12.430500673253283,43.981620749608311],[12.430742016874319,43.981631878722752],[12.430833937695439,43.981635273441519],[12.430899415662935,43.981638472690534],[12.430905671279046,43.98161895582593],[12.430868979420588,43.98159972170069],[12.430731515478818,43.981505742364661],[12.430592493274444,43.981408514712257],[12.430344217866397,43.981236247097286],[12.430121098969401,43.981079688837248]]]]}},{"type":"Feature","properties":{"gid":"106","id_archeo":"66","codice":"066_FE","nome":"Città etrusca di Spina","titolo":"L’abitato di Spina, con le sue necropoli di Valle Trebba e Valle Pega, era il principale porto dell’Etruria padana, ubicato alla confluenza di due paleoalvei, il cosiddetto “Po spinete” (il ramo del Po estinto, che nel IX sec. d.C. prese il nome","tipo_propr":"Pubblica","comuni":"COMACCHIO, OSTELLATO","sigla_pro":"FE, FE","localita":"Valle Lepri / Valle Mezzano","tipologie":"Struttura abitativa o insediamento - Epoca Età del Ferro","provvedime":"Decreto Ministeriale (11/11/1976)","data_ultim":"1976-11-11","ultimo_pro":"Decreto Ministeriale","rif_legge_":"L. 1089/1939","tutela":"Diretto","vincolo":"Area demaniale"},"geometry":{"type":"MultiPolygon","coordinates":[[[[12.098336630662875,44.690026630830459],[12.09813756527152,44.689971716428062],[12.098120120482774,44.689979670973536],[12.09806397527446,44.689989117925279],[12.097823549758594,44.690046402031108],[12.097776605248132,44.690054923773467],[12.097662840130184,44.690085442907758],[12.097623531649983,44.690119997969553],[12.096642507309845,44.690353253071763],[12.095123297297341,44.690714135816016],[12.093292890846968,44.691146579206546],[12.092063089946654,44.69144017591357],[12.091886299333799,44.691482381214676],[12.09179016212617,44.69150065097341],[12.091710315372138,44.691591143049237],[12.091373212913869,44.69200415511574],[12.091310373487005,44.692085345948676],[12.091324301146836,44.6924176727331],[12.092219484769124,44.692403675855893],[12.093504111567009,44.692386103541786],[12.094002749510864,44.692381200848438],[12.094448837483833,44.692200913874522],[12.094654072378793,44.691998444611919],[12.09499409025644,44.691659475024437],[12.095455746311758,44.691590467215995],[12.096319084818926,44.691455046465485],[12.096903709232281,44.691356768448649],[12.096963399650846,44.691345146346237],[12.097254287794238,44.691300671756757],[12.097790580904947,44.691219293181049],[12.098389121434778,44.691127894137431],[12.099465467806342,44.690966218837062],[12.100537511714824,44.690802309806436],[12.100632605133997,44.690649058232189],[12.100121713226436,44.690510489328915],[12.099673126939846,44.690382548456611],[12.098954019320599,44.690199150101044],[12.098918956988101,44.690183458165258],[12.098336630662875,44.690026630830459]]],[[[12.092582061490527,44.696420529676963],[12.092560704044645,44.695395504307534],[12.093903130316408,44.695379699992358],[12.093871718000607,44.694243655973516],[12.094340783369372,44.694236511395367],[12.094321452010732,44.693236285536379],[12.094311869825326,44.692814892633159],[12.093123153688945,44.692829737805319],[12.091101210995925,44.692853825271889],[12.091117777268254,44.693264613822322],[12.091130709334239,44.693718764371127],[12.091593338363827,44.693711220429826],[12.09161615625476,44.694527594687088],[12.091651108256178,44.695762880113527],[12.091675638803169,44.696433672733555],[12.092582061490527,44.696420529676963]]]]}},{"type":"Feature","properties":{"gid":"107","id_archeo":"62","codice":"062_FE","nome":"Necropoli romana","titolo":"Resti di una necropoli di età tardo-romana sono stati riportati in luce a più riprese e in maniera del tutto parziale nel corso degli anni Sessanta e Ottanta del secolo scorso, in seguito a ricognizioni di superficie e a qualche saggio di scavo. Le sep","tipo_propr":"Pubblica","comuni":"COMACCHIO","sigla_pro":"FE","localita":"Valle Pega, loc. Baro Zavelea","tipologie":"Sepoltura-e - Epoca Età Romana","provvedime":"Decreto Ministeriale (15/06/1993)","data_ultim":"1993-06-15","ultimo_pro":"Decreto Ministeriale","rif_legge_":"L. 1089/1939","tutela":"Diretto","vincolo":"Diretto"},"geometry":{"type":"MultiPolygon","coordinates":[[[[12.1110064333268,44.670383437124379],[12.111555333789465,44.669337758777971],[12.11199205468761,44.669456623680276],[12.112711857063893,44.668102709976594],[12.113074417256295,44.667422865597111],[12.112615962491221,44.667302599709693],[12.112334355408969,44.667228736633533],[12.111803839750129,44.667820377244887],[12.111648035345379,44.667997953256211],[12.111318339712218,44.668427162528594],[12.110419338770996,44.669648899289101],[12.11023693228624,44.669934367819621],[12.110236101461386,44.66999636033627],[12.11025210201068,44.670056516501901],[12.110300593411077,44.670122682095624],[12.110370675037792,44.670161855922309],[12.110493419787186,44.670207515115983],[12.1110064333268,44.670383437124379]]]]}},{"type":"Feature","properties":{"gid":"108","id_archeo":"198","codice":"198_RE","nome":"Necropoli romana","titolo":"Ampia porzione della necropoli orientale della città romana di Regium Lepidi (Reggio Emilia), costituita da quasi 400 tombe anche monumentali, rinvenute già a partire dal 1500. Si tratta di sepolture databili tra il I sec. a.C. e il III sec. d.C., sia","tipo_propr":"Privata","comuni":"REGGIO NELL`EMILIA","sigla_pro":"RE","localita":"San Lazzaro","tipologie":"Sepoltura-e - Epoca Età Romana","provvedime":"Decreto Direzione Regionale (24/02/2014), Decreto Ministeriale (29/10/1991)","data_ultim":"2014-02-24","ultimo_pro":"Decreto Direzione Regionale","rif_legge_":"D. Lgs. 42/2004","tutela":"Diretto","vincolo":"Diretto"},"geometry":{"type":"MultiPolygon","coordinates":[[[[10.666155241591754,44.686171349705447],[10.66607972203143,44.685955263525393],[10.665911846209626,44.685982373488542],[10.665501332923279,44.686053646502579],[10.665281318343393,44.685804202931443],[10.665167991549405,44.685675685505537],[10.664999749107164,44.685485080162813],[10.664960179001616,44.685427172764463],[10.664897842164191,44.685437991205724],[10.664889153452151,44.68543950424479],[10.664741585008541,44.685467459821972],[10.664778153249832,44.685560814824107],[10.665010185536508,44.686199803350789],[10.664857141528861,44.686226980196366],[10.664514851605251,44.68628976514745],[10.664536172929871,44.68634907522393],[10.664583365438235,44.68648819885027],[10.66463839634932,44.686596555981524],[10.664681992434474,44.686683690816032],[10.664703704292684,44.686671617463176],[10.664789553400793,44.686640892679598],[10.666095025416203,44.686192051173869],[10.666155241591754,44.686171349705447]]]]}},{"type":"Feature","properties":{"gid":"109","id_archeo":"77","codice":"077_FE","nome":"Necropoli romana","titolo":"La necropoli di Voghenza è una importante area sepolcrale composta da una settantina di sepolture e tombe ad inumazione e cremazione di varia tipologia, raggruppate attorno ai monumenti principali o racchiuse da recinti funerari a carattere familiare in","tipo_propr":"Privata","comuni":"VOGHIERA","sigla_pro":"FE","localita":"Voghenza, loc. Podere Setta","tipologie":"Sepoltura-e - Epoca Età Romana","provvedime":"Decreto Ministeriale (05/04/1993)","data_ultim":"1993-04-05","ultimo_pro":"Decreto Ministeriale","rif_legge_":"L. 1089/1939","tutela":"Diretto","vincolo":"Diretto"},"geometry":{"type":"MultiPolygon","coordinates":[[[[11.754509949555626,44.764890801298073],[11.754352109487593,44.765033611623466],[11.754197593114247,44.765170337160484],[11.754139553709342,44.765223418646492],[11.754070025229245,44.765287066709909],[11.753947963558796,44.765399225227213],[11.753532237753097,44.7657701489712],[11.753611445903772,44.765850236433735],[11.753928525219788,44.765539684364228],[11.754605502166619,44.766076252861033],[11.754125983219671,44.766422631159664],[11.754191349832007,44.766489828418528],[11.754256884411335,44.766456154300649],[11.75428270381618,44.766440290637298],[11.754340047098603,44.766399648636103],[11.754488024581098,44.766281597874681],[11.754839671096196,44.766009232370301],[11.755209589928079,44.765759784672248],[11.755436491163612,44.765603278650843],[11.755480510498995,44.765574768468035],[11.754998353002431,44.765233417172823],[11.754509949555626,44.764890801298073]]]]}},{"type":"Feature","properties":{"gid":"110","id_archeo":"49","codice":"049_FC","nome":"Necropoli principale della città umbro-romana di Sarsina","titolo":"I primi scavi nella necropoli di Sarsina furono effettuati fra il 1927 e il 1942, con anche al restauro dei monumenti funerari rinvenuti, fra cui quello di Aulo Murcio Obulacco, che venne rimontato negli anni Trenta del Novecento all’interno di un giar","tipo_propr":"Privata","comuni":"SARSINA","sigla_pro":"FC","localita":"Pian di Bezzo","tipologie":"Sepoltura-e - Epoca Età Romana, Sepoltura-e - Epoca Età del Ferro","provvedime":"Decreto Ministeriale (01/06/1982)","data_ultim":"1982-06-01","ultimo_pro":"Decreto Ministeriale","rif_legge_":"L. 1089/1939","tutela":"Diretto","vincolo":"Diretto"},"geometry":{"type":"MultiPolygon","coordinates":[[[[12.15317700423534,43.92060573067689],[12.153478379922211,43.920574581658059],[12.153481703886392,43.920586094488073],[12.153616823899004,43.920602932467943],[12.153723375940475,43.920531755587028],[12.153828883852134,43.92045661919196],[12.153950130247562,43.920438630005947],[12.154086602907398,43.920418401326756],[12.154194468986507,43.920388573791868],[12.154301752238656,43.920348670069536],[12.154345459050154,43.920331274975823],[12.154361756420785,43.92031396220262],[12.154428038452327,43.920254773098307],[12.154494576791187,43.920162518392651],[12.154563506939404,43.920058736915749],[12.154568877598177,43.919982487366617],[12.154587395694024,43.919929218813962],[12.15459648496485,43.919881360506544],[12.154605560087209,43.919831350904175],[12.15462180453809,43.91974357423851],[12.1546773699827,43.919651334632199],[12.154723653279213,43.919579995110858],[12.154768445327438,43.919512252915162],[12.154794398859737,43.919454277370598],[12.154632491965703,43.919386837925828],[12.154630492836905,43.919364818189806],[12.154542872529529,43.919364116052492],[12.15442134238325,43.919358562250309],[12.154404885139446,43.919354713740177],[12.154261676112109,43.919319347305319],[12.154085865498349,43.919310458774135],[12.153877694163439,43.919354041568646],[12.153866715789469,43.919350167621843],[12.153431627211045,43.919554878067324],[12.153263504011177,43.919671617725342],[12.153088504100008,43.919798000113403],[12.153012709071307,43.919836051479315],[12.152838826475705,43.919922565001499],[12.152710056716719,43.919939824531603],[12.152675441655399,43.920014000921533],[12.152460473828745,43.92002379210593],[12.152399562797337,43.920057146587794],[12.152288478270163,43.920050122617226],[12.152101701274942,43.920039508274478],[12.151980718849456,43.920038213097882],[12.151963318563249,43.920041502539192],[12.151891253914526,43.920052117476871],[12.151863166721729,43.920083916977667],[12.151829488755965,43.920099719746268],[12.151865041847088,43.920121992270289],[12.151787013615573,43.920186392819531],[12.151894140381199,43.920249326260937],[12.152209430873006,43.920419262123666],[12.152398137512341,43.920475080324771],[12.152498859739151,43.92054265549897],[12.152742948548815,43.920611068814722],[12.15293083992211,43.920631653484875],[12.15317700423534,43.92060573067689]]],[[[12.157688651319072,43.921520354676026],[12.157787089399609,43.921496654452191],[12.157802852299598,43.921537244297674],[12.157809016880433,43.921562398744875],[12.157844882127137,43.921562279675165],[12.157959465718106,43.921563340548552],[12.158117118226889,43.921531906631181],[12.158178087046917,43.921491444257057],[12.158191743190951,43.921455081977207],[12.158134950459017,43.921393057414555],[12.158070135403282,43.921322071892824],[12.158012321511444,43.921253224349925],[12.157977585357227,43.921205507103572],[12.15789618327808,43.921115525291619],[12.157760179089662,43.921049804374896],[12.157741777128017,43.921053464521748],[12.157654504980698,43.920977518337487],[12.157667583597837,43.920930008568028],[12.157608647135287,43.920846058080215],[12.157524932226663,43.920778007910236],[12.157362030250821,43.920711662236705],[12.157226904291361,43.920695206983019],[12.157109048604935,43.920657477249435],[12.156805014866022,43.920443066629787],[12.156775832294516,43.920405413632942],[12.156769128508911,43.920375943670138],[12.156637821835695,43.919891314876885],[12.156426798502469,43.919721208511568],[12.156286924093337,43.919607679680809],[12.156197171859212,43.919532098041316],[12.156073369837646,43.91943324925667],[12.155915042343741,43.919379108898362],[12.155713228134571,43.919303888681853],[12.155557896495187,43.919250097126891],[12.155423641200867,43.919215654960894],[12.155298380710537,43.919185492396068],[12.155154142267785,43.919148562038416],[12.155140450056395,43.919180972710691],[12.15507480129221,43.919257043083746],[12.155027422733772,43.919314728692797],[12.154965056808896,43.919365275196988],[12.154842808522428,43.919466704572585],[12.154755744766288,43.919607214949473],[12.154698657620498,43.919697290958581],[12.154663252445973,43.919755302663894],[12.154643159522584,43.919862154720569],[12.15463312388559,43.919916845343849],[12.154622779452717,43.919994897899876],[12.15461090067039,43.920069373721127],[12.154554294051412,43.920155124003934],[12.154477949622063,43.92026755507878],[12.154425073769342,43.920320233739375],[12.15439833919682,43.920342966616417],[12.15437455455694,43.920356714134918],[12.154339295349661,43.920372282258668],[12.154300041334315,43.920383909502227],[12.154294789468754,43.920385873227069],[12.154138612137396,43.920444476702471],[12.15412118385969,43.920444175107917],[12.154093344395294,43.920450022095039],[12.154053995508873,43.92045302713732],[12.153859488142322,43.920484213483938],[12.153699385505554,43.920586840740327],[12.153669673080742,43.920607441025908],[12.153800275591555,43.920621756781266],[12.154118833947756,43.920845100981737],[12.154163345973135,43.920869772028439],[12.154313912669775,43.920951633008777],[12.154386971582838,43.920994186898511],[12.154573166326024,43.92110864344815],[12.154766473112163,43.921176700474],[12.154903928358241,43.921238828732172],[12.155040875202779,43.921296991618931],[12.155228518308684,43.921340608643106],[12.155317109874542,43.921332775700833],[12.155566622936469,43.921390589684329],[12.155747564736117,43.92140617620494],[12.155975446958891,43.92143816402384],[12.156216299003837,43.921469747698374],[12.156572299922612,43.921513541032972],[12.156900221005793,43.921597695485879],[12.157134358143992,43.921663817826776],[12.157316667853237,43.921662870796553],[12.157576964534382,43.921634701930152],[12.157709374931652,43.921559834980407],[12.157688651319072,43.921520354676026]]],[[[12.158719547842063,43.921744960677998],[12.158571480159733,43.921541578955434],[12.158557374238219,43.921520056406273],[12.158449140361885,43.921374774835229],[12.158310627448378,43.921179618030536],[12.158161975879079,43.920962567584127],[12.158102049302409,43.920816417060024],[12.158056306099995,43.920700780822727],[12.158053501496793,43.920660516659396],[12.158050075466033,43.920476791279313],[12.158047673047568,43.920170085643242],[12.157985440118271,43.919919664828221],[12.157945825815611,43.919760510215738],[12.157921580232196,43.919653795083846],[12.157923018084622,43.919646607033812],[12.157605852188979,43.919663088887312],[12.157292678909513,43.919680647774605],[12.156739047783816,43.919713715739597],[12.156732501535762,43.919704398791943],[12.156666201295371,43.919890502932255],[12.156798426181552,43.920364708006709],[12.156836781234828,43.920428584666446],[12.157096785999435,43.920616880501385],[12.157124291236643,43.920632252744454],[12.157237678568098,43.920672158722468],[12.157366329893195,43.920689360265847],[12.157547671002973,43.920757455507648],[12.157554721008273,43.920765696132278],[12.157614867348791,43.920814394020852],[12.157636977178639,43.920838423110652],[12.157708308721242,43.92091441422275],[12.157730973512304,43.920945630214938],[12.157688775645907,43.920964461323905],[12.157729984494127,43.921009991942377],[12.157762258545819,43.92099874570291],[12.157776775302841,43.921008040118039],[12.157851401129287,43.921058497941516],[12.157913482306185,43.921098562420354],[12.158053623047834,43.921247337013973],[12.158147601765537,43.921354184139325],[12.158222599350781,43.921452103449809],[12.158209493128416,43.92149673313326],[12.158137200388458,43.921551976456861],[12.157973093762836,43.921585956734454],[12.157841080582619,43.921584576880058],[12.157812196557213,43.921585754189202],[12.15771605112101,43.921585713509351],[12.157586627406465,43.92165912040479],[12.157320852637023,43.921688746252485],[12.157220216540685,43.921687641006905],[12.157347523536961,43.921722462314889],[12.157522248321106,43.921771159426797],[12.157709361717435,43.921810825758392],[12.15795034496133,43.921859660586072],[12.158168359837493,43.921903539722841],[12.158660661083299,43.921985354984223],[12.158953346162685,43.922022151416144],[12.159199633176796,43.922049040902927],[12.158719547842063,43.921744960677998]]]]}},{"type":"Feature","properties":{"gid":"111","id_archeo":"30","codice":"030_BO","nome":"Necropoli villanoviana","titolo":"Nel 1965, durante la costruzione della strada che collega la frazione di Castelnuovo di Bisano con Quinzano, venne trovata fortuitamente una tomba maschile ad incinerazione entro dolio, caratterizzata da un consistente corredo di tipo villanoviano databi","tipo_propr":"Privata","comuni":"MONTERENZIO","sigla_pro":"BO","localita":"Castelnuovo di Bisano - Ca' Buganè","tipologie":"Sepoltura-e - Epoca Età del Ferro","provvedime":"Decreto Ministeriale (28/11/1987)","data_ultim":"1987-11-28","ultimo_pro":"Decreto Ministeriale","rif_legge_":"L. 1089/1939","tutela":"Diretto","vincolo":"Diretto"},"geometry":{"type":"MultiPolygon","coordinates":[[[[11.375218592425636,44.285819146358335],[11.374738407979777,44.285746316291331],[11.374582800476752,44.285691577555461],[11.37450167187173,44.285668778615737],[11.374392743615649,44.285578137993376],[11.374379953717044,44.285559318530183],[11.37436626355381,44.285543038529568],[11.374280568884064,44.285382053844657],[11.374263065255667,44.285271145377529],[11.37424252482754,44.28520927447159],[11.374222898902335,44.284871543535495],[11.374215289219665,44.284632951755498],[11.374190205561986,44.284557851446287],[11.374167707561124,44.284487761323582],[11.373095581052553,44.284514418602321],[11.373157502464077,44.284607061713174],[11.373026267808799,44.284659485566642],[11.372515877233031,44.284832146190794],[11.372664623763237,44.284940686196883],[11.372957980926186,44.285154610662168],[11.37337964803646,44.285467415488419],[11.373501206317977,44.285548071518697],[11.373640336149506,44.285567143932923],[11.373718764885909,44.285572714576283],[11.373764410360604,44.285585809158384],[11.373834663987747,44.2856124359201],[11.373855395487539,44.285629289710933],[11.373810953252269,44.285646058906856],[11.373793911330978,44.285845191779444],[11.373634178234166,44.285837351314406],[11.373682054917413,44.285930703087516],[11.373747282542409,44.286006768929667],[11.373818290556761,44.286052105496339],[11.373940346379181,44.286095299704805],[11.374059846494616,44.286149710234135],[11.374187333432426,44.286178386947299],[11.374494313735308,44.286232497125297],[11.374692158432969,44.286265470862837],[11.37475776690771,44.286301196358693],[11.37503267554035,44.286380459718266],[11.375095108488528,44.286312540682864],[11.375100307811628,44.286267419256255],[11.375291761139776,44.285967787358835],[11.375353788768098,44.285840099080751],[11.375218592425636,44.285819146358335]]],[[[11.37424182796844,44.286634947402533],[11.374506219961166,44.286527896116958],[11.374624739637335,44.286458450098934],[11.374699005041721,44.286410450958961],[11.374746992720805,44.286332389674243],[11.374656571484342,44.286302942229611],[11.374574324189329,44.286277285778191],[11.374411832213564,44.286250778324053],[11.374117482340361,44.286211529578623],[11.374030095954287,44.286182738704738],[11.373916141184017,44.286141536699759],[11.373793476375702,44.286083230695148],[11.37371615317795,44.286030463259138],[11.373594582167309,44.285899753038613],[11.373595120069517,44.28588821847184],[11.373526943832399,44.285838501585104],[11.3734601463745,44.285798118736146],[11.373223655560423,44.285728189530587],[11.373188204302322,44.285717709545906],[11.373159993231846,44.285739182396917],[11.373017180190873,44.285653566439024],[11.373106488917754,44.285580768301223],[11.373072721776229,44.285538978070349],[11.373057218588174,44.285502569697492],[11.373060343404839,44.285455690968277],[11.373096599337842,44.285409923748205],[11.373173710649967,44.285357905246975],[11.373117846560437,44.285315134162836],[11.372788672435233,44.285083229404584],[11.372571823401628,44.28492677110318],[11.372368813957019,44.285089078367832],[11.372269948790448,44.28519844529206],[11.372123937486547,44.285357046403391],[11.372051701538087,44.285430569193515],[11.372121937594184,44.285481684570669],[11.37180267786934,44.285769923685876],[11.371420775358855,44.28612104186044],[11.371856498049054,44.286409433093986],[11.372398367927998,44.286569938915349],[11.37261323075956,44.286577355033565],[11.372866103951841,44.286582539915976],[11.373135276167654,44.286668769147319],[11.373647893981419,44.286625697452713],[11.373875326777057,44.286696228320281],[11.37403030617803,44.286859732983196],[11.374133790769255,44.286690851011187],[11.37424182796844,44.286634947402533]]]]}},{"type":"Feature","properties":{"gid":"112","id_archeo":"79","codice":"079_MO","nome":"Necropoli villanoviana","titolo":"Vasta necropoli villanoviana con più nuclei di sepolture riferibili ad abitato villanoviano. Gli scavi condotti nell’ autunno 1988 nel podere Canale, hanno posto in luce almeno quaranta tombe ad incinerazione riferibili al \"VillanovianoII-III(VII", "tipo_propr": "Privata", "comuni": "CASTELFRANCOEMILIA", "sigla_pro": "MO", "localita": "Galoppatoio", "tipologie": "Sepoltura-e-EpocaEtàdelFerro", "provvedime": "DecretoMinisteriale(08/05/1990)", "data_ultim": "1990-05-08", "ultimo_pro": "DecretoMinisteriale", "rif_legge_": "L.1089/1939", "tutela": "Diretto", "vincolo": "Diretto" }, "geometry": { "type": "MultiPolygon", "coordinates": [ [ [ [ 11.079799683376988, 44.59154008679598 ], [ 11.079227503585773, 44.590812126057841 ], [ 11.078016223628968, 44.591248005632409 ], [ 11.07798617554865, 44.591258818118604 ], [ 11.077611882415406, 44.591387839444337 ], [ 11.077104944083246, 44.591562575077006 ], [ 11.076857268156921, 44.591647948433483 ], [ 11.076801338274784, 44.591667222421783 ], [ 11.075465763893867, 44.592125580326432 ], [ 11.076408310902053, 44.593355468837231 ], [ 11.076533554782532, 44.593328965940408 ], [ 11.076688192581154, 44.593291188551987 ], [ 11.076804074902462, 44.593255835326296 ], [ 11.076932783153804, 44.593195051249495 ], [ 11.076978706971488, 44.593179902220641 ], [ 11.077052771377831, 44.593161792641027 ], [ 11.077234940662432, 44.593133657622658 ], [ 11.077489795394499, 44.593059691518917 ], [ 11.077623048689983, 44.59299919170558 ], [ 11.077687918273456, 44.592977260347773 ], [ 11.07787517487921, 44.592950489851283 ], [ 11.077940057146893, 44.592928918211342 ], [ 11.078114146786199, 44.592836058152898 ], [ 11.078151688450916, 44.592827164390599 ], [ 11.078465788144966, 44.592776756463124 ], [ 11.078661446765437, 44.59270336178151 ], [ 11.078773809361699, 44.592661218750713 ], [ 11.078843843224989, 44.592643162674321 ], [ 11.079037582334344, 44.592598267581074 ], [ 11.079071675672116, 44.592591956983334 ], [ 11.07931718815879, 44.592525700927204 ], [ 11.079624649913745, 44.59242422369438 ], [ 11.079728982945786, 44.592406703299353 ], [ 11.07986734455605, 44.592380712599692 ], [ 11.079963915182843, 44.592372677856964 ], [ 11.079411022436375, 44.591672769747383 ], [ 11.079799683376988, 44.59154008679598 ] ] ], [ [ [ 11.076662841144673, 44.593905129199655 ], [ 11.076348886537525, 44.593439361625315 ], [ 11.076175266726095, 44.593476214397207 ], [ 11.076032163089108, 44.593503230678373 ], [ 11.075851700747277, 44.593540054329225 ], [ 11.075786235041784, 44.593553415636983 ], [ 11.075567466461131, 44.593597858016302 ], [ 11.075544826526452, 44.5936024556338 ], [ 11.075239065345212, 44.593661460021373 ], [ 11.074936777823408, 44.593718257919896 ], [ 11.075154720987065, 44.594059904284308 ], [ 11.074839579067621, 44.594160533671364 ], [ 11.074562237967873, 44.594241849622151 ], [ 11.074733872430661, 44.594518891465512 ], [ 11.075274131163173, 44.594346734717917 ], [ 11.075634770712581, 44.594230270213188 ], [ 11.075932941848325, 44.594136383826218 ], [ 11.076350208677958, 44.594005726121807 ], [ 11.076662841144673, 44.593905129199655 ] ] ], [ [ [ 11.081243527432099, 44.593666968493551 ], [ 11.080599136423043, 44.592609183282008 ], [ 11.080145824432121, 44.592756974003343 ], [ 11.080097142921257, 44.592772841209545 ], [ 11.079521022580222, 44.592961388783429 ], [ 11.079496548061153, 44.592973168671698 ], [ 11.079434848281975, 44.592989290829308 ], [ 11.0792827341654, 44.59303559770828 ], [ 11.07927700842056, 44.593027028323931 ], [ 11.079191313274706, 44.593052263977697 ], [ 11.079197273479831, 44.593061614093308 ], [ 11.079217709353046, 44.59310005064971 ], [ 11.079133573206416, 44.593133955876148 ], [ 11.078430377984787, 44.593368843365155 ], [ 11.078340400857433, 44.593398245214296 ], [ 11.078111740720576, 44.593472978515628 ], [ 11.077834413005725, 44.593553422750375 ], [ 11.077725377185372, 44.593585052619687 ], [ 11.077692107845262, 44.593594705666426 ], [ 11.077355192146737, 44.593693680096081 ], [ 11.077004785207917, 44.593796625342414 ], [ 11.07667752817736, 44.593898677493662 ], [ 11.077359639741642, 44.594928723160379 ], [ 11.077396520929032, 44.594984658198186 ], [ 11.078010676217675, 44.595916196443177 ], [ 11.080410650598587, 44.595181190809697 ], [ 11.080459247083907, 44.595168111238145 ], [ 11.080508658475935, 44.595154813329046 ], [ 11.080506713973687, 44.595151766399262 ], [ 11.080485694222487, 44.595117840978418 ], [ 11.080565235684068, 44.595086424847409 ], [ 11.080574751133632, 44.595082666643272 ], [ 11.081123473649022, 44.594901185128052 ], [ 11.080498630995642, 44.593913819106625 ], [ 11.081243527432099, 44.593666968493551 ] ] ] ] } },{"type":"Feature","properties":{"gid":"113","id_archeo":"215","codice":"215_RN","nome":"Necropoli villanoviana","titolo":"Necropoli villanoviana di Verucchio. Rinvenimento di oltre duemila tombe con ricchi corredi","tipo_propr":"Privata","comuni":"VERUCCHIO","sigla_pro":"RN","localita":null,"tipologie":"Sepoltura-e - Epoca Età del Ferro","provvedime":"Decreto Ministeriale (09/08/1988)","data_ultim":"1988-08-09","ultimo_pro":"Decreto Ministeriale","rif_legge_":"L. 1089/1939","tutela":"Diretto","vincolo":"Diretto"},"geometry":{"type":"MultiPolygon","coordinates":[[[[12.422334130229043,43.984895747633232],[12.422118225495479,43.984942112378199],[12.421938298837016,43.984982311612569],[12.421856820365141,43.985000788326346],[12.421797359924273,43.985019244047145],[12.421753929659134,43.985055404618372],[12.421733050099018,43.98510709395935],[12.421740622591438,43.985138169344303],[12.42177769083502,43.985173933103688],[12.421812273125797,43.985200291528805],[12.421880333785673,43.985230993944114],[12.421937898844174,43.985252639055723],[12.42204199195417,43.985291983819458],[12.422100559487614,43.985314364013547],[12.42218458630029,43.98532587976306],[12.422222111795334,43.985331650641619],[12.422310112539229,43.985328363719809],[12.4224121100234,43.985324332922211],[12.422438616576553,43.985323222984142],[12.422470610362859,43.985321048223462],[12.422708611119161,43.985306123550643],[12.422888102292339,43.985296275280909],[12.422955106111228,43.985291907058446],[12.423012588246246,43.985286095849986],[12.42316457871871,43.98527048194785],[12.423288565820176,43.98525921884756],[12.423323065519849,43.985257040710522],[12.423412544145101,43.985244336786288],[12.423531522725629,43.985227290874107],[12.423585002354018,43.9852193127481],[12.423676484249306,43.98520372167706],[12.423743467038634,43.985193573888743],[12.423807956275414,43.985180178861341],[12.423855924775468,43.985170034236148],[12.423962882774601,43.985144309756194],[12.424034366905039,43.985128751164225],[12.424059339746544,43.985121141893877],[12.424071341795695,43.985117153728787],[12.424103326616814,43.985108109714453],[12.424058671076578,43.985043441724926],[12.42398690335699,43.984935770785846],[12.423939749871446,43.984861706698432],[12.423889562200262,43.984783664394925],[12.423840381064409,43.984707077321161],[12.423802745804222,43.984647825174932],[12.423772637707462,43.984601941306465],[12.423758082421696,43.984578457749699],[12.423725497849359,43.984539805310007],[12.423679406585704,43.984503691667335],[12.423634307969422,43.984464676368908],[12.423561202388884,43.984423872382365],[12.4235342135033,43.984424609928425],[12.42351071609075,43.984427520425839],[12.423458863877283,43.98449475954191],[12.423446384283727,43.984507782677639],[12.423406965777863,43.984547550655947],[12.423375569101731,43.984584800323915],[12.423305628780009,43.984627833474264],[12.423241229006445,43.984669431013003],[12.423166795635069,43.984700904326239],[12.42311834497327,43.984720434940549],[12.422988890545321,43.984749777216607],[12.422811962301585,43.984789626823158],[12.422656016394209,43.984825110809098],[12.42248159364163,43.984864956790702],[12.422396117037916,43.984883067637419],[12.422334130229043,43.984895747633232]]]]}},{"type":"Feature","properties":{"gid":"114","id_archeo":"78","codice":"078_FE","nome":"Nucleo insediativo di epoca romana","titolo":"La zona è interessata da affioramenti di materiale archeologico riscontrabile per una estensione di circa m 80x15, riconducibile ai resti di un nucleo insediativo di carattere agricolo ed è caratterizzata prevalentemente da una dispersione di laterizi","tipo_propr":"Privata","comuni":"VOGHIERA","sigla_pro":"FE","localita":"loc. Podere San Donato","tipologie":"Struttura abitativa o insediamento - Epoca Età Romana","provvedime":"Decreto Ministeriale (28/12/1994)","data_ultim":"1994-12-28","ultimo_pro":"Decreto Ministeriale","rif_legge_":"L. 1089/1939","tutela":"Diretto","vincolo":"Diretto"},"geometry":{"type":"MultiPolygon","coordinates":[[[[11.785247558626747,44.756750797802567],[11.78500231775468,44.756621207225486],[11.78423205303833,44.757425995288223],[11.784469758221956,44.757548887592741],[11.784483326879064,44.757535000343523],[11.785247558626747,44.756750797802567]]]]}},{"type":"Feature","properties":{"gid":"115","id_archeo":"71","codice":"071_FE","nome":"Nucleo insediativo di età romana","titolo":"Nucleo insediativo di epoca romana in un’area attigua al Canal Bianco e al Po di Goro: saggi di scavo individuarono una struttura a pianta quadrangolare con copertura in laterizi, poggiante su pali di fondazione in legno. Nelle vicinanze di tale strutt","tipo_propr":"Privata","comuni":"MESOLA","sigla_pro":"FE","localita":"Ariano Ferrarese, loc. Ponte Stradella","tipologie":"Struttura abitativa o insediamento - Epoca Età Romana","provvedime":"Decreto Ministeriale (17/02/1996)","data_ultim":"1996-02-17","ultimo_pro":"Decreto Ministeriale","rif_legge_":"L. 1089/1939","tutela":"Diretto","vincolo":"Diretto"},"geometry":{"type":"MultiPolygon","coordinates":[[[[12.141023320119837,44.925398785790435],[12.141025315152321,44.925398669791043],[12.141027854716576,44.925428250005162],[12.141429066819521,44.925367987865776],[12.141722832078123,44.925324069574479],[12.141629140426051,44.924286576150564],[12.141581910673541,44.92379466544952],[12.141558536545777,44.923529313460747],[12.140855560126802,44.923460186379309],[12.140854930776097,44.923451947084132],[12.140735176230825,44.923425862510399],[12.140667413425351,44.923411461978048],[12.1406245588276,44.923402127767119],[12.140578986296108,44.923392211247631],[12.140130270265841,44.923307246004448],[12.139826263197904,44.923254042068358],[12.139687840385418,44.923230648720406],[12.139614772192759,44.923216537620718],[12.139549662265035,44.923204304866232],[12.139131276952023,44.923121093379294],[12.13901360707313,44.923095336701671],[12.138835002429341,44.923056529702286],[12.138688405298112,44.923022395817966],[12.138466449512794,44.922966984451378],[12.138100819687237,44.922858750752503],[12.137783418648587,44.922761737753945],[12.137573045183588,44.923006253861686],[12.137495219764711,44.923095955610421],[12.137324133408997,44.923294390323733],[12.13719815341304,44.923236336645147],[12.136621118838569,44.922945368598384],[12.136544685493977,44.922904585555138],[12.136329022065866,44.923266088874307],[12.136245537898501,44.92340919131842],[12.135934356875728,44.923943968237218],[12.135689433782694,44.924349528614101],[12.135987615347876,44.924518829594838],[12.136797810897255,44.924972397637873],[12.137348646034599,44.925279542718997],[12.137920996730291,44.925598676624965],[12.13826617632756,44.925791685836266],[12.138632357853451,44.925993820095819],[12.138787222323971,44.926080441381373],[12.139095694027848,44.925940588544755],[12.139391999695123,44.925806308794776],[12.139631607573397,44.925701899717119],[12.139887064221622,44.925617434049755],[12.140076903025676,44.925552606885383],[12.140429888830047,44.925476284307365],[12.140942988805561,44.925409999715335],[12.141023320119837,44.925398785790435]]]]}},{"type":"Feature","properties":{"gid":"116","id_archeo":"94","codice":"094_PC","nome":"Nucleo insediativo di età romana","titolo":"Strutture pertinenti a un nucleo insediativo di età romana, medievale e rinascimentale","tipo_propr":"Privata","comuni":"PIACENZA","sigla_pro":"PC","localita":null,"tipologie":"Struttura abitativa o insediamento - Epoca Età Medievale, Struttura abitativa o insediamento - Epoca Età Romana, Struttura abitativa o insediamento - Epoca Età Post-Medievale","provvedime":"Decreto Ministeriale (03/10/1997)","data_ultim":"1997-10-03","ultimo_pro":"Decreto Ministeriale","rif_legge_":"L. 1089/1939","tutela":"Diretto","vincolo":"Diretto"},"geometry":{"type":"MultiPolygon","coordinates":[[[[9.694033538960513,45.055354092853655],[9.693864290809396,45.05548873278962],[9.694244182962141,45.055735848967551],[9.69427727353751,45.055714403889333],[9.69451650552474,45.055567761505003],[9.694496884324673,45.055555215594119],[9.694388897215548,45.055476712269773],[9.694334455329795,45.055438183422226],[9.694196451204098,45.055343344508117],[9.694139991738149,45.055302838475789],[9.694123789256562,45.055290478753058],[9.694033538960513,45.055354092853655]]]]}},{"type":"Feature","properties":{"gid":"117","id_archeo":"190","codice":"190_RE","nome":"Pars rustica di villa romana  di probabile prima età imperiale","titolo":"Impianto produttivo appartenente ai resti della pars rustica di una villa romana di età augustea. \nIn seguito ad una raccolta di superficie e a saggi di scavo realizzati nel 1978 e ad uno scavo archeologico svolto nel 1979 dalla Società Reggiana di Arc","tipo_propr":"Ecclesiastica, Privata","comuni":"CASTELLARANO","sigla_pro":"RE","localita":"Gambarata","tipologie":"Struttura abitativa o insediamento - Epoca Età Romana","provvedime":"Decreto Ministeriale (06/09/1983)","data_ultim":"1983-09-06","ultimo_pro":"Decreto Ministeriale","rif_legge_":"L. 1089/1939","tutela":"Diretto","vincolo":"Diretto"},"geometry":{"type":"MultiPolygon","coordinates":[[[[10.67777578828831,44.548969626008372],[10.677241341997044,44.548556280151999],[10.676738143701753,44.548888802935188],[10.676532503127609,44.549018951863331],[10.676653582687926,44.549112362890376],[10.677036394176699,44.549402476741328],[10.677249042975498,44.549563630594172],[10.677943682247102,44.549099475200904],[10.67777578828831,44.548969626008372]]]]}},{"type":"Feature","properties":{"gid":"118","id_archeo":"163","codice":"163_RA","nome":"Pavimento musivo del VI sec. D.C.","titolo":"Pavimento musivo attribuibile al VI secolo d. C., in ottimo stato di conservazione.","tipo_propr":"Privata","comuni":"FAENZA","sigla_pro":"RA","localita":null,"tipologie":"Struttura abitativa o insediamento - Epoca Età Tardoantica","provvedime":"Decreto Ministeriale (24/02/1996)","data_ultim":"1996-02-24","ultimo_pro":"Decreto Ministeriale","rif_legge_":"L. 1089/1939","tutela":"Diretto","vincolo":"Diretto"},"geometry":{"type":"MultiPolygon","coordinates":[[[[11.88490752587006,44.285327216937844],[11.884933067722432,44.285354109787441],[11.884881912170432,44.28537434444781],[11.884938003875087,44.285444406085468],[11.885000347773271,44.285524671491402],[11.885150422031437,44.285475045118702],[11.885079084757582,44.285382853820551],[11.885040284705862,44.285334231108962],[11.884993911272394,44.285276059169561],[11.884966423354708,44.285292337507848],[11.88490752587006,44.285327216937844]]]]}},{"type":"Feature","properties":{"gid":"119","id_archeo":"123","codice":"123_PR","nome":"Resti del Capitolium","titolo":"Reati del Capitolium, massimo tempio della colonia romana","tipo_propr":"Privata","comuni":"PARMA","sigla_pro":"PR","localita":null,"tipologie":"Complesso monumentale - Epoca Età Romana","provvedime":"Decreto Ministeriale (22/06/1991)","data_ultim":"1991-06-22","ultimo_pro":"Decreto Ministeriale","rif_legge_":"L. 1089/1939","tutela":"Diretto","vincolo":"Diretto"},"geometry":{"type":"MultiPolygon","coordinates":[[[[10.327186483568294,44.801298602295645],[10.327282649899308,44.801278764670521],[10.327291750372128,44.801295325159941],[10.327412150617441,44.801265425917109],[10.327356579486493,44.801148001853115],[10.327345609071598,44.801138830338566],[10.327300581152727,44.801148625898648],[10.327204734388394,44.800952713482758],[10.326744741231444,44.801068136162975],[10.326859340048857,44.801375518893735],[10.327029316320443,44.801335969111427],[10.327186483568294,44.801298602295645]]]]}},{"type":"Feature","properties":{"gid":"120","id_archeo":"40","codice":"040_FC","nome":"Resti della centuriazione romana","titolo":"Le due centurie comprese tra via Masiera Prima, Via Rovescio, Via Boscone e il canale lungo cui attualmente si imposta il confine nord della provincia di Forlì/Cesena costituiscono un esempio particolarmente rilevante di conservazione della centuriazion","tipo_propr":"Privata","comuni":"CESENA","sigla_pro":"FC","localita":"Il Bagnile","tipologie":"Infrastruttura territoriale o urbana - Epoca Età Romana","provvedime":"Decreto Ministeriale (21/01/1985)","data_ultim":"1985-01-21","ultimo_pro":"Decreto Ministeriale","rif_legge_":"L. 1089/1939","tutela":"Diretto","vincolo":"Diretto"},"geometry":{"type":"MultiPolygon","coordinates":[[[[12.255619687612121,44.231061678912099],[12.255622979533396,44.231060186036849],[12.255669258491045,44.231061143647224],[12.255799220682723,44.231068824753805],[12.255799342763769,44.231067656353829],[12.256015699376871,44.231077145418283],[12.256021536315178,44.231020270702778],[12.256028789627189,44.230949790693643],[12.255979492186455,44.230946317625168],[12.255987721176668,44.230852907563943],[12.25600787036154,44.23068419409568],[12.25602139243202,44.230561465114675],[12.256046609714096,44.230339168533483],[12.256071726717236,44.2301034881608],[12.256089862624844,44.229935507277901],[12.256118234017647,44.229671232298301],[12.256124348463514,44.22962163442935],[12.256155346188846,44.22937001397176],[12.256175052764796,44.22920781284062],[12.256204854589942,44.228933396262939],[12.256236398940125,44.228688286940148],[12.256267181815396,44.228411690756467],[12.256292832229169,44.228182521838875],[12.255963240243629,44.22815229534973],[12.255890803306102,44.228146691546037],[12.255835078194933,44.228143086674663],[12.255697606419853,44.228134197417042],[12.255506966992304,44.228123124429985],[12.255467253794116,44.228123581923477],[12.255275576722584,44.22811071964216],[12.255065812647722,44.228098615912337],[12.255096956978109,44.227747460427338],[12.255315753523321,44.227758100172863],[12.255492829297381,44.227767750845992],[12.255538089170237,44.227769799865591],[12.255732765321248,44.22778121678796],[12.255860884897599,44.22779080488889],[12.255861697351907,44.227779663687855],[12.255905989900905,44.22776554474865],[12.255922630490856,44.22759292522953],[12.255938847219724,44.227593668965703],[12.255945788528875,44.227530921941636],[12.256048399661196,44.227536790259627],[12.256175138553905,44.227542240255225],[12.256178346159308,44.22744632666879],[12.256185919073934,44.227161822252178],[12.256188295944311,44.227161969604929],[12.256211976909624,44.226871774325836],[12.256421277022604,44.226884552666725],[12.256425069548035,44.226852823362528],[12.256431965716841,44.226783370759399],[12.256438008153749,44.226722494840338],[12.256482159864877,44.226307968667179],[12.256500115148231,44.226117918782904],[12.256506423163069,44.226091118568725],[12.256551003128042,44.225783718297713],[12.256588236895197,44.225499510858718],[12.256630220818826,44.225238088111574],[12.256636944088891,44.225145774190729],[12.256633750964333,44.22512443945417],[12.256624945327571,44.225094415446549],[12.256618847518508,44.225086460210051],[12.256575324978426,44.225052565387458],[12.256391598742757,44.22503854638461],[12.256373891394421,44.224959375349627],[12.256387484018582,44.224729515034817],[12.256393612792575,44.224508005871165],[12.256402532928597,44.224203234391794],[12.256413976656832,44.223902451010211],[12.25647482964809,44.223904450898139],[12.256481126496872,44.223702778322867],[12.256716913885162,44.223703297998597],[12.256720779767022,44.223744535965288],[12.256848004675248,44.223746010267163],[12.256832627170484,44.22353975269094],[12.256838147380785,44.22345967138525],[12.256842898372696,44.22339060403219],[12.256846563651768,44.223249241932805],[12.256847033506597,44.223230989555098],[12.256840738634107,44.223026885463689],[12.256839200215286,44.222966801959601],[12.256839371595875,44.222927717414841],[12.256861770800022,44.222672137758089],[12.256885169370941,44.222414026892125],[12.256880916171465,44.222329705212367],[12.256878326427316,44.222207021623923],[12.256904968787774,44.222032865108261],[12.2568971047112,44.221821873878746],[12.25689210047523,44.221593516316993],[12.256889530664697,44.221471192243904],[12.25690074736171,44.221314454502796],[12.256923063453732,44.221107733492531],[12.256935139137784,44.220993327788506],[12.256965998720196,44.220726154544359],[12.256996677103427,44.220440504409758],[12.257016262433762,44.220265288861221],[12.257046059911067,44.21999158308541],[12.257074175005537,44.219755897668669],[12.257090041822632,44.219614700467467],[12.257109521951266,44.219485445440419],[12.257127764767379,44.219387302201234],[12.257144484975013,44.219286294611962],[12.257158481346979,44.21916247149948],[12.257169757027373,44.219071233896507],[12.25721479587874,44.21870195511287],[12.256998023929569,44.218689514758729],[12.256873792351598,44.218681518457387],[12.25666253533962,44.218667614749855],[12.256542819691395,44.218660695561667],[12.256228478943425,44.218642737146901],[12.25612739197366,44.218637212611341],[12.255733559961962,44.218613310210564],[12.255659122287655,44.218608438506756],[12.255460493324819,44.218599924952279],[12.255288967387498,44.21858917067896],[12.254993757521145,44.218575119459487],[12.254794581142935,44.218563712559096],[12.254530031226384,44.218549947171859],[12.25432634231406,44.218538199987727],[12.254057777179716,44.218523350657954],[12.253853083151405,44.21851448506267],[12.25362877217206,44.218502415252097],[12.253527683899737,44.218496177252931],[12.253196227110484,44.218476069628714],[12.253033289291862,44.218469631427652],[12.252790394468974,44.218458332673336],[12.252573118250519,44.218446249363431],[12.252316126327575,44.21843173231958],[12.252117991222548,44.218422847763144],[12.251784022123919,44.218405292281936],[12.251639184918098,44.218397706248929],[12.251260989296648,44.218378087230633],[12.250910939563916,44.218359474823671],[12.250754014915092,44.218350836546314],[12.250646889254392,44.218343156490555],[12.250343555985804,44.218320439137202],[12.25025754005156,44.218313066832273],[12.250244964032843,44.21831201155431],[12.25004163759972,44.218286130529798],[12.249965653421748,44.21827657284603],[12.249923831203853,44.218615067807114],[12.249769021180226,44.218618017150568],[12.249493069702359,44.218622011446044],[12.249463569558431,44.218876513578422],[12.249435614364083,44.219191819340701],[12.249411373649535,44.219413393759879],[12.249391552843814,44.219624075411105],[12.249384082471877,44.219689609913978],[12.24920901242025,44.219675229358991],[12.249128469579677,44.2196683935965],[12.249043500030025,44.219661188647947],[12.248988139527061,44.219655184392565],[12.248768563055542,44.219633445647077],[12.248763754948744,44.219632970331652],[12.24841106907388,44.219600246398251],[12.248404102207658,44.219667215911997],[12.248392677694389,44.219741442224219],[12.248377626718248,44.21992172167699],[12.248359772666042,44.220125901395619],[12.248339036521962,44.220347087751385],[12.24833037134578,44.220450979649037],[12.248451098865321,44.220458265772749],[12.248606019983601,44.220469070815007],[12.248628647305933,44.220470101274913],[12.24861792469131,44.220568218155165],[12.248605527491232,44.220705048249933],[12.248564291208462,44.22070298999072],[12.248315332730458,44.220690620927293],[12.248295484589004,44.22095523684817],[12.248282674622038,44.221084354542484],[12.248443746810493,44.221091572823426],[12.248611783628366,44.221099096802924],[12.248582553230554,44.221361080995962],[12.248543259895948,44.221358850394509],[12.2484200839103,44.221357377616549],[12.248263153494294,44.221349456272129],[12.248250323045735,44.221493896716375],[12.248230946340142,44.221757076797388],[12.248215998688224,44.221948570307255],[12.248208804314675,44.221989124047582],[12.248187327833039,44.222180272193008],[12.248139351715272,44.222567293653654],[12.248113766779698,44.222809125481],[12.248095505089985,44.222965891759266],[12.248068115492904,44.223173349528537],[12.248031716916417,44.223384079467905],[12.248004718832087,44.223578868617949],[12.247987105330751,44.223693286878593],[12.247956875072099,44.223861655758618],[12.247935450441215,44.224002136523737],[12.247934228049711,44.224094788557863],[12.24792996999933,44.22435973489538],[12.247926348638892,44.224465436719065],[12.247919003141762,44.22454760407178],[12.247919150725982,44.224564614511728],[12.247911771398298,44.224701436715335],[12.24789102671124,44.224920462525525],[12.24786394565851,44.225105117206454],[12.247850252297276,44.22520865694635],[12.247820342746161,44.225415394082816],[12.247796433671649,44.225559879564855],[12.247779570353403,44.225704317603331],[12.247764913620889,44.225871559079131],[12.247743894902758,44.226059462150907],[12.247718774899242,44.226296590275638],[12.247700709572266,44.226476514141375],[12.24768781368144,44.226731704452177],[12.247671963698769,44.226937321282811],[12.247655564378334,44.227135688758381],[12.24763224143658,44.227406839977867],[12.247618915207816,44.227553454942139],[12.24757038097575,44.227640440141769],[12.247845083579778,44.227661431834946],[12.247994503594919,44.227672259198627],[12.247978938063785,44.227793190914525],[12.247946083628554,44.228066521915004],[12.247744359646166,44.22805511216734],[12.247511483473133,44.228041608579808],[12.247491860674069,44.228218272792788],[12.247489608525786,44.228248324025685],[12.247481703486031,44.228325798949591],[12.247455965666179,44.228548090492787],[12.247445707166147,44.22864149468522],[12.247421882362593,44.228853279939358],[12.247399472702055,44.2290552932784],[12.24738175168136,44.229219660011211],[12.247364553048969,44.229383282674434],[12.24734035071045,44.22955091263016],[12.247330539436682,44.229639253702658],[12.247739045033281,44.229664595121825],[12.247713230371543,44.229880020003726],[12.247737871213683,44.229881398455284],[12.247724821082125,44.230059865194157],[12.247718844572573,44.230125744107539],[12.247768733455109,44.230127700515723],[12.24776480298438,44.230174796121432],[12.247759485775367,44.230238549709242],[12.247756166069202,44.23027831795175],[12.247701647898513,44.230276196174117],[12.247257560437745,44.230258915815696],[12.247243981818322,44.230394824952128],[12.247225866203655,44.230569321611348],[12.247201923316556,44.230769884080281],[12.247201210036257,44.230801737021316],[12.247533683430952,44.230816791779098],[12.247635811880507,44.230822672404805],[12.248000505338148,44.230840536069408],[12.248155427273892,44.230848812005028],[12.248376259949508,44.230858722949648],[12.248493471355232,44.2308656589653],[12.248577969118674,44.230870140997901],[12.248890345035527,44.230885601735608],[12.249027163394032,44.230891393958707],[12.249242452521113,44.23090203717819],[12.249428588909739,44.230911682424598],[12.249621227960164,44.230920953180089],[12.249878279450392,44.230933296001382],[12.249956222611454,44.230935613998497],[12.250174554682745,44.230948077331675],[12.250399913969076,44.230960142073997],[12.250488426923365,44.230961366501418],[12.250737419204972,44.230972640533643],[12.250928573178536,44.230983355759001],[12.251025655575543,44.230986721344763],[12.251221318480974,44.230996326379952],[12.251346604420577,44.2310050460095],[12.251489527738737,44.23101914168172],[12.251580582260527,44.231026495537783],[12.251864409744599,44.231053258231654],[12.252105460460955,44.231076494717421],[12.252381726349169,44.231103264507531],[12.252565400518487,44.231119780631481],[12.252592072307753,44.231123692860315],[12.252886968455464,44.231151127863136],[12.253126496275886,44.231173298288233],[12.253456085314953,44.231201372477898],[12.253620628926043,44.231215398361407],[12.253685523042506,44.231219931268818],[12.253862157671895,44.231236835016865],[12.253899876852698,44.231238550500983],[12.254185575509538,44.231249715841471],[12.25448083220507,44.231262327409681],[12.254710201858293,44.231273288013611],[12.255000442531957,44.231285528121433],[12.255158381612297,44.231293078314948],[12.255378940526333,44.231302515360305],[12.255412901632093,44.231303968424889],[12.255594620995483,44.231311331314686],[12.255619687612121,44.231061678912099]],[[12.254113692967291,44.225214101486195],[12.254137213017385,44.224910750474969],[12.254668738364639,44.224923791346434],[12.254667368649425,44.224939359631293],[12.254673595043339,44.225019330930635],[12.254678922762647,44.225134077317421],[12.254684426524795,44.225225232261501],[12.254408852060868,44.225219820147672],[12.254113692967291,44.225214101486195]],[[12.250770157470068,44.22496027740803],[12.250741539337005,44.225197766931721],[12.250389868756038,44.2251704667204],[12.249954165532335,44.225134701143595],[12.249994805890708,44.224831304635615],[12.250010500976877,44.224669848874747],[12.250013887338035,44.224654277235516],[12.250028713950952,44.224565928108326],[12.250039841032033,44.22451451335467],[12.2500733422902,44.224259258146986],[12.250098362122579,44.224070268410614],[12.250425340154372,44.224093285341119],[12.250489217476748,44.224095643429905],[12.25076288902144,44.224115928257866],[12.250766755720768,44.224117033463905],[12.250883124875061,44.22412391899303],[12.250852732713041,44.22433283129341],[12.2508209432216,44.224611597401086],[12.250804593901394,44.224697055196749],[12.250801217170174,44.224713706881417],[12.250770157470068,44.22496027740803]],[[12.25213389465498,44.220035185186809],[12.252147450430245,44.21991680372826],[12.252184670839453,44.219919596287745],[12.252380893610903,44.219937528670755],[12.252579588698731,44.219951483202053],[12.252633410360664,44.219955675051722],[12.252722446439874,44.219961240022585],[12.252708720900984,44.220059712944014],[12.252671142719748,44.220308450427069],[12.252637477438197,44.220544148863937],[12.252543426801372,44.220540059083554],[12.252328634963666,44.220524357549422],[12.252081161948798,44.220508731514485],[12.25209214396993,44.220382033114085],[12.252126602293199,44.22012206862648],[12.25213389465498,44.220035185186809]],[[12.255563512471943,44.219871806893615],[12.255607061512325,44.219560430079582],[12.255785114940874,44.219570097438378],[12.256006423103752,44.219583247921307],[12.256099961521201,44.219588060649869],[12.25607783617745,44.219760395708626],[12.25605511217843,44.219921881865801],[12.256005510720849,44.220287563270624],[12.255996539892896,44.220355265587543],[12.25583000363884,44.220339067352789],[12.255500474957579,44.220310998276396],[12.255506792629307,44.22028709660659],[12.25551191787733,44.220239309422794],[12.255563512471943,44.219871806893615]]]]}},{"type":"Feature","properties":{"gid":"121","id_archeo":"202","codice":"202_RN","nome":"Resti di edifici di epoca romana","titolo":"Resti di costruzioni romane, tra cui un'intera casa del I secolo a. C. con pavimenti e impianto di riscaldamente, e un complesso termale.","tipo_propr":"Pubblica","comuni":"RIMINI","sigla_pro":"RN","localita":null,"tipologie":"Struttura abitativa o insediamento - Epoca Età Romana, Struttura abitativa o insediamento - Epoca Età Romana","provvedime":"Decreto Ministeriale (31/03/1962)","data_ultim":"1962-03-31","ultimo_pro":"Decreto Ministeriale","rif_legge_":"L. 1089/1939","tutela":"Diretto","vincolo":"Diretto"},"geometry":{"type":"MultiPolygon","coordinates":[[[[12.570579356176456,44.056856034101983],[12.570826221130689,44.056625792080176],[12.570538314558609,44.056472954328683],[12.570455367269377,44.05654856981289],[12.570394667180365,44.056515089276822],[12.570235501064229,44.056669647445304],[12.570206104576902,44.05669448079589],[12.570196520244524,44.056711855855596],[12.570170990169066,44.056783000697898],[12.570228698410043,44.056788541010953],[12.57022757854326,44.056793788535813],[12.570282365202422,44.056808242753178],[12.570294254611818,44.056792143242554],[12.570310049958952,44.056796807431958],[12.570367141560387,44.056741002847616],[12.570579356176456,44.056856034101983]]],[[[12.571817632708425,44.057297265101148],[12.571894113933226,44.057227891773024],[12.571615322772947,44.057073321988831],[12.571505990787026,44.057019614233155],[12.571233721719102,44.05723447438865],[12.571353913815784,44.057303327760934],[12.571365459601621,44.057297699866432],[12.571670275584502,44.057478742313194],[12.571799929510307,44.057558326244994],[12.571813505964791,44.057568596261767],[12.57182530383586,44.057561141910028],[12.571943960666806,44.057461784069865],[12.571972868120273,44.057435365829321],[12.571950385211109,44.057419820083332],[12.571829407519742,44.057334428134901],[12.57179503583,44.057314663243851],[12.571817632708425,44.057297265101148]]]]}},{"type":"Feature","properties":{"gid":"122","id_archeo":"93","codice":"093_PC","nome":"Resti di edifici romani","titolo":"Resti di edifici romani","tipo_propr":"Privata, Pubblica","comuni":"PIACENZA","sigla_pro":"PC","localita":null,"tipologie":"Struttura abitativa o insediamento - Epoca Età Romana","provvedime":"Decreto Ministeriale (12/04/1984)","data_ultim":"1984-04-12","ultimo_pro":"Decreto Ministeriale","rif_legge_":"L. 1089/1939","tutela":"Diretto","vincolo":"Diretto"},"geometry":{"type":"MultiPolygon","coordinates":[[[[9.696123553084202,45.054625575983401],[9.696069756152891,45.054583713430667],[9.69605558331587,45.054571179570715],[9.695926611615608,45.054471408784394],[9.695898008556277,45.054448142930077],[9.695842708590778,45.054404840165567],[9.695814744916333,45.05438193045434],[9.695750371580193,45.054382079769766],[9.695708903909372,45.054404854558328],[9.695474833785495,45.05452829782957],[9.695459658868792,45.054515851018252],[9.695414371866814,45.054539963204569],[9.695408652185604,45.054541663348402],[9.695267573575842,45.054617326158535],[9.695263498808732,45.054619574377853],[9.695332454972162,45.054678916144262],[9.695337279086933,45.054676672363101],[9.695429915667704,45.054624880729506],[9.695436049580056,45.054631988846459],[9.695458980712617,45.054624270683185],[9.695477949942401,45.054642752467224],[9.695489708952351,45.054653131709571],[9.695512986187826,45.054676025041026],[9.695538154547652,45.054700914206151],[9.695552948866135,45.054714434513848],[9.695619725258542,45.054779352394313],[9.695433535590837,45.054897858957645],[9.695426922490158,45.054902337047018],[9.695340911379869,45.054953009022277],[9.695306933565444,45.054971390256355],[9.69567875346603,45.055266389956977],[9.696337389428857,45.054854510766582],[9.696340937882027,45.054800901573465],[9.696325143873382,45.054788112989399],[9.696199859937023,45.05468672673576],[9.696135695252572,45.054636123854465],[9.696123553084202,45.054625575983401]]]]}},{"type":"Feature","properties":{"gid":"123","id_archeo":"6","codice":"006_BO","nome":"Resti di epoca pre-protostorica","titolo":"Resti di epoca protostorica sono stati rinvenuti all'interno del Parco dell’ex-Villa Cassarini, ora Facoltà d'Ingegneria, a partire dagli inizi del 900. Le indagini archeologiche misero in luce un complesso santuariale etrusco, in cui vennero recupera","tipo_propr":"Pubblica","comuni":"BOLOGNA","sigla_pro":"BO","localita":null,"tipologie":null,"provvedime":"Decreto Ministeriale (03/09/1945)","data_ultim":"1945-09-03","ultimo_pro":"Decreto Ministeriale","rif_legge_":"L. 1089/1939","tutela":"Diretto","vincolo":"Diretto"},"geometry":{"type":"MultiPolygon","coordinates":[[[[11.33080598277598,44.488107232067954],[11.330675162199134,44.487772324520492],[11.331021618760559,44.487701391632633],[11.331028224773528,44.48768633969398],[11.331093338887406,44.487666995352953],[11.331052731973307,44.48761211837904],[11.330914454283658,44.48740090319906],[11.330910516886918,44.487395195115894],[11.330792590035959,44.487234832535549],[11.330765575090247,44.487197232389107],[11.330685307313813,44.487085307284651],[11.330594934721121,44.486972265209936],[11.330583146354225,44.48695604969145],[11.330440541273237,44.487010429688212],[11.33033459804698,44.486881231132472],[11.330269661179695,44.486889228407463],[11.330255837652576,44.486889789865373],[11.330176364813301,44.486900352622428],[11.330124048476254,44.486900953128298],[11.329993588869439,44.486888673883733],[11.329955882822006,44.486881314868285],[11.329912880765798,44.486856554366703],[11.329888072324973,44.486834231006831],[11.329872545663941,44.486819505136246],[11.329823362551791,44.486750074973038],[11.329771167038155,44.486676367156008],[11.329662966264737,44.486523591810894],[11.329609572910549,44.486448215932668],[11.32957841630019,44.486449941488765],[11.329520916701922,44.48604890705338],[11.329058193501941,44.484842222739388],[11.328979847132066,44.484743958794084],[11.328935842897364,44.484546822628289],[11.328628889256484,44.484556815875877],[11.328539118786559,44.484567344633],[11.32841341370203,44.48459696266567],[11.327480218353582,44.484860223224636],[11.327346022392986,44.484883486589688],[11.32702280716137,44.484983246057503],[11.326790461766905,44.485049219835474],[11.326829974326373,44.485110242267439],[11.326961016248108,44.485211861878788],[11.32714832413868,44.485309767844996],[11.327228315808931,44.485395396132368],[11.327293324891784,44.485484678918262],[11.327334172823871,44.485591244045381],[11.327332443548981,44.485652702619767],[11.327383526912367,44.485825595560563],[11.327399521694478,44.485908037180728],[11.327400631347416,44.485946031625332],[11.327443989855128,44.48603508985741],[11.327583486756248,44.486210986062687],[11.327626380897838,44.486240971033347],[11.327680956946979,44.486300317466686],[11.327697195459995,44.486296295147113],[11.327774807942216,44.486369170187004],[11.327825073155974,44.486436157520899],[11.328034853705935,44.48676105781314],[11.328006466781261,44.486775500799631],[11.327951775639963,44.48680331797862],[11.327828082107931,44.486866221144915],[11.327803923059228,44.486878516255651],[11.32763165176277,44.486966131754237],[11.32766774240576,44.487052340388203],[11.327688310807426,44.487101487833613],[11.328051432455862,44.487968821599679],[11.328300790064329,44.487916100828144],[11.328395163205323,44.488149586969691],[11.328445941249312,44.48827708657155],[11.328402594931735,44.488292330126427],[11.328360959060364,44.488314209522649],[11.328340130838969,44.488342262954859],[11.328326983518679,44.488374345727678],[11.328320812317253,44.488421815221329],[11.328322479482622,44.488452947447094],[11.328333343770552,44.488506289883475],[11.328476360414683,44.488914689670978],[11.329940303663426,44.488650511642966],[11.330350146168767,44.488577908045968],[11.330670064466508,44.488520346748736],[11.330948194556569,44.488470426229682],[11.33080598277598,44.488107232067954]]]]}},{"type":"Feature","properties":{"gid":"124","id_archeo":"96","codice":"096_PC","nome":"Resti di epoca romana","titolo":"Stratigrafie e ruderi della prima età imperiale","tipo_propr":"Privata","comuni":"PIACENZA","sigla_pro":"PC","localita":null,"tipologie":"Struttura abitativa o insediamento - Epoca Età Romana, Struttura produttiva - artigianale - Epoca Età Romana","provvedime":"Decreto Ministeriale (31/12/1997)","data_ultim":"1997-12-31","ultimo_pro":"Decreto Ministeriale","rif_legge_":"L. 1089/1939","tutela":"Diretto","vincolo":"Diretto"},"geometry":{"type":"MultiPolygon","coordinates":[[[[9.697702936548383,45.053038516660379],[9.697609909658608,45.052966262049196],[9.697578345599384,45.052984557195089],[9.697545312686877,45.052959383469378],[9.697461274537462,45.052895247289015],[9.69744621062558,45.052882530009697],[9.697395350897784,45.052839866980236],[9.69735432475791,45.052806938520149],[9.697314388157697,45.052832242092506],[9.697227248979004,45.052893245449525],[9.697520504695207,45.053144314077755],[9.69764084637935,45.053074830607272],[9.697702936548383,45.053038516660379]]]]}},{"type":"Feature","properties":{"gid":"125","id_archeo":"97","codice":"097_PC","nome":"Resti di epoca romana","titolo":"Stratigrafie e ruderi della prima età imperiale","tipo_propr":"Privata","comuni":"PIACENZA","sigla_pro":"PC","localita":null,"tipologie":"Struttura abitativa o insediamento - Epoca Età Romana, Struttura abitativa o insediamento - Epoca Età Altomedievale","provvedime":"Decreto Ministeriale (22/04/1999)","data_ultim":"1999-04-22","ultimo_pro":"Decreto Ministeriale","rif_legge_":"L. 1089/1939","tutela":"Diretto","vincolo":"Diretto"},"geometry":{"type":"MultiPolygon","coordinates":[[[[9.697520504695207,45.053144314077755],[9.697227248979004,45.052893245449525],[9.697185570042397,45.052922424017467],[9.697254399579304,45.05298284561357],[9.69734168328794,45.053062192866271],[9.69738758933695,45.05310790172706],[9.697451672975395,45.053179028118485],[9.697455857498669,45.053181640028733],[9.697520504695207,45.053144314077755]]]]}},{"type":"Feature","properties":{"gid":"126","id_archeo":"83","codice":"083_MO","nome":"Resti di epoca romana e materiali dell'età del Bronzo","titolo":"Terramara dell’età del bronzo media e recente (BM 1/2-BR1), metà XVII/ XVI-XIII sec. a.C.\nVenturini segnala alla Soprintendenza per la prima volta la notizia del ritrovamento di questo sito archeologico nel 1930. Fernando Malavolti, dopo una prima ed","tipo_propr":"Privata","comuni":"MIRANDOLA","sigla_pro":"MO","localita":"Mortizzuolo, fondo La Tesa","tipologie":"Sepoltura-e - Epoca Età Romana, Struttura non identificata - Epoca Età del Bronzo","provvedime":"Decreto Ministeriale (21/10/1969)","data_ultim":"1969-10-21","ultimo_pro":"Decreto Ministeriale","rif_legge_":"L. 1089/1939","tutela":"Diretto","vincolo":"Diretto"},"geometry":{"type":"MultiPolygon","coordinates":[[[[11.208153689105723,44.906203488328252],[11.208446345115629,44.906004391976502],[11.208560204350068,44.905924918065033],[11.207162559554073,44.899805162281055],[11.207086003733174,44.899813885104457],[11.207083853786219,44.899798416524433],[11.205065406644584,44.90004316626365],[11.204937484751495,44.900058754353552],[11.203528601070097,44.90022550352689],[11.202907452361034,44.900295461888106],[11.202598353866648,44.90032913754537],[11.201445442996453,44.900467953176062],[11.200624812850295,44.900568274134777],[11.200045774853079,44.900636637726521],[11.19997190955832,44.900644633241292],[11.200148097401618,44.901291448065834],[11.200421002350996,44.902299234597947],[11.200482188868753,44.90252117420625],[11.20057255216388,44.902850132053352],[11.200690942958758,44.903289154834702],[11.200716867125132,44.903385289563957],[11.200719086017777,44.903393645477088],[11.20084128635218,44.903854757112533],[11.201108806404488,44.904803431402669],[11.201331814359545,44.905604217370929],[11.201460339866607,44.906112609813356],[11.202061563502498,44.906350422179415],[11.202127260443328,44.906379427322321],[11.202190989040623,44.906422558246142],[11.202260560370361,44.906517166058556],[11.202355982995133,44.906527161457561],[11.20276842782104,44.906573731929051],[11.203843071382083,44.906673377440406],[11.204692545147426,44.90674577693698],[11.205768316543312,44.906847912037072],[11.206628193410499,44.906926226233345],[11.206675160396806,44.90693178111917],[11.206769871843337,44.906936727553138],[11.206898661410177,44.906942427995943],[11.207035653790316,44.906924492827841],[11.207176427556782,44.90687397871924],[11.207543686800502,44.906616667031699],[11.207702544776531,44.906510171015142],[11.208153689105723,44.906203488328252]],[[11.201955864734778,44.903580849038221],[11.201858289054877,44.902900378216131],[11.203109072731733,44.90290317968234],[11.20322928253421,44.903514378705431],[11.201955864734778,44.903580849038221]]]]}},{"type":"Feature","properties":{"gid":"127","id_archeo":"76","codice":"076_FE","nome":"Resti di epoca romana","titolo":"Nella località di Ponte delle Guardate (frazione di Voghenza), sono stati rinvenuti in aratura numerosi resti fittili che suggerivano la presenza di strutture pertinenti a una o più fornaci di periodo romano imperiale.\nNel 2011, dopo l’esecuzione di","tipo_propr":"Privata","comuni":"VOGHIERA","sigla_pro":"FE","localita":"Ponte delle Guardate","tipologie":"Struttura produttiva - artigianale - Epoca Età Romana","provvedime":"Decreto Ministeriale (21/08/2000)","data_ultim":"2000-08-21","ultimo_pro":"Decreto Ministeriale","rif_legge_":"D. Lgs. 490/1999","tutela":"Diretto","vincolo":"Diretto"},"geometry":{"type":"MultiPolygon","coordinates":[[[[11.723592782701246,44.754243511006123],[11.7232754485242,44.754059337511798],[11.723212047713169,44.754114898843717],[11.723225032438391,44.75412416976809],[11.723107405022862,44.754247495253125],[11.723408787689644,44.754403891688412],[11.723592782701246,44.754243511006123]]]]}},{"type":"Feature","properties":{"gid":"128","id_archeo":"41","codice":"041_FC","nome":"Resti di epoca romana, bizantina e medievale","titolo":"Resti di un sito pluristratificato comprendente strutture di epoca romana, bizantina e medievale","tipo_propr":"Pubblica","comuni":"CESENA","sigla_pro":"FC","localita":"Il Garampo","tipologie":"Infrastruttura territoriale o urbana - Epoca Età Altomedievale, Struttura abitativa o insediamento - Epoca Età Romana, Struttura abitativa o insediamento - Epoca Età Medievale, Struttura abitativa o insediamento - Epoca Età Tardoantica","provvedime":"Decreto Ministeriale (24/06/1996)","data_ultim":"1996-06-24","ultimo_pro":"Decreto Ministeriale","rif_legge_":"L. 1089/1939","tutela":"Diretto","vincolo":"Diretto"},"geometry":{"type":"MultiPolygon","coordinates":[[[[12.241529387280863,44.135471826678561],[12.24161576339462,44.135454231294069],[12.241754818531232,44.135444610770165],[12.241827643783504,44.135439400109341],[12.241827836265522,44.135309379637825],[12.242048609876907,44.135293062108182],[12.242110614732935,44.135287420794143],[12.242316867787425,44.135273018621454],[12.242418457382556,44.135266171642435],[12.242380730134883,44.135203154125222],[12.242339500823039,44.135126633207861],[12.242334895906181,44.135118328614801],[12.242314734971346,44.135081846776146],[12.242268938319173,44.135094932043657],[12.242248481901488,44.135064922417243],[12.242296028417934,44.135049095685069],[12.242283518623017,44.13502746678401],[12.242295079069358,44.135020350463407],[12.24227757855812,44.134992273456234],[12.242263507095979,44.134993483399377],[12.24224733168063,44.134965863887174],[12.242200042145233,44.134882304007789],[12.242160181910803,44.134813882450644],[12.242123358476102,44.134829440550824],[12.242092393512328,44.134790600790559],[12.242046208518456,44.134733594044185],[12.242041649640253,44.134729096218614],[12.241988760528404,44.134699404591032],[12.241863297036785,44.134628192854585],[12.241839166572467,44.134615086291518],[12.241801843899053,44.134594819267271],[12.241768115591695,44.134576502720599],[12.241748620119839,44.134566316370609],[12.241707185030915,44.13454468068425],[12.241651271354382,44.134584160471398],[12.241556565414525,44.134649129879179],[12.241451671941544,44.134722094706895],[12.241363938383563,44.134783598009584],[12.241258057464451,44.134856572703043],[12.241160083237995,44.134928530546553],[12.241192392252113,44.134996266625052],[12.241229305922587,44.135072532401828],[12.241258301518746,44.13513043272583],[12.241292400920145,44.135201412872917],[12.241325380490695,44.135268148589148],[12.241370974312259,44.135361848852114],[12.241480567159956,44.135332224013133],[12.241504606732729,44.135403021649616],[12.241514399528151,44.135429139056527],[12.24151881456811,44.13544265255193],[12.241529387280863,44.135471826678561]]]]}},{"type":"Feature","properties":{"gid":"129","id_archeo":"139","codice":"139_PR","nome":"Resti di epoca romana, strutture pal. Pilotta e convento S. Domenico","titolo":"Strutture pertinenti al Palazzo della Pilotta e al convento di San Domenico, oltre a strutture murarie riferibili a due fasi di età imperiale romana.","tipo_propr":"Pubblica","comuni":"PARMA","sigla_pro":"PR","localita":null,"tipologie":"Complesso monumentale - Epoca Età Post-Medievale, Struttura abitativa o insediamento - Epoca Età Romana, Struttura abitativa o insediamento - Epoca Età Medievale","provvedime":"Decreto Ministeriale (05/06/1999)","data_ultim":"1999-06-05","ultimo_pro":"Decreto Ministeriale","rif_legge_":"L. 1089/1939","tutela":"Diretto","vincolo":"Diretto"},"geometry":{"type":"MultiPolygon","coordinates":[[[[10.327582861630082,44.805209161940638],[10.327522502811046,44.805122324866176],[10.327504743423308,44.805104538196829],[10.327393344629513,44.805148705456233],[10.327471964698091,44.805250684062308],[10.327582861630082,44.805209161940638]]]]}},{"type":"Feature","properties":{"gid":"130","id_archeo":"108","codice":"108_PR","nome":"Emergenze di età paleolitica e neolitica","titolo":"Il sito di Lemignano è stato individuato nel 1987 nell’area di cascina Mandrie per la presenza di materiale litico affiorante in aratura dal loess wurmiano.\nI reperti, molto abbondanti, sono realizzati prevalentemente su diaspro del Monte Lama e sono","tipo_propr":"Privata","comuni":"COLLECCHIO","sigla_pro":"PR","localita":"Lemignano","tipologie":"Struttura abitativa o insediamento - Epoca Paleolitico, Struttura abitativa o insediamento - Epoca Neolitico","provvedime":"Decreto Ministeriale (29/05/1993)","data_ultim":"1993-05-29","ultimo_pro":"Decreto Ministeriale","rif_legge_":"L. 1089/1939","tutela":"Diretto","vincolo":"Diretto"},"geometry":{"type":"MultiPolygon","coordinates":[[[[10.25118392710932,44.772576233048625],[10.251013068090252,44.772205490815871],[10.250897714220875,44.77195637957616],[10.25088771941231,44.771934803047259],[10.250846827022599,44.771842493523366],[10.250877837396215,44.771817821215258],[10.250924816878088,44.771801705986057],[10.251008785821293,44.77178556361693],[10.250990264734058,44.77174779573064],[10.250811214319274,44.771775205951933],[10.250804737232512,44.77175910015562],[10.250745720730075,44.771612274449616],[10.250725808116533,44.771562729033832],[10.250704787404135,44.771510441113698],[10.250692105869303,44.77147914473295],[10.25058735089857,44.771226793333419],[10.250586898003938,44.771225718040299],[10.250570887932501,44.771187166411558],[10.250551733757566,44.771191454111388],[10.250526215710549,44.771197161813845],[10.250503615247844,44.77120220741152],[10.2503410111803,44.771238564906263],[10.250272531106008,44.771253880055454],[10.25008053198844,44.771294330885532],[10.246964674544895,44.770658595308156],[10.24491086872553,44.771073698792236],[10.244967837724893,44.771137051049031],[10.245174083700654,44.771364670621558],[10.245445852739341,44.771661440391931],[10.245885950683114,44.772134713412164],[10.246088098077426,44.772353589944423],[10.246205749855264,44.77248079281118],[10.246258772995761,44.772538124562139],[10.246388988988453,44.772675380469295],[10.24641325080443,44.772707550164739],[10.246452941266257,44.772806553956165],[10.246505714935612,44.772804717613589],[10.246615083968056,44.772790128631513],[10.246767779240724,44.772721729171415],[10.246881291608682,44.772684175393202],[10.247011284603591,44.772652544941003],[10.247344010900992,44.772550473286195],[10.247409838160419,44.772530408762172],[10.247437994658242,44.772535088344235],[10.247494724067934,44.772590173516122],[10.247566492658889,44.772644680261358],[10.247604374551539,44.772670210402545],[10.247605644005782,44.772671060732137],[10.247709235451609,44.77271856717298],[10.247907596770389,44.77281119159224],[10.248270895099481,44.773018166694989],[10.248404933854898,44.773093300136644],[10.248482530445923,44.773134347485176],[10.248515793461893,44.773151942969584],[10.2486583884009,44.773227063578581],[10.248726963247456,44.773262898180839],[10.248831552047829,44.773336633743931],[10.248832833782043,44.773337465927156],[10.249226282761084,44.773239945915421],[10.249686921555194,44.773128762294284],[10.250401851433447,44.772955892049524],[10.251261226564596,44.772749099232456],[10.25118392710932,44.772576233048625]]]]}},{"type":"Feature","properties":{"gid":"131","id_archeo":"111","codice":"111_PR","nome":"Resti di età neolitica","titolo":"Strutture insediative e sepolture d'epoca neolitica","tipo_propr":"Privata, Pubblica","comuni":"COLLECCHIO","sigla_pro":"PR","localita":null,"tipologie":"Sepoltura-e - Epoca Neolitico, Struttura abitativa o insediamento - Epoca Neolitico","provvedime":"Decreto Ministeriale (19/10/1992)","data_ultim":"1992-10-19","ultimo_pro":"Decreto Ministeriale","rif_legge_":"L. 1089/1939","tutela":"Diretto","vincolo":"Diretto"},"geometry":{"type":"MultiPolygon","coordinates":[[[[10.212186824184533,44.757572984479005],[10.212152747187119,44.757375615395041],[10.212019529545767,44.757391050979017],[10.211835944309666,44.757412323124612],[10.211900002939014,44.757741593758674],[10.212209805317324,44.757706082719757],[10.212186824184533,44.757572984479005]]],[[[10.21341672587582,44.758507391582647],[10.213383131615075,44.758291918117976],[10.213374162736464,44.758234389920446],[10.212613594857499,44.758311540505417],[10.212591149408082,44.758197451851608],[10.212461090378014,44.758212668078841],[10.212416361014229,44.758217900561306],[10.212277683466478,44.758234125385421],[10.212328527940882,44.758489228870282],[10.212360477278544,44.758649526295237],[10.212553307176051,44.758625776785472],[10.212770219648682,44.758599059767349],[10.212965518943038,44.758576982938315],[10.213420503300576,44.758531624772445],[10.21341672587582,44.758507391582647]]]]}},{"type":"Feature","properties":{"gid":"132","id_archeo":"130","codice":"130_PR","nome":"Resti di età neolitica","titolo":"A partire dal 1986 l’area dell’alta pianura, posta in prossimità del torrente Cinghio, è stata oggetto di indagini da parte della Soprintendenza che hanno portato all’individuazione di numerosi siti di età preistorica. I siti si trovano distribu","tipo_propr":"Privata","comuni":"PARMA","sigla_pro":"PR","localita":"Gaione, loc. Casa Catena","tipologie":"Sepoltura-e - Epoca Neolitico, Struttura abitativa o insediamento - Epoca Neolitico","provvedime":"Decreto Ministeriale (09/06/1993)","data_ultim":"1993-06-09","ultimo_pro":"Decreto Ministeriale","rif_legge_":"L. 1089/1939","tutela":"Diretto","vincolo":"Diretto"},"geometry":{"type":"MultiPolygon","coordinates":[[[[10.287824815438343,44.748246949264008],[10.288522155171455,44.749973353847338],[10.288598972096677,44.749958046855497],[10.290741955875166,44.749529634508363],[10.291771926145271,44.74932908002009],[10.292300868198279,44.749220895053206],[10.294667023056903,44.748756683844306],[10.294958675810332,44.748674959854213],[10.294247055244735,44.746792555453148],[10.293460915186277,44.746971115443635],[10.291950960480211,44.747314065022465],[10.290973937469911,44.747537059017844],[10.289956062754598,44.747772361865188],[10.289686903717069,44.747826749723735],[10.288972428395335,44.747989021927275],[10.287824815438343,44.748246949264008]]]]}},{"type":"Feature","properties":{"gid":"133","id_archeo":"130","codice":"130_PR","nome":"Resti di età neolitica","titolo":"A partire dal 1986 l’area dell’alta pianura, posta in prossimità del torrente Cinghio, è stata oggetto di indagini da parte della Soprintendenza che hanno portato all’individuazione di numerosi siti di età preistorica. I siti si trovano distribu","tipo_propr":"Privata","comuni":"PARMA","sigla_pro":"PR","localita":"Gaione, loc. Casa Catena","tipologie":"Sepoltura-e - Epoca Neolitico, Struttura abitativa o insediamento - Epoca Neolitico","provvedime":"Decreto Ministeriale (09/06/1993)","data_ultim":"1993-06-09","ultimo_pro":"Decreto Ministeriale","rif_legge_":"L. 1089/1939","tutela":"Diretto","vincolo":"Diretto"},"geometry":{"type":"MultiPolygon","coordinates":[[[[10.295238705082634,44.750173669605168],[10.295195331474245,44.750105043303513],[10.295243268272747,44.749996303287439],[10.295353614753068,44.749711962394343],[10.294985888151841,44.748712361151483],[10.292689966546568,44.749173929586505],[10.29126469867237,44.749455453360198],[10.291843782160267,44.751055996683831],[10.292179712712354,44.750967873732534],[10.293068786766636,44.75073465808785],[10.295238705082634,44.750173669605168]]]]}},{"type":"Feature","properties":{"gid":"134","id_archeo":"131","codice":"131_PR","nome":"Resti di età neolitica","titolo":"A partire dal 1986 l’area dell’alta pianura, posta in prossimità del torrente Cinghio, è stata oggetto di indagini da parte della Soprintendenza che hanno portato all’individuazione di numerosi siti di età preistorica. I siti si trovano distribu","tipo_propr":"Privata","comuni":"PARMA","sigla_pro":"PR","localita":"Gaione, loc. Villa della Zoppa","tipologie":"Struttura abitativa o insediamento - Epoca Neolitico","provvedime":"Decreto Ministeriale (29/05/1993)","data_ultim":"1993-05-29","ultimo_pro":"Decreto Ministeriale","rif_legge_":"L. 1089/1939","tutela":"Diretto","vincolo":"Diretto"},"geometry":{"type":"MultiPolygon","coordinates":[[[[10.285530054438453,44.752237882058758],[10.285460823695972,44.751971326165553],[10.285429992805755,44.751484101802234],[10.285455370535924,44.75134389661968],[10.285460140554148,44.750763297865696],[10.285453777580381,44.75062052415214],[10.285454894428824,44.750444196173923],[10.285478921631796,44.750204964610013],[10.285478997943679,44.750203791673719],[10.284055192050651,44.750401441727966],[10.283481537989312,44.750481070017926],[10.283250123501011,44.750517468018849],[10.282010276651041,44.750712466310908],[10.281999720332543,44.750715882274712],[10.283501990059149,44.752948308337388],[10.285504555345888,44.752511013497099],[10.285509706052164,44.752502304507381],[10.285530054438453,44.752237882058758]],[[10.284784468877392,44.7515640124642],[10.284725617682932,44.751396200312655],[10.28460655069021,44.751416714114598],[10.284591523636205,44.751376535755796],[10.284853471645418,44.751329280756487],[10.284868505787133,44.751370341210624],[10.284775746541412,44.751389965074459],[10.284829598889793,44.751555096800793],[10.284932371045132,44.751536368469104],[10.285065079790876,44.751937340891075],[10.285118977504181,44.75192842547667],[10.285128795326667,44.751951864480695],[10.285075207451289,44.751961649613385],[10.285101393395719,44.752043562069495],[10.284826059868934,44.752091211284821],[10.284666504620581,44.751584135836794],[10.284784468877392,44.7515640124642]]]]}},{"type":"Feature","properties":{"gid":"135","id_archeo":"10","codice":"010_BO","nome":"Resti di un lastricato stradale e di elementi strutturali riferibili ad una domus romana","titolo":"Resti di un lastricato stradale romano e di elementi strutturali laterizi riferibili ad una domus romana.","tipo_propr":null,"comuni":"BOLOGNA","sigla_pro":"BO","localita":null,"tipologie":"Infrastruttura territoriale o urbana - Epoca Età Romana, Struttura abitativa o insediamento - Epoca Età Romana","provvedime":"Decreto Ministeriale (20/06/1994)","data_ultim":"1994-06-20","ultimo_pro":"Decreto Ministeriale","rif_legge_":"L. 1089/1939","tutela":"Diretto","vincolo":"Diretto"},"geometry":{"type":"MultiPolygon","coordinates":[[[[11.340844963353744,44.497903284849912],[11.34083562412669,44.497841405147796],[11.340865049270272,44.497837665809342],[11.340810706315978,44.497583846413704],[11.340424866534518,44.497641666022552],[11.340438461323616,44.497730397139492],[11.34068264654946,44.497694950890278],[11.340722456747732,44.497865568858771],[11.340763906039021,44.497860371104139],[11.340785259640111,44.497954757595551],[11.340852606965782,44.497945467043216],[11.340844692646431,44.497903309307226],[11.340844963353744,44.497903284849912]]]]}},{"type":"Feature","properties":{"gid":"136","id_archeo":"11","codice":"011_BO","nome":"Resti di età romana","titolo":"Resti di strutture di epoca romana con stratificazioni estese dal periodo villanoviano all'alto medievale.","tipo_propr":null,"comuni":"BOLOGNA","sigla_pro":"BO","localita":null,"tipologie":"Struttura abitativa o insediamento - Epoca Età Romana, Struttura non identificata - Epoca Età del Ferro","provvedime":"Decreto Ministeriale (12/07/1994)","data_ultim":"1994-07-12","ultimo_pro":"Decreto Ministeriale","rif_legge_":"L. 1089/1939","tutela":"Diretto","vincolo":"Diretto"},"geometry":{"type":"MultiPolygon","coordinates":[[[[11.338057160725572,44.494773888396288],[11.338079775076233,44.494772947767906],[11.338159816306538,44.49477196439301],[11.338180383935656,44.494770165457354],[11.33817085475085,44.494741031036199],[11.338273662281843,44.49472215234578],[11.338295636645746,44.494718418753735],[11.338292640557659,44.49470992430583],[11.338307459768457,44.494704842084865],[11.338271023633411,44.494607623307111],[11.33824354195003,44.494611678636986],[11.338243409322763,44.494611350062677],[11.338234923046072,44.494613009402258],[11.338203138234849,44.494536861644853],[11.338109314233989,44.494554241801048],[11.338128259900961,44.494600260728802],[11.338134864243063,44.494621361962892],[11.338091619812413,44.49462788379946],[11.338031674272305,44.494637907756378],[11.33798217648031,44.494645313915967],[11.337924470682754,44.494654733759361],[11.337881064735013,44.494662879257994],[11.33782976652156,44.494669611061489],[11.337837166142185,44.494691416208099],[11.337845006943416,44.494727084968339],[11.337969506560695,44.494708734245677],[11.337997361017971,44.494776869489804],[11.338057160725572,44.494773888396288]]]]}},{"type":"Feature","properties":{"gid":"137","id_archeo":"67","codice":"067_FE","nome":"Resti di età romana","titolo":"I terreni siti in frazione Casaglia sono interessati da un vasto affioramento di materiali archeologici di epoca romana. Il complesso dei materiali appare riconducibile nella sua interezza alla metà del I secolo d.C. \nLe particolari tipologie riscontrat","tipo_propr":"Privata","comuni":"FERRARA","sigla_pro":"FE","localita":"Casaglia","tipologie":"Struttura abitativa o insediamento - Epoca Età Romana","provvedime":"Decreto Ministeriale (03/01/1994)","data_ultim":"1994-01-03","ultimo_pro":"Decreto Ministeriale","rif_legge_":"L. 1089/1939","tutela":"Diretto","vincolo":"Diretto"},"geometry":{"type":"MultiPolygon","coordinates":[[[[11.522003692640872,44.896702845353779],[11.521545737177401,44.896265638411819],[11.521329691201725,44.896401569989955],[11.521254189940084,44.89644907382413],[11.521020596776708,44.896596043710723],[11.521323945684964,44.89688138093139],[11.521377062834155,44.896931344599224],[11.52179581757933,44.897325228690896],[11.522067820790843,44.89716838442795],[11.522079746797605,44.897161507943288],[11.522331854544417,44.897016132974805],[11.522006156252575,44.896705197083236],[11.522003692640872,44.896702845353779]]]]}},{"type":"Feature","properties":{"gid":"138","id_archeo":"57","codice":"057_FE","nome":"Resti di età romana imperiale","titolo":"La località Capo d’Argine è interessata dalla presenza, in riva fluviale, di materiali archeologici di età romana imperiale e da un tratto di struttura muraria laterizia coeva.\nI materiali risultano dispersi lungo una fascia corrispondente a circa m","tipo_propr":"Pubblica","comuni":"BONDENO","sigla_pro":"FE","localita":"San Biagio - loc. Capo d'Argine","tipologie":"Struttura abitativa o insediamento - Epoca Età Romana","provvedime":"Decreto Ministeriale (09/09/1997)","data_ultim":"1997-09-09","ultimo_pro":"Decreto Ministeriale","rif_legge_":"L. 1089/1939","tutela":"Diretto","vincolo":"Diretto"},"geometry":{"type":"MultiPolygon","coordinates":[[[[11.423540547499877,44.925567533952282],[11.423700047438958,44.925987131964327],[11.424229553580066,44.92561862449238],[11.423994930076006,44.925608613472697],[11.423540547499877,44.925567533952282]]]]}},{"type":"Feature","properties":{"gid":"139","id_archeo":"95","codice":"095_PC","nome":"Resti di età romana","titolo":"Resti di età romana","tipo_propr":"Privata","comuni":"PIACENZA","sigla_pro":"PC","localita":null,"tipologie":"Struttura abitativa o insediamento - Epoca Età Romana","provvedime":"Decreto Ministeriale (04/08/1993)","data_ultim":"1993-08-04","ultimo_pro":"Decreto Ministeriale","rif_legge_":"L. 1089/1939","tutela":"Diretto","vincolo":"Diretto"},"geometry":{"type":"MultiPolygon","coordinates":[[[[9.692827098470683,45.048881303098959],[9.69290917125897,45.049011625695762],[9.693034162569122,45.048970701696653],[9.69295180950647,45.048832864531128],[9.692827098470683,45.048881303098959]]]]}},{"type":"Feature","properties":{"gid":"140","id_archeo":"151","codice":"151_PR","nome":"Resti di età romana","titolo":"Livelli d'uso e di abbandono appartenenti sia all'età post-classica che romana","tipo_propr":"Privata","comuni":"PARMA","sigla_pro":"PR","localita":null,"tipologie":"Struttura abitativa o insediamento - Epoca Età Romana","provvedime":"Decreto Ministeriale (13/04/1995)","data_ultim":"1995-04-13","ultimo_pro":"Decreto Ministeriale","rif_legge_":"L. 1089/1939","tutela":"Diretto","vincolo":"Diretto"},"geometry":{"type":"MultiPolygon","coordinates":[[[[10.332399106352183,44.801614179767626],[10.332243860178519,44.801354405264711],[10.332183035133848,44.801371432050146],[10.332083012380238,44.801399605125837],[10.332230342482836,44.801665461252597],[10.332397301268468,44.801614695048471],[10.332399106352183,44.801614179767626]]]]}},{"type":"Feature","properties":{"gid":"141","id_archeo":"61","codice":"061_FE","nome":"\tManufatto in laterizi della prima età imperiale, attribuibile ad un faro","titolo":"Imponente manufatto in laterizi di età romano-imperiale.\nA partire dal 1976 sono stati condotti scavi archeologici che portarono alla luce un basamento quadrato di 7,42 m di lato, realizzato in mattoni sesquipedali e conservato per un’altezza di ca 2","tipo_propr":"Pubblica","comuni":"COMACCHIO","sigla_pro":"FE","localita":"Valle del Mezzano, Baro Zavelea","tipologie":"Struttura portuale - d'attracco - Epoca Età Romana","provvedime":"Decreto Ministeriale (15/06/1993)","data_ultim":"1993-06-15","ultimo_pro":"Decreto Ministeriale","rif_legge_":"L. 1089/1939","tutela":"Diretto","vincolo":"Diretto"},"geometry":{"type":"MultiPolygon","coordinates":[[[[12.110456290035959,44.669356014706842],[12.10999316734619,44.669212085739169],[12.109822407779607,44.669503495107264],[12.110261685696273,44.669633520620962],[12.110456290035959,44.669356014706842]]]]}},{"type":"Feature","properties":{"gid":"142","id_archeo":"113","codice":"113_PR","nome":"Resti di età tardoantica-altomedievale","titolo":"Emergenze di età tardoantica/altomedievale","tipo_propr":"Pubblica","comuni":"FIDENZA","sigla_pro":"PR","localita":null,"tipologie":"Struttura abitativa o insediamento - Epoca Età Tardoantica, Struttura abitativa o insediamento - Epoca Età Altomedievale","provvedime":"Declaratoria (07/07/1999), Decreto Ministeriale (13/03/1999)","data_ultim":"1999-07-07","ultimo_pro":"Declaratoria","rif_legge_":"L. 1089/1939","tutela":"Diretto","vincolo":"Diretto"},"geometry":{"type":"MultiPolygon","coordinates":[[[[10.059763778255318,44.865910246083502],[10.060059475026526,44.865732953499808],[10.060036984634392,44.865714519262404],[10.06017520558645,44.865634234474385],[10.059856094164481,44.865376473543769],[10.059789463694406,44.865417934036294],[10.059782404921549,44.86541266139831],[10.059752600706885,44.865430203850082],[10.059717784890065,44.86540299001701],[10.059684831478458,44.865377244219175],[10.059634390015242,44.865406950809046],[10.059600515866402,44.865426889508846],[10.059519308137768,44.865346580507236],[10.059354124333305,44.865400612915174],[10.059262825424845,44.865430491432456],[10.059288889755351,44.865465735340607],[10.05945610108436,44.865680059847705],[10.059611181842248,44.865869966337179],[10.059649891945657,44.865919676870078],[10.059688200079924,44.86590819305853],[10.059696814878583,44.865922374001592],[10.059763778255318,44.865910246083502]],[[10.059539462299309,44.865780983503043],[10.059594417392583,44.865746506421729],[10.059623581979817,44.865754582680594],[10.059650939605854,44.865770790720788],[10.059663024910867,44.86580754396357],[10.059680166850582,44.865817818490392],[10.059638876291602,44.865841851145667],[10.059620705394615,44.865828803861277],[10.059591057962916,44.865843280254609],[10.059539462299309,44.865780983503043]],[[10.059496135726706,44.865529645911145],[10.059577778383666,44.865501529178161],[10.059640532416676,44.865581169671181],[10.059556976384094,44.865611622780207],[10.059496135726706,44.865529645911145]]]]}},{"type":"Feature","properties":{"gid":"143","id_archeo":"132","codice":"132_PR","nome":"Resti di fornace post-antica","titolo":"Nel 1998, durante i lavori di posa di un nuovo elettrodotto aereo, è stata rinvenuta una fornace per laterizi secentesca, posta alla periferia nord della città di Parma, all’incrocio tra la strada per Baganzola e la strada per l’Ente Fiere. La stru","tipo_propr":"Privata","comuni":"PARMA","sigla_pro":"PR","localita":"Golese","tipologie":"Struttura produttiva - artigianale - Epoca Età Post-Medievale","provvedime":"Decreto Ministeriale (13/03/1999)","data_ultim":"1999-03-13","ultimo_pro":"Decreto Ministeriale","rif_legge_":"L. 1089/1939","tutela":"Diretto","vincolo":"Diretto"},"geometry":{"type":"MultiPolygon","coordinates":[[[[10.30803619704786,44.844384940512683],[10.308032664854194,44.844192552702829],[10.307797488796405,44.84422683043416],[10.307827387864181,44.844421840703198],[10.30803619704786,44.844384940512683]]]]}},{"type":"Feature","properties":{"gid":"144","id_archeo":"126","codice":"126_PR","nome":"Resti di impianto rustico di epoca romana","titolo":"Resti di un impianto rustico di età romana","tipo_propr":"Privata, Pubblica","comuni":"PARMA","sigla_pro":"PR","localita":"Cortile S. Martino","tipologie":"Struttura abitativa o insediamento - Epoca Età Romana","provvedime":"Declaratoria (20/09/1982), Decreto Ministeriale (29/01/1981)","data_ultim":"1982-09-20","ultimo_pro":"Declaratoria","rif_legge_":"L. 1089/1939","tutela":"Diretto","vincolo":"Diretto"},"geometry":{"type":"MultiPolygon","coordinates":[[[[10.34538978486405,44.812361895575727],[10.345132040880534,44.812352194975539],[10.344969716323789,44.812418183513991],[10.344705232217814,44.812530340042194],[10.344709123072839,44.812535596376648],[10.344806498114018,44.812728558882959],[10.345132574219301,44.812646985278477],[10.345596521068428,44.812531180639702],[10.34538978486405,44.812361895575727]]]]}},{"type":"Feature","properties":{"gid":"145","id_archeo":"34","codice":"034_BO","nome":"Resti di insediamento protostorico","titolo":"La grotta \"SerafinoCalindri\" fu scoperta nel 1964 dal Gruppo Speleologico Bolognese. Durante successive ricerche è stata riconosciuta la presenza di tre livelli antropici: uno superficiale di smottamento con reperti provenienti dall'esterno della cavit","tipo_propr":"Privata","comuni":"SAN LAZZARO DI SAVENA","sigla_pro":"BO","localita":"Farneto, Grotta Serafino Calindri","tipologie":"Struttura abitativa o insediamento - Epoca Età del Bronzo","provvedime":"Decreto Ministeriale (16/09/1976)","data_ultim":"1976-09-16","ultimo_pro":"Decreto Ministeriale","rif_legge_":"L. 1089/1939","tutela":"Diretto","vincolo":"Diretto"},"geometry":{"type":"MultiPolygon","coordinates":[[[[11.394564973662677,44.437257556860509],[11.394438978592991,44.437037998699857],[11.394107606955039,44.436478746660399],[11.393037925121686,44.436889642629595],[11.392794710004482,44.436987487550439],[11.392671660744172,44.437036990106364],[11.392347194087504,44.4371675210419],[11.392316236220418,44.437075611633595],[11.392294621335346,44.436969998125917],[11.391970212081018,44.436772819804823],[11.391961169675305,44.436767972536657],[11.391666038079157,44.43696894543389],[11.39113134535306,44.437221671748304],[11.390924987159751,44.437291173749273],[11.390912716649078,44.437560760637062],[11.390921031922471,44.437931026999429],[11.390919949847813,44.438039052887703],[11.390966754751096,44.438083553142555],[11.391017169040271,44.438135948492786],[11.391165021117953,44.438260197129779],[11.392020587940269,44.438125546477004],[11.392697205731666,44.437891258831783],[11.392742362235388,44.437876359707708],[11.392763776868017,44.437851742581493],[11.393964790239954,44.437458323540838],[11.394341569676341,44.437325978853941],[11.394564973662677,44.437257556860509]]]]}},{"type":"Feature","properties":{"gid":"146","id_archeo":"159","codice":"159_RA","nome":"Resti di un insediamento rustico - probabile mansio","titolo":"Il complesso di Strada Casale si colloca a ridosso della via Faventina che collegava Firenze a Faventia e questa importante presenza è segnalata anche nel toponimo del luogo. Il sito è costituito da un edificio principale con ambienti di diverse dimens","tipo_propr":"Privata","comuni":"BRISIGHELLA","sigla_pro":"RA","localita":"Strada Casale","tipologie":"Struttura abitativa o insediamento - Epoca Età Romana","provvedime":"Decreto Ministeriale (01/06/1982)","data_ultim":"1982-06-01","ultimo_pro":"Decreto Ministeriale","rif_legge_":"L. 1089/1939","tutela":"Diretto","vincolo":"Diretto"},"geometry":{"type":"MultiPolygon","coordinates":[[[[11.697469036326947,44.1828514653497],[11.697465134889764,44.182837252259283],[11.697457540226928,44.18282846502553],[11.69744052386271,44.182780999800372],[11.697441928037293,44.182778049757538],[11.697441796452072,44.182777696426733],[11.697448423898845,44.182775096448459],[11.697486328312259,44.182759409486955],[11.697649277404738,44.182696321757504],[11.697848749661048,44.182619091808583],[11.698099583309327,44.18252198518168],[11.698197348578663,44.18248241262966],[11.698571686807336,44.182335194053607],[11.698619678322224,44.182316036327045],[11.698520312946751,44.182157507011532],[11.698484369798148,44.182170924297033],[11.698339008721804,44.182225153023765],[11.69830530175842,44.1821804050849],[11.698478836499392,44.182109188644297],[11.698491939658505,44.182103810434484],[11.698459583141471,44.182052197582749],[11.698800738861186,44.181917276953669],[11.698762325498263,44.181872478345902],[11.698554933263219,44.181660244762369],[11.69836235189362,44.18148357244921],[11.698191132245881,44.181348401490823],[11.698048753432548,44.181251683385256],[11.697804040509357,44.181104249408023],[11.697449106429817,44.181258758346019],[11.697177664907898,44.181374616840067],[11.697148100983586,44.181339754654545],[11.697121420220151,44.1813083083847],[11.697078433327503,44.181255910953809],[11.69702169474601,44.181186724253074],[11.696856978784147,44.180985074861667],[11.696462613775047,44.181156933032128],[11.696545537636217,44.181227806243974],[11.696374670217901,44.181282346807869],[11.696405867270414,44.181331628936036],[11.696635182045556,44.181657952835749],[11.696776515157016,44.181934688062356],[11.696946726347033,44.18226768291612],[11.697057946627613,44.182484586042385],[11.697124814827843,44.182607117379547],[11.697248652350829,44.182853467108387],[11.697249044447485,44.182853313801878],[11.697306295284285,44.182969293209119],[11.697338601540578,44.182962246096139],[11.697438630034426,44.182919604826886],[11.697444430959273,44.182913760072267],[11.697474688877055,44.182904321584466],[11.697466258161164,44.182890647643177],[11.697471460484639,44.182874427934152],[11.697469036326947,44.1828514653497]]]]}},{"type":"Feature","properties":{"gid":"147","id_archeo":"35","codice":"035_BO","nome":"Scoperta nel 1871 da Francesco Orsoni, con la sua imponente stratificazione archeologica addossata alla parete esterna, presso l’imboccatura principale, e con altri ritrovamenti nelle concamerazioni interne, la grotta mostra di essere stata frequentata","titolo":"Scoperta nel 1871 da Francesco Orsoni, con la sua imponente stratificazione archeologica addossata alla parete esterna, presso l’imboccatura principale, e con altri ritrovamenti nelle concamerazioni interne, la grotta mostra di essere stata frequentata","tipo_propr":"Privata","comuni":"SAN LAZZARO DI SAVENA","sigla_pro":"BO","localita":"Grotta del Farneto","tipologie":"Struttura abitativa o insediamento","provvedime":"Decreto Ministeriale (04/05/1962)","data_ultim":"1962-05-04","ultimo_pro":"Decreto Ministeriale","rif_legge_":"L. 1089/1939","tutela":"Diretto","vincolo":"Diretto"},"geometry":{"type":"MultiPolygon","coordinates":[[[[11.406170965477706,44.430833029005662],[11.406130998424604,44.430699888536921],[11.406081667943834,44.430617755367678],[11.405970395911311,44.430533408620377],[11.405721832153041,44.430332854703678],[11.40560972119286,44.430240594132677],[11.405566651457578,44.430198317603818],[11.405555949854545,44.429998229723502],[11.405675475131794,44.429890713629092],[11.404960209678885,44.42949123205225],[11.404488058911525,44.429225043636997],[11.403892039117261,44.430009024919798],[11.403849021089011,44.430199505034551],[11.404086307927207,44.430592358991888],[11.404022262251566,44.430750162274506],[11.40370694777474,44.430656663384632],[11.40364940176052,44.430385191667987],[11.403456476021757,44.430516317109394],[11.40330631716026,44.430810430862365],[11.403251634112783,44.430964066386821],[11.403164765273095,44.43121028593027],[11.403056931946564,44.431413744260276],[11.402956911483653,44.431437952174356],[11.40314869856288,44.431697422869149],[11.403080409748892,44.431757674417703],[11.402874542745398,44.431926917763356],[11.402896271608714,44.431940845985288],[11.402909321596544,44.43195208524039],[11.402982962186719,44.431980350170399],[11.403126920885109,44.43204164016629],[11.403221990714522,44.432100412939576],[11.403319524514961,44.432157684334413],[11.40339322136662,44.432233867847181],[11.403442919500888,44.432278157124564],[11.403505009436358,44.432353162721739],[11.403535885493874,44.43239282515372],[11.403632684840719,44.432514254197727],[11.403751002674424,44.432668349739671],[11.403824291107041,44.432769766436614],[11.403984993108754,44.432950300047366],[11.404033024778336,44.432921488292372],[11.404316095800093,44.432665839681057],[11.405090921604499,44.431957497447499],[11.405603412746824,44.43148487480822],[11.405944642128395,44.431167760297811],[11.406055097825888,44.431071256052178],[11.40618110143855,44.430892618492145],[11.406170965477706,44.430833029005662]]]]}},{"type":"Feature","properties":{"gid":"148","id_archeo":"149","codice":"149_PR","nome":"Resti di isolato urbano di epoca romana","titolo":"Significativa successione stratigrafica pertinente un isolato di epoca romana.","tipo_propr":"Privata","comuni":"PARMA","sigla_pro":"PR","localita":null,"tipologie":"Struttura abitativa o insediamento - Epoca Età Romana","provvedime":"Decreto Ministeriale (06/06/1995)","data_ultim":"1995-06-06","ultimo_pro":"Decreto Ministeriale","rif_legge_":"L. 1089/1939","tutela":"Diretto","vincolo":"Diretto"},"geometry":{"type":"MultiPolygon","coordinates":[[[[10.329514178243803,44.801785100893305],[10.329455708680625,44.801645802576189],[10.329346851445349,44.801667556889356],[10.329296886834838,44.801676015413754],[10.329293922708809,44.801667525032123],[10.329128787161844,44.80168330173985],[10.329157611404368,44.801848773891308],[10.329345575693914,44.801815636544724],[10.329514178243803,44.801785100893305]]]]}},{"type":"Feature","properties":{"gid":"149","id_archeo":"148","codice":"148_PR","nome":"Resti di isolato urbano di età romana imperiale","titolo":"Successione stratigrafica pertinente a un isolato urbano di età romana, comprendente resti di murature e pavimenti musivi.","tipo_propr":"Privata","comuni":"PARMA","sigla_pro":"PR","localita":null,"tipologie":"Struttura abitativa o insediamento - Epoca Età Romana","provvedime":"Decreto Ministeriale (04/01/1993)","data_ultim":"1993-01-04","ultimo_pro":"Decreto Ministeriale","rif_legge_":"L. 1089/1939","tutela":"Diretto","vincolo":"Diretto"},"geometry":{"type":"MultiPolygon","coordinates":[[[[10.331004745904664,44.801198482795705],[10.331002523778078,44.801192027265884],[10.330988635724973,44.801151689205874],[10.330962258610064,44.801071914975928],[10.330972131310633,44.801070170515693],[10.330910907782286,44.800918399463356],[10.33073285979753,44.800950973697489],[10.33077614285574,44.80104235253777],[10.330824354987881,44.801144629333848],[10.33085393500102,44.801214689121437],[10.330971194268978,44.801192122455952],[10.330974969834219,44.801203447957327],[10.331004745904664,44.801198482795705]]]]}},{"type":"Feature","properties":{"gid":"150","id_archeo":"69","codice":"069_FE","nome":"Resti di murature in fondazione di una struttura di età romana","titolo":"La zona della ex Piazza d’Armi di Ferrara è stata oggetto di un saggio di scavo che ha riportato alla luce, a una profondità di m 0,30—0,40 dal piano di campagna, già precedentemente sconvolto, le fondazioni e una piccola\nparte dell’elevato di u","tipo_propr":"Pubblica","comuni":"FERRARA","sigla_pro":"FE","localita":"Ex Piazza d'Armi","tipologie":"Struttura abitativa o insediamento - Epoca Età Romana","provvedime":"Decreto Ministeriale (11/10/1983)","data_ultim":"1983-10-11","ultimo_pro":"Decreto Ministeriale","rif_legge_":"L. 1089/1939","tutela":"Diretto","vincolo":"Diretto"},"geometry":{"type":"MultiPolygon","coordinates":[[[[11.612726325290666,44.86168573185769],[11.612720223717661,44.86170716114038],[11.612327581353879,44.863088603590739],[11.61220978443524,44.863501815443449],[11.61234934111026,44.863519864214737],[11.613522084500207,44.863658907759479],[11.614583305578007,44.863785066041061],[11.614958101686959,44.863830954864014],[11.615325110183937,44.863871034727751],[11.615803174533857,44.862117001895392],[11.612726325290666,44.86168573185769]]]]}},{"type":"Feature","properties":{"gid":"151","id_archeo":"15","codice":"015_BO","nome":"Resti di strutture di epoca romana","titolo":"Resti di una villa urbano-rustica di età imperiale romana, dotata sia di una pars urbana che di una fructuaria, pianificata al centro di un’area produttiva e commerciale estesa su una superficie di oltre 10.000 mq, delimitata da un lungo muro di recin","tipo_propr":null,"comuni":"CASALECCHIO DI RENO","sigla_pro":"BO","localita":"Possessione Santa Rosa","tipologie":"Struttura abitativa o insediamento - Epoca Età Romana","provvedime":"Decreto Ministeriale (02/12/1993)","data_ultim":"1993-12-02","ultimo_pro":"Decreto Ministeriale","rif_legge_":"L. 1089/1939","tutela":"Diretto","vincolo":"Diretto"},"geometry":{"type":"MultiPolygon","coordinates":[[[[11.271876157475376,44.48591396278902],[11.273073651688204,44.485660960530168],[11.272937289368437,44.485445306901276],[11.272638262506538,44.484973931392034],[11.272628326528642,44.484960625768252],[11.272545229678895,44.48482861386745],[11.272516346866219,44.484782727968891],[11.27233736264829,44.484507624718084],[11.272147317519179,44.484547230762132],[11.270991908676727,44.484787988491568],[11.270856511614697,44.484816196689998],[11.270898534210803,44.484908390757482],[11.270967156254844,44.485058939850553],[11.27133455102739,44.485864999358419],[11.271814630109851,44.485782979177813],[11.271844053223241,44.48584439260533],[11.271876157475376,44.48591396278902]]]]}},{"type":"Feature","properties":{"gid":"152","id_archeo":"205","codice":"205_RN","nome":"Resti di strutture di epoca romana","titolo":"Complesso di ruderi di età romana con sovrapposizioni di più tarda età.","tipo_propr":"Privata","comuni":"RIMINI","sigla_pro":"RN","localita":null,"tipologie":"Struttura abitativa o insediamento - Epoca Età Romana","provvedime":"Notifica (25/05/1945)","data_ultim":"1945-05-25","ultimo_pro":"Notifica","rif_legge_":"L. 1089/1939","tutela":"Diretto","vincolo":"Diretto"},"geometry":{"type":"MultiPolygon","coordinates":[[[[12.565705220549951,44.057535528258128],[12.565791556482065,44.05749104018097],[12.565778925450518,44.057480073705968],[12.56585312419991,44.057430761431064],[12.565914808069921,44.057385711339997],[12.565817631493541,44.057325217379201],[12.565780080558209,44.057305279950192],[12.565627794189675,44.057230339536808],[12.565610540589372,44.057246525182919],[12.565591810985193,44.057266817101251],[12.565568699893131,44.057288776377078],[12.565562575071725,44.057295917752242],[12.565578847532075,44.057335281557975],[12.565558690442026,44.057349685398513],[12.565529545069756,44.057369906694987],[12.565466898798649,44.057414734580576],[12.565618691264456,44.057501393965339],[12.565609341482197,44.05751075172801],[12.565654272068604,44.057534455726056],[12.56566512164213,44.057526788578187],[12.56568171675038,44.057520625349014],[12.565705220549951,44.057535528258128]]]]}},{"type":"Feature","properties":{"gid":"153","id_archeo":"8","codice":"008_BO","nome":"Resti di un tratto dell'antica via Emilia di epoca romana","titolo":"Porzione di piano interrato di fabbricato con resti di un tratto dell'antica via Emilia di epoca romana.","tipo_propr":"Privata","comuni":"BOLOGNA","sigla_pro":"BO","localita":null,"tipologie":"Infrastruttura territoriale o urbana - Epoca Età Romana","provvedime":"Decreto Ministeriale (30/01/1984), Decreto Ministeriale (03/08/1983)","data_ultim":"1984-01-30","ultimo_pro":"Decreto Ministeriale","rif_legge_":"L. 1089/1939","tutela":"Diretto","vincolo":"Diretto"},"geometry":{"type":"MultiPolygon","coordinates":[[[[11.347754753764379,44.49368540401845],[11.347733907594641,44.49365700924232],[11.347625269233886,44.493700790998297],[11.34764582383743,44.493728691259797],[11.347753959932145,44.493685712034889],[11.347754753764379,44.49368540401845]]]]}},{"type":"Feature","properties":{"gid":"154","id_archeo":"63","codice":"063_FE","nome":"Resti di una barca di età alto-medievale","titolo":"Resti del relitto di un’imbarcazione in fasciame ligneo di età altomedievale sono emersi a metà degli anni Ottanta del secolo scorso in seguito alla realizzazione di opere e impianti necessari per assicurare il razionale sviluppo dell’itticoltura n","tipo_propr":"Privata","comuni":"COMACCHIO","sigla_pro":"FE","localita":"La Macchia Vecchia","tipologie":"Rinvenimento navale - Epoca Età Altomedievale","provvedime":"Decreto Ministeriale (07/01/1986)","data_ultim":"1986-01-07","ultimo_pro":"Decreto Ministeriale","rif_legge_":"L. 1089/1939","tutela":"Diretto","vincolo":"Diretto"},"geometry":{"type":"MultiPolygon","coordinates":[[[[12.232971196866847,44.639527380831652],[12.232780423608286,44.639504206354701],[12.232721158658789,44.63972107354909],[12.232921760016566,44.639742189874873],[12.232971196866847,44.639527380831652]]]]}},{"type":"Feature","properties":{"gid":"155","id_archeo":"222","codice":"222_FC","nome":"Resti di villa urbano rustica e di strutture ad essa annesse","titolo":"A Forlimpopoli, nel 2000, è stato indagato parte del settore residenziale di una villa romana, dotata anche di un ambito termale. L’area era prospiciente un cortile di forma quadrangolare con pavimentazione in opus spicatum e dotazione di un pozzo; so","tipo_propr":"Privata","comuni":"FORLIMPOPOLI","sigla_pro":"FC","localita":"Podere Ausa e Casa Ausetta","tipologie":"Struttura abitativa o insediamento - Epoca Età Romana","provvedime":"Decreto Direzione Regionale (12/12/2011)","data_ultim":"2011-12-12","ultimo_pro":"Decreto Direzione Regionale","rif_legge_":"D. Lgs. 42/2004","tutela":"Diretto","vincolo":"Diretto"},"geometry":{"type":"MultiPolygon","coordinates":[[[[12.125183932439972,44.176090235768974],[12.124814907386881,44.175493170507814],[12.12360006888882,44.175901666526727],[12.123559039074838,44.175915462536167],[12.123482427854833,44.175941222795174],[12.122911508355047,44.1761331898497],[12.12307591603307,44.17638588354059],[12.123647817373495,44.17726486446675],[12.123837488992089,44.177556374947919],[12.12401544765736,44.177492290621437],[12.124468607680283,44.17735253075066],[12.124532813220116,44.177332728002447],[12.124571393436117,44.177320829836653],[12.124858929632804,44.177206014868354],[12.124845753620326,44.177177783563501],[12.125007824816228,44.177146571665979],[12.125108782778932,44.177106266169233],[12.125362410124859,44.177051183267608],[12.125218053158392,44.176725121238945],[12.125167851751968,44.176611740531946],[12.125091694369827,44.17644465018963],[12.124967396235677,44.176171900761531],[12.125183932439972,44.176090235768974]]]]}},{"type":"Feature","properties":{"gid":"156","id_archeo":"31","codice":"031_BO","nome":"Resti paleontologici","titolo":"Importante giacimento di pesci fossili di epoca miocenica, tra i rarissimi conosciuti in area bolognese.","tipo_propr":"Privata","comuni":"MONTERENZIO","sigla_pro":"BO","localita":"Monte delle Formiche","tipologie":"Zona paleontologica - Epoca Archeolitico","provvedime":"Decreto Ministeriale (23/08/1990)","data_ultim":"1990-08-23","ultimo_pro":"Decreto Ministeriale","rif_legge_":"L. 1089/1939","tutela":"Diretto","vincolo":"Diretto"},"geometry":{"type":"MultiPolygon","coordinates":[[[[11.389396612229293,44.31102720026977],[11.390057488302977,44.310603920551294],[11.390527887598077,44.310627915944309],[11.390331505663122,44.310163894899539],[11.390193919532512,44.309813875137188],[11.390264624410371,44.309875412204242],[11.390520663238764,44.309585566002973],[11.391033890173174,44.308984961740066],[11.390681409904712,44.308777005276085],[11.390690729027471,44.308636009297437],[11.390820817944483,44.308208720752575],[11.390752507310419,44.308132009473546],[11.390661507684676,44.308163444680538],[11.390465571637497,44.308253614680261],[11.39042393145421,44.308314984551174],[11.390412460794483,44.308328908817906],[11.390118832591847,44.308532757114023],[11.390036675352942,44.308930232533456],[11.389973986672366,44.309227891531862],[11.389942880798852,44.309206282339275],[11.389948367250469,44.309176232865511],[11.389675677995573,44.308487663429894],[11.389622043524575,44.308500670145655],[11.389721525142049,44.308208702791973],[11.38939782488306,44.308388331876294],[11.389321350799868,44.308431705378148],[11.389229579431465,44.308592433013551],[11.389205737497036,44.308622820898378],[11.389076054789211,44.308837997758843],[11.38895108996139,44.309045873609399],[11.388327775611803,44.310073335709077],[11.387963065059227,44.310651734171508],[11.388328767423742,44.311012466442399],[11.38838522209269,44.311068901379912],[11.388765398616119,44.3114401323556],[11.389396612229293,44.31102720026977]]]]}},{"type":"Feature","properties":{"gid":"157","id_archeo":"117","codice":"117_PR","nome":"Resti romani","titolo":"In località Arola, podere Saccaglia, è venuto alla luce un insediamento rurale romano documentato dalla presenza di tracce di pavimentazioni in cocciopesto, frammenti di lastre marmoree, resti di strutture murarie in ciottoli e materiali fittili. Quest","tipo_propr":"Privata","comuni":"LANGHIRANO","sigla_pro":"PR","localita":"Arola, podere Saccaglia","tipologie":"Struttura abitativa o insediamento - Epoca Età Romana","provvedime":"Decreto Ministeriale (19/03/1982)","data_ultim":"1982-03-19","ultimo_pro":"Decreto Ministeriale","rif_legge_":"L. 1089/1939","tutela":"Diretto","vincolo":"Diretto"},"geometry":{"type":"MultiPolygon","coordinates":[[[[10.283971184587688,44.670094701993008],[10.284018124058599,44.670178525401731],[10.284180940137535,44.670487452578207],[10.284383861753859,44.670862545169783],[10.284501708340349,44.671087059313571],[10.285071311439934,44.670875717810134],[10.285522449148544,44.670709943515639],[10.285908168618638,44.670565644925901],[10.285859323174224,44.670315419446446],[10.285822738987832,44.670114739267923],[10.28575809016534,44.669801918992647],[10.285719593564526,44.669598586622079],[10.284953057907636,44.669814658085251],[10.284365227218382,44.669983956419493],[10.283971184587688,44.670094701993008]]]]}},{"type":"Feature","properties":{"gid":"158","id_archeo":"152","codice":"152_PR","nome":"Resti di villa romana","titolo":"I terrazzi a nord del centro di Salsomaggiore sono stati interessati da importanti ritrovamenti archeologici riferibili sia all’età del Bronzo che a epoca romana.\nTracce della presenza di un insediamento romano erano emerse già nella metà del 1900,","tipo_propr":"Privata","comuni":"SALSOMAGGIORE TERME","sigla_pro":"PR","localita":"Campore","tipologie":"Struttura abitativa o insediamento - Epoca Età Romana","provvedime":"Decreto Ministeriale (14/05/1987)","data_ultim":"1987-05-14","ultimo_pro":"Decreto Ministeriale","rif_legge_":"L. 1089/1939","tutela":"Diretto","vincolo":"Diretto"},"geometry":{"type":"MultiPolygon","coordinates":[[[[10.005598852589273,44.82821202818824],[10.005760085612097,44.828364086969465],[10.006627919414708,44.829209525277747],[10.00848681432633,44.828212710229842],[10.007488663865814,44.827210025604423],[10.005598852589273,44.82821202818824]]]]}},{"type":"Feature","properties":{"gid":"159","id_archeo":"156","codice":"156_RA","nome":"Rinvenimenti dal Neolitico all'epoca romana della Tanaccia","titolo":"Sito in grotta con grande quantità di materiale, dall'eneolitico all'età romana, con stratificazione complessa. Alcuni rinvenimenti sono riferibili alle fasi recenti e finali del Neolitico e anche a quelli iniziali dell’Eneolitico. Importanti stratig","tipo_propr":"Privata","comuni":"BRISIGHELLA","sigla_pro":"RA","localita":"La Tanaccia","tipologie":"Struttura abitativa o insediamento - Epoca Eneolitico, Struttura abitativa o insediamento - Epoca Neolitico, Struttura abitativa o insediamento - Epoca Età Romana","provvedime":"Decreto Ministeriale (15/10/1985)","data_ultim":"1985-10-15","ultimo_pro":"Decreto Ministeriale","rif_legge_":"L. 1089/1939","tutela":"Diretto","vincolo":"Diretto"},"geometry":{"type":"MultiPolygon","coordinates":[[[[11.758626061278152,44.231165410287254],[11.758558832467218,44.231071859236224],[11.758531871986364,44.231037247487734],[11.758425902277772,44.230921432781365],[11.758349033681453,44.230842626756527],[11.758325817333791,44.230820339096653],[11.758310887872758,44.230715783330439],[11.758245032478094,44.2305562367143],[11.758215116935217,44.230445543142743],[11.758124695914347,44.230260806512497],[11.7581037201267,44.230225104785653],[11.758064915107298,44.230124852916397],[11.758044766488366,44.230048718436372],[11.758064254737768,44.230007060601878],[11.758119480107162,44.229921272722244],[11.758074652305989,44.229835741618913],[11.757985837948958,44.229669007289957],[11.757949145883883,44.229602698222863],[11.757879004959378,44.229582327383532],[11.757831988691491,44.229528718324559],[11.757815130826019,44.229510391133942],[11.757746252402795,44.229470147941171],[11.757687956600744,44.229361913336909],[11.75766298165718,44.229312426089564],[11.757646323397363,44.229285775636363],[11.757731945007134,44.229381817770026],[11.757804717528298,44.229459840925777],[11.757878199556842,44.229505356435688],[11.757899300461844,44.229558745335829],[11.757970249941973,44.229583021768725],[11.757990819736026,44.229618616305494],[11.75805500735447,44.229738771907563],[11.758161605093241,44.229938800309569],[11.758186275579789,44.229936223647208],[11.758211362228854,44.229937192958737],[11.758340885009613,44.229848997574599],[11.758420226766722,44.229790039785634],[11.758433274975888,44.229748294432696],[11.758452261668918,44.229663508101133],[11.758427797516408,44.229560416087438],[11.75842436508964,44.229542700848725],[11.758425033427228,44.229425758674928],[11.758506393438271,44.229358028515172],[11.758486030256728,44.229350427234706],[11.758334804987193,44.229305116189423],[11.758193072619504,44.229259314493753],[11.757974007585821,44.229176948843303],[11.757715083225008,44.229081033459821],[11.757611503124902,44.229044905445356],[11.757442948257589,44.229025525271076],[11.757443627635471,44.229017289464458],[11.757440690566701,44.228940505041564],[11.757437978579807,44.228820844705069],[11.757434604893877,44.228669340069843],[11.757431772559684,44.228508252565774],[11.757429531981703,44.228378047765652],[11.757556021816498,44.228367799193805],[11.75776301807417,44.228325149743853],[11.757855020058072,44.228259035492151],[11.757989041934147,44.228139654747061],[11.758116005486526,44.228092141261321],[11.758227603239188,44.228001165143034],[11.758278402950539,44.227976629899437],[11.758283399128617,44.227776822025795],[11.758150001707429,44.227784438494993],[11.757930067320148,44.227795865044378],[11.757809456662445,44.227789362165637],[11.757601389666855,44.227771548949327],[11.757525562945586,44.227730195084483],[11.757478235636032,44.22770740035525],[11.757436009751181,44.227648822990488],[11.757345642889744,44.227571467633034],[11.757298143588745,44.227402168307854],[11.757305748079153,44.227354306737801],[11.757313157823791,44.227325589446217],[11.757307047087972,44.227279481572765],[11.757348296252582,44.227219094919633],[11.757333779522504,44.2270600721371],[11.757326093114726,44.226982385109764],[11.757323019762543,44.226931882612121],[11.757281000220711,44.226862163957044],[11.757272611644792,44.22682812959453],[11.757261622374259,44.226808103117797],[11.757263091245509,44.226798542864991],[11.757202509096313,44.226784386592925],[11.757113830771162,44.226783332509619],[11.75663582278154,44.226785865009276],[11.756515624288852,44.226813065628413],[11.75642872292117,44.226836653295074],[11.75648955492778,44.226980261661943],[11.756581610154829,44.227198603015928],[11.756681975166563,44.227435613110437],[11.756722708231079,44.227535152730418],[11.756737483523244,44.227565737928657],[11.756663215962899,44.227672988128489],[11.756536164761899,44.227852912685712],[11.756471207287261,44.227944525452607],[11.756268598078041,44.228060987153356],[11.756025828120983,44.228201149730609],[11.755902961793597,44.228273166137804],[11.755806347517666,44.228329037144192],[11.75566750561415,44.228408848127181],[11.755535842264853,44.228485811870492],[11.755393137282224,44.228569514872412],[11.755513035602858,44.228699085328778],[11.755596481187577,44.228789644990655],[11.755680268931609,44.228875460949865],[11.755782057377811,44.228990145833173],[11.755988399599071,44.229209266581293],[11.756233745951318,44.229474780986621],[11.756307633551248,44.229551787879394],[11.756264371019542,44.229577436626599],[11.756223261183631,44.229653997213035],[11.756149003711368,44.229702027573879],[11.756075987917438,44.22975332286638],[11.756011559873896,44.22985498749825],[11.755992177050775,44.230000262587403],[11.756019724086592,44.230017719796585],[11.756152404382691,44.230120621283888],[11.756233319682748,44.230182946323779],[11.756444563579326,44.230347121914342],[11.756587898828942,44.230456418540548],[11.756601129252378,44.230471340486332],[11.756612161974424,44.230479689570004],[11.756704262602327,44.230588179673383],[11.756758622669524,44.230628801111521],[11.756847049160967,44.230689728964656],[11.756878935499781,44.230713220953078],[11.757046337972316,44.230825473793139],[11.757180817333415,44.230865780433064],[11.757305613682206,44.230907329091323],[11.757617076281905,44.231007917948538],[11.757732425533943,44.231041817059577],[11.757974912189315,44.231103037304308],[11.758063696803131,44.231127386922914],[11.758095093272649,44.231128329843607],[11.758166388262802,44.231114687786452],[11.758217685272511,44.231139303860843],[11.75850748119028,44.231256321415209],[11.758549215400228,44.231256897371154],[11.758624377008861,44.231263021356689],[11.758664886141334,44.231231235452533],[11.758626061278152,44.231165410287254]]]]}},{"type":"Feature","properties":{"gid":"160","id_archeo":"199","codice":"199_RE","nome":"Rinvenimenti età del bronzo","titolo":"Resti di una terramara a pianta quadrangolare con argine e fossato vennero individuati già nel 1788 quando, all’interno di una cava di marna, emersero ossa, corna di cervi, strumenti e reperti ceramici riconducibili all’età del bronzo media e recen","tipo_propr":"Privata","comuni":"SCANDIANO","sigla_pro":"RE","localita":"Arceto","tipologie":"Struttura abitativa o insediamento - Epoca Età del Bronzo","provvedime":"Decreto Ministeriale (10/01/1977)","data_ultim":"1977-01-10","ultimo_pro":"Decreto Ministeriale","rif_legge_":"L. 1089/1939","tutela":"Diretto","vincolo":"Diretto"},"geometry":{"type":"MultiPolygon","coordinates":[[[[10.719877378248897,44.622034918801113],[10.719698368671528,44.621778082152176],[10.719577494484051,44.621658733471008],[10.719523532828664,44.621598511417076],[10.719533367835922,44.621593502038053],[10.719285717044462,44.621206896587431],[10.719204489220514,44.621104297545124],[10.71870393960784,44.6206021575357],[10.718620122569748,44.620456602448357],[10.718365943155179,44.620505791825067],[10.718281711553569,44.620521733596718],[10.717981333266158,44.62058107897743],[10.717635428216415,44.620699443126071],[10.717498201447849,44.620739137523621],[10.717354245875597,44.620824214176764],[10.717406165732211,44.620888816063669],[10.718508641948416,44.622251861306204],[10.718764978873752,44.622547179295559],[10.719009525015728,44.622828910799974],[10.719198877624601,44.622761267936532],[10.71935894641285,44.622705293479122],[10.719697115099498,44.622576508125306],[10.719707720870254,44.622572837452452],[10.71988402589878,44.622494742223566],[10.719929915355907,44.622472894581541],[10.720050589129245,44.622415443025758],[10.72007204685406,44.622356695234672],[10.720059719399181,44.622310609612576],[10.719877378248897,44.622034918801113]]],[[[10.719546823044793,44.621487838302961],[10.719960905041319,44.621406952481948],[10.719904723424289,44.621168709112624],[10.719888199426677,44.62109105289386],[10.719849193490077,44.620931176071643],[10.719824627639296,44.620815948709556],[10.719793133855276,44.620684225640829],[10.719502601372874,44.620750007284911],[10.719057006314484,44.620852476318646],[10.719133145631504,44.620932592545422],[10.719239993236677,44.621039720930185],[10.719246292573789,44.621048160145932],[10.719396461873712,44.621269252083579],[10.719473137224444,44.621379868529779],[10.719546823044793,44.621487838302961]]]]}},{"type":"Feature","properties":{"gid":"161","id_archeo":"144","codice":"144_PR","nome":"Rinvenimenti romani","titolo":"A ridosso della via Emilia è nota un’area con affioramenti di murature e materiali di epoca romana.","tipo_propr":"Privata","comuni":"PARMA","sigla_pro":"PR","localita":"San Pancrazio, loc. Fraore","tipologie":"Struttura abitativa o insediamento - Epoca Età Romana","provvedime":"Decreto Ministeriale (27/06/1981)","data_ultim":"1981-06-27","ultimo_pro":"Decreto Ministeriale","rif_legge_":"L. 1089/1939","tutela":"Diretto","vincolo":"Diretto"},"geometry":{"type":"MultiPolygon","coordinates":[[[[10.265943157503674,44.817547251341239],[10.2658305475563,44.816978979115511],[10.265140529541908,44.817030350364014],[10.264530111190949,44.817082789251124],[10.264832995427657,44.817739146025012],[10.265198004858716,44.818505556089661],[10.265797794540864,44.818317652265073],[10.265948044985606,44.81826663730962],[10.266147021030521,44.818209014432441],[10.266460911974065,44.818150179516003],[10.266012553401415,44.817628066989045],[10.2659728267285,44.817581823122453],[10.265943157503674,44.817547251341239]]]]}},{"type":"Feature","properties":{"gid":"162","id_archeo":"21","codice":"021_BO","nome":"Anfiteatro romano","titolo":"Ruderi dell'antico anfiteatro romano","tipo_propr":"Privata","comuni":"IMOLA","sigla_pro":"BO","localita":"Ex Podere Pasticcia","tipologie":"Complesso monumentale - Epoca Età Romana","provvedime":"Notifica (17/06/1925)","data_ultim":"1925-06-17","ultimo_pro":"Notifica","rif_legge_":"L. 364/1909","tutela":"Diretto","vincolo":"Diretto"},"geometry":{"type":"MultiPolygon","coordinates":[[[[11.705138714915266,44.358428449322957],[11.7051988457329,44.358404212196042],[11.70587643460312,44.358132510647856],[11.706070220191304,44.358055852537177],[11.706194244330309,44.358007099028313],[11.706122993663032,44.357981411851476],[11.70606116282864,44.357957823938889],[11.705957431595973,44.357912102079609],[11.705859416846508,44.357875251529173],[11.705735912903922,44.357806722431192],[11.705633819291034,44.357752572108311],[11.705501065854103,44.357663420506611],[11.705499185841912,44.357661886939631],[11.705496117744874,44.357658068819056],[11.705475708955868,44.357632868650541],[11.705444873484238,44.357595690326136],[11.705327049454441,44.357441993880897],[11.705265306861561,44.357361166107637],[11.705089460036712,44.357135726900289],[11.704887671501384,44.357203408534971],[11.704785068031692,44.35723828448355],[11.704655948414834,44.357285914868484],[11.704596068739203,44.357310136753988],[11.704417375207116,44.35738208664133],[11.704352148812815,44.357405192741552],[11.704098758792801,44.357506612188267],[11.703848019252034,44.357610840062968],[11.703778790539745,44.357634238692171],[11.703716538287686,44.357656544783474],[11.703576725044838,44.357706605814855],[11.703501247831101,44.357735742768156],[11.703457559273369,44.357752171598655],[11.703447180327224,44.357755676278039],[11.70318970799425,44.357861160453609],[11.703289961794558,44.358030435268589],[11.703377959268584,44.358181491297572],[11.703386988720595,44.358195834358938],[11.703429505686548,44.358264380054351],[11.703438388874863,44.358261090845168],[11.703507258431717,44.358240230607784],[11.703543109413172,44.358296708870014],[11.703556471430815,44.358292584378731],[11.703561927699038,44.358300719362916],[11.70356719991144,44.358310308092832],[11.703551877796796,44.358315739350552],[11.703580839355791,44.358365385889648],[11.703582508937629,44.358368128090277],[11.703584601149856,44.358371328408559],[11.703597738040708,44.358366128954245],[11.703749422726647,44.358305941675312],[11.703908610429302,44.358531785632515],[11.703939023432238,44.358578143330298],[11.704002052071246,44.358558728307905],[11.704042523510415,44.35854327571311],[11.704038444988345,44.358537268694981],[11.704087356153508,44.358519797676152],[11.704207583634826,44.358475466425595],[11.704254004804771,44.358458423421183],[11.704292015731424,44.358443631292346],[11.704444929869631,44.358700752556175],[11.704557531660303,44.358662383855304],[11.705138714915266,44.358428449322957]]]]}},{"type":"Feature","properties":{"gid":"163","id_archeo":"37","codice":"037_FC","nome":"Insediamento dell'età del ferro","titolo":"Insediamento dell'età del ferro con una serie di livelli stratificati per uno spessore superiore a due metri in alcuni punti. Nel livello superiore, del VII secolo, lo scavo ha messo in luce i resti di alcune strutture abitative.","tipo_propr":"Privata","comuni":"BORGHI","sigla_pro":"FC","localita":"Ripa Calbana, Marola di Sotto","tipologie":"Struttura abitativa o insediamento - Epoca Età del Ferro","provvedime":"Decreto Ministeriale (26/06/1981), Decreto Ministeriale (18/06/1982), Decreto Ministeriale (19/02/1982), Decreto Ministeriale (22/01/1983)","data_ultim":"1983-01-22","ultimo_pro":"Decreto Ministeriale","rif_legge_":"L. 1089/1939","tutela":"Diretto","vincolo":"Diretto"},"geometry":{"type":"MultiPolygon","coordinates":[[[[12.364010997570656,43.994692292186976],[12.364548367339182,43.994280302667015],[12.364734982511889,43.994312913451758],[12.364787274792048,43.994157093899005],[12.364831092617351,43.993956202616062],[12.364810087885983,43.993337313526936],[12.364549722241174,43.993447533781548],[12.364544281962967,43.993309457256451],[12.36465807858483,43.993126129067427],[12.36461193603636,43.99306743212081],[12.364541014017727,43.993069342784047],[12.364515475039962,43.993051703064523],[12.364389524598582,43.993029181876338],[12.364305679631869,43.993210285523077],[12.364219031023156,43.993450529654133],[12.364150233924411,43.993644594698132],[12.364039391816599,43.993817806257105],[12.363933530435849,43.993989574517038],[12.363875893664838,43.994083758283054],[12.363803937451753,43.994234559082521],[12.363775148054879,43.994289775044145],[12.363692360126779,43.994334599791515],[12.363820891616625,43.994689174300134],[12.364010997570656,43.994692292186976]]],[[[12.363626675160493,43.995188445706411],[12.363460697119557,43.994836784077528],[12.363393351204239,43.994707454911776],[12.363386815286811,43.994697726511163],[12.363269155495997,43.994770721795845],[12.363014814285863,43.99489834875768],[12.363008964313002,43.994788039656257],[12.363004664976053,43.994696113441087],[12.362849678199908,43.994654144974866],[12.362526926876273,43.994479386210841],[12.362359598892043,43.994642214615986],[12.362341592988621,43.994797997112052],[12.362354389175433,43.994892445882165],[12.362344456844696,43.994905801442137],[12.362160663316232,43.995238464932221],[12.362006736534155,43.995372800526667],[12.362376218254804,43.99547143442922],[12.362504724385204,43.995510186471023],[12.362691686999314,43.995551033249932],[12.362891642522298,43.995595818211946],[12.363156953761054,43.995608778960239],[12.363224021315414,43.995648701365241],[12.363764842078885,43.995430886399213],[12.363626675160493,43.995188445706411]]]]}},{"type":"Feature","properties":{"gid":"164","id_archeo":"122","codice":"122_PR","nome":"Stratificazione archeologica","titolo":"Stratificazione archeologica di grande interesse per la comprensione dell'evoluzione della città dall'epoca romana a quella longobarda e successive.","tipo_propr":"Privata","comuni":"PARMA","sigla_pro":"PR","localita":null,"tipologie":"Struttura abitativa o insediamento - Epoca Età Altomedievale, Struttura abitativa o insediamento - Epoca Età Romana","provvedime":"Decreto Ministeriale (07/02/1991)","data_ultim":"1991-02-07","ultimo_pro":"Decreto Ministeriale","rif_legge_":"L. 1089/1939","tutela":"Diretto","vincolo":"Diretto"},"geometry":{"type":"MultiPolygon","coordinates":[[[[10.334561501726837,44.79960445020167],[10.334540479388489,44.799562907774579],[10.334268693632156,44.799497265093919],[10.334332668394788,44.799618350417433],[10.334390341664351,44.799606540871309],[10.334401253715702,44.799623562136162],[10.33444477727088,44.799618813479341],[10.334449276707561,44.799622577732876],[10.334522987572939,44.799613200247748],[10.334520255868027,44.799608785191545],[10.334561501726837,44.79960445020167]]]]}},{"type":"Feature","properties":{"gid":"165","id_archeo":"192","codice":"192_RE","nome":"Strutture abitative lignee (secc. X-XI e XIV-XV) e relitto murario della Cinta trecentesca","titolo":"Strutture abitative lignee riferibili ai secoli centrali del Medioevo e relitto murario residuo della cinta trecentesca in mattoni.","tipo_propr":"Ecclesiastica","comuni":"POVIGLIO","sigla_pro":"RE","localita":null,"tipologie":"Infrastruttura territoriale o urbana - Epoca Età Medievale, Struttura abitativa o insediamento - Epoca Età Medievale, Struttura abitativa o insediamento - Epoca Età Medievale","provvedime":"Decreto Ministeriale (09/03/1991)","data_ultim":"1991-03-09","ultimo_pro":"Decreto Ministeriale","rif_legge_":"L. 1089/1939","tutela":"Diretto","vincolo":"Diretto"},"geometry":{"type":"MultiPolygon","coordinates":[[[[10.54228615292868,44.841795825114687],[10.542273429837786,44.841726392725306],[10.542196701459501,44.841735796497879],[10.542210986298469,44.84180505746464],[10.54228615292868,44.841795825114687]]],[[[10.542526482225997,44.841810664679137],[10.542532242627844,44.841810175458598],[10.542536304396332,44.841810942449357],[10.542537622314684,44.841817085521718],[10.542540018283248,44.841820338832157],[10.542545789662501,44.841820260849623],[10.542549730877081,44.841816511426806],[10.542549632215112,44.841812815692791],[10.542547769163113,44.841807912340563],[10.542544763543901,44.841803434914183],[10.542508916524017,44.841806403786251],[10.542509070710853,44.841807202866903],[10.542508647388757,44.841812958982437],[10.542510640714438,44.841822789998233],[10.542515357202062,44.841826422437315],[10.542522858853335,44.841826321078493],[10.542524261599599,44.841813980367064],[10.542526482225997,44.841810664679137]]]]}},{"type":"Feature","properties":{"gid":"166","id_archeo":"68","codice":"068_FE","nome":"Strutture alto medievali e di XIII - XIV","titolo":"Stratificazione archeologica con strutture in legno databili all'alto medioevo ed elementi strutturali del XIII-XIV secolo","tipo_propr":"Privata","comuni":"FERRARA","sigla_pro":"FE","localita":null,"tipologie":"Struttura abitativa o insediamento - Epoca Età Altomedievale, Struttura abitativa o insediamento - Epoca Età Medievale","provvedime":"Decreto Ministeriale (30/12/1992)","data_ultim":"1992-12-30","ultimo_pro":"Decreto Ministeriale","rif_legge_":"L. 1089/1939","tutela":"Diretto","vincolo":"Diretto"},"geometry":{"type":"MultiPolygon","coordinates":[[[[11.61822076291018,44.833541073488242],[11.617959876422175,44.833686023550882],[11.61797215086747,44.833696139088389],[11.617739463699969,44.833834140149328],[11.618077577724135,44.83414853338207],[11.61833917676481,44.834033497759528],[11.618145458765866,44.833855573693256],[11.618130990616681,44.833842276829429],[11.618151391257969,44.833830988308684],[11.618175690515724,44.833817512862872],[11.618195794344658,44.833806375183059],[11.618381947558731,44.8337032164955],[11.618301341467774,44.833622122835067],[11.618221558269552,44.833541874409931],[11.61822076291018,44.833541073488242]]]]}},{"type":"Feature","properties":{"gid":"167","id_archeo":"43","codice":"043_FC","nome":"Strutture di epoca romana","titolo":"Materiali archeologici e strutture di epoca romana","tipo_propr":"Privata","comuni":"FORLIMPOPOLI","sigla_pro":"FC","localita":"Ex Podere Carmine","tipologie":"Struttura abitativa o insediamento - Epoca Età Romana","provvedime":"Decreto Ministeriale (21/12/1962)","data_ultim":"1962-12-21","ultimo_pro":"Decreto Ministeriale","rif_legge_":"L. 1089/1939","tutela":"Diretto","vincolo":"Diretto"},"geometry":{"type":"MultiPolygon","coordinates":[[[[12.132452720055094,44.191659811451316],[12.132464778006405,44.19152155800635],[12.132425482758388,44.191522047068396],[12.132221747106719,44.191528674168211],[12.13217449952265,44.191531249458343],[12.132092555983965,44.191533129631026],[12.131959849861303,44.191538311610891],[12.131783905847721,44.191545706435939],[12.131738170316918,44.19154753784948],[12.131514478977493,44.191558232270225],[12.131447134059304,44.191563357367066],[12.131296824361687,44.191569273738672],[12.1312033294766,44.19157441409336],[12.131064095117104,44.191582492932753],[12.130915814417266,44.191589865550007],[12.130831877229507,44.19159426621431],[12.130708216908193,44.191599441606051],[12.130591601876024,44.191605341832805],[12.130578528765561,44.19160751000755],[12.130327697803246,44.191617497275644],[12.130281945770394,44.191620435868408],[12.13009195313883,44.191630725186513],[12.130038161354863,44.191633299061621],[12.129970292377507,44.19163444053487],[12.129847635743859,44.191642504281127],[12.129746602502335,44.191647301052001],[12.129606373869514,44.191656458682992],[12.12949376956356,44.191663436114574],[12.129225856624076,44.1916766892382],[12.129300167159828,44.191909617547431],[12.129377483575295,44.192126997009645],[12.129459331075092,44.192357386840754],[12.129542175381461,44.192588865582607],[12.129556719932358,44.192626754455773],[12.129657339571565,44.192889065400138],[12.129683736979413,44.192969769312008],[12.129696263698587,44.193008064611114],[12.129810521120262,44.193349691783716],[12.129818061659606,44.19337227936996],[12.130108427082316,44.193249388234776],[12.130728816661065,44.192986554155361],[12.131051310060418,44.19284806898758],[12.131858065978538,44.192510183113612],[12.132340786853538,44.192304629828712],[12.132403586628762,44.192279607336694],[12.132418791010206,44.192067945494159],[12.132452720055094,44.191659811451316]]]]}},{"type":"Feature","properties":{"gid":"168","id_archeo":"14","codice":"014_BO","nome":"Strutture di età romana","titolo":"Resti di un complesso edilizio di ambito rurale databile all'età imperiale romana","tipo_propr":null,"comuni":"CALDERARA DI RENO","sigla_pro":"BO","localita":null,"tipologie":"Struttura abitativa o insediamento - Epoca Età Romana","provvedime":"Decreto Ministeriale (20/07/1994)","data_ultim":"1994-07-20","ultimo_pro":"Decreto Ministeriale","rif_legge_":"L. 1089/1939","tutela":"Diretto","vincolo":"Diretto"},"geometry":{"type":"MultiPolygon","coordinates":[[[[11.300370304352949,44.543381531409914],[11.300318373941129,44.543301557786023],[11.300286551418635,44.54325268676515],[11.300281657432901,44.543248284296162],[11.300242706042004,44.543258072027669],[11.300075031442823,44.543315466763268],[11.300068210714535,44.543302100818558],[11.299940882329368,44.543345178405588],[11.299934770614387,44.543349802783354],[11.299926909412415,44.543349961276554],[11.299920443204256,44.543345590487931],[11.29991415424268,44.543345717276104],[11.299907688043502,44.543341346487168],[11.299904366316127,44.54333691230061],[11.299849114868637,44.543252504268786],[11.29981959682129,44.543262101673029],[11.299802479432534,44.543266947922575],[11.299758988459253,44.543281328162607],[11.299703096773477,44.543300459537051],[11.299571228590329,44.54334812938199],[11.299566511869147,44.543348224458704],[11.299552538925242,44.543353007284615],[11.299755895209385,44.54368199334111],[11.300215608343493,44.543528687746814],[11.300375600756979,44.543475949774326],[11.300422615892989,44.543460663711116],[11.300388663976992,44.543408169015521],[11.300370304352949,44.543381531409914]]]]}},{"type":"Feature","properties":{"gid":"169","id_archeo":"70","codice":"070_FE","nome":"Strutture di età romana e post-classica","titolo":"Il terreno conserva i resti di strutture attribuibili ad età romana e post classica. Il ritrovamento è nei pressi di un lobo di meandro dell’antico Po di Volano. \nNella zona A è stato individuato nel corso del 1983, l’impianto di una fornace a cam","tipo_propr":"Privata","comuni":"LAGOSANTO","sigla_pro":"FE","localita":"Le Vignole","tipologie":"Struttura abitativa o insediamento - Epoca Età Romana, Struttura produttiva - artigianale - Epoca Età Tardoantica","provvedime":"Decreto Ministeriale (26/06/1992)","data_ultim":"1992-06-26","ultimo_pro":"Decreto Ministeriale","rif_legge_":"L. 1089/1939","tutela":"Diretto","vincolo":"Diretto"},"geometry":{"type":"MultiPolygon","coordinates":[[[[12.143489555035604,44.787416880904317],[12.143434530170179,44.787265963985327],[12.143230003974116,44.787328074404726],[12.143247061930332,44.787401923427083],[12.143314657370682,44.787468221421172],[12.143489555035604,44.787416880904317]]],[[[12.145711666314028,44.788653922376959],[12.145705736840267,44.788591144351635],[12.145770858796432,44.788590122380924],[12.145758887811024,44.788563392725244],[12.145742402899112,44.78844877560045],[12.145662581549438,44.788334068934105],[12.145536825844841,44.788157111375078],[12.145521282609892,44.788140004260889],[12.145404705567472,44.788004436388015],[12.145349007109319,44.787938367858906],[12.145330885871198,44.787918156836014],[12.144495323335498,44.788260882432759],[12.144849604771021,44.788686978313187],[12.144873521328501,44.788757771749729],[12.144952580215108,44.78947369449925],[12.145817058001652,44.789425975416123],[12.14580460030902,44.789327260776034],[12.145747279286848,44.788916183866505],[12.145711666314028,44.788653922376959]]]]}},{"type":"Feature","properties":{"gid":"170","id_archeo":"72","codice":"072_FE","nome":"Strutture murarie di età romana imperiale","titolo":"Due fornaci di età romano-imperiale con vaste aree di concotto, di cui una più grande, della lunghezza di 13,50 m, forse destinata alla cottura di laterizi, e uno scarico di laterizi, principalmente tegole, coppi e qualche mattone frammentato con rare","tipo_propr":"Privata","comuni":"OSTELLATO","sigla_pro":"FE","localita":"San Giovanni di Ostellato, loc. Bivio Gallare","tipologie":"Struttura produttiva - artigianale - Epoca Età Romana","provvedime":"Decreto Ministeriale (01/07/1983), Decreto Ministeriale (30/01/1984)","data_ultim":"1984-01-30","ultimo_pro":"Decreto Ministeriale","rif_legge_":"L. 1089/1939","tutela":"Diretto","vincolo":"Diretto"},"geometry":{"type":"MultiPolygon","coordinates":[[[[12.01911025356438,44.741751404324702],[12.018849098318404,44.741220288461491],[12.018386881328071,44.741382674678057],[12.018179405343089,44.74094547723336],[12.017868110809195,44.741059242812213],[12.017166885215689,44.741317384762439],[12.017275414997076,44.741612044198888],[12.017361653686562,44.741824121612105],[12.017453827167833,44.742053905395444],[12.017509524781573,44.742275378389017],[12.017629542164915,44.74227375730019],[12.017819017268058,44.742283895097579],[12.017953285857448,44.742306709566535],[12.018123659355071,44.742376908992213],[12.018222605001711,44.742412198181519],[12.018291943128796,44.7424142613933],[12.018382420150639,44.742392702281293],[12.018403199629446,44.742382547390335],[12.018415755112679,44.742373339262123],[12.018536222471129,44.742315014755185],[12.018632186384762,44.742179372808693],[12.018747250655258,44.74203384531809],[12.018858289943273,44.741924287917747],[12.019020756694342,44.741788695059348],[12.01911025356438,44.741751404324702]]]]}},{"type":"Feature","properties":{"gid":"171","id_archeo":"118","codice":"118_PR","nome":"Strutture romane","titolo":"A causa di un movimento franoso del terreno in località Fienile di Mulazzano, in comune di Lesignano de’ Bagni, nei primi anni ’70 del secolo scorso è venuta alla luce una cavità ellittica rivestita da ciottoli fluviali e contenente materiali rife","tipo_propr":"Privata","comuni":"LESIGNANO DE`BAGNI","sigla_pro":"PR","localita":"Mulazzano, loc. Fienile","tipologie":"Struttura abitativa o insediamento - Epoca Età Romana","provvedime":"Decreto Ministeriale (17/03/1975)","data_ultim":"1975-03-17","ultimo_pro":"Decreto Ministeriale","rif_legge_":"L. 1089/1939","tutela":"Diretto","vincolo":"Diretto"},"geometry":{"type":"MultiPolygon","coordinates":[[[[10.27810050992557,44.606572540730042],[10.278000788799281,44.606486759341699],[10.277986332965998,44.606508505924964],[10.277853867484033,44.60663961205811],[10.27762044990536,44.606828201495183],[10.277476485233175,44.606898174892585],[10.277305506684275,44.606956287943028],[10.277222854042456,44.606989775122202],[10.278844998428074,44.607879027106591],[10.278952869196385,44.607772538358439],[10.279154627916622,44.607531619013628],[10.279190902920858,44.60749577972831],[10.279266734331332,44.607421462711322],[10.279401785245534,44.607286500020834],[10.279109081993228,44.607125178522168],[10.278142533411005,44.606592505945379],[10.27810050992557,44.606572540730042]]]]}},{"type":"Feature","properties":{"gid":"172","id_archeo":"121","codice":"121_PR","nome":"Successione stratigrafica, tombe d'epoca alto e basso medievale","titolo":"Strutture murarie di un edificio sacro medievale (chiesa di Sant'Antonino), tombe di epoca alto e basso medievale e resti di un isolato urbano d'epoca romana","tipo_propr":"Privata","comuni":"PARMA","sigla_pro":"PR","localita":null,"tipologie":"Luogo di culto - Epoca Età Medievale, Sepoltura-e - Epoca Età Altomedievale, Sepoltura-e - Epoca Età Medievale, Struttura abitativa o insediamento - Epoca Età Romana","provvedime":"Decreto Ministeriale (27/04/1993)","data_ultim":"1993-04-27","ultimo_pro":"Decreto Ministeriale","rif_legge_":"L. 1089/1939","tutela":"Diretto","vincolo":"Diretto"},"geometry":{"type":"MultiPolygon","coordinates":[[[[10.328096381451209,44.803194940486271],[10.328054409627885,44.803126419465798],[10.327870863926639,44.803178200430381],[10.327903711561621,44.803245297311406],[10.327946061629579,44.803233903303436],[10.327954242595855,44.803231701675863],[10.328096381451209,44.803194940486271]]]]}},{"type":"Feature","properties":{"gid":"173","id_archeo":"36","codice":"036_BO","nome":"Terramara","titolo":"In località Montirone, dall’esplicito toponimo indicante un “piccolo rilievo naturale del terreno” (montironum, italianizzato ‘montirone/montironi’), è emerso un sito di notevole interesse, in cui si sovrappongono una terramara dell’età de","tipo_propr":"Privata","comuni":"SANT`AGATA BOLOGNESE","sigla_pro":"BO","localita":"Montirone","tipologie":"Struttura abitativa o insediamento - Epoca Età del Bronzo","provvedime":"Decreto Ministeriale (06/08/1991)","data_ultim":"1991-08-06","ultimo_pro":"Decreto Ministeriale","rif_legge_":"L. 1089/1939","tutela":"Diretto","vincolo":"Diretto"},"geometry":{"type":"MultiPolygon","coordinates":[[[[11.143640182649458,44.642511337091577],[11.143443839809187,44.642288529687825],[11.143334335211984,44.642163835408262],[11.143059150715708,44.642224097568651],[11.142682483703476,44.642308950314536],[11.142534433565244,44.642287964422742],[11.142463633259352,44.6422143953343],[11.142053167835241,44.642340210523713],[11.141506399649669,44.642503871062154],[11.141134170584438,44.642613481523426],[11.140958604887356,44.642708238260361],[11.140909195363822,44.642736171954063],[11.140800467746459,44.642796906326694],[11.1403882364501,44.643039417373245],[11.140384429309076,44.643045610294323],[11.139883822329983,44.643185180448341],[11.139766845564218,44.643217792571285],[11.139464843509046,44.643303395066049],[11.139117755252311,44.643397403840488],[11.139352328828007,44.643840357747195],[11.13776266519643,44.644211495761191],[11.137465253568292,44.64428092989899],[11.137422626253288,44.644290880942151],[11.137787653560821,44.645070233162585],[11.137630331712911,44.645114313380681],[11.137649960368993,44.645148552875533],[11.138072681535473,44.645757566332904],[11.138319382753778,44.646115552637504],[11.138577426639852,44.646493850848444],[11.138931167100926,44.64699464279056],[11.139078745776354,44.646944647131072],[11.139719507798272,44.646729543551423],[11.139756378412491,44.646716913415851],[11.140771560346892,44.646369167052164],[11.141142793818279,44.646231849672574],[11.141642376376586,44.646046030886914],[11.141772255824442,44.645997919518287],[11.142116327134211,44.645903901709055],[11.142757450413624,44.645699216838608],[11.142928460592202,44.645645620014569],[11.143331888030469,44.645519186733615],[11.143389787882098,44.645502615343993],[11.14337229214091,44.645479538233836],[11.143827942096177,44.645320101367183],[11.144458507251477,44.64510300219888],[11.144938703474249,44.644939138617076],[11.14482513002983,44.644718018589742],[11.144768264121133,44.644612141174917],[11.144647728293091,44.644393672445609],[11.144539489547887,44.644194057161826],[11.144456520384679,44.644050500781091],[11.144323598486686,44.643865392609712],[11.14426520917001,44.643786550193603],[11.144178275400092,44.643658551907258],[11.14414171916029,44.643569936858221],[11.144111198269693,44.643508215036555],[11.144124992403937,44.643362480045454],[11.144125350427492,44.643331145613324],[11.144125177932994,44.643312784332565],[11.144115335954806,44.643292084131943],[11.144091036050266,44.643221243190219],[11.14407803722149,44.643183318046923],[11.144049373579774,44.643117240243512],[11.144026254357959,44.643064741617636],[11.143984101380376,44.642988474682305],[11.143903403517532,44.642865400239558],[11.143781044271158,44.642679372769152],[11.14378791498171,44.642674202442457],[11.143747951036778,44.642629942180371],[11.143640182649458,44.642511337091577]]]]}},{"type":"Feature","properties":{"gid":"174","id_archeo":"188","codice":"188_RE","nome":"Terramara","titolo":"Area con i resti di una delle più grandi terramare conosciute, con numerosi reperti da attribuire in prevalenza al Bronzo Medio, con altri riferibili all’inizio del Bronzo Finale. \nGià segnalata nel 1863 e presente sulla Carta archeologica di Chieric","tipo_propr":"Privata","comuni":"CAMPEGINE","sigla_pro":"RE","localita":"Case del Lago","tipologie":"Struttura abitativa o insediamento - Epoca Età del Bronzo","provvedime":"Decreto Ministeriale (03/07/1985)","data_ultim":"1985-07-03","ultimo_pro":"Decreto Ministeriale","rif_legge_":"L. 1089/1939","tutela":"Diretto","vincolo":"Diretto"},"geometry":{"type":"MultiPolygon","coordinates":[[[[10.492850446613607,44.772704916860683],[10.492907651798024,44.772683122249731],[10.493079770785124,44.772984877514354],[10.493536823459706,44.772824920784309],[10.49303282453193,44.772170631947297],[10.492985053445645,44.772115678371811],[10.493456350292464,44.771974664905237],[10.493418347944717,44.771818743512419],[10.493747093986755,44.771730787601854],[10.493638960560038,44.771518792212682],[10.493467156944483,44.771500162204013],[10.493418295024963,44.771457986991138],[10.493558308744834,44.771466852582748],[10.493895736860363,44.771503451146167],[10.493957900852946,44.771512287892484],[10.493990805459084,44.771527349750919],[10.494289584152401,44.771543190187572],[10.494413809451148,44.771558344005342],[10.494515523112604,44.771566959845572],[10.494693598495978,44.771566510180548],[10.494796341671664,44.771575841459423],[10.494900611237732,44.771567436754523],[10.495104272688554,44.77159226209136],[10.495246675855217,44.771586553420342],[10.495333226700279,44.771597203506502],[10.4954452943976,44.771595195607453],[10.495486856867631,44.771576512226119],[10.495641059854709,44.77150557316434],[10.495945079130745,44.771440016691976],[10.495943083604185,44.77142342517422],[10.495789720919195,44.771026232457722],[10.495756635059985,44.770940534920364],[10.495595811920456,44.77052397734812],[10.495585756852904,44.770492323047399],[10.495189399164904,44.769613825275222],[10.495070269999781,44.769301239331725],[10.494986768809346,44.769263144347583],[10.495059120900994,44.769250383662495],[10.495346480884157,44.769205670467343],[10.495627442976032,44.769167197726659],[10.49581367803561,44.769134097252291],[10.494721013183003,44.768491009784611],[10.494425800262373,44.768422723200743],[10.494330959314713,44.768335934068055],[10.494288827717032,44.768265360759671],[10.494233248231751,44.767993327876319],[10.494219218137031,44.767509627539788],[10.494171206230385,44.767463355486832],[10.49342127849172,44.766304564487719],[10.492976701781501,44.766473008636545],[10.492736876483972,44.76656471494455],[10.491919220596838,44.766866211340236],[10.491664906003786,44.766966080488544],[10.491585854168953,44.766986764580942],[10.491404941420821,44.766730662673098],[10.491071223742676,44.766838562209458],[10.489246642139287,44.767406005745038],[10.48936988718741,44.768579806031354],[10.489369597462765,44.768780383138377],[10.48930191571228,44.768895942332158],[10.489185429031396,44.769042924849096],[10.488829400408578,44.769520496397952],[10.488579645026105,44.76991843603944],[10.48849939580886,44.770073209206643],[10.488540474311533,44.770083202391028],[10.488569680131437,44.770103321846307],[10.488579658123541,44.770110195307261],[10.48864342109038,44.770170720618133],[10.488476762809178,44.770135671996712],[10.488130504083724,44.770059383698104],[10.487554952582872,44.770105889395971],[10.487553020127036,44.770498138361724],[10.488536892369169,44.771103573869652],[10.489879651017583,44.771962007263824],[10.49004047439966,44.772065295695526],[10.490029509428554,44.772071658263307],[10.490114775206649,44.772125700640217],[10.490052591451134,44.772168173374702],[10.490272695539153,44.772305524588923],[10.490520017924513,44.772436326683504],[10.490682173382387,44.772517424021139],[10.491132934364517,44.77271824150872],[10.491318176165866,44.772790331508979],[10.491374313433074,44.772836489581401],[10.491585554517924,44.772947947282034],[10.491715352928759,44.772997355777889],[10.491947932927243,44.773039830874986],[10.492247865569425,44.773007960058216],[10.492495725758179,44.77291215292837],[10.492545545596201,44.772880345812922],[10.492850446613607,44.772704916860683]]]]}},{"type":"Feature","properties":{"gid":"175","id_archeo":"234","codice":"234_RA","nome":"Tomba romana","titolo":"Tomba romana, conservata parzialmente in elevato","tipo_propr":"Pubblica","comuni":"FAENZA","sigla_pro":"RA","localita":null,"tipologie":"Sepoltura-e - Epoca Età Romana","provvedime":"Regio Decreto (28/09/1904)","data_ultim":"1904-09-28","ultimo_pro":"Regio Decreto","rif_legge_":null,"tutela":"Diretto","vincolo":"Area demaniale"},"geometry":{"type":"MultiPolygon","coordinates":[[[[11.933205947410494,44.294459946726029],[11.933174796324774,44.294412062042383],[11.933104128412586,44.294444010048139],[11.933144197424475,44.294488244551481],[11.933205947410494,44.294459946726029]]]]}},{"type":"Feature","properties":{"gid":"176","id_archeo":"185","codice":"185_RE","nome":"Tracce di stanziamenti databili alla fine della penultima glaciazione","titolo":"Esteso e consistente deposito di manufatti litici in giacitura primaria riconducibile ad un accampamento formatosi in seguito a ripetute frequentazioni, avvenute in una fase avanzata del Paleolitico medio. Si tratta di una delle testimonianze più antich","tipo_propr":"Privata","comuni":"BIBBIANO","sigla_pro":"RE","localita":"Casa del Ghiardo","tipologie":"Struttura abitativa o insediamento - Epoca Paleolitico","provvedime":"Decreto Ministeriale (18/01/1982)","data_ultim":"1982-01-18","ultimo_pro":"Decreto Ministeriale","rif_legge_":"L. 1089/1939","tutela":"Diretto","vincolo":"Diretto"},"geometry":{"type":"MultiPolygon","coordinates":[[[[10.501780810424254,44.657536663697357],[10.501656364499274,44.657450348734919],[10.501593634999256,44.657475488537209],[10.501328930276031,44.657291219060816],[10.501322124316044,44.657298735354388],[10.500367981620609,44.656626712154349],[10.498146914454042,44.655062248429147],[10.498075566112941,44.655034287358994],[10.498004159102873,44.65503342364984],[10.497505773235272,44.655211542285329],[10.496715103511821,44.655539415654758],[10.495517723034691,44.656016195703209],[10.493984383133624,44.656627710783809],[10.494305602533256,44.657024465965861],[10.494489908191266,44.657251610212505],[10.494610050323653,44.657401544867994],[10.494649681047513,44.657446757342832],[10.49547250968558,44.658519939596069],[10.495884471819734,44.659065118331576],[10.496022486033514,44.659247585332302],[10.496159381260856,44.659425745763798],[10.496295812113097,44.659595630086933],[10.497112257798864,44.660643857592952],[10.49930945993532,44.659778726920464],[10.501522603089716,44.658907249825141],[10.502000166817515,44.658719188116009],[10.502905806461406,44.658339713027651],[10.502547372051442,44.65808678687182],[10.502263892628608,44.657881971547255],[10.502215386675505,44.657846924924776],[10.501978148121754,44.657676303075618],[10.501780810424254,44.657536663697357]]],[[[10.502476928870792,44.659338839006857],[10.50201457413279,44.658793536800566],[10.501627836530119,44.658944008399359],[10.500479185488967,44.659399134339914],[10.499425548896093,44.659817262459832],[10.498338621394559,44.660246080156995],[10.497170673732622,44.66071257067896],[10.497166666060679,44.660714171593867],[10.497943009371125,44.661732131184579],[10.498076887085567,44.661904333348772],[10.498497729614277,44.662445658881133],[10.498960790679618,44.663052720761499],[10.499447038735678,44.663682971952788],[10.499958310747385,44.663468847022145],[10.501260208968148,44.662927001338034],[10.502895167066709,44.662251666504964],[10.504270722846821,44.661682440610015],[10.503884062193837,44.661163425744355],[10.503547174909027,44.660720272835533],[10.503086183184807,44.660128496852344],[10.503005883841572,44.660025407375358],[10.502985472133039,44.659998921501774],[10.502476928870792,44.659338839006857]]]]}},{"type":"Feature","properties":{"gid":"177","id_archeo":"50","codice":"050_FC","nome":"Vasca di epoca romana","titolo":"Vasca di epoca romana, con annesso pozzo e pavimentazione.","tipo_propr":"Privata","comuni":"SARSINA","sigla_pro":"FC","localita":null,"tipologie":"Infrastruttura territoriale o urbana - Epoca Età Romana","provvedime":"Declaratoria (10/10/1967)","data_ultim":"1967-10-10","ultimo_pro":"Declaratoria","rif_legge_":"L. 1089/1939","tutela":"Diretto","vincolo":"Diretto"},"geometry":{"type":"MultiPolygon","coordinates":[[[[12.14223047287487,43.918256285303059],[12.142260498811712,43.918260968376082],[12.142268269014343,43.918236824856834],[12.142241143234497,43.918230216345123],[12.14223047287487,43.918256285303059]]]]}},{"type":"Feature","properties":{"gid":"178","id_archeo":"235","codice":"235_RA","nome":"Villa romana","titolo":"La villa romana di Russi è la testimonianza più completa e significativa dell'insediamento rurale di epoca romana nella regio VIII. L’area comprende due quartieri: uno residenziale a N e uno rustico a S, finalizzato alla produzione agricola per il co","tipo_propr":"Privata, Pubblica","comuni":"RUSSI","sigla_pro":"RA","localita":null,"tipologie":"Struttura abitativa o insediamento - Epoca Età Romana","provvedime":"Decreto Ministeriale (09/05/1953), Decreto Ministeriale (10/09/1982)","data_ultim":"1982-09-10","ultimo_pro":"Decreto Ministeriale","rif_legge_":"L. 1089/1939","tutela":"Indiretto","vincolo":"Indiretto"},"geometry":{"type":"MultiPolygon","coordinates":[[[[12.03272021602651,44.383223192526863],[12.032899967953664,44.383014538550533],[12.032939437043659,44.383033687971164],[12.032951278644713,44.383038378492927],[12.032953741798275,44.383035807630556],[12.033213029698304,44.382765199417356],[12.033327099381067,44.382644711734464],[12.033497110695929,44.382467254427688],[12.03352190459303,44.382460968609259],[12.033485350904447,44.382429488665842],[12.033502633062191,44.382415019533219],[12.033589724549326,44.382331438719355],[12.033677656087011,44.382236186350006],[12.033930495367891,44.381975539886234],[12.034210042640144,44.381689228654977],[12.03403263577402,44.381591813617874],[12.033895880872507,44.381516715404693],[12.033880388185757,44.381508170007272],[12.033790880958147,44.38145877740746],[12.033731571236615,44.381426046400833],[12.033544409474992,44.381321896028773],[12.033435487525082,44.381264079997237],[12.03289736135712,44.380973601584827],[12.03263670587987,44.380831063714204],[12.032591661719461,44.380806433173326],[12.032594295058852,44.380804436645626],[12.032594238788382,44.380804416537181],[12.032873093450569,44.38058615292266],[12.032731208306402,44.380490816297218],[12.032696228960265,44.380465891220432],[12.03260443190903,44.380405899675686],[12.032536451872952,44.380361299267861],[12.032476505120123,44.380328107415963],[12.031963551866447,44.380051214375293],[12.031862796006711,44.380108249773301],[12.031844201895428,44.380114982627013],[12.031839638795143,44.380135026278595],[12.031707498449412,44.380191670394176],[12.03161742835541,44.380112105890468],[12.031464738858908,44.380142252510936],[12.031425871721005,44.380102239650356],[12.028454500861843,44.380924323175066],[12.028421040171592,44.38092731621412],[12.028937936741906,44.381358016953477],[12.028904818570295,44.3813905398084],[12.02892855220383,44.381407977529243],[12.02906831818631,44.381524277874419],[12.029163644269142,44.381605496295407],[12.029264321005266,44.381688715133244],[12.029535520637825,44.381910607155348],[12.029597847423103,44.381963398649319],[12.02990150178551,44.381786565620708],[12.030149811895473,44.381852935017072],[12.030236084747886,44.381843621529278],[12.030817738738024,44.381497447657082],[12.030839320124922,44.381499205918637],[12.031043001850723,44.381626049029855],[12.031008366083229,44.381556489274608],[12.031032616203143,44.381540891928275],[12.031557430766915,44.381187816166253],[12.031655945419848,44.381126331296173],[12.031959820920525,44.381347142158752],[12.032496092121324,44.381739734820904],[12.032169322247148,44.38193647239445],[12.031892048152736,44.382092144255196],[12.031858981894763,44.38207196997444],[12.031820102611638,44.382097921968771],[12.031473167499692,44.382297561078737],[12.031634799643998,44.38242633073795],[12.0320206937915,44.382184784664638],[12.032045365140428,44.382176854982191],[12.032111951081015,44.38213539351522],[12.032526833979516,44.382464909445737],[12.032607981323396,44.382533493384976],[12.032140586605463,44.382829115681758],[12.032527297429352,44.3831407453537],[12.032677057438864,44.383206326006508],[12.03272021602651,44.383223192526863]]],[[[12.032374763197668,44.384152242629476],[12.032653926538952,44.383843393562074],[12.032663269467063,44.383833057975352],[12.033149763032693,44.384057671138919],[12.033165224485019,44.384047821908936],[12.033173010992073,44.3840384144032],[12.03278704524884,44.38385993101577],[12.032344259914048,44.383658992199734],[12.03259828944471,44.383396129536699],[12.032697804218996,44.383300020879339],[12.032617571800255,44.383266171052327],[12.032419572754058,44.383467651250385],[12.032314264403144,44.383574824600238],[12.032093827749822,44.383802251456693],[12.032005827023887,44.383884351866492],[12.031992249922618,44.38391386257139],[12.031880848730323,44.383880291476295],[12.031810709800077,44.383869543129478],[12.031668673352662,44.383892249936771],[12.031733393133077,44.383918140429707],[12.031803548583344,44.3839430582074],[12.03191670042145,44.383984513983641],[12.032374763197668,44.384152242629476]]]]}},{"type":"Feature","properties":{"gid":"179","id_archeo":"235","codice":"235_RA","nome":"Villa romana","titolo":"La villa romana di Russi è la testimonianza più completa e significativa dell'insediamento rurale di epoca romana nella regio VIII. L’area comprende due quartieri: uno residenziale a N e uno rustico a S, finalizzato alla produzione agricola per il co","tipo_propr":"Privata, Pubblica","comuni":"RUSSI","sigla_pro":"RA","localita":null,"tipologie":"Struttura abitativa o insediamento - Epoca Età Romana","provvedime":"Decreto Ministeriale (09/05/1953), Decreto Ministeriale (10/09/1982)","data_ultim":"1982-09-10","ultimo_pro":"Decreto Ministeriale","rif_legge_":"L. 1089/1939","tutela":"Diretto","vincolo":"Area demaniale"},"geometry":{"type":"MultiPolygon","coordinates":[[[[12.033013564260207,44.383354319156453],[12.032776064377556,44.383245420218628],[12.032768740422028,44.383242157996037],[12.032677057438864,44.383206326006508],[12.032527297429352,44.3831407453537],[12.032140586605463,44.382829115681758],[12.032607981323396,44.382533493384976],[12.032526833979516,44.382464909445737],[12.032111951081015,44.38213539351522],[12.032045365140428,44.382176854982191],[12.0320206937915,44.382184784664638],[12.031634799643998,44.38242633073795],[12.031473167499692,44.382297561078737],[12.031820102611638,44.382097921968771],[12.03185773686571,44.38207280067558],[12.031890509832728,44.382093007955767],[12.032169322247148,44.38193647239445],[12.032496092121324,44.381739734820904],[12.031959820920525,44.381347142158752],[12.031655945419848,44.381126331296173],[12.031557430766915,44.381187816166253],[12.031032616203143,44.381540891928275],[12.031008366083229,44.381556489274608],[12.031043001850723,44.381626049029855],[12.030839320124922,44.381499205918637],[12.030817738738024,44.381497447657082],[12.030236084747886,44.381843621529278],[12.030149811895473,44.381852935017072],[12.02990150178551,44.381786565620708],[12.029597847423103,44.381963398649319],[12.029778314013967,44.382116264480153],[12.029804086445905,44.382138095972962],[12.030179240901809,44.382450157565962],[12.029999247426659,44.382668367935999],[12.029807867140526,44.382909926651934],[12.029635432647133,44.383120931786323],[12.02954858805297,44.383230096893705],[12.029357776903472,44.383461593007496],[12.029678575927484,44.383591900223514],[12.030150398153994,44.383787207810535],[12.030563736031056,44.383392994850155],[12.030631707676863,44.383330188700825],[12.030659475590443,44.383439820764359],[12.030868365065542,44.383548025836994],[12.030878964116898,44.383602064874943],[12.031465739456371,44.383815549605764],[12.031668673352662,44.383892249936771],[12.031810709800077,44.383869543129478],[12.031880848730323,44.383880291476295],[12.031992249922618,44.38391386257139],[12.032005827023887,44.383884351866492],[12.032093827749822,44.383802251456693],[12.032314264403144,44.383574824600238],[12.032419572754058,44.383467651250385],[12.032617571800255,44.383266171052327],[12.032697804218996,44.383300020879339],[12.03259828944471,44.383396129536699],[12.032344259914048,44.383658992199734],[12.03278704524884,44.38385993101577],[12.033173010992073,44.3840384144032],[12.03352631980367,44.38367300104418],[12.033578173436478,44.383609289376089],[12.033283623804909,44.383478673273387],[12.033013564260207,44.383354319156453]]]]}},{"type":"Feature","properties":{"gid":"180","id_archeo":"92","codice":"092_PC","nome":"Villa romana della prima età imperiale","titolo":"Tra le cascine denominate La Secca e la Secchetta, in comune di Monticelli d’Ongina, nel 1987, ripetuti sopralluoghi condotti dalla Soprintendenza evidenziarono la presenza di una vasta area di circa 250x300 metri in cui affioravano materiali ceramici,","tipo_propr":"Privata","comuni":"MONTICELLI D`ONGINA","sigla_pro":"PC","localita":"La Secca","tipologie":"Sepoltura-e - Epoca Età Romana, Struttura abitativa o insediamento - Epoca Età Romana, Struttura abitativa o insediamento - Epoca Età Altomedievale, Struttura produttiva - artigianale - Epoca Età Romana","provvedime":"Decreto Soprintendente Regionale (03/04/2002)","data_ultim":"2002-04-03","ultimo_pro":"Decreto Soprintendente Regionale","rif_legge_":"D. Lgs. 490/1999","tutela":"Diretto","vincolo":"Diretto"},"geometry":{"type":"MultiPolygon","coordinates":[[[[9.949688276007867,45.044622450638137],[9.949584056181518,45.04210843588298],[9.948957305802919,45.042120699327484],[9.94674631009816,45.042178705950739],[9.946752706812653,45.042331022118049],[9.946787122367132,45.043046003384958],[9.946805269108422,45.043458104050465],[9.946832598563294,45.043976591692122],[9.946857455369413,45.044696981035386],[9.946940703145108,45.044696317440682],[9.947202431561148,45.044688078674582],[9.947654077294002,45.044678190697709],[9.948140222079738,45.044663666541055],[9.948614247963471,45.044651140395843],[9.948836324796773,45.044646197975325],[9.949078060972605,45.04463915629001],[9.94937238175836,45.044630029423345],[9.949688276007867,45.044622450638137]]]]}},{"type":"Feature","properties":{"gid":"181","id_archeo":"92","codice":"092_PC","nome":"Villa romana della prima età imperiale","titolo":"Tra le cascine denominate La Secca e la Secchetta, in comune di Monticelli d’Ongina, nel 1987, ripetuti sopralluoghi condotti dalla Soprintendenza evidenziarono la presenza di una vasta area di circa 250x300 metri in cui affioravano materiali ceramici,","tipo_propr":"Privata","comuni":"MONTICELLI D`ONGINA","sigla_pro":"PC","localita":"La Secca","tipologie":"Sepoltura-e - Epoca Età Romana, Struttura abitativa o insediamento - Epoca Età Romana, Struttura abitativa o insediamento - Epoca Età Altomedievale, Struttura produttiva - artigianale - Epoca Età Romana","provvedime":"Decreto Soprintendente Regionale (03/04/2002)","data_ultim":"2002-04-03","ultimo_pro":"Decreto Soprintendente Regionale","rif_legge_":"D. Lgs. 490/1999","tutela":"Indiretto","vincolo":"Indiretto"},"geometry":{"type":"MultiPolygon","coordinates":[[[[9.952890071762232,45.045071663065301],[9.952886741375099,45.044337779065536],[9.9528723261816,45.041161347476596],[9.952822763180899,45.041161984617943],[9.952162217426729,45.041175465306083],[9.950513594578277,45.041198118156451],[9.950227708029809,45.041202550899371],[9.950145592823077,45.041203828589708],[9.950149253610572,45.041286181778084],[9.949736079011297,45.0412905655879],[9.949092139720079,45.041302763067094],[9.948923548794392,45.041305776089288],[9.94791485841861,45.041323780252213],[9.946707354440267,45.041349230764183],[9.946494045586348,45.041353844315559],[9.945731438343042,45.041365989611492],[9.9454022198231,45.041372974712203],[9.945230934248002,45.041376607712465],[9.944598150065302,45.041387814303377],[9.944386972742874,45.041392352266101],[9.943737487109363,45.041403278194785],[9.943366216600436,45.041412630491976],[9.943066516585983,45.041422623506044],[9.9430896248753,45.041987721887168],[9.943097998997327,45.042281891530173],[9.94311234874856,45.04259199881686],[9.943116752020586,45.042666820630544],[9.943123588864653,45.042883615264721],[9.943131572776487,45.043111490517937],[9.943141164322336,45.043330557811089],[9.943149552790462,45.04355445094393],[9.943162745915847,45.043860579957069],[9.943173136396362,45.044073384431854],[9.943192336088929,45.044527163752583],[9.943201128502487,45.04468363974037],[9.943205824301902,45.044794798987041],[9.943210333566153,45.044901557938111],[9.943221527535789,45.045135419719514],[9.943238296557878,45.045520031945969],[9.94324872099471,45.045740271480184],[9.943258327030387,45.045899873295149],[9.943265184805199,45.046025903468454],[9.94327117732273,45.046183509755558],[9.94327917851815,45.046334303159981],[9.943288392529036,45.046478533289076],[9.943314002114381,45.046942845429889],[9.943317257114899,45.047030432085428],[9.943664688025013,45.047007756550563],[9.944043348075464,45.046980725902067],[9.944684239508685,45.046936815231625],[9.945032197801739,45.046914617259738],[9.945355668837614,45.04689289109119],[9.945648446668052,45.046872615518637],[9.945990339212914,45.046849933777473],[9.946253766307228,45.046830133943544],[9.946584060344129,45.046807942651597],[9.946947797203785,45.046780900097161],[9.948885904506136,45.046648133891601],[9.949563540564856,45.04659983958858],[9.949912263979986,45.046574235729679],[9.950279482556972,45.046550592234567],[9.950324502525751,45.046544771391417],[9.950349063938859,45.046541902395759],[9.950673605434174,45.046497647983564],[9.950882014903481,45.046469798065381],[9.951819094459424,45.046340338816627],[9.952186869911039,45.046291497270353],[9.952660199708223,45.046227981932482],[9.952895179313446,45.046196843414499],[9.952890071762232,45.045071663065301]],[[9.948957305802919,45.042120699327484],[9.949584056181518,45.04210843588298],[9.949688276007867,45.044622450638137],[9.94937238175836,45.044630029423345],[9.949078060972605,45.04463915629001],[9.948836324796773,45.044646197975325],[9.948614247963471,45.044651140395843],[9.948140222079738,45.044663666541055],[9.947654077294002,45.044678190697709],[9.947202431561148,45.044688078674582],[9.946940703145108,45.044696317440682],[9.946857455369413,45.044696981035386],[9.946832598563294,45.043976591692122],[9.946805269108422,45.043458104050465],[9.946787122367132,45.043046003384958],[9.946752706812653,45.042331022118049],[9.94674631009816,45.042178705950739],[9.948957305802919,45.042120699327484]]]]}},{"type":"Feature","properties":{"gid":"182","id_archeo":"47","codice":"047_FC","nome":"Villa romana di età imperiale","titolo":"G. Bermond Montanari ritenne che il complesso di Fiumana di Predappio potesse costituire una grande villa formata dalla parte rustica e da quella residenziale, dotata anche di un impianto termale.\nLa località è nota per i suoi ritrovamenti archeologici","tipo_propr":"Privata","comuni":"PREDAPPIO","sigla_pro":"FC","localita":"Fiumana","tipologie":"Struttura abitativa o insediamento - Epoca Età Romana","provvedime":"Decreto Ministeriale (25/09/1978)","data_ultim":"1978-09-25","ultimo_pro":"Decreto Ministeriale","rif_legge_":"L. 1089/1939","tutela":"Diretto","vincolo":"Diretto"},"geometry":{"type":"MultiPolygon","coordinates":[[[[11.990480382287672,44.153195653310981],[11.990468940957937,44.153176380590047],[11.989727187564965,44.153392331062228],[11.988891764357966,44.15362922920086],[11.988924705875878,44.153678888059659],[11.988959598570521,44.153731476555855],[11.989175364954546,44.154054563621443],[11.989280448466126,44.154208195018654],[11.989341101627149,44.154393950455152],[11.989450623939128,44.154724458737356],[11.991097280078982,44.15423476426907],[11.990717600907805,44.1535952322117],[11.990480382287672,44.153195653310981]]]]}},{"type":"Feature","properties":{"gid":"183","id_archeo":"89","codice":"089_PC","nome":"Villa romana di età imperiale","titolo":"Durante i lavori di indagini preventive per il passaggio del metanodotto Cortemaggiore-Ripalta, effettuati nel 1995 nell'area compresa fra la via Caorsana, antica via Postumia, e l'autostrada A21, nei campi della cascina Brè, sono venuti in luce i resti","tipo_propr":"Privata","comuni":"CAORSO","sigla_pro":"PC","localita":"Brè di sopra","tipologie":"Struttura abitativa o insediamento - Epoca Età Romana, Struttura abitativa o insediamento - Epoca Età Romana","provvedime":"Decreto Ministeriale (17/03/1997)","data_ultim":"1997-03-17","ultimo_pro":"Decreto Ministeriale","rif_legge_":"L. 1089/1939","tutela":"Diretto","vincolo":"Diretto"},"geometry":{"type":"MultiPolygon","coordinates":[[[[9.8533144173462,45.04453653744298],[9.853305599465404,45.044554939796846],[9.851899989927624,45.044254404438625],[9.850960210098823,45.046436032634496],[9.852524034598551,45.046767326859765],[9.853072482373193,45.046143987413849],[9.853241570920636,45.045766415503302],[9.853120140990406,45.045733979158328],[9.853093832776281,45.045772282606208],[9.852992487828336,45.0457349332167],[9.853057266493316,45.045572493562396],[9.853055921176347,45.045481998920977],[9.853166099438146,45.045209662219769],[9.853190212043952,45.045023708883861],[9.853281367895702,45.044827727877227],[9.8533144173462,45.04453653744298]]]]}},{"type":"Feature","properties":{"gid":"184","id_archeo":"107","codice":"107_PR","nome":"Villa romana","titolo":"Si tratta di una villa romana individuata in località Lemignano in prossimità dell’attuale SS della Cisa, l’antica via per Luni di età romana. Una serie di sepolture, che si sovrappongono alle strutture romane, è stata inoltre messa in luce dallo","tipo_propr":"Privata","comuni":"COLLECCHIO","sigla_pro":"PR","localita":"Lemignano","tipologie":"Struttura abitativa o insediamento - Epoca Età Romana","provvedime":"Decreto Ministeriale (30/01/1984)","data_ultim":"1984-01-30","ultimo_pro":"Decreto Ministeriale","rif_legge_":"L. 1089/1939","tutela":"Diretto","vincolo":"Diretto"},"geometry":{"type":"MultiPolygon","coordinates":[[[[10.256487305284992,44.770523214019818],[10.256491564727762,44.770522663041056],[10.256572668979457,44.770513848789577],[10.256577434560004,44.770513328243865],[10.256643352899621,44.770488396278004],[10.25671662797429,44.770451905666512],[10.25681495289405,44.77034101618252],[10.256743502064161,44.77003762220837],[10.256616362531819,44.770057556611171],[10.256508955976914,44.770074294068316],[10.256374055503574,44.770095321833672],[10.256487305284992,44.770523214019818]]]]}},{"type":"Feature","properties":{"gid":"185","id_archeo":"2","codice":"002_BO","nome":"Villa rustica di epoca romana","titolo":"Nei terreni ubicati presso lo Scolo Calcarata, nel Comune di Bentivoglio, attraverso scavi stratigrafici e prospezioni geognostiche sono stati riconosciuti alcuni tratti di fondazioni. Si tratta dei resti facenti parte di una grande villa rustica della p","tipo_propr":null,"comuni":"BENTIVOGLIO","sigla_pro":"BO","localita":"Scolo Calcarata","tipologie":"Struttura abitativa o insediamento - Epoca Età Romana","provvedime":"Decreto Ministeriale (02/01/1995)","data_ultim":"1995-01-02","ultimo_pro":"Decreto Ministeriale","rif_legge_":"L. 1089/1939","tutela":"Diretto","vincolo":"Diretto"},"geometry":{"type":"MultiPolygon","coordinates":[[[[11.433250011236172,44.662865767109373],[11.433840853814871,44.664023351829037],[11.435367146279825,44.663661250752561],[11.43498036419258,44.66300338467898],[11.434619180353943,44.662534223189979],[11.433250011236172,44.662865767109373]]]]}},{"type":"Feature","properties":{"gid":"186","id_archeo":"177","codice":"177_RA","nome":"Villa rustica di epoca romana","titolo":"Il podere Danesi si localizza a San Zaccaria, lungo la via Dismano. Alcuni sondaggi, effettuati fra il 1977 e il 1980, hanno permesso di identificare una villa di tipo urbano-rustico di epoca imperiale romana, con fasi insediative anche di epoca successi","tipo_propr":"Privata","comuni":"RAVENNA","sigla_pro":"RA","localita":"San Zaccaria","tipologie":"Struttura abitativa o insediamento - Epoca Età Tardoantica, Struttura abitativa o insediamento - Epoca Età Romana","provvedime":"Decreto Ministeriale (13/06/1983)","data_ultim":"1983-06-13","ultimo_pro":"Decreto Ministeriale","rif_legge_":"L. 1089/1939","tutela":"Diretto","vincolo":"Diretto"},"geometry":{"type":"MultiPolygon","coordinates":[[[[12.214920878888558,44.282963263249201],[12.21508845829327,44.282925954277559],[12.215241560179367,44.282895012465758],[12.215330136689463,44.282890698780967],[12.215264272248765,44.282760155952488],[12.215131445895583,44.28249800278985],[12.214964159880644,44.282162190229492],[12.21489606277612,44.282025220226046],[12.213131408854331,44.282073715259379],[12.213131353212681,44.282074785407488],[12.213111661279271,44.282392530242284],[12.21308220126309,44.283000904353862],[12.213379024773193,44.282971464570601],[12.213592578085649,44.282952416671264],[12.214067839817652,44.282905986813525],[12.214193407980966,44.282893601474107],[12.214221454264486,44.282898429166742],[12.214283782226559,44.282903623808224],[12.214355447232775,44.282956124122791],[12.214414444232791,44.282953787461054],[12.214724961768882,44.282976181417865],[12.214796427861147,44.28297981304592],[12.214920878888558,44.282963263249201]]]]}},{"type":"Feature","properties":{"gid":"187","id_archeo":"51","codice":"051_FC","nome":"Villa rustica di epoca romana","titolo":"Nel 1935, come indicato nell’Archivio storico della Soprintendenza, nei terreni posti in località Gaggio II, di proprietà dei conti Spalletti, venne in luce un ampio mosaico geometrico con tessere bianche e nere, datato ipoteticamente al I-II secolo","tipo_propr":"Privata","comuni":"SAVIGNANO SUL RUBICONE","sigla_pro":"FC","localita":"Podere Spalletto","tipologie":"Struttura abitativa o insediamento - Epoca Età Romana","provvedime":"Decreto Ministeriale (02/01/1998)","data_ultim":"1998-01-02","ultimo_pro":"Decreto Ministeriale","rif_legge_":"L. 1089/1939","tutela":"Diretto","vincolo":"Diretto"},"geometry":{"type":"MultiPolygon","coordinates":[[[[12.366916746749842,44.079633081053267],[12.366886461909552,44.078622187001564],[12.36687811475495,44.078124290708161],[12.366870308862254,44.077920443967166],[12.366717863977003,44.077907769834944],[12.365824223112398,44.077838144185883],[12.364759012571504,44.077750280486768],[12.363779342199109,44.077671336817495],[12.36337025160163,44.07763884035284],[12.36333535182826,44.077645522580042],[12.363372932803257,44.077887612105059],[12.363390326226334,44.078018591933073],[12.363409523179042,44.078224312465402],[12.363453799800903,44.078579385697694],[12.363474162712947,44.078753688667454],[12.363513550604225,44.079072310240186],[12.363540907646357,44.079293517811919],[12.363559812646598,44.079424489048925],[12.363574224974467,44.079542545177915],[12.365835130788954,44.079626520049175],[12.366223745304634,44.079640950048407],[12.366225364679629,44.079591241971933],[12.366916746749842,44.079633081053267]]]]}},{"type":"Feature","properties":{"gid":"188","id_archeo":"115","codice":"115_PR","nome":"Villa rustica di epoca romana","titolo":"Nella valle del Rio Sporzana, in loc. Roncolongo di Sivizzano in comune di Fornovo Taro, è stato individuato nel 1987 un insediamento databile tra il I sec. a.C. e il I sec. d. C. Tale insediamento è posto in fregio alla strada che collegava Parma a Lu","tipo_propr":"Privata","comuni":"FORNOVO DI TARO","sigla_pro":"PR","localita":"Roncolongo di Sivizzano","tipologie":"Struttura abitativa o insediamento - Epoca Età Romana, Struttura produttiva - artigianale - Epoca Età Romana","provvedime":"Decreto Ministeriale (30/10/1995), Decreto Ministeriale (15/07/1989)","data_ultim":"1995-10-30","ultimo_pro":"Decreto Ministeriale","rif_legge_":"L. 1089/1939","tutela":"Diretto","vincolo":"Diretto"},"geometry":{"type":"MultiPolygon","coordinates":[[[[10.122021956725344,44.652892826271447],[10.122516342772277,44.653394532255575],[10.123028427364057,44.653253965873596],[10.122837418189937,44.653024618304208],[10.122783428596945,44.652938429801623],[10.122600976648457,44.652749634929478],[10.122344116598196,44.652633081892795],[10.122027705961129,44.652874040594284],[10.122021956725344,44.652892826271447]]]]}},{"type":"Feature","properties":{"gid":"189","id_archeo":"115","codice":"115_PR","nome":"Villa rustica di epoca romana","titolo":"Nella valle del Rio Sporzana, in loc. Roncolongo di Sivizzano in comune di Fornovo Taro, è stato individuato nel 1987 un insediamento databile tra il I sec. a.C. e il I sec. d. C. Tale insediamento è posto in fregio alla strada che collegava Parma a Lu","tipo_propr":"Privata","comuni":"FORNOVO DI TARO","sigla_pro":"PR","localita":"Roncolongo di Sivizzano","tipologie":"Struttura abitativa o insediamento - Epoca Età Romana, Struttura produttiva - artigianale - Epoca Età Romana","provvedime":"Decreto Ministeriale (30/10/1995), Decreto Ministeriale (15/07/1989)","data_ultim":"1995-10-30","ultimo_pro":"Decreto Ministeriale","rif_legge_":"L. 1089/1939","tutela":"Diretto","vincolo":"Diretto"},"geometry":{"type":"MultiPolygon","coordinates":[[[[10.122516342772277,44.653394532255575],[10.122243829308699,44.65311798587156],[10.122154639671473,44.65314624566404],[10.122147404577293,44.653186331821509],[10.122302343904423,44.653468727772243],[10.122374038986239,44.653448968577337],[10.122516342772277,44.653394532255575]]]]}},{"type":"Feature","properties":{"gid":"190","id_archeo":"134","codice":"134_PR","nome":"Villa rustica di epoca romana","titolo":"Primo insediamento rustico documentato a ovest della città romana. Resti di una villa rustica d'epoca romana con zona sepolcrale.","tipo_propr":"Privata","comuni":"PARMA","sigla_pro":"PR","localita":"Golese, loc. Crocetta","tipologie":"Sepoltura-e - Epoca Età Romana, Struttura abitativa o insediamento - Epoca Età Romana","provvedime":"Decreto Ministeriale (26/01/1989), Decreto Ministeriale (12/01/1990), Decreto Ministeriale (08/11/1991), Decreto Ministeriale (12/09/1983)","data_ultim":"1991-11-08","ultimo_pro":"Decreto Ministeriale","rif_legge_":"L. 1089/1939","tutela":"Diretto","vincolo":"Diretto"},"geometry":{"type":"MultiPolygon","coordinates":[[[[10.299295153345033,44.810862860698954],[10.300278737129151,44.810659758434156],[10.300251570161546,44.810408182973852],[10.30016723813727,44.810427480436317],[10.299196843642736,44.810632655141703],[10.299295153345033,44.810862860698954]]]]}},{"type":"Feature","properties":{"gid":"191","id_archeo":"134","codice":"134_PR","nome":"Villa rustica di epoca romana","titolo":"Primo insediamento rustico documentato a ovest della città romana. Resti di una villa rustica d'epoca romana con zona sepolcrale.","tipo_propr":"Privata","comuni":"PARMA","sigla_pro":"PR","localita":"Golese, loc. Crocetta","tipologie":"Sepoltura-e - Epoca Età Romana, Struttura abitativa o insediamento - Epoca Età Romana","provvedime":"Decreto Ministeriale (26/01/1989), Decreto Ministeriale (12/01/1990), Decreto Ministeriale (08/11/1991), Decreto Ministeriale (12/09/1983)","data_ultim":"1991-11-08","ultimo_pro":"Decreto Ministeriale","rif_legge_":"L. 1089/1939","tutela":"Diretto","vincolo":"Diretto"},"geometry":{"type":"MultiPolygon","coordinates":[[[[10.300743456906714,44.811073864788163],[10.30071064753098,44.81070579893214],[10.300655848511001,44.810302458647499],[10.300247492708472,44.810386003478477],[10.300251570161546,44.810408182973852],[10.300278737129151,44.810659758434156],[10.300304114185584,44.810904269696586],[10.300333154014789,44.811154752562153],[10.300743456906714,44.811073864788163]]]]}},{"type":"Feature","properties":{"gid":"192","id_archeo":"134","codice":"134_PR","nome":"Villa rustica di epoca romana","titolo":"Primo insediamento rustico documentato a ovest della città romana. Resti di una villa rustica d'epoca romana con zona sepolcrale.","tipo_propr":"Privata","comuni":"PARMA","sigla_pro":"PR","localita":"Golese, loc. Crocetta","tipologie":"Sepoltura-e - Epoca Età Romana, Struttura abitativa o insediamento - Epoca Età Romana","provvedime":"Decreto Ministeriale (26/01/1989), Decreto Ministeriale (12/01/1990), Decreto Ministeriale (08/11/1991), Decreto Ministeriale (12/09/1983)","data_ultim":"1991-11-08","ultimo_pro":"Decreto Ministeriale","rif_legge_":"L. 1089/1939","tutela":"Diretto","vincolo":"Diretto"},"geometry":{"type":"MultiPolygon","coordinates":[[[[10.300655848511001,44.810302458647499],[10.300566574351288,44.809655507365399],[10.300237593292008,44.809689748715918],[10.300165214439547,44.809697315479184],[10.300181277673284,44.809879143942275],[10.300200280832433,44.810007800124602],[10.300221314453619,44.810167706119202],[10.300247492708472,44.810386003478477],[10.300655848511001,44.810302458647499]]]]}},{"type":"Feature","properties":{"gid":"193","id_archeo":"134","codice":"134_PR","nome":"Villa rustica di epoca romana","titolo":"Primo insediamento rustico documentato a ovest della città romana. Resti di una villa rustica d'epoca romana con zona sepolcrale.","tipo_propr":"Privata","comuni":"PARMA","sigla_pro":"PR","localita":"Golese, loc. Crocetta","tipologie":"Sepoltura-e - Epoca Età Romana, Struttura abitativa o insediamento - Epoca Età Romana","provvedime":"Decreto Ministeriale (26/01/1989), Decreto Ministeriale (12/01/1990), Decreto Ministeriale (08/11/1991), Decreto Ministeriale (12/09/1983)","data_ultim":"1991-11-08","ultimo_pro":"Decreto Ministeriale","rif_legge_":"L. 1089/1939","tutela":"Diretto","vincolo":"Diretto"},"geometry":{"type":"MultiPolygon","coordinates":[[[[10.299898827863496,44.810236759765232],[10.299992787276404,44.81046444748614],[10.30016723813727,44.810427480436317],[10.300251570161546,44.810408182973852],[10.300247492708472,44.810386003478477],[10.300221314453619,44.810167706119202],[10.299898827863496,44.810236759765232]]]]}},{"type":"Feature","properties":{"gid":"194","id_archeo":"134","codice":"134_PR","nome":"Villa rustica di epoca romana","titolo":"Primo insediamento rustico documentato a ovest della città romana. Resti di una villa rustica d'epoca romana con zona sepolcrale.","tipo_propr":"Privata","comuni":"PARMA","sigla_pro":"PR","localita":"Golese, loc. Crocetta","tipologie":"Sepoltura-e - Epoca Età Romana, Struttura abitativa o insediamento - Epoca Età Romana","provvedime":"Decreto Ministeriale (26/01/1989), Decreto Ministeriale (12/01/1990), Decreto Ministeriale (08/11/1991), Decreto Ministeriale (12/09/1983)","data_ultim":"1991-11-08","ultimo_pro":"Decreto Ministeriale","rif_legge_":"L. 1089/1939","tutela":"Indiretto","vincolo":"Indiretto"},"geometry":{"type":"MultiPolygon","coordinates":[[[[10.299992787276404,44.81046444748614],[10.299898827863496,44.810236759765232],[10.299502209771864,44.810317620729222],[10.299096417114368,44.81040444500541],[10.299196843642736,44.810632655141703],[10.299992787276404,44.81046444748614]]]]}},{"type":"Feature","properties":{"gid":"195","id_archeo":"90","codice":"090_PC","nome":"Villa rustica di età romana imperiale","titolo":"In località il Portone di S. Giuliano, frazione di Castelvetro Piacentino, in concomitanza con lo scasso per la posa di alberi, sono venuti alla luce i resti di una villa rustica romana caratterizzata dalla presenza di cocciopesto pavimentale e intonaci","tipo_propr":"Privata","comuni":"CASTELVETRO PIACENTINO","sigla_pro":"PC","localita":"San Giuliano, loc. Il Portone","tipologie":"Sepoltura-e - Epoca Età Romana, Struttura abitativa o insediamento - Epoca Età Romana, Struttura abitativa o insediamento - Epoca Età Tardoantica, Struttura produttiva - artigianale - Epoca Età Romana","provvedime":"Decreto Ministeriale (15/11/1999)","data_ultim":"1999-11-15","ultimo_pro":"Decreto Ministeriale","rif_legge_":"L. 1089/1939","tutela":"Diretto","vincolo":"Diretto"},"geometry":{"type":"MultiPolygon","coordinates":[[[[9.988214824435623,45.062547666880903],[9.987930218336778,45.062672230217977],[9.987816270267942,45.062723761190732],[9.987562602973931,45.062781857445906],[9.987464269762722,45.062831470576981],[9.987182268894982,45.062975489120426],[9.987132105586108,45.063311955569802],[9.987070994832264,45.063712788618368],[9.987012310230375,45.064110720089772],[9.986983375252528,45.064313814047544],[9.986936817502729,45.064605249794219],[9.986911126763582,45.064779132241355],[9.986941899550768,45.064811380091314],[9.98716591596355,45.064700791979433],[9.987247993009852,45.064688775731092],[9.987311459361965,45.064678108685904],[9.987474716378957,45.064650672042944],[9.987711466788181,45.064609933630209],[9.987966806718301,45.064567377461096],[9.988178115374426,45.064530387036271],[9.988416081042534,45.064489465608176],[9.988378873937377,45.064447255025826],[9.988531635361982,45.064317171725293],[9.988796606633317,45.064092831527674],[9.989057317338991,45.063880085780674],[9.989252423100304,45.063716076206681],[9.98903452937992,45.0634702571733],[9.988899240160642,45.063319724634091],[9.988728921954326,45.063127997772483],[9.98848775843652,45.062853871010049],[9.988345408162663,45.062695117432902],[9.988214824435623,45.062547666880903]]]]}},{"type":"Feature","properties":{"gid":"196","id_archeo":"101","codice":"101_PC","nome":"Villa rustica di età romana","titolo":"In comune di Vigolzone presso la frazione Chiulano, loc. Bertoni, su un pianoro digradante verso il rio Spettine e costituito da una paleo frana, è stata individuata una villa romana databile fra l’età repubblicana e la prima età imperiale. Saggi di","tipo_propr":"Privata","comuni":"VIGOLZONE","sigla_pro":"PC","localita":"Chiulano, loc. I Bertoni","tipologie":"Struttura abitativa o insediamento - Epoca Età Romana","provvedime":"Decreto Ministeriale (07/06/2001)","data_ultim":"2001-06-07","ultimo_pro":"Decreto Ministeriale","rif_legge_":"D. Lgs. 490/1999","tutela":"Diretto","vincolo":"Diretto"},"geometry":{"type":"MultiPolygon","coordinates":[[[[9.586305070688317,44.84228643862685],[9.586273419546412,44.842240537321686],[9.586198928260645,44.842137863542575],[9.586096170011228,44.841968953302882],[9.58591651176039,44.841771702509988],[9.58579020509208,44.841571270368959],[9.585662143618762,44.841373516193698],[9.584825791140537,44.841628207999243],[9.584826291942322,44.841677747482876],[9.585392429440354,44.842574218642589],[9.585926507170827,44.842419047511129],[9.586305070688317,44.84228643862685]]]]}},{"type":"Feature","properties":{"gid":"197","id_archeo":"102","codice":"102_PC","nome":"Villa rustica di età romana","titolo":"A valle del paese di Ziano, su un pianoro presso il terrazzo del rio Lora, in seguito a lavori per l’impianto di un vigneto sono venuti alla luce, in un terreno scuro e carbonioso, i resti di una villa rustica abitata dall’età imperiale alla tarda a","tipo_propr":"Privata","comuni":"ZIANO PIACENTINO","sigla_pro":"PC","localita":null,"tipologie":"Struttura abitativa o insediamento - Epoca Età Tardoantica, Struttura abitativa o insediamento - Epoca Età Romana","provvedime":"Decreto Ministeriale (07/06/2001)","data_ultim":"2001-06-07","ultimo_pro":"Decreto Ministeriale","rif_legge_":"D. Lgs. 490/1999","tutela":"Diretto","vincolo":"Diretto"},"geometry":{"type":"MultiPolygon","coordinates":[[[[9.407991169811226,45.001126416363334],[9.408178958947262,45.001004301369505],[9.40814102744066,45.001001457378592],[9.407973166998012,45.001060443254303],[9.407696334901669,45.001089706966447],[9.407473380872478,45.000974757391546],[9.407452300278385,45.000981061895146],[9.407054302437357,45.001041236638677],[9.406795695002174,45.001081283090421],[9.406892481934303,45.001552050868909],[9.407461561953879,45.001482250871632],[9.407845044250609,45.001432361654231],[9.407848657086035,45.001274519625355],[9.407991169811226,45.001126416363334]]]]}},{"type":"Feature","properties":{"gid":"198","id_archeo":"216","codice":"216_RN","nome":"Villa rustica romana","titolo":"Resti di una villa rustica romana di medie In occasione dei lavori per la predisposizione di un campo da golf in località Villa Verucchio, Tenuta Amalia, via mulino Bianco, si rinvenne una villa rustica romana caratterizzata da un peristilio e da alcuni","tipo_propr":"Privata","comuni":"VERUCCHIO","sigla_pro":"RN","localita":"Villa Verucchio, loc. Tenuta Amalia","tipologie":"Struttura abitativa o insediamento - Epoca Età Romana","provvedime":"Decreto Ministeriale (30/12/1992)","data_ultim":"1992-12-30","ultimo_pro":"Decreto Ministeriale","rif_legge_":"L. 1089/1939","tutela":"Diretto","vincolo":"Diretto"},"geometry":{"type":"MultiPolygon","coordinates":[[[[12.433085005026184,44.022009642551772],[12.432498540521765,44.021697893762415],[12.432371411472763,44.021820192357389],[12.431762661508882,44.022419008939586],[12.431274538273563,44.022896260688242],[12.43131175974278,44.022937598119256],[12.4314251206458,44.023090115762066],[12.431950612126069,44.023395232111504],[12.432297545567149,44.023586989255676],[12.432531687241839,44.023720343611309],[12.432632831479204,44.023597404013387],[12.432768673854087,44.023431081125352],[12.433017577498925,44.023126992389308],[12.433665484370271,44.022320695104476],[12.433600827570741,44.022287368007056],[12.433085005026184,44.022009642551772]]],[[[12.433942474740784,44.022486121236234],[12.433711774808392,44.022366521296746],[12.433652849996992,44.022431519860341],[12.433557457106454,44.022554170301468],[12.43341355914316,44.022734528562999],[12.433224638767671,44.022966809007556],[12.433162406485161,44.023042169853795],[12.432951570630337,44.023297471728419],[12.432715159972934,44.023588904917439],[12.43257966534488,44.023755856464753],[12.432633619786799,44.023790289274636],[12.432775851905246,44.023880313949824],[12.432859555450182,44.023932316261138],[12.43303057870823,44.023997626520945],[12.433148789597505,44.024043306017653],[12.433255940437981,44.024085428960724],[12.433353041600798,44.02412399201183],[12.4334314628183,44.024148910770379],[12.433540523926231,44.02418198232472],[12.43362595541655,44.02420687009301],[12.433721074213125,44.024248688409187],[12.433924935359441,44.024339855223616],[12.434038721758478,44.024393148122705],[12.434082827987897,44.024395106906411],[12.434202597561987,44.024207623583557],[12.434394382323559,44.023914604439959],[12.434456543594248,44.023819034101557],[12.434613268619447,44.023578060732824],[12.434767089795576,44.023343422381046],[12.434930285170173,44.023093557259109],[12.434970236206313,44.023034449698478],[12.434832198259047,44.022960668362373],[12.434594387235915,44.022833154853174],[12.43426489248402,44.02265693166396],[12.433942474740784,44.022486121236234]]]]}},{"type":"Feature","properties":{"gid":"199","id_archeo":"100","codice":"100_PC","nome":"Villaggio del Neolitico superiore","titolo":"In loc. S. Andrea, su un terrazzo fluviale ai margini del paese di Travo, negli anni ‘80 è stato scoperto uno dei più importanti villaggi neolitici dell'Italia settentrionale, databile tra fine V e inizi IV millennio a.C. Gli scavi archeologici diret","tipo_propr":"Privata","comuni":"TRAVO","sigla_pro":"PC","localita":"Sant'Andrea","tipologie":"Struttura abitativa o insediamento - Epoca Neolitico","provvedime":"Decreto Ministeriale (31/10/1997)","data_ultim":"1997-10-31","ultimo_pro":"Decreto Ministeriale","rif_legge_":"L. 1089/1939","tutela":"Diretto","vincolo":"Diretto"},"geometry":{"type":"MultiPolygon","coordinates":[[[[9.547830887726471,44.862399082090988],[9.547787212850084,44.862178003056897],[9.547129179396299,44.862403640105363],[9.546971209045603,44.862457841245025],[9.546809453005654,44.862513293559978],[9.546654106085931,44.862566572501585],[9.546644275282787,44.862569942167148],[9.546765413700721,44.862791555836985],[9.546889448583578,44.863018464923755],[9.547049020783138,44.863310383115746],[9.547498507172659,44.864132647486919],[9.547563378382081,44.864120366744409],[9.547648551543872,44.864104232155157],[9.547713601284473,44.864091029565451],[9.547843899401153,44.864057547713287],[9.54814830271596,44.863966464076121],[9.548409585343043,44.86387591958367],[9.548473823105441,44.863833220752419],[9.54845823861087,44.863767562596038],[9.548423625992967,44.863693515796122],[9.548137086899295,44.863197617136365],[9.548016782288624,44.86293256156511],[9.547965977663488,44.862806011288171],[9.547936107934689,44.862708752322369],[9.547844247345612,44.862438447033654],[9.547830887726471,44.862399082090988]]]]}},{"type":"Feature","properties":{"gid":"200","id_archeo":"193","codice":"193_RE","nome":"Villaggio terramaricolo sovrastato da insediamento di età romana","titolo":"La terramara fu individuata in seguito alle fotografie aeree nonché a ricognizioni di superficie condotte dal 1972.\nTra 1984 e 1992 è stata esplorata la parte più antica del villaggio, il cd. ‘Villaggio Piccolo’, risalente al Bronzo Medio. Dal 199","tipo_propr":"Privata","comuni":"POVIGLIO","sigla_pro":"RE","localita":"Fodico, loc. La Mandria","tipologie":"Infrastruttura territoriale o urbana - Epoca Età del Bronzo, Struttura abitativa o insediamento - Epoca Età del Bronzo","provvedime":"Decreto Ministeriale (06/09/1983), Decreto Ministeriale (11/09/1999), Decreto Ministeriale (10/02/2015)","data_ultim":"2015-02-10","ultimo_pro":"Decreto Ministeriale","rif_legge_":"D. Lgs. 42/2004","tutela":"Diretto","vincolo":"Diretto"},"geometry":{"type":"MultiPolygon","coordinates":[[[[10.577770110202037,44.873843763455291],[10.57777011021102,44.873843763646263],[10.57781913751038,44.873910320649266],[10.578539290355394,44.873692432090387],[10.578903029918983,44.873577246692612],[10.578941894667366,44.873565569410353],[10.578573823948501,44.873000263634424],[10.578299590839972,44.872474640134094],[10.577977182951253,44.871888397410068],[10.577856363893384,44.871642499203162],[10.577760377063731,44.871470044690049],[10.57761729133915,44.871212968543929],[10.577441029456706,44.870880005227242],[10.576949415395143,44.870125566787102],[10.576238414738961,44.86898738299994],[10.575132643610088,44.869312830301098],[10.573924951281979,44.869668739012042],[10.573910780735664,44.869672724148842],[10.574322361831424,44.870336217754975],[10.574323197821593,44.870337628518939],[10.573947046837594,44.870448091563823],[10.573351069686359,44.870623110694886],[10.57293950582927,44.869959919434443],[10.571375107764213,44.870417259990944],[10.571826545069955,44.87116410193012],[10.571976306507786,44.871431536452697],[10.572263805684901,44.871951474404923],[10.572505174674363,44.872310455292244],[10.573293277623582,44.873522404316695],[10.573564329842608,44.873925802851339],[10.573945374174537,44.874474494958804],[10.574024419038443,44.87459692809518],[10.574071591631155,44.874707945248097],[10.57419658211486,44.874839268656977],[10.574287004303535,44.874892815825426],[10.574434430651637,44.874958746426891],[10.57544760656716,44.874617624391611],[10.573881087624635,44.872041018444534],[10.576220558809277,44.871318850242233],[10.576841963187855,44.871127018601463],[10.577394372649682,44.872065757850791],[10.578029431294814,44.873144932548243],[10.578331561934835,44.873658324553674],[10.577770110202037,44.873843763455291]]]]}},{"type":"Feature","properties":{"gid":"201","id_archeo":"138","codice":"138_PR","nome":"Villaggio terramaricolo","titolo":"L'esistenza di un insediamento terramaricolo in loc. Montirone di Gaione era già stata segnalata da Strobel e Pigorini (1864), ma grazie alle ricerche condotte negli anni ’80 del secolo scorso è stato possibile meglio localizzare il sito. L'abitato,","tipo_propr":"Privata","comuni":"PARMA","sigla_pro":"PR","localita":"Montirone di Gaione","tipologie":"Struttura abitativa o insediamento - Epoca Età del Bronzo","provvedime":"Decreto Ministeriale (06/07/1984)","data_ultim":"1984-07-06","ultimo_pro":"Decreto Ministeriale","rif_legge_":"L. 1089/1939","tutela":"Diretto","vincolo":"Diretto"},"geometry":{"type":"MultiPolygon","coordinates":[[[[10.300188517986678,44.750861449192016],[10.299874095599812,44.750307780327638],[10.298554015307015,44.747921817753735],[10.298111435102516,44.748024756065305],[10.297104114675513,44.748247003563307],[10.295494588430618,44.748602797548777],[10.295004916508731,44.748706312017347],[10.295378551751792,44.749705180026879],[10.295221312719571,44.750103713411988],[10.295870849521119,44.751097297702017],[10.296164976153991,44.751651603277409],[10.296288390786072,44.751947046359184],[10.298405043685948,44.751363251996239],[10.300188517986678,44.750861449192016]]]]}},{"type":"Feature","properties":{"gid":"202","id_archeo":"224","codice":"224_FE","nome":"Resti della della necropoli bizantina e chiesa paleocristiana di S. Maria in Padovetere","titolo":"Tra gli anni ’50 e ’60, durante i lavori di bonifica di Valle Pega, venne individuata una pieve databile al VI sec. d.C., identificata con la Chiesa di Santa Maria in Padovetere citata nel Liber Pontificalis della prima metà del IX sec. d.C. di Andr","tipo_propr":"Pubblica","comuni":"COMACCHIO, OSTELLATO","sigla_pro":"FE, FE","localita":"Valle Pega, loc. Motta della Girata","tipologie":"Luogo di culto - Epoca Età Tardoantica","provvedime":"Decreto Ministeriale (11/11/1976)","data_ultim":"1976-11-11","ultimo_pro":"Decreto Ministeriale","rif_legge_":"L. 1089/1939","tutela":"Diretto","vincolo":"Area demaniale"},"geometry":{"type":"MultiPolygon","coordinates":[[[[12.12587865615321,44.675704591070634],[12.126384318042238,44.674755808179647],[12.126252359398737,44.674718925591392],[12.1255386490823,44.67452447448192],[12.125537240595801,44.674524089986434],[12.124641265018754,44.674285018317406],[12.12417540811777,44.674164641564559],[12.123668798613917,44.67510812044025],[12.122410623859412,44.674758846576026],[12.12235717621105,44.674744205327997],[12.121929002908601,44.674626838560179],[12.121610060360922,44.675208385019218],[12.121607828739142,44.675212684246105],[12.121471858704675,44.675474546666365],[12.12146664645482,44.675484585237655],[12.121109674933328,44.676138313965836],[12.120825241418817,44.67665352307926],[12.121250655267394,44.67677118555288],[12.121325847616374,44.67679154259136],[12.122892469838209,44.677215723054161],[12.123940809380263,44.677502900557784],[12.124784132228138,44.677733311150867],[12.124901435962705,44.677513940777828],[12.125448897935136,44.676502263153495],[12.12587865615321,44.675704591070634]]]]}},{"type":"Feature","properties":{"gid":"203","id_archeo":"235","codice":"235_RA","nome":"Villa romana","titolo":"La villa romana di Russi è la testimonianza più completa e significativa dell'insediamento rurale di epoca romana nella regio VIII. L’area comprende due quartieri: uno residenziale a N e uno rustico a S, finalizzato alla produzione agricola per il co","tipo_propr":"Privata, Pubblica","comuni":"RUSSI","sigla_pro":"RA","localita":null,"tipologie":"Struttura abitativa o insediamento - Epoca Età Romana","provvedime":"Decreto Ministeriale (09/05/1953), Decreto Ministeriale (10/09/1982)","data_ultim":"1982-09-10","ultimo_pro":"Decreto Ministeriale","rif_legge_":"L. 1089/1939","tutela":"Diretto","vincolo":"Diretto"},"geometry":{"type":"MultiPolygon","coordinates":[[[[12.032879534514885,44.380590481995256],[12.032873093450569,44.38058615292266],[12.032594238788382,44.380804416537181],[12.032594295058852,44.380804436645626],[12.032591661719461,44.380806433173326],[12.03263670587987,44.380831063714204],[12.03289736135712,44.380973601584827],[12.033435487525082,44.381264079997237],[12.033515620401513,44.381306613842227],[12.033736376414902,44.381141038528988],[12.033862216776727,44.381046660285108],[12.033741248823105,44.380994977771451],[12.033552541042909,44.38091310453067],[12.033343081083707,44.380823158444642],[12.033197793130226,44.380761420827817],[12.033026044240037,44.380682192631532],[12.033010947530665,44.38067547308821],[12.032879534514885,44.380590481995256]]]]}},{"type":"Feature","properties":{"gid":"204","id_archeo":"98","codice":"098_PC","nome":"Insediamento di epoca romana","titolo":"Su un terrazzo fluviale del torrente Chiarone, alla confluenza col Tidone, negli anni ‘60-’70 affiorarono resti murari, frammenti architettonici, materiali ceramici, in bronzo ed elementi musivi. Successive indagini negli anni ’80-‘90 hanno evide","tipo_propr":"Privata","comuni":"PIANELLO VAL TIDONE","sigla_pro":"PC","localita":"Cimitero","tipologie":"Struttura abitativa o insediamento - Epoca Età Romana","provvedime":"Decreto Ministeriale (06/06/1995)","data_ultim":"1995-06-06","ultimo_pro":"Decreto Ministeriale","rif_legge_":"L. 1089/1939","tutela":"Diretto","vincolo":"Diretto"},"geometry":{"type":"MultiPolygon","coordinates":[[[[9.414199227223952,44.942903838941142],[9.414213135776615,44.942544800249117],[9.414225057489428,44.942327234192312],[9.414859899946007,44.942227781267157],[9.414810682167872,44.942100888663703],[9.414188048103467,44.942198739701041],[9.413684654909691,44.94228386791211],[9.413665024474945,44.942340103607641],[9.413344112730327,44.94264441510775],[9.413203977297721,44.942802893677914],[9.413214818292335,44.942806492715157],[9.413474892820108,44.942894175634521],[9.413480105294544,44.942884002581536],[9.414199227223952,44.942903838941142]]],[[[9.413444960712296,44.942921550853406],[9.413173874168645,44.942834240774182],[9.413124898980554,44.942940547341898],[9.413082362018102,44.943088370756804],[9.4130561656083,44.943176590881876],[9.413046805172019,44.943274277191641],[9.412993746045016,44.943357830898279],[9.412962469940759,44.943504895506422],[9.412961303271748,44.943510381295766],[9.412895326182314,44.944082998224303],[9.413437655962749,44.943947059890512],[9.413451903180272,44.943744005665394],[9.413477134503017,44.943248861844005],[9.413498233180198,44.942940865209572],[9.413444960712296,44.942921550853406]]],[[[9.415194044800019,44.942619447717128],[9.415169909898029,44.942596346451566],[9.414952781811763,44.942669466017819],[9.41492792890433,44.943023548471217],[9.414899716495366,44.943377589090261],[9.414862338782171,44.943571365498229],[9.41485214969496,44.943691290288697],[9.414841544687773,44.943815579364284],[9.414852370123564,44.943848616317396],[9.415363927350374,44.944008089859977],[9.415551990490536,44.944074830308445],[9.416024598293763,44.944237530245601],[9.416293798824473,44.944313164883305],[9.416378650137865,44.94431350373187],[9.4164586517345,44.944307513844258],[9.416603406088704,44.944260436963091],[9.416777464457654,44.944171159927429],[9.416773642449515,44.944161469792554],[9.41676220299726,44.944144830948431],[9.416425604592677,44.943935467357989],[9.416152055470389,44.943762979042795],[9.415982343150782,44.94366068712268],[9.415815630710149,44.943522619333088],[9.41556252855527,44.943240942687538],[9.415538061653915,44.943214043892468],[9.415472067712086,44.943060143807401],[9.415408337866133,44.942916083561535],[9.415377427160598,44.942869142848508],[9.415241031091124,44.942684522951069],[9.415194044800019,44.942619447717128]]],[[[9.415439735710075,44.944120212317628],[9.415337672792621,44.944074331554965],[9.415027036526199,44.944077504128586],[9.414649397491916,44.944084051791755],[9.414629077106117,44.944152468246756],[9.414582891169013,44.944307856259833],[9.414899820178915,44.944421453127958],[9.41519328571462,44.944527662801526],[9.415408769758153,44.94460880591059],[9.415477122774735,44.944362012324788],[9.415532528337193,44.944161913813602],[9.415439735710075,44.944120212317628]]]]}},{"type":"Feature","properties":{"gid":"205","id_archeo":"9","codice":"009_BO","nome":"Teatro romano","titolo":"Porzione di piano interrato di fabbricato contenente strutture murarie facenti parte della cavea di un edificio teatrale romano.","tipo_propr":"Privata","comuni":"BOLOGNA","sigla_pro":"BO","localita":null,"tipologie":"Complesso monumentale - Epoca Età Romana","provvedime":"Decreto Ministeriale (15/12/1988), Decreto Ministeriale (03/08/1983)","data_ultim":"1988-12-15","ultimo_pro":"Decreto Ministeriale","rif_legge_":"L. 1089/1939","tutela":"Diretto","vincolo":"Diretto"},"geometry":{"type":"MultiPolygon","coordinates":[[[[11.341035431598332,44.491763665041994],[11.34100828380976,44.491635326114753],[11.341081602686282,44.49163806158387],[11.34108830855598,44.491536350130708],[11.341088878276516,44.491506603581129],[11.34109075253949,44.491489649647022],[11.341013617439978,44.491485516106188],[11.340813559293457,44.491496182804624],[11.340712031592247,44.491501595922017],[11.340711286942776,44.491507861306452],[11.340667229698486,44.491507838064017],[11.340639138508188,44.491512681583714],[11.340668776148247,44.491629095380134],[11.340692163669887,44.491714417161816],[11.340631129677087,44.491720728828653],[11.340667879979938,44.491796152894558],[11.340761451221827,44.491792693492521],[11.340775982810037,44.491790000676822],[11.341035431598332,44.491763665041994]]]]}},{"type":"Feature","properties":{"gid":"206","id_archeo":"127","codice":"127_PR","nome":"Villa rustica romana","titolo":"Resti di una villa rustica d'epoca romana","tipo_propr":"Privata","comuni":"PARMA","sigla_pro":"PR","localita":"Cortile S. Martino","tipologie":"Struttura abitativa o insediamento - Epoca Età Romana","provvedime":"Decreto Ministeriale (22/12/1997)","data_ultim":"1997-12-22","ultimo_pro":"Decreto Ministeriale","rif_legge_":"L. 1089/1939","tutela":"Diretto","vincolo":"Diretto"},"geometry":{"type":"MultiPolygon","coordinates":[[[[10.349999144845338,44.847743482834574],[10.350396038019076,44.84764405383968],[10.350372869578568,44.847596791325564],[10.350114599595518,44.847659041790102],[10.350059750054291,44.847548887918499],[10.349933625528386,44.847575974513461],[10.349829134033527,44.847599464514857],[10.349910327407084,44.847762640161989],[10.349944507189733,44.847755060758686],[10.349999144845338,44.847743482834574]]]]}},{"type":"Feature","properties":{"gid":"207","id_archeo":"127","codice":"127_PR","nome":"Villa rustica romana","titolo":"Resti di una villa rustica d'epoca romana","tipo_propr":"Privata","comuni":"PARMA","sigla_pro":"PR","localita":"Cortile S. Martino","tipologie":"Struttura abitativa o insediamento - Epoca Età Romana","provvedime":"Decreto Ministeriale (22/12/1997)","data_ultim":"1997-12-22","ultimo_pro":"Decreto Ministeriale","rif_legge_":"L. 1089/1939","tutela":"Indiretto","vincolo":"Indiretto"},"geometry":{"type":"MultiPolygon","coordinates":[[[[10.349929314989447,44.847576978446973],[10.349781532306622,44.847282070727438],[10.349692198013688,44.847306726800355],[10.349684205882268,44.847308671159155],[10.349829206258077,44.847599183371564],[10.349929314989447,44.847576978446973]]],[[[10.35053943491109,44.847926455801968],[10.350396064213951,44.847645174673453],[10.349999144845338,44.847743482834574],[10.349946093228251,44.847755490468664],[10.350081840139167,44.848037703155796],[10.35053943491109,44.847926455801968]]]]}},{"type":"Feature","properties":{"gid":"208","id_archeo":"128","codice":"128_PR","nome":"Villa rustica romana","titolo":"Indagini geofisiche preventive, condotte su un’area della bassa pianura parmense in loc. Certosino di Ravadese, in comune di Parma, avevano indicato la presenza di strutture murarie sepolte, successivamente indagate dalla Soprintendenza nel 1988 median","tipo_propr":"Privata","comuni":"PARMA","sigla_pro":"PR","localita":"Ravadese, loc. Il Certosino","tipologie":"Struttura abitativa o insediamento - Epoca Età Romana","provvedime":"Decreto Ministeriale (08/07/1991)","data_ultim":"1991-07-08","ultimo_pro":"Decreto Ministeriale","rif_legge_":"L. 1089/1939","tutela":"Indiretto","vincolo":"Indiretto"},"geometry":{"type":"MultiPolygon","coordinates":[[[[10.398704072700863,44.875857392866365],[10.398469395199069,44.874968390745416],[10.39840800243711,44.874735818653768],[10.39828116866434,44.874756675690598],[10.398000309770921,44.874800219075944],[10.397683597147205,44.873941447420677],[10.395094714724673,44.874406481485366],[10.395010813514441,44.874421551332915],[10.395210260204701,44.874954044722507],[10.395247183029001,44.875004039731813],[10.395361754052541,44.875087175531092],[10.395974807692237,44.875402260672182],[10.396965690072438,44.875908851190907],[10.397236645695619,44.876042713834565],[10.397434884690806,44.87614586062962],[10.398624963742158,44.875875560457921],[10.398704072700863,44.875857392866365]],[[10.396235238015745,44.874691843527216],[10.397681945280144,44.874470499160509],[10.397792958373287,44.874832633959855],[10.397866351118276,44.875072045057316],[10.397938354924104,44.875306923343366],[10.396480248146545,44.875541175145052],[10.396418066591901,44.875325624293644],[10.396235238015745,44.874691843527216]]]]}},{"type":"Feature","properties":{"gid":"209","id_archeo":"128","codice":"128_PR","nome":"Villa rustica romana","titolo":"Indagini geofisiche preventive, condotte su un’area della bassa pianura parmense in loc. Certosino di Ravadese, in comune di Parma, avevano indicato la presenza di strutture murarie sepolte, successivamente indagate dalla Soprintendenza nel 1988 median","tipo_propr":"Privata","comuni":"PARMA","sigla_pro":"PR","localita":"Ravadese, loc. Il Certosino","tipologie":"Struttura abitativa o insediamento - Epoca Età Romana","provvedime":"Decreto Ministeriale (08/07/1991)","data_ultim":"1991-07-08","ultimo_pro":"Decreto Ministeriale","rif_legge_":"L. 1089/1939","tutela":"Diretto","vincolo":"Diretto"},"geometry":{"type":"MultiPolygon","coordinates":[[[[10.397792958373287,44.874832633959855],[10.397681945280144,44.874470499160509],[10.396235238015745,44.874691843527216],[10.396418066591901,44.875325624293644],[10.396480248146545,44.875541175145052],[10.397938354924104,44.875306923343366],[10.397866351118276,44.875072045057316],[10.397792958373287,44.874832633959855]]]]}},{"type":"Feature","properties":{"gid":"210","id_archeo":"150","codice":"150_PR","nome":"Strutture romane","titolo":"Resti di strutture di epoca romana riferibili al primo tratto suburbano della via Parma-Brescello","tipo_propr":"Privata","comuni":"PARMA","sigla_pro":"PR","localita":null,"tipologie":"Infrastruttura territoriale o urbana - Epoca Età Romana","provvedime":"Decreto Ministeriale (17/04/1981)","data_ultim":"1981-04-17","ultimo_pro":"Decreto Ministeriale","rif_legge_":"L. 1089/1939","tutela":"Diretto","vincolo":"Diretto"},"geometry":{"type":"MultiPolygon","coordinates":[[[[10.338526810944964,44.808790718751034],[10.338409415213931,44.80864233816596],[10.33833008282625,44.808544768533174],[10.338200362658675,44.808594962861626],[10.338152152898086,44.808613882998152],[10.338101404803931,44.80863349900855],[10.338034104316419,44.808654785320158],[10.337885541707282,44.808695685038387],[10.337671010650503,44.808725267887716],[10.337586331121944,44.80872397355715],[10.3376671321024,44.808827674855543],[10.337803999625702,44.809001708713936],[10.337942656718813,44.809175442374453],[10.33820010128486,44.809078309250275],[10.338616221828261,44.80891994706127],[10.338626930231536,44.80891587628998],[10.338612449865266,44.808896298079461],[10.338526810944964,44.808790718751034]]]]}},{"type":"Feature","properties":{"gid":"211","id_archeo":"204","codice":"204_RN","nome":"Cinta muraria della città","titolo":"Resti della cinta muratia urbana di Rimini, costituita da mura laterizie in opera a sacco, riferibili all'età imperiale romana (Aureliano)","tipo_propr":"Privata","comuni":"RIMINI","sigla_pro":"RN","localita":null,"tipologie":"Fortificazione - Epoca Età Romana","provvedime":"Decreto Ministeriale (21/09/1965), Decreto Ministeriale (01/04/1965), Decreto Ministeriale (26/11/1965)","data_ultim":"1965-11-26","ultimo_pro":"Decreto Ministeriale","rif_legge_":"L. 1089/1939","tutela":"Indiretto","vincolo":"Indiretto"},"geometry":{"type":"MultiPolygon","coordinates":[[[[12.570315144493575,44.061429821556757],[12.570236786023393,44.061345515981664],[12.570099473079443,44.06141689102143],[12.570061492102615,44.061436633408668],[12.569874860796167,44.061522343674554],[12.569891239778743,44.061573701780311],[12.569964754101722,44.061560850294875],[12.570110629768994,44.061525797109027],[12.570125074840462,44.061524729671419],[12.570156649383023,44.061522396413835],[12.570177179480527,44.061520879304446],[12.570196123620361,44.061519310817829],[12.570217018074542,44.061514899374316],[12.570326051613177,44.061491879075483],[12.570315144493575,44.061429821556757]]],[[[12.570352873106687,44.06155076054219],[12.570330029353254,44.061514510911124],[12.57024068141491,44.061533052282449],[12.570258963828758,44.061569021545083],[12.570264825578533,44.061567883849506],[12.570352873106687,44.06155076054219]]],[[[12.570203013644692,44.061579909922663],[12.570200134795735,44.061542051826791],[12.570102828835001,44.061549860508563],[12.56997914401663,44.061580408253398],[12.56989806816966,44.061595112907682],[12.569901113171014,44.061604660833396],[12.569927033474631,44.061655110340652],[12.569972073592622,44.061742790310959],[12.570012417650686,44.061732309338858],[12.570057457535112,44.061720610117668],[12.570098650033996,44.061709913511663],[12.570131385451432,44.061701417073607],[12.570157334743683,44.061694672412237],[12.5702337272329,44.061675150111348],[12.570223118362957,44.061642217656306],[12.570219099686653,44.06162979385077],[12.570212313983674,44.061608733157854],[12.570209290236464,44.061599357090273],[12.570203013644692,44.061579909922663]]]]}},{"type":"Feature","properties":{"gid":"212","id_archeo":"204","codice":"204_RN","nome":"Cinta muraria della città","titolo":"Resti della cinta muratia urbana di Rimini, costituita da mura laterizie in opera a sacco, riferibili all'età imperiale romana (Aureliano)","tipo_propr":"Privata","comuni":"RIMINI","sigla_pro":"RN","localita":null,"tipologie":"Fortificazione - Epoca Età Romana","provvedime":"Decreto Ministeriale (21/09/1965), Decreto Ministeriale (01/04/1965), Decreto Ministeriale (26/11/1965)","data_ultim":"1965-11-26","ultimo_pro":"Decreto Ministeriale","rif_legge_":"L. 1089/1939","tutela":"Diretto","vincolo":"Diretto"},"geometry":{"type":"MultiPolygon","coordinates":[[[[12.570330029353254,44.061514510911124],[12.570326051613177,44.061491879075483],[12.570217018074542,44.061514899374316],[12.570196123620361,44.061519310817829],[12.570177717481551,44.061520839546652],[12.570156649383023,44.061522396413835],[12.570125074840462,44.061524729671419],[12.570110629768994,44.061525797109027],[12.569964754101722,44.061560850294875],[12.569891239778743,44.061573701780311],[12.56989806816966,44.061595112907682],[12.56997914401663,44.061580408253398],[12.570102828835001,44.061549860508563],[12.570200134795735,44.061542051826791],[12.570220181078591,44.061537602447565],[12.57024068141491,44.061533052282449],[12.570330029353254,44.061514510911124]]]]}},{"type":"Feature","properties":{"gid":"213","id_archeo":"172","codice":"172_RA","nome":"Palazzo di caccia di Teodorico","titolo":"L’impianto tardoantico di Palazzolo, forse una villa residenziale, fu scavato negli anni Sessanta-Settanta del Novecento e attribuito al re goto Teodorico. L’edificio venne probabilmente edificato sulla duna costiera, fra la laguna e l’antica spiag","tipo_propr":"Privata, Pubblica","comuni":"RAVENNA","sigla_pro":"RA","localita":null,"tipologie":"Luogo di culto - Epoca Età Altomedievale, Struttura abitativa o insediamento - Epoca Età Tardoantica","provvedime":"Declaratoria (27/05/1982), Decreto Ministeriale (20/09/1982)","data_ultim":"1982-09-20","ultimo_pro":"Decreto Ministeriale","rif_legge_":"L. 1089/1939","tutela":"Diretto","vincolo":"Diretto"},"geometry":{"type":"MultiPolygon","coordinates":[[[[12.199466490777901,44.48426253778581],[12.199677354588296,44.484833214672612],[12.200732735889114,44.484992968698386],[12.200732503441051,44.484992229913956],[12.200632548240748,44.484675599084433],[12.200563195983163,44.484460149911271],[12.20028454645127,44.484409645170317],[12.199853154548036,44.484331918208923],[12.199466490777901,44.48426253778581]]]]}},{"type":"Feature","properties":{"gid":"214","id_archeo":"172","codice":"172_RA","nome":"Palazzo di caccia di Teodorico","titolo":"L’impianto tardoantico di Palazzolo, forse una villa residenziale, fu scavato negli anni Sessanta-Settanta del Novecento e attribuito al re goto Teodorico. L’edificio venne probabilmente edificato sulla duna costiera, fra la laguna e l’antica spiag","tipo_propr":"Privata, Pubblica","comuni":"RAVENNA","sigla_pro":"RA","localita":null,"tipologie":"Luogo di culto - Epoca Età Altomedievale, Struttura abitativa o insediamento - Epoca Età Tardoantica","provvedime":"Declaratoria (27/05/1982), Decreto Ministeriale (20/09/1982)","data_ultim":"1982-09-20","ultimo_pro":"Decreto Ministeriale","rif_legge_":"L. 1089/1939","tutela":"Diretto","vincolo":"Diretto"},"geometry":{"type":"MultiPolygon","coordinates":[[[[12.201055369263953,44.484548744052844],[12.201003276715213,44.48453989883027],[12.201035798917516,44.484795091421169],[12.201064617913879,44.485016638442723],[12.201061712690384,44.485049158438414],[12.201468380172219,44.48510775960424],[12.202320943917556,44.485230612272531],[12.202218195711305,44.48494009085978],[12.202141147218368,44.484722233449283],[12.202027165211181,44.484704717935578],[12.201769315127645,44.48466390433947],[12.201662087939354,44.484648766570594],[12.20136775123545,44.484603008036217],[12.201055369263953,44.484548744052844]]]]}},{"type":"Feature","properties":{"gid":"215","id_archeo":"221","codice":"221_FC","nome":"Fornaci di età romana","titolo":"L’impianto produttivo di Cà Turchi è costituito da due fornaci rettangolari con orientamento NO-SE, parallele fra loro e disposte a una distanza di circa 2 m. Le strutture sono riconducibile al tipo II b della classificazione Cuomo di Caprio: in orig","tipo_propr":"Privata","comuni":"CESENATICO","sigla_pro":"FC","localita":"Ca' Turchi","tipologie":"Struttura produttiva - artigianale - Epoca Età Romana","provvedime":"Declaratoria (06/05/1972)","data_ultim":"1972-05-06","ultimo_pro":"Declaratoria","rif_legge_":"L. 1089/1939","tutela":"Diretto","vincolo":"Declaratoria"},"geometry":{"type":"MultiPolygon","coordinates":[[[[12.397751112668514,44.183382010981767],[12.397644475224206,44.183268487450846],[12.397489214722412,44.183345400404541],[12.397591889886648,44.183462904117597],[12.397751112668514,44.183382010981767]]]]}},{"type":"Feature","properties":{"gid":"216","id_archeo":"125","codice":"125_PR","nome":"Terramara di Ravadese","titolo":"La terramara di Ravadese, localizzata nella media pianura pochi chilometri a NE di Parma, è stata individuata nel 1982 e successivamente è stata oggetto di indagini da parte della Soprintendenza. Nell’ottocento venne utilizzata come cava di terra fer","tipo_propr":"Privata","comuni":"PARMA","sigla_pro":"PR","localita":"Cortile S. Martino / Ravadese","tipologie":"Struttura abitativa o insediamento - Epoca Età del Bronzo","provvedime":"Decreto Ministeriale (01/03/1993)","data_ultim":"1993-03-01","ultimo_pro":"Decreto Ministeriale","rif_legge_":"L. 1089/1939","tutela":"Diretto","vincolo":"Diretto"},"geometry":{"type":"MultiPolygon","coordinates":[[[[10.368800850962435,44.856278576311482],[10.368367174041564,44.855298065693809],[10.365867617063561,44.855924440478695],[10.366432375342207,44.85735159452193],[10.366735809150242,44.858136604512076],[10.367250285982575,44.858029094046806],[10.368218849342249,44.857820171285674],[10.369366903812216,44.857576350521597],[10.36925934217216,44.8573211230661],[10.36904128271261,44.856819672152994],[10.368981485726904,44.856688513739691],[10.368800850962435,44.856278576311482]]]]}},{"type":"Feature","properties":{"gid":"217","id_archeo":"26","codice":"026_BO","nome":"Zona archeologica con i resti della città etrusca","titolo":"L’impianto urbano si sviluppa attorno ad un ampio asse viario NS di 15 m, intersecato da tre strade EO altrettanto ampie. Una serie di strade minori definisce isolati rettangolari entro cui vennero costruite case, impianti artigianali e templi. La citt","tipo_propr":"Privata","comuni":"MARZABOTTO","sigla_pro":"BO","localita":"Misano","tipologie":"Struttura abitativa o insediamento - Epoca Età del Ferro","provvedime":"Decreto Ministeriale (19/10/1983)","data_ultim":"1983-10-19","ultimo_pro":"Decreto Ministeriale","rif_legge_":"L. 1089/1939","tutela":"Diretto","vincolo":"Area demaniale"},"geometry":{"type":"MultiPolygon","coordinates":[[[[11.200007957495401,44.335539310235831],[11.200323278143653,44.335453475518719],[11.200719027483558,44.335533618628695],[11.200548917668417,44.335391849176553],[11.200473274275337,44.335355758072453],[11.200398118856096,44.335319297400972],[11.200308573486016,44.335288785845499],[11.200212551424437,44.335260163625186],[11.200114079315718,44.335253888090413],[11.199982995119269,44.335246602816497],[11.199729326531687,44.335251358636363],[11.199708807923633,44.335253419704181],[11.199476118896623,44.335294258161234],[11.199338865169615,44.335320886958002],[11.199247386669962,44.335333246358495],[11.199141572360931,44.335353345177808],[11.199110605331027,44.335358425351217],[11.199199597913815,44.335545540300458],[11.199278597260086,44.335594909460909],[11.199435934343423,44.335826845311438],[11.199519266929064,44.335888761463401],[11.199264262322076,44.33603896152438],[11.199096836574192,44.336161743537446],[11.198907540586132,44.336351764326665],[11.199086215505128,44.336416038521087],[11.199425839875762,44.336437877468633],[11.199479641478314,44.33648289779741],[11.199625108960104,44.336622110004548],[11.199697859580345,44.336761562625128],[11.19980062688478,44.336799093857273],[11.199884880099857,44.336818517572574],[11.199956164849217,44.336899661240871],[11.200060466619886,44.3369778545458],[11.200249625749615,44.33686198916979],[11.200007957495401,44.335539310235831]]],[[[11.203963584895975,44.337356442512579],[11.204080747765721,44.337186910064119],[11.204221495750538,44.337204842680393],[11.204448601891785,44.337232665755053],[11.204467333535144,44.33696780653338],[11.204483067904638,44.336904700140174],[11.204558742316548,44.33658216798031],[11.204576038631741,44.336508201214805],[11.204577177982982,44.336406498503528],[11.204592736246749,44.336405221542094],[11.204632938083535,44.336033554256474],[11.205030646110085,44.33573566788894],[11.205056346712736,44.33572092895735],[11.205214415716414,44.335605466667644],[11.205213295643022,44.335561555478492],[11.205229182735097,44.33554067735642],[11.205430454676248,44.335315312732931],[11.205618869075654,44.335104348476726],[11.205781416630186,44.334909062495406],[11.205786697439466,44.334902712562439],[11.205797117555401,44.334884568837417],[11.20592260770003,44.334666115183296],[11.205973664581082,44.334362702465249],[11.205809705863071,44.334262189504052],[11.205665131594133,44.334152442935761],[11.205721435480861,44.334086184261523],[11.20592796722868,44.333930973353922],[11.206144329887444,44.334039187513788],[11.206258305094384,44.334128017964517],[11.206262789394453,44.334126517823705],[11.20644398152762,44.334279479251684],[11.206585578303601,44.333595779884476],[11.20660174620903,44.333418582751833],[11.206609403170036,44.333242207436761],[11.206487213516608,44.333008908024638],[11.206400146113307,44.33288732748894],[11.205876704202238,44.332679144389893],[11.205714910981019,44.332403757183961],[11.204888803330464,44.332204788087289],[11.204767118593107,44.332220958990817],[11.204585818895668,44.332335861762409],[11.204534873235035,44.332326898321675],[11.204412705356765,44.332307094513524],[11.204385217115686,44.332281130815737],[11.203980827087673,44.332497995181086],[11.203447126029785,44.332780023399174],[11.203171391225561,44.332928851422224],[11.202876618928581,44.333021185530292],[11.202889073495072,44.333067389807653],[11.203060566230658,44.333059540798672],[11.203250440221721,44.333018368750921],[11.20337167584635,44.333068503793307],[11.203484455287853,44.333091451932745],[11.203638437504964,44.333123759081744],[11.203591147960587,44.333431690553908],[11.203422950263432,44.333425738650199],[11.203435473101887,44.333468086023494],[11.203138902763982,44.333451840722283],[11.203083111393074,44.333446805355869],[11.202559433719159,44.333365459189849],[11.202782573681645,44.333482056606286],[11.202861365355393,44.333523504920784],[11.202905344419303,44.333537330029806],[11.202970120452219,44.333559882226318],[11.202963366253162,44.333570770847594],[11.20268190688089,44.333725289880839],[11.202565163955576,44.333789455279316],[11.202375518109646,44.3337674590585],[11.202131549180157,44.333818172402019],[11.20207239475039,44.333918298604651],[11.202133206562873,44.334021897688871],[11.200064915445484,44.335154456741257],[11.200270120992485,44.335176616351838],[11.200358035902356,44.335202108909677],[11.200459630914329,44.335233180271089],[11.200481918754331,44.335241527998541],[11.200551126239427,44.335280939157791],[11.200580687522692,44.335299634649381],[11.200636395808417,44.335320868722988],[11.200786208099874,44.335453180681263],[11.201133664333502,44.335823751494289],[11.201612193696333,44.336339480296374],[11.201792996787118,44.336526829165621],[11.202032551053939,44.336776053297257],[11.202102515297797,44.336825531760745],[11.202169551905197,44.336857772517668],[11.202299920081487,44.336895668648815],[11.202538781019586,44.336919901627965],[11.202723989250895,44.336930860802994],[11.203084830786494,44.337069181399748],[11.20317345602121,44.337145945772264],[11.203303579164038,44.337320865506825],[11.203393896204911,44.337536138488595],[11.203570421320682,44.337551436310711],[11.203640366798735,44.337557494381088],[11.203811870448851,44.337572348669227],[11.203963584895975,44.337356442512579]]],[[[11.202853538945178,44.338036425029671],[11.203168832958381,44.337949141604803],[11.20325435896045,44.337978981036386],[11.203274675770956,44.337890164829467],[11.203303821134243,44.337754427455621],[11.203299987861227,44.337741510698216],[11.203288024080308,44.337626111992364],[11.203278421449248,44.337583760033702],[11.203272956117024,44.337546036539003],[11.203266642335,44.337514793324615],[11.203254839244718,44.337484349321045],[11.203088869019124,44.337506685228881],[11.203125542911279,44.33758791891087],[11.203039960926196,44.337694155201135],[11.20273715254323,44.337660327884123],[11.202689718828232,44.337669220091122],[11.202619178845124,44.337755107771144],[11.20261376444738,44.33779909112851],[11.202595737280838,44.337800051369527],[11.202550117201515,44.337682574603058],[11.20251506477743,44.337665030038941],[11.202418433846736,44.337770686952894],[11.202595507779247,44.337889685972215],[11.202758910485015,44.337944426854037],[11.202853538945178,44.338036425029671]]]]}},{"type":"Feature","properties":{"gid":"218","id_archeo":"26","codice":"026_BO","nome":"Zona archeologica con i resti della città etrusca","titolo":"L’impianto urbano si sviluppa attorno ad un ampio asse viario NS di 15 m, intersecato da tre strade EO altrettanto ampie. Una serie di strade minori definisce isolati rettangolari entro cui vennero costruite case, impianti artigianali e templi. La citt","tipo_propr":"Privata","comuni":"MARZABOTTO","sigla_pro":"BO","localita":"Misano","tipologie":"Struttura abitativa o insediamento - Epoca Età del Ferro","provvedime":"Decreto Ministeriale (19/10/1983)","data_ultim":"1983-10-19","ultimo_pro":"Decreto Ministeriale","rif_legge_":"L. 1089/1939","tutela":"Indiretto","vincolo":"Indiretto"},"geometry":{"type":"MultiPolygon","coordinates":[[[[11.199731412689271,44.335155575409871],[11.199868025486289,44.335143344709813],[11.199955326756989,44.335144731353353],[11.199976388585277,44.335144451286176],[11.200064915445484,44.335154456741257],[11.202133206562873,44.334021897688871],[11.20207239475039,44.333918298604651],[11.202131549180157,44.333818172402019],[11.202375518109646,44.3337674590585],[11.202565163955576,44.333789455279316],[11.20268190688089,44.333725289880839],[11.202963366253162,44.333570770847594],[11.202970120452219,44.333559882226318],[11.202905344419303,44.333537330029806],[11.202861365355393,44.333523504920784],[11.202782573681645,44.333482056606286],[11.202559433719159,44.333365459189849],[11.202085420780149,44.333324141099041],[11.201664884990178,44.33335448431918],[11.20125425485098,44.333439046990996],[11.201167891133974,44.333454937376153],[11.200888462376454,44.333511507961525],[11.200441975803027,44.333645499815503],[11.200276130533089,44.33371174382993],[11.200006159768886,44.333825062757533],[11.199862572398104,44.333878777405914],[11.199814418324079,44.333957524912478],[11.199441909074309,44.334101699553223],[11.199122792352281,44.334215666226619],[11.198960885458243,44.334278618219365],[11.198875035981823,44.334315013902263],[11.198733968699823,44.334369416571974],[11.198594391345585,44.334442875941726],[11.198402674164271,44.334537172570862],[11.198299621231509,44.334627077850918],[11.19826500535272,44.334666402095799],[11.198258276378356,44.334677649992301],[11.198242689799692,44.334716013423431],[11.198257666359396,44.334891492299576],[11.198267725720896,44.335011600682385],[11.198295101977996,44.33526107635403],[11.198316096073309,44.335396872701175],[11.19909423473872,44.335266481894074],[11.199731412689271,44.335155575409871]]],[[[11.202884598672235,44.341077200615722],[11.202972266671166,44.341013776697892],[11.203101096734057,44.341049531945075],[11.203146695828734,44.341047850085751],[11.203324905240747,44.340855443186335],[11.203257945340493,44.340806645833666],[11.203176103176689,44.340744001731217],[11.20315694559714,44.340720847860261],[11.203090358551627,44.340646844850333],[11.203047765076162,44.340608884101549],[11.20290303625208,44.340400900488753],[11.202842395505776,44.340284704236112],[11.20280649443426,44.340154499295956],[11.202783605217089,44.340003958231463],[11.202773002536539,44.339843187008107],[11.202771958262987,44.339703162312588],[11.202778289364531,44.339616686870016],[11.202792404898016,44.339500937620542],[11.202797385418462,44.339420601038491],[11.202799981369973,44.339325168076478],[11.202808138108685,44.339251261053029],[11.202823742312294,44.339114984067983],[11.202864210005488,44.338930864135548],[11.202922942334871,44.338755133044756],[11.202973066998219,44.338615164532612],[11.203008959966928,44.338527578030238],[11.203118658806844,44.338284594245664],[11.203172769268157,44.338163643239994],[11.203219902802118,44.338064388243922],[11.203241726832958,44.338014785390286],[11.203246880530626,44.338000677762388],[11.20325435896045,44.337978981036386],[11.203168832958381,44.337949141604803],[11.202853538945178,44.338036425029671],[11.202758910485015,44.337944426854037],[11.202595507779247,44.337889685972215],[11.202418433846736,44.337770686952894],[11.20251506477743,44.337665030038941],[11.202550117201515,44.337682574603058],[11.202595737280838,44.337800051369527],[11.20261376444738,44.33779909112851],[11.202619178845124,44.337755107771144],[11.202689718828232,44.337669220091122],[11.20273715254323,44.337660327884123],[11.203039960926196,44.337694155201135],[11.203125542911279,44.33758791891087],[11.203088869019124,44.337506685228881],[11.203254839244718,44.337484349321045],[11.203231653808084,44.337440378134417],[11.203211756376069,44.337388079026347],[11.203196066392332,44.337362364449113],[11.2031869673658,44.337339808536292],[11.203159840202551,44.337298767288722],[11.203111941312947,44.337249709727878],[11.202939393631826,44.337111214421277],[11.202850289388451,44.337078905099922],[11.20275771659705,44.337067512777615],[11.202500369597027,44.337046400970443],[11.202268656203296,44.337027476523986],[11.201920444091261,44.336864633108185],[11.201852509563837,44.336737368561927],[11.201837450251329,44.336736839938865],[11.201452228879091,44.336321050561274],[11.201257230942565,44.336107966400277],[11.20095259632954,44.33578435592127],[11.200777676943353,44.335591535643566],[11.200719027483558,44.335533618628695],[11.200323278143653,44.335453475518719],[11.200007957495401,44.335539310235831],[11.200249625749615,44.33686198916979],[11.200060466619886,44.3369778545458],[11.199956164849217,44.336899661240871],[11.199884880099857,44.336818517572574],[11.19980062688478,44.336799093857273],[11.199697859580345,44.336761562625128],[11.199625108960104,44.336622110004548],[11.199479641478314,44.33648289779741],[11.199425839875762,44.336437877468633],[11.199086215505128,44.336416038521087],[11.198907540586132,44.336351764326665],[11.199096836574192,44.336161743537446],[11.199264262322076,44.33603896152438],[11.199519266929064,44.335888761463401],[11.199435934343423,44.335826845311438],[11.199278597260086,44.335594909460909],[11.199199597913815,44.335545540300458],[11.199110605331027,44.335358425351217],[11.19872497637518,44.335420701338947],[11.198330404052877,44.33548668637502],[11.198381214696727,44.335629227356904],[11.198387632054505,44.335647217004812],[11.198349185615612,44.335733392754733],[11.198308774444417,44.335801240975172],[11.198308927131064,44.335826796505209],[11.198287252534975,44.335862360384738],[11.198227827227216,44.335971851980069],[11.198161226491377,44.336094751657434],[11.198058715790703,44.336305605615152],[11.19789401715734,44.336615182936562],[11.197892820520536,44.336647597455631],[11.197853218084623,44.337044818187266],[11.197878892160022,44.337068243615384],[11.197910695449588,44.337056314671578],[11.197891554982945,44.337033519613698],[11.197916351664823,44.337022400832133],[11.197937693309338,44.337053075801556],[11.197962406528742,44.337058514458512],[11.197999615026289,44.337101586467064],[11.197989752970756,44.337108555433531],[11.198004812373094,44.337128881343851],[11.198007125804445,44.337131375520173],[11.198090416995717,44.337221363709574],[11.198126636969157,44.33726516592624],[11.198213605243367,44.337233070529862],[11.198259368568044,44.337277481072093],[11.198286505549884,44.337259844231617],[11.198421441084468,44.337418994635676],[11.198402996048605,44.337423194156713],[11.198547712107628,44.337572505138738],[11.198616878575647,44.337629563403702],[11.198860416673126,44.337791013777334],[11.198898522587641,44.337762128182362],[11.198992025279091,44.337824244814357],[11.199013647970524,44.337838934489824],[11.198982827958904,44.337861395871926],[11.198975196060895,44.337866953541827],[11.19922871697443,44.338042047768354],[11.199342417988598,44.337956680825961],[11.19943194051452,44.338025715820777],[11.199380201336059,44.338062021483069],[11.199642554117158,44.338241112754943],[11.199652487175529,44.33823738322257],[11.199882618842658,44.33839205880129],[11.199984352743158,44.338309370673223],[11.200033850490234,44.338342563239259],[11.199930709738167,44.33842922168084],[11.200190654198869,44.338295156667108],[11.200167255726768,44.338104311005083],[11.20060125590639,44.338050396939899],[11.20105663559452,44.338186285342012],[11.201037336718958,44.338335210012993],[11.201003670377395,44.33841196767807],[11.201030563071376,44.33850341074892],[11.201080199895625,44.338522204973437],[11.201054095275676,44.338560708651848],[11.200994641311661,44.338609722544142],[11.200895387776443,44.338691292405628],[11.200881986601233,44.338696871462588],[11.200864643456864,44.338705380386948],[11.200844888847996,44.338717158767409],[11.200821207595222,44.338732947030785],[11.200788150401253,44.338754614809744],[11.20074375362972,44.338783991480682],[11.201156301204925,44.339110156911062],[11.202276160621379,44.339991519010781],[11.202282486791175,44.340003676465642],[11.202444160931719,44.340306113378205],[11.202765564782428,44.340913526734703],[11.202802420790041,44.340982162288199],[11.202816215382427,44.341011505552601],[11.202830957948965,44.341039029987797],[11.20284253826604,44.341060835796846],[11.202884598672235,44.341077200615722]]]]}},{"type":"Feature","properties":{"gid":"219","id_archeo":"32","codice":"032_BO","nome":"Compendio della città romana di Claterna","titolo":"L'antico municipium di Claterna rappresenta uno degli insediamenti romani più rilevanti in Emilia Romagna, corrispondendo ad una delle poche città romane non sopravvissute fino ai giorni nostri. Si tratta di un importante centro abitato con i relativi","tipo_propr":"Pubblica","comuni":"OZZANO DELL`EMILIA","sigla_pro":"BO","localita":"Maggio","tipologie":"Struttura abitativa o insediamento - Epoca Età Romana","provvedime":"Decreto Ministeriale (19/05/1969), Decreto Ministeriale (19/05/1969)","data_ultim":"1969-05-19","ultimo_pro":"Decreto Ministeriale","rif_legge_":"L. 1089/1939","tutela":"Diretto","vincolo":"Diretto"},"geometry":{"type":"MultiPolygon","coordinates":[[[[11.508277918509934,44.430495751530287],[11.508188927005124,44.430341732967051],[11.506512243464174,44.430879202860318],[11.504896535345873,44.431397094548338],[11.506800011030951,44.433065613476579],[11.506817032425733,44.433057614502779],[11.506878101569614,44.433029598742657],[11.507207310423686,44.432920755673962],[11.507403281603976,44.43286077874729],[11.507680486087937,44.432779535121732],[11.507850933678602,44.43273264969298],[11.508670939459703,44.432541913877699],[11.508648966865486,44.432446584205323],[11.508509572902314,44.431652817597573],[11.508398099323774,44.431000801225039],[11.508330545556268,44.430590218429884],[11.508277918509934,44.430495751530287]]],[[[11.505102151351091,44.435624989479479],[11.504151037451402,44.434418989374279],[11.504113242506689,44.434404262599692],[11.503897409871911,44.434503019991269],[11.503645364908357,44.434614400665659],[11.503449473938636,44.434696182244259],[11.50334908809497,44.434738922424081],[11.503180653485122,44.43480285256701],[11.502812250245874,44.43494757209286],[11.502644610995393,44.435013383517003],[11.502474561609931,44.435080138779767],[11.502545259570759,44.435126256129543],[11.502560881255585,44.435140173364502],[11.50262394304243,44.435196360788396],[11.502646483605471,44.435270478460978],[11.502673310991931,44.435377297914272],[11.50265407265384,44.435437846982076],[11.502793319131611,44.435449439898534],[11.502858292605243,44.435439480525552],[11.502902729549437,44.435431736038048],[11.502861091881433,44.435332065319379],[11.503027896776674,44.435213769794629],[11.502985691696802,44.435163462808873],[11.503036716750543,44.435144059665525],[11.503209488444549,44.435356003657894],[11.503317198567135,44.4354911256927],[11.503469212512579,44.435681828829438],[11.504071954858251,44.436433454521783],[11.505335410188472,44.435918797546549],[11.505102151351091,44.435624989479479]]]]}},{"type":"Feature","properties":{"gid":"220","id_archeo":"32","codice":"032_BO","nome":"Compendio della città romana di Claterna","titolo":"L'antico municipium di Claterna rappresenta uno degli insediamenti romani più rilevanti in Emilia Romagna, corrispondendo ad una delle poche città romane non sopravvissute fino ai giorni nostri. Si tratta di un importante centro abitato con i relativi","tipo_propr":"Pubblica","comuni":"OZZANO DELL`EMILIA","sigla_pro":"BO","localita":"Maggio","tipologie":"Struttura abitativa o insediamento - Epoca Età Romana","provvedime":"Decreto Ministeriale (19/05/1969), Decreto Ministeriale (19/05/1969)","data_ultim":"1969-05-19","ultimo_pro":"Decreto Ministeriale","rif_legge_":"L. 1089/1939","tutela":"Diretto","vincolo":"Area demaniale"},"geometry":{"type":"MultiPolygon","coordinates":[[[[11.506800011030951,44.433065613476579],[11.50475993236744,44.431277348238218],[11.504508190315798,44.431404865524691],[11.50240986248178,44.432467714504881],[11.502165452093214,44.432591509889136],[11.501644701651518,44.432855256234802],[11.501123861297444,44.433119065196031],[11.501135395926203,44.433139391903168],[11.501251867901667,44.433291905639479],[11.501366089282929,44.433474680707171],[11.501696449849062,44.433996051596637],[11.501753315434367,44.434059892377498],[11.502117108043475,44.43460812143018],[11.502275927104485,44.43483210295372],[11.502353413840533,44.434896562521693],[11.502441898075679,44.434955217369129],[11.502711422107691,44.434856734552902],[11.503044013002029,44.434729878490295],[11.503179813075244,44.434684957346334],[11.503522819036982,44.434539308438048],[11.503641954068101,44.434488711741118],[11.503943331928898,44.434356587284405],[11.504430897615853,44.434136815423841],[11.505037760398986,44.433827180235433],[11.505431501860501,44.433628008733031],[11.50544453488814,44.433623986574119],[11.50588203039457,44.433426769617284],[11.506490009469191,44.433187339054079],[11.506535628901723,44.433173805632116],[11.506800011030951,44.433065613476579]]],[[[11.509322809069269,44.432622556506232],[11.509296610485542,44.432529201400463],[11.508831886827254,44.432638509303729],[11.508775527397693,44.432657942285992],[11.508782135324077,44.43266966219273],[11.508424148302073,44.43276152468659],[11.507846934172344,44.432904278649183],[11.507593354670689,44.432982698902073],[11.507209443688925,44.433109786571336],[11.506916022799487,44.433206149280977],[11.506802650766341,44.433242137901438],[11.506711987227296,44.433279716125313],[11.506074904372404,44.433555454617782],[11.505466304247511,44.433817510682019],[11.50456292215976,44.434220250934302],[11.504219558408023,44.434374769199259],[11.505454988026145,44.435918697849445],[11.506642912414387,44.435453318315012],[11.507515904729637,44.435107521536672],[11.508468880055377,44.434731971350693],[11.508650338763603,44.434526031078875],[11.508754812471821,44.434411015011911],[11.508795377749005,44.434356315728792],[11.508897216033743,44.434167150567475],[11.509019731955282,44.433948290815188],[11.509041864934714,44.433907383320282],[11.509079794680616,44.433819612998001],[11.509119686751342,44.433689650210141],[11.509135039866848,44.433623333915172],[11.509155309165457,44.433513679916416],[11.509197752882784,44.433251433503727],[11.509250518736795,44.432973809018911],[11.509262027305429,44.432900753412149],[11.509379330860334,44.432893834719145],[11.509392870762369,44.432728864768684],[11.509393275776798,44.432716612575227],[11.509386457348192,44.432700567171779],[11.509360639730998,44.43266627755672],[11.509322809069269,44.432622556506232]]]]}},{"type":"Feature","properties":{"gid":"221","id_archeo":"44","codice":"044_FC","nome":"Resti dell'abitato romano di Mevaniola","titolo":"Il sito di Mevaniola fu identificato nel 1934 da Mons. Mambrini in seguito al ritrovamento casuale di resti musivi romani nella frazione Monastero di Galeata.\nIl centro abitato antico doveva occupare un’area di circa 200x100 m scandito da una strada; n","tipo_propr":"Privata, Pubblica","comuni":"GALEATA","sigla_pro":"FC","localita":"Pianetto","tipologie":"Struttura abitativa o insediamento - Epoca Età Romana","provvedime":"Decreto Ministeriale (18/06/1953), Decreto Ministeriale (12/06/1962), Decreto Ministeriale (27/06/1981), Decreto Ministeriale (09/05/1953)","data_ultim":"1981-06-27","ultimo_pro":"Decreto Ministeriale","rif_legge_":"L. 1089/1939","tutela":"Diretto","vincolo":"Area demaniale"},"geometry":{"type":"MultiPolygon","coordinates":[[[[11.904716470865102,43.988314743147576],[11.904416771470482,43.987877005124638],[11.904312977023372,43.987917907945693],[11.904216619081705,43.987954822285829],[11.90441075577642,43.988240676198828],[11.904429176485905,43.988244573946915],[11.904531250075346,43.988393972520029],[11.904592827710593,43.988368998354765],[11.90463105443953,43.988351271406778],[11.904716470865102,43.988314743147576]]],[[[11.902914436732798,43.989464971140315],[11.90335879788328,43.989342053387567],[11.903422641402052,43.989428648847174],[11.903669509707003,43.989339552652545],[11.903595889481634,43.989215646009903],[11.903475229057261,43.98901702347441],[11.903377038534451,43.988843163435298],[11.903334356422217,43.988867728419287],[11.903249461136291,43.988908581773792],[11.903207764826265,43.988928818265698],[11.903185478127122,43.988952261335498],[11.903149791959573,43.988983994684467],[11.903103684975401,43.989024752815148],[11.903024384280283,43.98909977368654],[11.903015381786716,43.989108588252826],[11.902888127323916,43.989233185961005],[11.902766242388013,43.989353970728864],[11.902758090886481,43.989362226567827],[11.902859996481981,43.989429197725144],[11.902874152268973,43.989438500722805],[11.902914436732798,43.989464971140315]]]]}},{"type":"Feature","properties":{"gid":"222","id_archeo":"44","codice":"044_FC","nome":"Resti dell'abitato romano di Mevaniola","titolo":"Il sito di Mevaniola fu identificato nel 1934 da Mons. Mambrini in seguito al ritrovamento casuale di resti musivi romani nella frazione Monastero di Galeata.\nIl centro abitato antico doveva occupare un’area di circa 200x100 m scandito da una strada; n","tipo_propr":"Privata, Pubblica","comuni":"GALEATA","sigla_pro":"FC","localita":"Pianetto","tipologie":"Struttura abitativa o insediamento - Epoca Età Romana","provvedime":"Decreto Ministeriale (18/06/1953), Decreto Ministeriale (12/06/1962), Decreto Ministeriale (27/06/1981), Decreto Ministeriale (09/05/1953)","data_ultim":"1981-06-27","ultimo_pro":"Decreto Ministeriale","rif_legge_":"L. 1089/1939","tutela":"Indiretto","vincolo":"Indiretto"},"geometry":{"type":"MultiPolygon","coordinates":[[[[11.902940836161857,43.99048733221926],[11.902900429113929,43.990326992228674],[11.902871647819861,43.990219887680503],[11.902850391111055,43.990130012348679],[11.902817508630422,43.989989449358752],[11.902785058113681,43.989832688208523],[11.902929283548827,43.98982550977329],[11.903217721833721,43.989811152674044],[11.903570300800084,43.989785467419665],[11.903823947459793,43.989774424448051],[11.903786139875786,43.989650777371629],[11.903726540663168,43.989425033807827],[11.903669509707003,43.989339552652545],[11.903422641402052,43.989428648847174],[11.90335879788328,43.989342053387567],[11.902914436732798,43.989464971140315],[11.902874152268973,43.989438500722805],[11.902747773196452,43.98946589591106],[11.902693910158117,43.989427175663202],[11.90266908037332,43.989412159290353],[11.902661547451693,43.989419688863627],[11.902551995100048,43.989516716353961],[11.902460332858988,43.989606509738515],[11.902355281776586,43.989707122778057],[11.902266468416684,43.989763812036593],[11.902201495607803,43.989814331382412],[11.902122245281223,43.989770269344689],[11.902078288756044,43.989725778211223],[11.902004314819033,43.989636747655581],[11.901874979867021,43.989507927138334],[11.901735064198267,43.989344957419931],[11.901695497182923,43.989279233818671],[11.901590913341252,43.989117625595227],[11.901536379414111,43.989040065439681],[11.901460818423491,43.98879672958261],[11.901701320915992,43.988737157804422],[11.901677542115165,43.988377143060184],[11.901219079912039,43.988419980935539],[11.901504455965897,43.988130452123336],[11.901661026723414,43.987976844879157],[11.901667690210596,43.987774677999958],[11.901959829446666,43.987817740410932],[11.902206251836891,43.987854068770012],[11.902282350999219,43.987865278359827],[11.902490776242942,43.987898475771743],[11.90260935951085,43.987917364799593],[11.902635729807542,43.987920889664956],[11.902756185667561,43.987941099367326],[11.902916433346315,43.987965176678173],[11.903143387717201,43.987999882362004],[11.903310125723884,43.988023568991203],[11.903563457021026,43.988063968063351],[11.903660516493028,43.988078469851139],[11.903766480632068,43.988080735228813],[11.90389967966931,43.988055947331588],[11.904110322368382,43.987992493533262],[11.904216619081705,43.987954822285829],[11.904312977023372,43.987917907945693],[11.904416771470482,43.987877005124638],[11.904599528208363,43.987801736877351],[11.904488675868743,43.98769625264714],[11.904343398488429,43.987566039932517],[11.904302610572788,43.987437013065517],[11.904263343981025,43.987319480165112],[11.904249285274965,43.987163772984594],[11.904236795925703,43.987022079361317],[11.904223329712471,43.986891538140775],[11.904215355502441,43.986763152933371],[11.904199814162935,43.986604908624948],[11.903956572150175,43.986598663295112],[11.903677954014404,43.986580641177838],[11.903437161617591,43.986566842041896],[11.903267477289488,43.986551432119093],[11.902964492064173,43.986531309070287],[11.902651061435346,43.986514070633731],[11.902617257660525,43.986517396903743],[11.901460952964172,43.986450685903336],[11.9012183527887,43.986436687993603],[11.900266218591488,43.986381745263991],[11.900097345271408,43.987519874936375],[11.900095217638608,43.987537054232526],[11.899964762226924,43.988590385930863],[11.9000712801414,43.989112287202808],[11.900111935869949,43.989204992341385],[11.900169092518393,43.98932104586568],[11.90020762930085,43.989382807898636],[11.900240175865465,43.989438843221293],[11.900344605304705,43.989556927717388],[11.900443179138648,43.98970452826002],[11.900456650984317,43.98971817645856],[11.900469664015453,43.989736481784448],[11.900484134473309,43.989747592799709],[11.900501130858999,43.989768056647222],[11.900586410165724,43.989825056810616],[11.900693667753007,43.989905716201946],[11.900855793440712,43.990022955413615],[11.900980497325911,43.990110778641395],[11.901013419655808,43.990134087750803],[11.901047304970705,43.990150548191544],[11.901084183454168,43.990170596735787],[11.901085972808382,43.990188869322715],[11.90126477862988,43.990175568334791],[11.901319588564389,43.990202768523552],[11.901587529459443,43.99028125192423],[11.901749390233974,43.990332658579774],[11.901956630869332,43.990410937410381],[11.902089806963602,43.990377887557678],[11.902243825221122,43.990458446112029],[11.90238190949451,43.990531126913822],[11.902630603930701,43.99052764885964],[11.902814126194901,43.99052000257641],[11.902910051418093,43.990498909462168],[11.902940836161857,43.99048733221926]]]]}},{"type":"Feature","properties":{"gid":"223","id_archeo":"44","codice":"044_FC","nome":"Resti dell'abitato romano di Mevaniola","titolo":"Il sito di Mevaniola fu identificato nel 1934 da Mons. Mambrini in seguito al ritrovamento casuale di resti musivi romani nella frazione Monastero di Galeata.\nIl centro abitato antico doveva occupare un’area di circa 200x100 m scandito da una strada; n","tipo_propr":"Privata, Pubblica","comuni":"GALEATA","sigla_pro":"FC","localita":"Pianetto","tipologie":"Struttura abitativa o insediamento - Epoca Età Romana","provvedime":"Decreto Ministeriale (18/06/1953), Decreto Ministeriale (12/06/1962), Decreto Ministeriale (27/06/1981), Decreto Ministeriale (09/05/1953)","data_ultim":"1981-06-27","ultimo_pro":"Decreto Ministeriale","rif_legge_":"L. 1089/1939","tutela":"Diretto","vincolo":"Diretto"},"geometry":{"type":"MultiPolygon","coordinates":[[[[11.90342533562027,43.99048686791263],[11.903612769239047,43.990463041741947],[11.903735147475802,43.990462737962588],[11.903966352944106,43.990440237623893],[11.904094053591127,43.990405398103178],[11.90430373511081,43.990346613877989],[11.904444943221698,43.990329715158566],[11.904718518017837,43.990324015044507],[11.904881245136609,43.990343047890498],[11.905006717198155,43.990373678911944],[11.905239069824058,43.99039001219807],[11.905481838334834,43.990395177442068],[11.905852332052561,43.990369092200474],[11.905948787937541,43.990359146585],[11.906133956499248,43.990268041464837],[11.906198996529064,43.990234785685921],[11.906246565377629,43.990190793075747],[11.906374956011632,43.990080768477036],[11.90655390851005,43.98992600858228],[11.906658978025881,43.989833313753863],[11.906728454924711,43.989788538067181],[11.906690863699941,43.989719218788409],[11.906653350017741,43.989668587479521],[11.906522776639292,43.989478629295398],[11.906421238535593,43.98934110271081],[11.906337192822365,43.989221892686601],[11.906294661932526,43.989159415167478],[11.906169587923465,43.988981668497274],[11.906002483682622,43.988743240877689],[11.905867440466983,43.988552567424328],[11.90579991238231,43.98845849569679],[11.905613345826426,43.988203205326663],[11.905492274270099,43.988028687072003],[11.905450294703298,43.987977718865501],[11.905447417776735,43.98798136622522],[11.905427993972472,43.987949774324932],[11.905431752703281,43.987945033180637],[11.905402159907119,43.987882154009064],[11.905378001361472,43.987813860848291],[11.905353807538981,43.987733351677498],[11.905329562701162,43.987639537551424],[11.905320452050434,43.987601066054019],[11.905315370137142,43.987575897307323],[11.905298804691265,43.987411557291232],[11.905282783920891,43.987260158540977],[11.905274399872477,43.987154074966035],[11.905267702464911,43.98709581675228],[11.905237983365618,43.986878631474369],[11.905218957299429,43.986723645013534],[11.905202162477725,43.986625851045801],[11.905199570047614,43.986602122422013],[11.904951960039666,43.986624664527902],[11.904701256144049,43.98662240086562],[11.904587858751464,43.986619794300694],[11.904380913742681,43.986616344566137],[11.904235145864257,43.986607340872681],[11.904199814162935,43.986604908624948],[11.904215355502441,43.986763152933371],[11.904223329712471,43.986891538140775],[11.904236795925703,43.987022079361317],[11.904249285274965,43.987163772984594],[11.904263343981025,43.987319480165112],[11.904302610572788,43.987437013065517],[11.904343398488429,43.987566039932517],[11.904488675868743,43.98769625264714],[11.904599528208363,43.987801736877351],[11.904416771470482,43.987877005124638],[11.904716470865102,43.988314743147576],[11.90463105443953,43.988351271406778],[11.904592827710593,43.988368998354765],[11.904531250075346,43.988393972520029],[11.904429176485905,43.988244573946915],[11.90441075577642,43.988240676198828],[11.904216619081705,43.987954822285829],[11.904110322368382,43.987992493533262],[11.90389967966931,43.988055947331588],[11.903766480632068,43.988080735228813],[11.903660516493028,43.988078469851139],[11.903563457021026,43.988063968063351],[11.903310125723884,43.988023568991203],[11.903143387717201,43.987999882362004],[11.902916433346315,43.987965176678173],[11.902756185667561,43.987941099367326],[11.902635729807542,43.987920889664956],[11.90260935951085,43.987917364799593],[11.902490776242942,43.987898475771743],[11.902282350999219,43.987865278359827],[11.902206251836891,43.987854068770012],[11.901959829446666,43.987817740410932],[11.901667690210596,43.987774677999958],[11.901661026723414,43.987976844879157],[11.901504455965897,43.988130452123336],[11.901219079912039,43.988419980935539],[11.901677542115165,43.988377143060184],[11.901701320915992,43.988737157804422],[11.901460818423491,43.98879672958261],[11.901536379414111,43.989040065439681],[11.901590913341252,43.989117625595227],[11.901695497182923,43.989279233818671],[11.901735064198267,43.989344957419931],[11.901874979867021,43.989507927138334],[11.902004314819033,43.989636747655581],[11.902078288756044,43.989725778211223],[11.902122245281223,43.989770269344689],[11.902201495607803,43.989814331382412],[11.902266468416684,43.989763812036593],[11.902321031018047,43.989728421059084],[11.902355281776586,43.989707122778057],[11.902460332858988,43.989606509738515],[11.902551995100048,43.989516716353961],[11.902661547451693,43.989419688863627],[11.90266908037332,43.989412159290353],[11.902693910158117,43.989427175663202],[11.902747773196452,43.98946589591106],[11.902874152268973,43.989438500722805],[11.902758090886481,43.989362226567827],[11.902766242388013,43.989353970728864],[11.902888127323916,43.989233185961005],[11.903024384280283,43.98909977368654],[11.903103684975401,43.989024752815148],[11.903149791959573,43.988983994684467],[11.903185478127122,43.988952261335498],[11.903207764826265,43.988928818265698],[11.903249461136291,43.988908581773792],[11.903334356422217,43.988867728419287],[11.903377038534451,43.988843163435298],[11.903475229057261,43.98901702347441],[11.903595889481634,43.989215646009903],[11.903669509707003,43.989339552652545],[11.903726540663168,43.989425033807827],[11.903786139875786,43.989650777371629],[11.903823947459793,43.989774424448051],[11.903570300800084,43.989785467419665],[11.903217721833721,43.989811152674044],[11.902929283548827,43.98982550977329],[11.902785058113681,43.989832688208523],[11.902817508630422,43.989989449358752],[11.902850391111055,43.990130012348679],[11.902871647819861,43.990219887680503],[11.902900429113929,43.990326992228674],[11.902940836161857,43.99048733221926],[11.90309726564133,43.990541629944509],[11.903194087428092,43.990497511456226],[11.90342533562027,43.99048686791263]]]]}},{"type":"Feature","properties":{"gid":"224","id_archeo":"75","codice":"075_FE","nome":"Resti dell'abitato romano di Vicus Habentia","titolo":"Il quadro archeologico e storico di età romana del delta ferrarese ha tra le proprie eccellenze l’attuale sito di Voghenza-Voghiera (il Vicus Aventinus); varie fonti documentali vi hanno infatti da tempo riconosciuto uno dei vici dell’amministrazion","tipo_propr":"Privata","comuni":"VOGHIERA","sigla_pro":"FE","localita":"Voghenza","tipologie":"Struttura abitativa o insediamento - Epoca Età Romana","provvedime":"Decreto Direzione Regionale (02/09/2009), Decreto Ministeriale (22/04/1980)","data_ultim":"2009-09-02","ultimo_pro":"Decreto Direzione Regionale","rif_legge_":"D. Lgs. 42/2004","tutela":"Diretto","vincolo":"Diretto"},"geometry":{"type":"MultiPolygon","coordinates":[[[[11.749391621920999,44.767926301873672],[11.749498855065118,44.767726178103089],[11.749594702063018,44.767545745922241],[11.749607592860391,44.767522363162158],[11.749691528718648,44.767369989083818],[11.749785242316561,44.767189626156672],[11.749813591431145,44.767130943084638],[11.749945525784197,44.766885321615291],[11.749963064806213,44.766852059621826],[11.749927847649074,44.766838496268903],[11.74959198092229,44.766709049655844],[11.749385307123871,44.766947073726918],[11.749351358684361,44.766933083540614],[11.749316056771173,44.766918531820707],[11.749277622441571,44.766902678265659],[11.749018272800335,44.766777822529548],[11.748741605670613,44.76704224234431],[11.748690610647552,44.767090002194628],[11.74848028768584,44.767286928442218],[11.748328266877268,44.767429257144471],[11.748257658478472,44.767495367206116],[11.748079846274525,44.767701609817927],[11.748079113392986,44.767702941759879],[11.74807140388952,44.767717026526689],[11.748006060902878,44.767834717022851],[11.74797832809546,44.767886462266929],[11.748071326760167,44.767909490890275],[11.748179370948248,44.767727955925508],[11.748430577675844,44.767791958229715],[11.748724766373318,44.767863242296059],[11.748768945689671,44.767786093113394],[11.749159044913903,44.767868262208488],[11.749156259660413,44.767875071813705],[11.749391621920999,44.767926301873672]]]]}},{"type":"Feature","properties":{"gid":"225","id_archeo":"23","codice":"023_BO","nome":"Villa rustica romana","titolo":"La villa, databile dalla fine dell’età repubblicana al periodo medio/tardo imperiale, non è mai stata oggetto di uno scavo regolare. Si tratta di una costruzione con funzioni sia residenziali che produttive, sviluppatasi su tre terrazzi, di cui quell","tipo_propr":"Privata","comuni":"IMOLA","sigla_pro":"BO","localita":"Morine di Sotto","tipologie":"Struttura abitativa o insediamento - Epoca Età Romana","provvedime":"Decreto Direzione Regionale (16/03/2006), Decreto Ministeriale (20/10/1991)","data_ultim":"2006-03-16","ultimo_pro":"Decreto Direzione Regionale","rif_legge_":"D. Lgs. 42/2004","tutela":"Indiretto","vincolo":"Indiretto"},"geometry":{"type":"MultiPolygon","coordinates":[[[[11.667765234050838,44.339126322787962],[11.667211319587517,44.338149707233917],[11.667033362934475,44.338220071659713],[11.666711857825664,44.338349296107403],[11.666705548705899,44.33834294372641],[11.666263607931199,44.338507542267642],[11.666060899538994,44.338583045139103],[11.665923765674194,44.338634113967252],[11.665895569973895,44.338644135011343],[11.665891989980874,44.338636906441153],[11.665862049357035,44.338648683216277],[11.665862396340295,44.338649476767507],[11.665073458209386,44.338942323968595],[11.66483105606752,44.33903224903608],[11.664645738502259,44.339286456194486],[11.665336661389631,44.339544648314977],[11.665638152617818,44.339656881732452],[11.665835723401184,44.33972636703318],[11.665930657045999,44.339747673331431],[11.666316626328587,44.339838144564254],[11.666546861760118,44.339895702607528],[11.666586467304201,44.339904914167448],[11.666631130345367,44.339914727762242],[11.666701688788855,44.33993044516523],[11.666514129504748,44.339518355290686],[11.66636957267211,44.33926888017222],[11.66739064842614,44.338887285362524],[11.667427720011457,44.338956503174728],[11.667575697305301,44.339200279491898],[11.668197179109674,44.340253732976585],[11.668231058486707,44.340258378533235],[11.66826971744903,44.34025750188016],[11.668244129746643,44.34023571991019],[11.668226669255349,44.340227449688982],[11.668270192855443,44.340211317209686],[11.668362173001301,44.340178754211713],[11.667765234050838,44.339126322787962]]]]}},{"type":"Feature","properties":{"gid":"226","id_archeo":"23","codice":"023_BO","nome":"Villa rustica romana","titolo":"La villa, databile dalla fine dell’età repubblicana al periodo medio/tardo imperiale, non è mai stata oggetto di uno scavo regolare. Si tratta di una costruzione con funzioni sia residenziali che produttive, sviluppatasi su tre terrazzi, di cui quell","tipo_propr":"Privata","comuni":"IMOLA","sigla_pro":"BO","localita":"Morine di Sotto","tipologie":"Struttura abitativa o insediamento - Epoca Età Romana","provvedime":"Decreto Direzione Regionale (16/03/2006), Decreto Ministeriale (20/10/1991)","data_ultim":"2006-03-16","ultimo_pro":"Decreto Direzione Regionale","rif_legge_":"D. Lgs. 42/2004","tutela":"Diretto","vincolo":"Diretto"},"geometry":{"type":"MultiPolygon","coordinates":[[[[11.667575697305301,44.339200279491898],[11.667427720011457,44.338956503174728],[11.66739064842614,44.338887285362524],[11.66636957267211,44.33926888017222],[11.666514129504748,44.339518355290686],[11.666701688788855,44.33993044516523],[11.667121719429192,44.340029525492618],[11.667161425907979,44.34002934494309],[11.667206639328953,44.340040225745568],[11.667825510844708,44.340180263616432],[11.668044870669529,44.340230852825655],[11.668197179109674,44.340253732976585],[11.667575697305301,44.339200279491898]]]]}},{"type":"Feature","properties":{"gid":"227","id_archeo":"39","codice":"039_FC","nome":"Manufatti del paleolitico inferiore","titolo":"L’antro nei pressi del quale si rinvennero i manufatti attribuiti al Paleolitico inferiore è caratterizzato da un accesso in cui venne riscontrato un “suolo costituito in superficie da terriccio e da detriti calcarei.\nNel settore a meridione dell’","tipo_propr":"Privata","comuni":"CASTROCARO TERME E TERRA DEL SOLE","sigla_pro":"FC","localita":"Grotta Bagnile","tipologie":"Struttura abitativa o insediamento - Epoca Paleolitico","provvedime":"Decreto Ministeriale (21/01/1985)","data_ultim":"1985-01-21","ultimo_pro":"Decreto Ministeriale","rif_legge_":"L. 1089/1939","tutela":"Indiretto","vincolo":"Indiretto"},"geometry":{"type":"MultiPolygon","coordinates":[[[[11.924942490629968,44.170012745044694],[11.926403002808398,44.170210015427983],[11.926439598834584,44.170100036750426],[11.926471743519892,44.170004495437333],[11.926487054639155,44.169952211461975],[11.926515786031809,44.169875402173027],[11.926450582463698,44.169836211378467],[11.926267910940005,44.169813032868298],[11.926242860951184,44.169805509863608],[11.926042479626755,44.169731542043714],[11.92594414729589,44.169657793020939],[11.925865387251829,44.169599161673474],[11.92573710709264,44.169545283997181],[11.925621872384783,44.169495699072804],[11.925521463849671,44.169403223378588],[11.925476783390172,44.169362200457492],[11.925443653971652,44.169335213613302],[11.925394578917848,44.169320140946851],[11.925237051247938,44.16933441539642],[11.925155036930997,44.169342468610402],[11.925097354588448,44.169432290333191],[11.925063358825685,44.169570353241156],[11.925164621065745,44.169620675025797],[11.925139356756864,44.16968846447034],[11.925101721460742,44.1697883504035],[11.925076912903137,44.169842093016456],[11.925017115755733,44.169903079380816],[11.924964282258577,44.169955406718714],[11.924942490629968,44.170012745044694]]]]}},{"type":"Feature","properties":{"gid":"228","id_archeo":"39","codice":"039_FC","nome":"Manufatti del paleolitico inferiore","titolo":"L’antro nei pressi del quale si rinvennero i manufatti attribuiti al Paleolitico inferiore è caratterizzato da un accesso in cui venne riscontrato un “suolo costituito in superficie da terriccio e da detriti calcarei.\nNel settore a meridione dell’","tipo_propr":"Privata","comuni":"CASTROCARO TERME E TERRA DEL SOLE","sigla_pro":"FC","localita":"Grotta Bagnile","tipologie":"Struttura abitativa o insediamento - Epoca Paleolitico","provvedime":"Decreto Ministeriale (21/01/1985)","data_ultim":"1985-01-21","ultimo_pro":"Decreto Ministeriale","rif_legge_":"L. 1089/1939","tutela":"Diretto","vincolo":"Diretto"},"geometry":{"type":"MultiPolygon","coordinates":[[[[11.925712340360592,44.169086153449484],[11.925649190296303,44.169053805565206],[11.925544668195842,44.169195963523009],[11.925443653971652,44.169335213613302],[11.925476783390172,44.169362200457492],[11.925521463849671,44.169403223378588],[11.925621872384783,44.169495699072804],[11.92573710709264,44.169545283997181],[11.925865387251829,44.169599161673474],[11.92594414729589,44.169657793020939],[11.926042479626755,44.169731542043714],[11.926242860951184,44.169805509863608],[11.926267910940005,44.169813032868298],[11.926450582463698,44.169836211378467],[11.926515786031809,44.169875402173027],[11.926621429355508,44.169900483892867],[11.926718062496063,44.169922690696907],[11.926819707436398,44.169946335337642],[11.926867985963019,44.169879593694496],[11.92692172330908,44.169805635929045],[11.926948146462646,44.169785053293012],[11.927024671058108,44.169779543312274],[11.927076856106375,44.169693687772103],[11.927155400366123,44.169563475155542],[11.927201124389507,44.169483042845123],[11.927244855698062,44.169411628280116],[11.927203312389095,44.169402674041308],[11.927104186926686,44.169384429726342],[11.926967016671135,44.169358671706377],[11.926869411490561,44.169342584837672],[11.926730749816045,44.169318278210476],[11.926577572714008,44.169291813950537],[11.926493445002558,44.169275354083041],[11.926345277113157,44.169246735446272],[11.926186575336191,44.16921452459983],[11.926058405238587,44.169188390644344],[11.925915217573191,44.169159049560221],[11.925855129659094,44.16914182876333],[11.925785011758405,44.169122101294953],[11.925712340360592,44.169086153449484]]]]}},{"type":"Feature","properties":{"gid":"229","id_archeo":"219","codice":"219_FC","nome":"Pavimentazione a mosaico","titolo":"Pavimentazione a mosaico","tipo_propr":"Privata","comuni":"FORLIMPOPOLI","sigla_pro":"FC","localita":null,"tipologie":"Struttura abitativa o insediamento","provvedime":"Declaratoria (12/06/1969)","data_ultim":"1969-06-12","ultimo_pro":"Declaratoria","rif_legge_":"L. 1089/1939","tutela":"Diretto","vincolo":"Declaratoria"},"geometry":{"type":"MultiPolygon","coordinates":[[[[12.123369291845044,44.189448678122893],[12.123326025001425,44.189378140317089],[12.123267079241312,44.189395727825975],[12.123316978499387,44.189482323434142],[12.123378055162169,44.189464158491312],[12.123369291845044,44.189448678122893]]]]}},{"type":"Feature","properties":{"gid":"230","id_archeo":"59","codice":"059_FE","nome":"Resti di epoca romana","titolo":"Resti attribuibili ad un insediamento di epoca romana sono emersi nel 1962 durante lavori di bonifica dei terreni a nord della località di Salto del Lupo, presso l’argine di Agosta. Al casuale affioramento di uno strato di frammenti di tegole ha fatto","tipo_propr":null,"comuni":"COMACCHIO","sigla_pro":"FE","localita":"Valle del Mezzano, Salto del Lupo","tipologie":"Struttura abitativa o insediamento - Epoca Età Romana","provvedime":"Declaratoria (10/09/1971)","data_ultim":"1971-09-10","ultimo_pro":"Declaratoria","rif_legge_":"L. 1089/1939","tutela":"Diretto","vincolo":"Declaratoria"},"geometry":{"type":"MultiPolygon","coordinates":[[[[12.097041097284375,44.629199288716784],[12.09701933207522,44.629193235501354],[12.096795688328537,44.629550405361286],[12.096681200758489,44.629733986176419],[12.096506853958465,44.630022886167858],[12.096342099270229,44.630291423993022],[12.096279624325811,44.630394734725478],[12.096140435322255,44.630620907899399],[12.096017224086715,44.630827301847795],[12.09582404652323,44.631142916761249],[12.095855853406057,44.631151676430953],[12.096012190799232,44.63119596194889],[12.09620235636547,44.631255946488736],[12.096563815394012,44.631369981632218],[12.097040277868121,44.631519087933029],[12.098262375939454,44.631900487917655],[12.099127793085307,44.632168475236142],[12.099799222153722,44.632376662688181],[12.10108679423996,44.632776858217177],[12.101487477378935,44.632899101170274],[12.101490783816987,44.632900109490357],[12.101644383872809,44.632946559183857],[12.101881671312876,44.633018305506582],[12.101809026235699,44.632646464833819],[12.101691428743051,44.632073058921272],[12.101632324008087,44.631768544786937],[12.101602554055164,44.631629931641108],[12.101563183106119,44.631446740683458],[12.101485268574367,44.631068435593356],[12.1014499789681,44.630884458443013],[12.101408123898814,44.630675940363027],[12.101376233041474,44.630520227024249],[12.101087505678716,44.630459771648795],[12.100880856898383,44.630416501054071],[12.100854875347629,44.630314134713259],[12.100781588235533,44.630293712479713],[12.100140123048343,44.630106852139207],[12.099014737043547,44.629776442017793],[12.098509389510966,44.629628983971351],[12.098174728520924,44.629530133477779],[12.09773283725238,44.62940002324671],[12.097503375845234,44.629333294869141],[12.097041097284375,44.629199288716784]]]]}},{"type":"Feature","properties":{"gid":"231","id_archeo":"223","codice":"223_FC","nome":"Giacimento preistorico  di Cà Belvedere","titolo":"Cà Belvedere di Monte Poggiolo rappresenta uno dei giacimenti preistorici più antichi e più importanti d’Europa. Fu scoperto nel 1983 da un gruppo di lavoro coordinato dall’Università di Ferrara e da Carlo Peretto. \nLa stratigrafia indagata, risa","tipo_propr":"Privata","comuni":"FORLI`","sigla_pro":"FC","localita":"Monte Poggiolo, Ca' Belvedere","tipologie":"Struttura abitativa o insediamento - Epoca Paleolitico","provvedime":"Decreto Direzione Regionale (22/02/2012), Decreto Ministeriale (27/06/1992)","data_ultim":"2012-02-22","ultimo_pro":"Decreto Direzione Regionale","rif_legge_":"D. Lgs. 42/2004","tutela":"Diretto","vincolo":"Diretto"},"geometry":{"type":"MultiPolygon","coordinates":[[[[11.948313886685234,44.203355879361105],[11.948320782054543,44.203337822013921],[11.948369241834241,44.203211010473176],[11.948223590808672,44.203183345867025],[11.948142789567703,44.203395347414549],[11.948288383837713,44.203422617467538],[11.948313886685234,44.203355879361105]]]]}},{"type":"Feature","properties":{"gid":"232","id_archeo":"166","codice":"166_RA","nome":"Resti dell’impianto portuale di Classe, della basilica Petriana e della città di Classe romana, bizantina e altomedievale","titolo":"Resti della città antica di Classe, di epoca romana, bizantina e altomedioevale conosciuti mediante scavi e sondaggi; riferibili per l’epoca romana ai Castra di età imperiale, al porto fatto costruire da Augusto, e a una serie di edifici identificabi","tipo_propr":"Privata, Pubblica","comuni":"RAVENNA","sigla_pro":"RA","localita":"Classe","tipologie":"Luogo di culto - Epoca Età Altomedievale, Luogo di culto - Epoca Età Medievale, Luogo di culto - Epoca Età Altomedievale, Luogo di culto - Epoca Età Tardoantica, Struttura abitativa o insediamento - Epoca Età Tardoantica, Struttura abitativa o insed","provvedime":"Decreto Commissione Regionale (21/10/2022), Decreto Ministeriale (14/05/1971), Decreto Ministeriale (15/12/1969), Decreto Ministeriale (20/09/1982), Decreto Ministeriale (24/05/1975), Decreto Ministeriale (15/12/1969)","data_ultim":"2022-10-21","ultimo_pro":"Decreto Commissione Regionale","rif_legge_":"D. Lgs. 42/2004","tutela":"Diretto","vincolo":"Area demaniale"},"geometry":{"type":"MultiPolygon","coordinates":[[[[12.225147090541951,44.390256592127713],[12.22410251794131,44.389893874023564],[12.223726597869257,44.390309573372718],[12.223683661614643,44.39035705263511],[12.224795446596035,44.39079131456019],[12.225165002679223,44.390262811824968],[12.225147090541951,44.390256592127713]]],[[[12.226305642436872,44.393346881967084],[12.226262771381982,44.393327370104281],[12.226177736336162,44.393403647641172],[12.226057267342778,44.393513434399956],[12.226096632174299,44.393531404682626],[12.226200943314399,44.393579023221598],[12.226233650875081,44.393594768301384],[12.226287175913304,44.393626236431409],[12.226476316331127,44.393424681993018],[12.226470598850783,44.393422058720411],[12.226443318012734,44.393409542680594],[12.226420897716146,44.393399337829351],[12.226305642436872,44.393346881967084]]],[[[12.21665297669664,44.395455668277215],[12.216578464048936,44.395357572720727],[12.2163801760776,44.39554975395545],[12.21627968162761,44.395649388925484],[12.21642439756087,44.395692833015161],[12.216802860350267,44.395805523082522],[12.216994371691618,44.395861762845641],[12.217010026236814,44.39586514748148],[12.217016920483228,44.395856697948972],[12.216927178885157,44.395803053464242],[12.216905296059583,44.395788213389757],[12.216852267322585,44.39572517060909],[12.216801897356284,44.39566321414997],[12.2167364345254,44.395571255228283],[12.21665297669664,44.395455668277215]]],[[[12.228851113926011,44.394536610068357],[12.228580671285773,44.394408759542266],[12.22853904199007,44.394553677756896],[12.22846282802305,44.394800661748477],[12.228386615107059,44.395050184312275],[12.228311159884077,44.39529820000304],[12.228252221409303,44.395488853573887],[12.22819599955673,44.395673893820735],[12.228227243869608,44.395677411982625],[12.228304140367598,44.395687299494561],[12.228352989809517,44.395693587365265],[12.228481910153096,44.395710176915642],[12.228435966850954,44.395859313204646],[12.228392257640953,44.396002507742899],[12.22855755291736,44.39600426742377],[12.228836432274234,44.396007223882144],[12.228891346835525,44.39600827157355],[12.228920792388829,44.395904091515071],[12.228978566997332,44.39569643812991],[12.229012923092329,44.395572674037652],[12.229040268627044,44.395474143822298],[12.229099135568971,44.395263083585483],[12.229156894492897,44.395053342008438],[12.229204464787751,44.394882490764211],[12.229249473931828,44.394723505039863],[12.228851113926011,44.394536610068357]]],[[[12.222871522560144,44.392967346715999],[12.22313507439452,44.392732557162375],[12.223659553868723,44.392266057163972],[12.223776983502175,44.39216238135046],[12.223972852705717,44.391989421697325],[12.224023290512784,44.391942444718644],[12.223894452508787,44.391876469872791],[12.223651663264897,44.392095082527526],[12.223403891901558,44.392317652409538],[12.22316117146862,44.392534155533227],[12.222942799314502,44.392730651382635],[12.222902092004684,44.392771033402738],[12.222620483754623,44.392772280468783],[12.222117142654149,44.392775908467506],[12.221579570602989,44.392778754264754],[12.221103728703046,44.39277924276422],[12.220558217871407,44.39278430636741],[12.220045686080313,44.392788391674785],[12.219567484117471,44.392789345455988],[12.219382349565983,44.392789437761323],[12.219336810173338,44.392838588099366],[12.219309895138258,44.392833847049388],[12.219256107953663,44.392827433521092],[12.219243439821698,44.392823775882619],[12.219239574865103,44.392822669612123],[12.219230698459066,44.392815124013993],[12.219208270472899,44.392796059641917],[12.218988558993569,44.393010275381776],[12.218821962902734,44.393168357104493],[12.218520265924418,44.393456084266361],[12.21821968521064,44.393748190298865],[12.217970753619214,44.393991531601451],[12.217842050623018,44.394119285600738],[12.21771486710916,44.394242477426182],[12.217543906310972,44.394408548426931],[12.217244215279669,44.394703084464624],[12.216998693423566,44.394943266719892],[12.216779627599367,44.395156721841332],[12.216652806097585,44.395282702015002],[12.216619049574147,44.395316233122621],[12.216629076021377,44.395328949859852],[12.216739343512833,44.395470004862226],[12.216789391388188,44.395536165522365],[12.216882683640302,44.395654778972606],[12.216940122521439,44.395719479865811],[12.216999888272724,44.395777156315042],[12.217025680826929,44.395784531224415],[12.217040167993447,44.395800281981863],[12.217053112096853,44.395812394282679],[12.217079502345129,44.395837072843904],[12.217129605412977,44.395851126220684],[12.217148941442854,44.395852498539234],[12.217178746807365,44.395860237397045],[12.217436640917329,44.39592721698412],[12.217675531625602,44.395991554049047],[12.217685840242643,44.395994990315472],[12.217728521950633,44.396009252709916],[12.218060668160941,44.396102224229082],[12.218102950909151,44.396114247145547],[12.218490371554832,44.396224410323342],[12.218876744944556,44.396330793728112],[12.218927829152356,44.396344863642632],[12.219038628581208,44.396375838711386],[12.219278391427856,44.396161399252122],[12.219578176917009,44.395899974883868],[12.219907892986843,44.395604477469647],[12.220274466582438,44.395274855284562],[12.220555744171627,44.39502363723178],[12.220800960852063,44.394800335398045],[12.221076844498143,44.394558432705509],[12.22135513056269,44.394312077392776],[12.221658524692135,44.39404491025325],[12.22188596699195,44.393842858354787],[12.222196052645002,44.393568226953903],[12.222399519853111,44.393387367420473],[12.222625731676581,44.393184034459161],[12.222871522560144,44.392967346715999]]],[[[12.221186200262467,44.395704305497659],[12.22163320229819,44.395362388800159],[12.221817360237232,44.395472815097193],[12.22213940184688,44.395716831220312],[12.222144990589655,44.395712514319293],[12.222167261235905,44.395695312099221],[12.222301225565904,44.395604926444818],[12.222583002690255,44.395418911284452],[12.222746712799513,44.39530983335856],[12.222670419223791,44.39525079928999],[12.222725674156742,44.39521395850025],[12.22260511322977,44.395115241023547],[12.222482040325803,44.395013758626099],[12.222466485071394,44.395000757436932],[12.222420910752254,44.394962650291163],[12.222415002047542,44.394955201179904],[12.222340273184329,44.394894466259039],[12.222283404176444,44.394847999768011],[12.222133356813838,44.394724925923811],[12.221940350738739,44.394567451665075],[12.221717761120123,44.394382941112781],[12.221680217694709,44.394352501956909],[12.221603281598981,44.394423668166638],[12.221397502971744,44.394610785165995],[12.221357991867547,44.394645785467269],[12.221425427246082,44.394729655927897],[12.221320901390664,44.394825205017582],[12.221179962720463,44.39496211246886],[12.221067561613424,44.394900117607072],[12.220990537572629,44.394976795319707],[12.220729111969689,44.395227084987198],[12.220509802603232,44.395436331982644],[12.220308927115562,44.395626891570195],[12.220069162014148,44.39585581801326],[12.219874627985595,44.396040724458274],[12.219844728711209,44.396069016327168],[12.220119277532641,44.396149743530025],[12.220498638035453,44.396257561653144],[12.220528255355626,44.39626598011936],[12.220870818636575,44.396361278056162],[12.221129045662185,44.39643351521331],[12.2212841655956,44.396324303771443],[12.221527205155049,44.396151609999798],[12.221557940473508,44.396129865795622],[12.221682245794176,44.396041896131763],[12.221684880984094,44.396040039260811],[12.221196265454036,44.395711079184167],[12.221186200262467,44.395704305497659]]],[[[12.226515317704282,44.396500619891],[12.226437999276584,44.396458658790898],[12.226330300355986,44.396560567778515],[12.226283126882926,44.396605292907033],[12.226543484047637,44.396749422173201],[12.226838269585786,44.396912229290663],[12.227040444378712,44.39702167838584],[12.227133192314646,44.396930562281923],[12.227195059144535,44.396869694152926],[12.227025841967329,44.396778227120926],[12.226779368615675,44.396644104032639],[12.226515317704282,44.396500619891]]],[[[12.218314895940807,44.397238540488829],[12.218434017892456,44.397069951522795],[12.218562855195771,44.396898801791941],[12.218611960513815,44.396838604324913],[12.218691830273697,44.396750306928666],[12.218820236179065,44.396612270690241],[12.218930603796739,44.39650040886665],[12.